2002511	The neighbors are quiet.	3282567	Tha na nàbaidhean sàmhach.
2002513	The box is heavy.	3282571	Tha am bogsa trom.
2002516	The bus is slow.	3282577	Tha am bus mall.
2002518	The towel is wet.	3282578	Tha an searbhadair fliuch.
2002519	The towel is dry.	3282580	Tha an searbhadair tioram.
2002521	The book is old.	3282581	Tha an leabhar sean.
2002523	The book is new.	3282583	Tha an leabhar nodha.
2002544	The room is dark.	3282535	Tha an seòmar dorcha.
2111668	I'm working.	3077661	Tha mi ag obair.
2163151	The book is on the table.	3282768	Tha an leabhar air a' bhòrd.
2203056	I'm lazy.	3077658	Tha mi leisg.
2242999	They're talking.	3476009	Tha iad a’ bruidhinn.
2245181	Close that door.	3476011	Dùin an doras sin.
2248318	I'm working here.	3077663	Tha mi ag obair an seo.
2268142	The food in this hotel is very good.	3323556	Tha am biadh anns an taigh-òsta seo glè mhath.
2322734	I don't like guys who don't like me.	3282732	Cha toigh leam daoine nach toigh leotha mi.
2345890	Is your mum at home?	2345916	Am bheil do mhàthair a-staigh?
2392572	I remember it now.	3605536	Tha cuimhn’ agam air an-dràsda.
2412739	I have two cats.	3081383	Tha dà chat agam.
2445198	I'm eating an apple.	3077675	Tha mi ag ithe ubhal.
2504046	The girl is beautiful.	3085198	Tha a' chaileag bòidheach.
2784773	He did the work without any difficulty.	2784766	Rinn e an obair gun dragh sam bith.
2799233	He is speaking quickly.	770012	Tha e a' bruidhinn gu luath.
2799249	I can't see her.	769993	Chan urrainn dhomh ga faicinn.
2799427	I was listening to a really beautiful song yesterday.	768173	Bha mi ag èisteachd ri òran glè bhòidheach an-dè.
2843277	The day is cold.	2843278	Tha an latha fuar.
2843281	The fire is hot.	2843283	Tha an teine teth.
2847764	I don't like them.	3282742	Cha toigh leam iad.
2889086	I don't like gambling.	3282743	Cha toigh leam cearrachas.
2889360	I don't like cookies.	3282738	Cha toigh leam briosgaidean.
2900385	I'm drinking water in the kitchen.	3077690	Tha mi ag òl uisge anns an cidsin.
2908791	I don't like the bad boy.	3282739	Cha toigh leam am balach dona.
255923	I don't like apples.	3282740	Cha toigh leam ùbhlan.
2931784	I don't like snow.	3282741	Cha toigh leam sneachd.
2954242	I'm not a fangirl.	3282906	Chan eil mi nam fhangirl.
2835899	I don't like this sentence.	3282736	Cha toigh leam an seantans seo.
2983683	The house is big.	2987680	Tha an taigh mòr.
2983752	The man is tall.	2989016	Tha am fear àrd.
261041	I don't like her.	3282737	Cha toigh leam i.
3077684	I'm drinking.	3077685	Tha mi ag òl.
3091046	She has twenty children.	3338365	Tha fichead pàisde aice.
3092443	I'm not singing.	3092444	Chan eil mi a' seinn.
3092445	The dictionary is big.	3092446	Tha am faclair mòr.
3092448	The dictionary is small.	3092449	Tha am faclair beag.
3095092	Aren't you pleased?	3095097	Nach eil thu toilichte?
3095214	Were you tired?	3095223	An robh thu sgìth?
3095216	Weren't you tired?	3095222	Nach robh thu sgìth?
3095217	You were tired.	3095220	Bha thu sgìth.
3095218	You weren't tired.	3095219	Cha robh thu sgìth.
3116496	She's reading.	3117166	Tha i a' leughadh.
3179083	It's midday.	3179112	Tha e meadhan là.
3196474	I don't like cheese.	3282735	Cha toigh leam càise.
3239417	I want hot water.	3282969	Tha mi ag iarraidh uisge teth.
3239419	I want cold water.	3282967	Tha mi ag iarraidh uisge fuar.
3252619	Where is Cornwall?	3254452	Càite bheil a' Chòrn?
3282631	I don't like her hat.	3282722	Cha toigh leam a h-ad.
3282765	The song is very beautiful.	3282766	Tha an t-òran glè bhòidheach.
3314386	I'm reading a book.	3475953	Tha mi a' leughadh leabhar.
3323447	I am eating fruit and drinking water.	3282473	Tha mi ag ithe measan agus ag òl uisge.
3332890	John, did you see the cat?	3338265	A Iain, an do dh'fhaic thu an cat?
3428636	It's not good.	3339441	Chan eil e math.
3339315	She called her sister.	3339430	Ghoir i a piuthar.
3383331	This hotel was very near the lake.	3383651	Bha an taigh-òsta seo glè fhaisg air an loch.
1401113	That hotel is very near the lake.	3383652	Tha an taigh-òsta sin glè fhaisg air an loch.
3383333	This hotel is very near the lake.	3383653	Tha an taigh-òsta seo glè fhaisg air an loch.
3385244	My friend doesn't use milk.	3385310	Chan eil mo charaid a' cleachdadh bainne.
3452093	I'll arrive on 23 May.	3456328	Ruigidh mi air a' 23mh dhen Chèitean.
3452116	I like eating.	3456316	'S toigh leam ithe.
3456685	Emily was surprised.	3475968	Bha iongnadh air Eamag.
3456694	Emily was listening to music.	3475977	Bha Eamag ag èisteachd ri ceòl.
3561604	I'm listening to this song.	3561602	Tha mi ag èisteachd air an òran seo.
3663249	There are islands in the sea.	3663860	Tha eileanan anns a' mhuir.
2332108	I'm not a teacher.	3282907	Chan eil mi nam thidsear.
259070	I am not a teacher.	3282907	Chan eil mi nam thidsear.
1860	I don't want to go to school.	3803724	Chan eil mi ag iarraidh dol dhan sgoil.
3807635	The badger bit the boy.	3807634	Bhìd an broc an gille.
3807636	The toilet is small.	3807632	Tha an taigh-beag beag.
3807649	We have a small house.	3807648	Tha taigh beag againn.
3807676	He is running around like a headless chicken.	3807675	Tha e mar chù a’ mùin air an t-sneachd.
3836273	Which color do you prefer?	3836270	Dè an dath as fheàrr leibh?
3836368	What is the difference between Malcolm and Mairy?	3836361	Dè an diofar a tha eadar Calum agus Màiri?
789735	I prefer coffee.	3838421	’S fheàrr leam cofaidh.
254819	I saw it with my own eyes.	3838480	Chunnaic mi e le m’ shùilean fhèin.
294739	He went abroad.	3838490	Chaidh e a-null thairis.
4000290	Is he drinking coffee?	4000294	A bheil e ag òl cofaidh?
4000305	Are you listening to music?	4000306	A bheil thu ag èisteachd ri ceòl?
3994414	God created him.	4000313	Chruthaich Dia e.
3994412	God created you.	4000314	Chruthaich Dia thu.
3994413	God created me.	4000315	Chruthaich Dia mi.
3994415	God created her.	4000316	Chruthaich Dia i.
258045	I'm doing my homework.	4000323	Tha mi a’ dhèanamh m’ obair-dachaigh.
4001332	I'm drinking the coffee.	4001333	Tha mi ag òl an cofaidh.
4001334	She is drinking the water.	4001336	Tha i ag òl an t-uisge.
4001341	I'm learning Scottish Gaelic.	4001342	Tha mi ag ionnsachadh Gàidhlig.
256178	I can swim.	4001441	’S urrainn dhomh snàmh.
261421	I can jump.	4001445	’S urrainn dhomh leum.
4046724	I will be late.	4046721	Bidh mi fadalach.
4046954	I prefer walking by myself.	3573509	B’fheàrr leam a bhith a’ siubhal ‘nam aonar.
4046980	It is very fast.	770008	Tha e glè luath.
2548760	I'll see you there.	4185187	Chi mi ann sibh.
3407132	Will you be there?	4185189	Am bi sibh ann?
4188991	It's now windy.	4188989	Tha i gaothach an-dràsda.
4188996	It's sunny just now.	4188994	Tha i grianach an-dràsda
242680	It's cloudy today.	4188999	Tha i sgòthach an-duigh.
318150	It's a beautiful day.	4189002	Tha là brèagha ann.
2701432	The weather is bad.	4189004	Tha droch shìde ann
1766700	The weather is good.	4189006	Tha deagh shìde ann.
36584	How's the weather?	4189009	Ciamar a tha an t-sìde ?
569283	How are things?	3817837	Dé do chor?
4189026	I hope the weather is going to be dry.	3614521	'S dòcha leam gum bi turadh ann.
4189350	How is life treating you?	4189353	dè an saoghal a tha agad?
453219	Happy birthday!	4189358	co-là breith sona dhut!
403068	You're welcome.	4189365	’S e do bheatha.
464478	Well done!	4189370	'S math a rinn thu!
3668669	I am boring.	4189378	Tha mi gleamach
4189381	I'm full of confidence today.	4189383	Tha mi làn misneachd an-diugh.
329713	Good morning!	4189469	Madainn mhath!
1317949	I am in the garden.	4192184	Tha mi sa ghàrradh.
1849064	This is awesome.	4192638	Tha seo sgoinneil!
4192641	Have you seen this yet?	4192643	Am faca sibh seo fhathast?
4192645	Have you read this yet?	4192647	An do leugh thu seo fhathast?
2233696	This is important.	4192650	Tha seo cudromach.
4192657	This is funny.	4192658	Tha seo èibhinn.
4192660	The weekend is here.	4192663	Tha an deireadh-sheachdain ann.
4192666	Look where I am today.	4192667	Seall far a bheil mise an-diugh!
36136	What a beautiful picture!	4195562	abair dealbh breagha!
4195566	I hope it will be good.	4195567	Tha mi an dòchas gum bi e math.
4195570	I will be busy tomorrow.	4195571	Bidh mi trang a-màireach.
4195573	I am learning Gaelic.	4195574	Tha mi ag ionnsachadh na Gàidhlig.
1434	I love you.	773096	Tha gaol agam ort.
32706	I'll see you later.	4195579	Chì mi a-rithist thu.
403063	Do you understand?	4195582	Tuigsinn?
2301402	I can understand that.	4195586	Tuigidh mi sin!
2267617	Now I understand what you mean.	4195591	Tha mi agad a-nis.
1841686	I don't understand it.	878982	Chan eil mi ga thuigsinn.
4201822	It's correct.	4201825	Tha e ceart.
433490	That's right!	4201827	Tha sin ceart.
16643	You've got it in one. That's right.	4201831	Tha e ceart agad.
4206989	It is very dark.	4206994	Tha e gle dorcha.
4207033	I'm well.	4207027	Tha mi gu math!
3893154	Enjoy the day.	4209520	Gabh math an latha.
2251311	That's very good.	4209734	Tha sin uabhasach math.
2251072	That's good enough.	4209737	Tha sin math gu leòr.
325876	That's better.	4209738	Tha sin nas fheàrr.
4209739	There you have it.	4209742	Sin agad e.
1723740	It's not right.	4209749	Chan eil e ceart.
2218493	You're very nice.	4209750	Tha thu uabhasach laghach .
4209752	Do you have any news for me?	4209756	A bheil naidheachd agad dhomh?
2258234	Good morning.	4189469	Madainn mhath!
4210951	It is the toilet.	3752706	Tha an taigh beag.
28045	I'd like to see a doctor.	4217735	Tha mi ag iarraidh dotair fhaicinn.
4217751	I'm too busy at work.	4217757	Tha mi ro thrang aig m' obair.
4217770	Will you take that?	4217776	An gabh thu sin?
1326	Are you sure?	4217783	Bheil thu cinnteach?
38153	Where do you work?	4218007	Càite a bheil thu fhèin ag obair?
4218241	Have you been working there for long?	4218239	A bheil fada bho thòisich thu san obair an sin?
4218256	Do you enjoy the work?	4218261	Bheil an obair a' còrdadh riut?
499689	Good afternoon.	4223915	Feasgar math!
1646	My name is Jack.	4223922	Is mise Jack.
4224103	They were so happy together.	4224105	Bha iad cho dòigheil còmhla.
4224110	Where was she going?	4224112	Càit' an robh i a' dol?
4224117	I'll phone her tonight.	4224120	Cuiridh mise fòn thuice a-nochd fhèin.
16300	Can you swim?	4224134	An urrainn dhut snàmh?
370708	Where do you live?	4224168	Càit a bheil thu a’ fuireach?
4224755	I did some work in the garden.	4224759	Rinn mi obair anns a' ghàrradh.
4224773	Fish is good for you.	4224776	Tha iasg math dhut.
4234245	It was a good day.	4234246	Bha latha math ann.
4844536	If not now, when?	4844565	Mur h-eil a-nist, cuine?
1577672	Burj Khalifa is currently the tallest building in the world.	5217659	'S e Burj Khalifa an togalach as airde san t-saoghal.
2582543	Why can't you explain what you're doing?	5223275	Carson nach urrainn dhut mìneachadh dé tha thu a' déanamh?
2046687	I was busy cooking.	5223277	Bha mi trang a' còcaireachd.
434258	Are you thirsty?	773100	A bheil am pathadh ort?
289503	He looks like his father.	1526162	Tha e coltach ri athair.
5223387	I don't think it will work.	1515906	Cha chreid mi gun obraich e.
253464	I want to stay here.	1515919	Tha mi ag iarraidh fuireach an-seo.
463150	They are eating their apples.	1515921	Tha iad ag ithe nan ùbhlan aca.
5223646	He has to go to England in the summer.	877972	Feumaidh e dol a Shasainn san t-samhradh.
823527	The black one is mine.	1516515	'S ann agamsa a tha am fear dubh.
4771541	Welcome!	5223655	Do bheatha dhan duthaich!
138919	Welcome.	5223655	Do bheatha dhan duthaich!
2954638	You need to go with Tom now.	5223814	Feumaidh tu dol còmhla ri Tòmas an-dràsta.
2143070	I am waiting for the train.	1514157	Tha mi a' feitheamh air an trèan.
293951	Does he speak English?	878430	A bheil Beurla aige?
294045	Can he speak English?	878430	A bheil Beurla aige?
574624	I am well.	770516	Tha mi gu dòigheal.
1858850	Hello.	770521	Halò.
5720657	Say this.	773240	Can seo.
2011393	Do you want a beer?	5732675	A bheil thu ag iarraidh leann?
5745481	Where are your silk gowns?	5745477	Càite a bheil do ghùnan sìod?
5745395	Tom hasn't left Australia.	5745505	Cha do dh'fhàg Tàmas Astràilia.
456237	It's raining.	5745509	Tha an t-uisge ann.
5745521	I could translate that poem to Spanish.	5745515	B' urrainn dhomh cuir Spànntis air an dàn sin.
5745540	There is nothing to be said.	5745537	Chan eil guth ri ràdh.
5745544	I started to learn it seriously in October.	5745543	Thòisich mi air ionnsachadh dha-rìribh san Dàmhair.
5745559	There are five cows in the little village.	3872513	Tha còig bhò anns a’ bhaile bheag.
5745562	You have red wine.	3872518	Tha fìon-dhearc agad.
5745563	Milk is better than water.	3573537	Tha am bainne nas fheàrr na am bùrn.
881343	The boy is eating bread.	767936	Tha am ballach ag ithe aran.
767950	The man ate bread.	770438	Dh'ithe am fear aran.
768053	My mother didn't see the boy on the street.	768196	Chan fhaca mo mhàthair am ballach air an t-sràid.
5745587	Your sister can't talk to you today.	768242	Chan urrainn dha phiuthar ruit a bhruidhinn an-diugh.
5745588	I listened to a very beautiful song yesterday.	772670	Dh'èist mi ri òran glè bhòidheach an-dè.
5745589	Are you going to work in the hotel tomorrow morning?	852119	Am bi thu ag obair aig an taigh-osda a-màireach anns a' mhadainn?
5745590	I hate that look!	1677625	'S beag orm an coltas sin!
5745593	I don't think that she is working.	1515910	Cha chreid mi gu bheil i ag obair.
5240374	I have no idea what happened.	879158	Chan eil càil fhios agam air dè a thachair.
5745596	Can you talk more slowly?	5745595	An urrainn dhuibh bruidhinn nas maille?
376611	I don't understand.	5745597	Cha do thuig mi sin.
5745600	I only speak a little Gaelic.	5745598	Chan eil ach beagan Gàidhlig agam.
436193	How much does it cost?	5745602	Dè a' phrìs?
432824	How much does this cost?	5745604	Dè a' phrìs a tha seo?
5745611	I'd rather have Judas by my side.	5745610	B' fheàrr Iùdas làmh rium.
5745618	My curses on the big sheep.	5745616	Mo mhallachd aig na caoraich mhòr.
5745620	It's been sixty-three years since I left Sutherland.	5745619	Tha trì fichead bliadhna 's a trì on dh'fhàg mi Dùthaich 'IcAoidh.
18157	Hunger is the best sauce.	5745632	Thig an t-acras na 's tric no aon-uair.
5745636	Hunger will come more than once.	5745632	Thig an t-acras na 's tric no aon-uair.
5745647	Three things that come unwanted: love, jealousy, and fear.	5745644	Triùir a thig gun iarraidh, gaol, èud agus eagal.
5745651	Wealth collects wealth and debt collects debt.	5745650	Tionailidh maoin, maoin, agus tionailidh fiachan, fiachan.
3455720	The rich get richer and the poor get poorer.	5745650	Tionailidh maoin, maoin, agus tionailidh fiachan, fiachan.
5745655	He is now on the road of truth.	5745654	Tha e a-nis air slighe na fìrinn.
2320235	He passed away.	5745654	Tha e a-nis air slighe na fìrinn.
5745658	Return good for evil.	5745656	Dèan math an aghaidh 'n uilc.
1847666	Turn the other cheek.	5745656	Dèan math an aghaidh 'n uilc.
5745660	Honor cannot be repaired.	5745659	Ch' an fhuiling an onair chùd.
5745663	The grass is greener on the other side of the fence.	5745662	Nach gorm na cnuic a tha fada bhuainn.
5745666	How green are the hills that are far from us.	5745662	Nach gorm na cnuic a tha fada bhuainn.
5745674	There is no hero without compare.	5745673	Chan eil saoigh gun choimheas.
5745679	A trout from the river pool, a staff from the wood, and a deer from the moor - "thefts" of which no Gael was ever ashamed.	5745677	Breac à linne, slat à coille ‘s fiadh à fìreach - mèirle às nach do ghabh Gàidheal a-riamh nàire.
5745683	The extravagant poor will never be wealthy.	5745682	Cha bhi 'm bochd soghail, saibhir.
412447	Better safe than sorry.	5745685	'S fheàrr cinnteach na caillteach.
5745688	Better sure than a loser.	5745685	'S fheàrr cinnteach na caillteach.
5745691	As you see yourself so will others see you.	5745690	Air rèir do mheas ort fhèin 's ann a mheasas càch thu.
5745692	According as thou esteemest thyself, others will esteem thee.	5745690	Air rèir do mheas ort fhèin 's ann a mheasas càch thu.
5745695	Better broken Gaelic than no Gaelic at all.	5745693	Is fheàrr Gàidhlig bhriste na Gàidhlig sa chiste.
5745697	It would blow the horns off a goat.	5745696	Sheideadh e na h-adharcan de ghobhar.
5745699	It's not easy to put breeches on a cat.	5745698	Cha shoirbh triubhas a chur air cat.
5745701	Glory lasts longer than life.	5745700	Is buaine bladh nas saoghal.
5745704	Shame lasts longer than anything.	5745703	Is buaine na gach ni 'n naire.
5745706	Son is like father.	5745705	Am mac mar an t-athair.
5745708	Holy Mary!	5745707	A Mhuire!
5745712	Revenge today, mourning tomorrow.	5745710	Buillean an-diugh, tuiream a-màireach.
5745715	What a day.	5745714	Abair latha.
5745719	Her glory will not be lost, despite the deceit and great malice of the Lowlanders.	5745718	’S cha tèid a glòir air chall, dh’aindeoin gò is mì-run mòr nan Gall.
5745722	Gaelic is the only language in the mouths of bards and fish.	5745721	Is i Gàidhlig an aon chànain am beul nam bàrd ’s nan èisg.
250692	My brother is now in Australia.	770522	Tha mo bràithair anns an Astràilia an-dràsta.
436243	How old are you?	770497	Dè an aois a tha thu?
69226	Are you ten years old?	770512	A bheil thu deich bliadhna a dh'aois?
5748830	I didn't buy this book.	5748831	Cha do cheannaich mi an leabhar seo.
3144650	Their car is not good.	5748832	Chan eil an càr aca math.
3656386	The weather's not as good today as it was yesterday.	5748835	Chan eil an t-sìde cho math an-diugh 's a bha e an-dé.
5748838	Today the weather's not as good as yesterday.	5748835	Chan eil an t-sìde cho math an-diugh 's a bha e an-dé.
4003500	I know these students.	5748839	Tha mi eòlach air na h-oileanaich a tha seo.
301279	He is a good carpenter.	5749180	Tha esan na dheagh shaor.
2451533	I only speak a little French.	5749902	Chan eil ach beagan Fraingis agam.
2271921	I don't speak French.	5749904	Chan eil Fraingis agam.
5749910	I only speak a little Irish.	5749908	Chan eil ach beagan Gàidhlig na h-Èireann agam.
2714042	Do you speak Irish?	5749912	A bheil Gàidhlig na h-Èireann agad?
2714042	Do you speak Irish?	5749913	A bheil Gàidhlig na h-Èireann agaibh?
5749916	I couldn't believe my ears.	5749915	Cha chreid mi mo chluasan.
565931	Kiss me.	5749922	Thoir pòg dhomh.
1025020	Tom is good at swimming.	5749963	Tha Tàmas math air an t-snàmh.
5749968	He couldn't do any better.	5749967	Cha b' urrainn dha nas fheàrr a dhèanamh.
4786620	Tom is taller than Mary.	5749969	Tha Tàmas nas àirde na Màiri.
5749974	The weather didn't clear.	5749973	Cha do rinn e turadh.
5749978	I am a carpenter.	5749977	Tha mi nam shaor.
5749978	I am a carpenter.	5749979	'S e saor a th' annam.
1642586	I like snow.	2890669	'S toil leam sneachd.
1880037	I am busy now.	852128	Tha mi trang an-dràsda.
3950503	I've lost my key.	1515926	Tha mi air an iuchair agam a chall.
70238	What did you do with that car?	1525534	Dè rinn thu leis a' chàr ud?
3552554	Good afternoon!	4223915	Feasgar math!
5750037	What's your favourite colour?	3836270	Dè an dath as fheàrr leibh?
484051	I have to help my mother.	1525323	Feumaidh mi mo mhàthair a chuideachadh.
5152871	There's a man at the door who's asking to speak with you.	878421	Tha fear aig an doras a tha ag iarraidh bruidhinn riut.
40296	The days are getting longer and longer.	770502	Tha na laithean a' fàs nas fhaide 's nas fhaide.
2833868	Where did you buy these shoes?	1516381	Càite an do cheannaich thu na brogan seo?
516307	You shouldn't go out.	1516539	Cha bu chòir dhut dol a-mach.
1723	Merry Christmas!	5751041	Nollaig Chridheil!
361350	Happy New Year!	5751042	Bliadhna math ùr!
361350	Happy New Year!	5751043	Bliadhn' ùr math!
5751060	Did you see my boyfriend?	5751059	Am faca tu mo leannan?
5751061	Did you see my girlfriend?	5751059	Am faca tu mo leannan?
4629571	Tom met Mary in 1972.	5751261	Choinnich Tàmas ri Màiri ann an 1972.
5751280	They were talking about you.	5751277	Bha iad a' bruidhinn mu do dhèidhinn.
4061418	I have enough.	5751663	Tha gu leòr agam.
5751665	You had enough.	5751664	Bha gu leòr agaibh.
5751667	She will have enough.	5751666	Bidh gu leòr aice.
5751669	Tom would have enough.	5751668	Biodh gu leòr aig Tàmas.
5751671	You'll have enough to do.	5751670	Bithidh do thoil ri dhèanamh.
5751675	I am as tired as a dog.	5751674	Tha mise cho sgìth ri cù!
1887560	I love your eyes.	5751677	Mo ghaoil air do dhà shùil.
5751679	Salvation is God's affair.	5751678	'S ann do Dhia a bhuineas slàinte.
5751681	Damn them!	5751680	Mo mhallachd aca!
5751683	Damn Tom!	5751682	Mo mhallachd aig Tàmas!
5751697	Tom saw enough.	5751695	Chunnaic Tàmas gu leòr.
5751705	Tom has enough to say.	5751704	Tha gu leòr aig Tàmas ri ràdh.
5751712	Tom expects so.	5751710	Tha Tàmas 'n dùil gur e.
2141970	I must go.	5751727	Feumaidh mi falbh.
5751732	Tom expected Mary to be in good spirits.	5751731	Bha Tàmas an dùil gun robh Màiri gu sunndach.
5751734	Come without delay.	5751733	Thig gun dàil.
1028687	Tom hates Mary.	5751735	Is coma le Tàmas Màiri.
2323	I don't care.	5751737	Tha mi coma.
318150	It's a beautiful day.	5751746	'S bhòidheach an latha.
5751748	Sit at the head of the table.	5751747	Suidh aig ceann a' bhùird.
2246045	I ran away.	5751759	Rinn mi mo chasan.
1533842	Tom ran away.	5751776	Rinn Tàmas a chasan.
5751805	It happened last year.	5751804	Thachair e an-uiridh.
4771541	Welcome!	5751815	Fàilte romhad chun dùthaich.
4771541	Welcome!	5751824	Fàilte romhaibh chun dùthaich.
4771541	Welcome!	5751817	Fàilte.
5751830	They are talking to each other.	5751829	Tha iad a’ bruidhinn ri chèile.
5751831	They are talking among themselves.	5751829	Tha iad a’ bruidhinn ri chèile.
5751834	Tom and Mary are talking to each other.	5751833	Tha Tàmas agus Màiri a’ bruidhinn ri chèile.
5751895	I don't have to go.	5751894	Chan fheum mi falbh.
4666767	Tom doesn't have to go.	5751896	Chan eil feum aig Tàmas falbh.
5751903	Tom, stay in your seat!	5751902	A Thàmais, fuirich san t-sèithear!
5752889	She was from Eriskay.	5752888	B' e Èirisgeach a bh' innte.
5752893	Tom is from Eriskay.	5752892	S' e Èirisgeach a th' ann an Tàmas.
5752895	Pleased to meet you, Tom.	5752894	Tha mi toilichte ur coinneachadh, a Thàmais.
5752895	Pleased to meet you, Tom.	5752904	Tha mi toilichte do choinneachadh, a Thàmais.
1556519	It's not raining.	773232	Chan eil an t-uisge ann.
5753124	Why aren't you listening?	5753121	Carson nach eil sibh ag éisteachd?
780304	I'm sick.	770454	Tha mi tinn.
436427	I am sick.	770454	Tha mi tinn.
448236	I'm ill.	770454	Tha mi tinn.
64158	How is the weather?	4189009	Ciamar a tha an t-sìde ?
442070	What's the weather like?	4189009	Ciamar a tha an t-sìde ?
5205265	What is the weather like?	4189009	Ciamar a tha an t-sìde ?
259335	I was born in Osaka.	5753161	Rugadh mise ann an Osaka.
5753164	It's very cold in this room, isn't it?	1516300	Tha e glè fhuar san t-seòmar seo, nach eil?
360558	See you later!	4195579	Chì mi a-rithist thu.
451481	"What do you want?" "I want a dog."	1515918	"Dè tha thu ag iarraidh?" "Tha mi ag iarraidh cù."
3825121	Well done.	4189370	'S math a rinn thu!
906731	What's your favorite color?	3836270	Dè an dath as fheàrr leibh?
2794594	What is your favourite colour?	3836270	Dè an dath as fheàrr leibh?
2239588	What is your favorite color?	3836270	Dè an dath as fheàrr leibh?
350137	It's always been that way.	5754179	'S ann mar sin a bha e riamh.
532812	It's always been like that.	5754179	'S ann mar sin a bha e riamh.
5134170	Where will we go afterwards?	5754189	Càit an deach sin an déidh sin?
1955256	I hope everyone knows what this means.	5754202	Tha mi an dòchas gu bheil fios aig a h-uile duine dé tha seo a' ciallachadh.
453344	Yesterday I bought a book.	5754212	Cheannaich mi leabhar an-dé.
971763	Yesterday, I bought a book.	5754212	Cheannaich mi leabhar an-dé.
1489178	Do you have a mobile phone?	5754290	A bheil fón-laimh agad?
2800541	Do you have a cell phone?	5754290	A bheil fón-laimh agad?
535419	Do you have a cellphone?	5754290	A bheil fón-laimh agad?
5754306	Give me the magazine, please.	5754301	Thoir dhomh an iris, mas e do thoil e.
654928	I am going to the shop.	770513	Tha mi a' dol dhan bhùth.
5760005	Mary was from Eriskay.	5760010	'S e Èirisgeach a bh' ann am Màiri.
5765323	Tom told me in French, "Alice saw Mary the day before yesterday."	5765322	Thuirt Tòmas rium sa Fhraingis, "Chunnaic Ailis Màiri a-bhòin-dè."
5765325	Tom told me in French that Alice saw Mary the day before yesterday.	5765324	Thuirt Tòmas rium sa Fhraingis gun chunnaic Ailis Màiri a-bhòin-dè.
5765331	Tom asked me, "Did Alice see Mary the day before yesterday?"	5765330	Chuir Tòmas ceist orm, "Am faca Ailis Màiri a-bhòin-dè?"
5765335	Thomas asked me, "Didn't Alice see Mary the day before yesterday?"	5765333	Chuir Tòmas ceist orm, "Nach fhaca Ailis Màiri a-bhòin-dè?"
5765337	Tom is asking me, "Why did Alice see Mary the day before yesterday?"	5765336	Tha Tòmas a' cur ceist orm, "Carson a chunnaic Ailis Màiri a-bhòin-dè?"
5765339	Tom will ask me, "Where did Alice see Mary the day before yesterday?"	5765338	Bidh Tòmas a' cur ceist orm, "Càite a fhaca Ailis Màiri a-bhòin-dè?"
5765343	Tom will tell me, "Alice didn't see Mary the day before yesterday."	5765341	Bheir Tòmas rium, "Chan fhaca Ailis Màiri a-bhòin-dè."
19143	Thank you for the information.	5765415	Tapadh leibh airson am fiosrachadh.
