1436	I am curious.	7351434	انا قرعاجي.
1435	I don't like you anymore.	7351435	ما ولّيتش نحبّك خلاص.
1434	I love you.	7351438	نحبّك.
1433	It's not much of a surprise, is it?	7351439	ما راهيش سورپريز تع صسح، ولّا لالا⸮
1432	I can only wait.	7351440	قادر نسّنّا برك.
1431	Where is the problem?	7351443	وين راه لموشكيل⸮
1430	I will play Sudoku then instead of continuing to bother you.	7351444	راني رايح نلعب سودۆكو مّالا خير ما نديرانژيك.
1429	You never have class or what?!	7351445	ژامي ما عندك كور ولّا كيفاش⸮!
1428	It's too bad that I don't need to lose weight.	7351446	خسارا ما نصحقش نشيان.
1448	Next thing you know, you'll be in the papers.	7351447	قبل ما تعرفها نتا، تكون نتا ف لجرنان.
1447	You can probably guess what happens though.	7351450	كاپابل تدوڥيني وحدك واش صرا.
1446	I didn't want this to happen.	7351454	ما كونتش حايبها تصرا.
1445	I hate chemistry.	7351456	نكره شّيمي.
1444	It is inevitable that I go to France someday, I just don't know when.	7351460	راهي رايحا تكمّل علييا نروح ل فرانسا كاش نهار، ما علاباليش برك وقتاش.
1443	I don't know what to do anymore.	7351462	ما علاباليش ڨع وش لازم ندير دوركا.
1442	I shouldn't have logged off.	7351464	اوكون غير ما ديكۆنيكتيتش.
1440	But the possibility seems unlikely.	7351466	لپۆسيبيليتي تبان امپرۆبابل.
1439	Why don't you come visit us?	7351469	وعلاش ما تجيش تزورنا⸮
1438	I don't want to wait that long.	7351473	ما رانيش حايب نسّنّا بزّاف كيما هاكدا.
1459	I don't know if I still have it.	7351476	ما علاباليش ادا مازالها عندي.
1458	It's not something anyone can do.	7351478	ماشي حاجا كولّ واحد قادر اديرها.
1456	How could I be a robot? Robots don't dream.	7351481	كيفاش قادر نكون رۆبۆ⸮ رۆبۆوات ما يناموش.
1455	It only shows you're not a robot.	7351483	تورّي برك بلّي نتا ماشي رۆبۆ.
1454	Seriously though, episode 21 made me almost cry while laughing.	7351486	ولّاه ساريو، اپيزۆد 21 قريب بكيت ب ضحك.
1453	Everyone has strengths and weaknesses.	7351489	كولّ واحد عندو ديكاليتي او ديفابلاس.
1452	I can't explain it either.	7351490	ما رانيش قادر نفهّما تاني.
1451	I have nothing better to do.	7351493	ما عنديش حاجا خير نديرها.
1450	I am not much of a traveller.	7351496	ما نحبش نڥواياژي بزّاف.
1449	What other options do I have?	7351498	واش قادر نخيّر ڨانا⸮
1469	Why are you sorry for something you haven't done?	7351501	وعلاش تطلب سّماح علا حاجا لّي ما درتهاش⸮
1468	Everyone wants to meet you. You're famous!	7351503	ڨع حابّين يتلاقاو بيك، راك مشهور!
1467	All you can do is trust one another.	7351504	ڨع واش تقّقدرو تديرو هووا تديرو كۆنفيانس مان بيناتكوم.
1466	How do you find food in outer space?	7351506	كيفا لقيت لماكلا ف ليسپاس⸮
1465	Therein lies the problem.	7351507	راهو هنا لپرۆبلام.
1464	I was wondering if you were going to show up today.	7351508	كونت حاير ادا كاش نهار تبيّن روحك.
1463	I don't speak French well enough!	7351510	ما نهضرش مليح فرانساوييا!
1462	My mom doesn't speak English very well.	7351512	يمّا ما تهضرش مليح انڨلي.
1461	Don't underestimate my power.	7351514	ما تحڨرش لپوڥوار ديالي.
1460	What do you think I've been doing?	7351517	واش حساباتلك كونت ندير⸮
1479	Stop it! You're making her feel uncomfortable!	7351520	حبّس! راك تحرج فيها!
1478	Bearing can be unbearable.	7351523	تّحمال قادر اكون انسوپۆرتابل.
1477	Life is hard, but I am harder.	7351526	لحيات صعيبا، بصّح انا صويب عليها.
1476	You're not fast enough.	7351529	ماراكش بزّاف راپيد.
1475	I don't have anyone who'd travel with me.	7351530	ما عندي حتّا واحد قادر اڥواياژي معايا.
1474	You'd be surprised what you can learn in a week.	7351532	تحير واش تقدر تسمع ف سامانا وحدا.
1473	What keeps you up so late?	7351535	واش لي حاكمك حتّا ل دۆرك باش ما ترقدش⸮
1472	Whatever I do, she says I can do better.	7351537	ڨـ‬ع واش ندير، هييا تقول بلّي نقدر ندير خير.
1471	Foreign people intrigue me.	7351540	لبرّانييا احيروني.
1470	I utterly despise formal writing!	7351542	نكره جدّ لكتيبا ۆفّيسيال.
1489	Do you really need to ask the question to know the answer?	7351543	تصحق سح تسقسي لاكيستيۆن باش تعرف لاريپۆنس⸮
1488	I just wanted to check my email.	7351544	حبّيت برك نڥيريفيي ليمايل ديالي.
1487	I have too many things on my mind these days.	7351547	عندي بزّاف حوايج في راسي هاد لّييامات.
1486	It's useless to keep on thinking any more.	7351550	سيپالاپان تكمّل تخمّم.
1485	I learned to live without her.	7351552	تعلّمت نعيش بلا بيها.
1484	Nobody understands me.	7351553	حتّا واحد ما يفهمني.
1483	This is a pun.	7351554	هادي بلاڨ.
1482	I don't speak Japanese.	7351557	ما نهضرش ژاپۆنييا.
1481	Tomorrow, he will land on the moon.	7351558	غدوا، نحطّو رجلينا فوق لقمر.
1480	Nothing is beautiful but the truth.	7351651	ما كانش حاجا شابّا خير من لاڥيريتي
1499	Are you referring to me?	7351653	راك تهضر علييا⸮
1498	Stop seeing me as a "normal" person!	7351654	ريّح ما تشوف فييّا شغول انسان "نۆرمال".
1497	I'm so dumb... I'm trying to explain things to you that I don't understand myself.	7351656	انا صح جاياح... راني نفهّم فيك حوايج ما رانيش فاممهوم.
1496	It would take me too much time to explain to you why it's not going to work.	7351657	رايحا تدّيلي بزّاف وقت باش نفهّملك بلّي ما راهيش رايحا تمشي.
1495	It's no use pretending to make me believe that I believe things you don't believe!	7351658	سيپالاپين تلعبها ترجّعني نامن بلّي نامن حوايج ما تامنش بيهوم!
1494	You never have time for important things!	7351660	ژامي ما عندك لوقت ل حوايج امپۆرتانت!
1493	Don't expect others to think for you!	7351663	ما تّسّنّاش نّاس تخمّم في پلاصتك!
1492	You really don't have the right priorities!	7351666	ما عندكش ڨع ليپريۆريتي لملاح!
1491	I suppose that behind each thing we have to do, there's something we want to do...	7351667	شكّيت بلّي مور كولّ حاجا لازم نديروها، كاين حاجا حايبين نديروها...
1490	You can't expect me to always think of everything!	7351669	ما تقدرش تسّنّا منّي نفكّر دايمن علا كولّش.
1509	We must learn to live together as brothers, or we will perish together as fools.	7351673	لازم نتّعلّمو نعيشو كيف كيف كي لخاوا، سينۆن نموتو كي لبهالل.
1508	"What's going on in the cave? I'm curious." "I have no idea."	7351677	"واش راه صاري داخل لاكاڥ⸮ حبّيت نعرف." "ولّاه ما علابالي."
1507	"What's the matter?" asked the little white rabbit.	7351680	"واشنو هووا لپرۆبلام⸮" سقسات لڨنينا لبيضا صّغيرا.
1506	"When will you be back?" "It all depends on the weather."	7351685	"وكتاش تولّي ⸮ " "علا حساب سحاب."
1505	"Who is it?" "It's your mother."	7351686	"شكون⸮" "يمّاك.".
1504	Would you like something to drink?	7351687	حاب حاجا تشربها⸮
1503	"A rolling stone gathers no moss" is a proverb.	7351689	"حجرا تدور ما تتعمّرش ب لاموس" هووا پرۆڥارب.
1502	I wish I could care more about my grades but it seems that, at a certain point of my life, I decided they wouldn't be so important anymore.	7351692	اوكون غير كونت نمدّ قيما ل نۆت ديالي بصّح تبانلي بلّي، ف وقت من حياتي، ديسيديت ما رايحينش ازودو اكونو امپۆرتان.
1501	It can't be!	7351693	ما كانش منها!
1500	There will always be things I will never learn, I don't have eternity before me!	7351695	كاين دايمن حوايج ژامي ما نتعلّمهوم، ما عنديش لاتارنيتا قدّامي!
1519	Someday I'll run like the wind.	7351696	كاش نهار نجري كيما رّيح.
1518	"Thank you for helping me." "Don't mention it."	7351701	"يعطيك صّحّا علا لمعاونا ديالك." "بلا مزييا."
1517	"That's very nice of you," Willie answered.	7351704	"هادي حاجا ژانتيي من عندك،" ريپۆندات ويلي .
1516	"The phone is ringing." "I'll get it."	7351706	"تيليفون راهو اصۆني." "دۆرك نريپۆندي."
1515	Their communication may be much more complex than we thought.	7351707	لكۆمّونيكاسيۆن ديالهوم راهي پلوس كۆمپلكس علا واش حساباتلنا.
1514	"This looks pretty interesting," Hiroshi says.	7351711	"هادي حاجا انتيريسّانت، " قالت هيرۆشي.
1513	"This is what I was looking for!" he exclaimed.	7351714	"هادا واش كونت نحوّس!" قالها ب زڨا.
1512	"Trust me," he said.	7351715	قال لي: "دير فييا كۆنفيانس."
1511	"To tell you the truth, I am scared of heights." "You are a coward!"	7351719	"نقول لك صّح، نخاف لعيالي." "نتا مخوافا!"
1510	Uh... How's that working?	7351720	او... كيفاش تمشي⸮
1529	A Japanese would never do such a thing.	7351721	واحد ژاپۆني ژامي ما يدير حاجا كيما هادي.
1528	"Haven't we met somewhere before?" asked the student.	7351722	"ما تلاقيناش من قبل ف كاش پلاصا⸮" سقسا لاتوديان.
1527	"I feel like playing cards." "So do I."	7351725	"راني حايب نلعلب كارطا." "انا ڨانا."
1526	I want a boat that will take me far away from here.	7351729	حبّيت بابور يدّيني بعيد علا هنا.
1525	Class doesn't begin until eight-thirty.	7351730	لكلاسا ما تبداش حتّا تمنيا او نص.
1524	It is up to you to decide whether we will go there or not.	7351732	نتا لّي ديسيدي ادا نروحو تمّا ولّا لالا.
1523	It may be that the happiness awaiting us is not at all the sort of happiness we would want.	7351734	بالاك لفرحا لّي تسّانانا ما راهيش لفرحا لّي كونّا نستنّاو فيها.
1522	Let me know if there is anything I can do.	7351737	قول لي ادا كاينا حاجا نقدر نديرها.
1521	Please don't cry.	7351738	مادا بيك ما تبكيش.
1520	"She likes music." "So do I."	7351739	"تحب لموسيقا." "انا تاني."
1539	How do you spell "pretty"?	7351741	كيفاش يتنكتب "شباب"⸮
1538	If you don't eat, you die.	7351743	ادا ما تاكولش تموت.
1537	The Germans are very crafty.	7351745	لالمانييين مارڨين بزّاف.
1536	Place the deck of cards on the oaken table.	7351747	پلاصي لكارطا فوق طّابلا تع لحطب تع شان.
1535	If you see a mistake, then please correct it.	7351751	ادا تشوف غلطا، مادا بيك تسڨّمها.
1534	In the 1950's, the Finns were cited as having one of the least healthy diets in the world.	7351754	ف لخمسينات، كانو ليفينوا مسيتيين علا لماكلا لفاقيرا ديالهوم ف لعالم.
1533	Rye was called the grain of poverty.	7351758	سّڨلا كان وسّمها لعلفا تاع لفاقير.
1532	Communism will never be reached in my lifetime.	7351760	لكۆمّونيزم ژامي ما يلحق او انا عايش.
1531	The archer killed the deer.	7351763	لارشي قتل سّار.
1530	Allen is a poet.	7351765	الّان هوا پۆات.
1552	It wasn't me, commissioner!	7351767	ماشي انا، كۆميسّار!
1551	When you're beginning to look like the photo in your passport, you should go on a holiday.	7351768	كيما تولّي تشبه ل تّصويرا ديالك ف لپاسۆپر، تمّاك تقدر تڥواياژي.
1550	Democracy is the worst form of government, except all the others that have been tried.	7351770	ديمۆقراطييا هييا لافۆرم لعيّانا ڨع تاع لحوكم، حاشا لخرين لّي تّجربو من قبل.
1549	First, I'm going to do an outline of my new website.	7351773	ف لّوّل، راني رايح ندير شيما تع سّيت انترنات ژديد ديالي.
1547	It is not rare at all to live over ninety years.	7351776	ماشي قليل لّي اعيشو كتر من تسعين سنا.
1544	One million people lost their lives in the war.	7351777	مليون عبد مات ف لڨيرّا.
1543	"Why aren't you going?" "Because I don't want to."	7351780	"وعلاش ما تروحش⸮" "پاسك ما رانيش حايب."
1542	Ten years is a long time to wait.	7351781	عشر سّنين راهي وقت بزّاف لواحد يسّنّاها.
1541	I'm sorry, I can't stay long.	7351784	سمحلي، ما نقدرش نطوّل.
1540	Why don't we go home?	7351785	وعلاش ما تروحش ل دّار.
1564	Thank you very much!	7351787	يعطيك صّحّا بزّاف بزّاف!
1563	Are they all the same?	7351789	هوما ڨع كيف كيف⸮
1561	Did you miss me?	7351790	توحّشتني⸮
1560	You're lucky because he didn't bite you.	7351792	راك مزهور پاسك ما عضّكش.
1559	Well, the night is quite long, isn't it?	7351794	اهي، لّيل راهي طويلا، اه ولّا لالا⸮
1558	People from Madrid are weird.	7351796	لعيباد تع مادريد ناس بيزار.
1557	You're an angel!	7351798	نتا مالايكا!
1555	When I left the train station, I saw a man.	7351800	كي خلّيت ستاسيۆن تاع تران، شفت راجل.
1554	With so many people around he naturally became a bit nervous.	7351802	معا لغاشي لّي داير بيه، ولّا شوييّا مقلّق.
1553	Oh, my white pants! And they were new.	7351804	ۆه، سروالي لبيض! او كان ژديد.
1574	Wash before first wearing.	7351805	اغسل قبل ما تلبسها لمرّا لولا.
1573	Pull into shape after washing.	7351807	عاود رجّع لافۆرم بعد ما تغسل.
1572	Damn! It's not bad!	7351809	يا زّح! ولّاه انتيك!
1571	They were left speechless.	7351811	قعدو بلا لسان.
1570	It's a pity when somebody dies.	7351813	خسارا كيما اموت واحد.
1569	Round trip? Only one-way.	7351816	الي راتور⸮ الي برك.
1568	That's a good idea!	7351818	هادي ادي شابّا!
1567	It's a surprise.	7351820	هادي سورپريز.
1566	I'll take him.	7351822	ندّيه.
1565	Where are the eggs, please?	7351824	سمحلي، وين راهوم لبيض⸮
1585	How long does it take to get to the station?	7351827	شحال لازم لوقت باش تلحق ل لاستاسيۆن⸮
1584	Seeing that you're not surprised, I think you must have known.	7351828	ماراكش سورپري، باينا بلّي كونت علابالك.
1583	Poor is not the one who has too little, but the one who wants too much.	7351833	لفاقير ماشي لّي عندوش شوييا، مي لّي يسحق بزّاف.
1582	To have doubts about oneself is the first sign of intelligence.	7351836	لّي ادوتي علا روحو، هادا سيني لّوّل تع لانتيلّلژانس.
1581	The only useful answers are those that raise new questions.	7351838	ليريپۆنس لّي تستفاد منهوم هوما ليريپۆنس لّي اخلقو ليكيستيۆن ژدد.
1580	Math is like love: a simple idea, but it can get complicated.	7351840	لمات كيما لامور - ادي سامپل، بصّح تتكۆمپليكا.
1579	Oh, I'm sorry.	7351841	ۆه، سمحلي.
1578	They say love is blind.	7351844	اقولو بلّي لامور عما.
1577	Those who live in glass houses should not throw stones.	7351845	لّي عايشين ف دار تع زجاڨ، ما لازمش يرميو لحجر.
1575	Don't open before the train stops.	7351846	ما تفتحش قبل ما يحبس تران.
1596	It's quite difficult to master French in 2 or 3 years.	7351849	صعيبا تهضر مليح رومييا ف 2 ولّا 3 سنين.
1595	"How do you feel?" he inquired.	7351850	"كيفاش راك تحسّ روحك⸮" هووا سقسا.
1594	May I ask a question?	7351851	قادر نسقسيق كستيۆن⸮
1592	It is said that "Hamlet" is the most interesting play ever written.	7351852	اقولو بلّ 'هاملت' پياس تع تيياتر لّي ژامي ما كتبو خير منها.
1591	"I can't think with that noise," she said, as she stared at the typewriter.	7351855	"ما رانيش قادرا نخمّم معا لحسّ هادا،" هييا قالت، او كانت تشوف ف لاماشينا تع لكتيبا.
1590	Do you speak Italian?	7351856	تهضر طاليانييا⸮
1589	It is difficult to keep up a conversation with someone who only says "yes" and "no".	7351857	صعيبا تڨسّر معا واحد يعرف غير اقول "اه" ولّا "لالا".
1324	That's MY line!	7352001	هادا هووا لخطّ ديالي!
1427	No, he's not my new boyfriend.	7352002	لالا، ماشي صاحبي لّي نخرج معاه جديد.
1587	Excuse me; allow me to point out three errors in the above article.	7352003	سمحلي، مي خلّيني نوجّه تلاتا ليزيرّار ف لارتيكل لّي من فوق.
1586	This will be a good souvenir of my trip around the United States.	7352005	هادا راح اكون سوڥنير شباب من لڥواياژ ديالي ل لماريكان.
1604	I wonder how long it's going to take.	7352017	راني مسقسي روحي شحال رايحا طّوّل.
1603	That is rather unexpected.	7352018	ما كونّاش ڨع نستنّاوها.
1602	You'll forget about me someday.	7352019	تنساني كاش نهار.
1601	Imagination affects every aspect of our lives.	7352020	ليماژيناسيۆن تافّيكتي ڨع ليزاسپي ف حياتنا.
1600	I would never have guessed that.	7352023	ژامي ما كونت ندوڥينيها.
1599	It would be fun to see how things change over the years.	7352026	نزهاو اوكون نشوفو كيفاش لحوايج يتّبدّلو معا لعوام لجايين.
1598	I don't want to spend the rest of my life regretting it.	7352028	ما رانيش حايب نجوّز ڨع حياتي نندمها
1597	It's impossible for me to explain it to you.	7352029	امپۆسّيبل علييّا نفهّم لك.
1615	Do whatever he tells you.	7352031	دير ڨع واش اقولّك.
1613	Do you have a condom?	7352033	عندك كاپّۆتا⸮
1612	We can't sleep because of the noise.	7352035	ما نقّدروش نرّقدو علاجال لحسّ.
1611	I think exams are ruining education.	7352036	في رايي، ليمتيحانات فسّدو تّربييا.
1610	Let me know if I need to make any changes.	7352039	قول لي ادا لازم نبدّل كاش حاجا.
1609	Life without love is just totally pointless.	7352041	دّنيا بلا لامور ما عندها حتّا معنا.
1608	Many people drift through life without a purpose.	7352044	بزّاف نّاس عايشين لّاهوبال ف لحيات بلا ۆبژكتيف.
1607	Nothing is achieved without effort.	7352045	حتّا حاجا ما تكمل بلا مجهود.
1606	I couldn't have done it without you. Thank you.	7352046	.امپۆسّيبل نكون درتها بلا بيك. صاحّيت.
1605	I can't live without a TV.	7352047	ما نقدرش نعيش بلا لاتالا.
1626	Do you need me to give you some money?	7352048	صحقّيتني نمدّلك شوييا دراهم⸮
1625	I have a bone to pick with you.	7352050	راني نسالهالك.
1623	The mandatory character of schooling is rarely analyzed in the multitude of works dedicated to the study of the various ways to develop within children the desire to learn.	7352054	لكاراكتار ۆبليڨاتوار تع لمسيد قليل وين يتّاناليزا ف لكتابات لّي مكۆنساكرييين ل اتود تع ليموايان باش نديڥلۆپّيو ديزير تع لقرايا عند دراري.
1622	What do you want?	7352056	واشنو تحوّس؟
1621	"Ah!" is an interjection.	7352060	"اه!" انترژكسيۆن.
1620	"Yes, orange juice please," says Mike.	7352061	"اه، ژّيدۆرانژ تاع ڜّينا مادامبيك، " قال مارك.
1619	May I talk to Ms. Brown?	7352062	نقدر نهدر معا سي براون⸮
1618	It is already eleven.	7352066	راهي ديجا لحداش.
1617	It took me more than two hours to translate a few pages of English.	7352068	جوّزت كتر من زوج سوايع باش نطرجم شوييّا پاژات ب لانڨلي.
1637	And yet, the contrary is always true as well.	7352070	وشنو، لكۆنترار ڨانا دايمن صح.
1636	To be perfect she lacked just one defect.	7352073	باش تكون پارفات، خصها ديفۆ واحد.
1634	To be surprised, to wonder, is to begin to understand.	7352078	تكون مسورپري، موهوم، معناتها ولّيت بديت تفهم.
1633	All that which is invented, is true.	7352079	ڨع واش مانڥانتي صح.
1632	The cost of life increased drastically.	7352080	لمعيشا غلات بلبزّاف.
1631	This is my friend Rachel. We went to high school together.	7352083	هادي صاحبتي راشال. كونّا كيف كيف ف ليشي.
1630	I have a dream.	7352085	عندي حلم.
1629	Hey, I may have no money, but I still have my pride.	7352088	شوف، بالاك ما عنديش دراهم، بصّح عندي نّيف.
1627	Paris is the most beautiful city in the world.	7352089	پاري هييا لمدينا شّابّا ڨاع ف لمۆند.
1647	I like it very much.	7352090	عجبتني بزّاف.
1646	My name is Jack.	7352093	واسمني جاك.
1645	I think I'm gonna go to sleep.	7352096	واقيل راني رايح نرقد.
1644	You look stupid.	7352098	تبان بهلول.
1643	What do you mean you don't know?!	7352100	واش حايب تمعني كي راك تقول بلّي ما تعرفش⸮!
1642	You're by my side; everything's fine now.	7352102	راك معايا، كولّش راهو انتيك دۆكّا.
1641	You found me where no one else was looking.	7352104	لقيتني وين حتّا واحد ما حوّس.
1640	You opened up my eyes to what it's like when everything is right.	7352106	فتحت لي عينييّا علا واش راهي، كيما اكون كولّش مليح.
1639	The world is a den of crazies.	7352107	دّنيا پلاست لمهابل.
1638	We don't see things as they are, but as we are.	7352108	ما نشوفوش لحوايج كيما راهوم، نشوفوهوم كيما حنا.
1661	Could you dial for me? The telephone is too high.	7352111	قادر تكۆمپۆزي نومرۆ في پلاصتي⸮ تيليفون راهو عالي بزّاف.
1660	I'd like to stay for one night.	7352113	حايب نقعد ليلا.
1659	It's not my fault!	7352116	ماشي لا فۆت ديالي!
1658	Italy is a very beautiful country.	7352117	طّليان بلاد شابّا.
1654	Would you like to dance with me?	7352120	تشطح معايا⸮
1653	Thanks, that's all.	7352121	صاحّا، هادا كولّش.
1652	These things aren't mine!	7352124	هادو لحوايج ماشي ديالي!
1651	Is it far from here?	7352126	اسك بعيدا من هنا⸮
1650	I have to go shopping. I'll be back in an hour.	7352128	راني رايح ندير ليكورس، نولّي علا ساعا.
1649	How do you say that in Italian?	7352129	كيفاش تقولها ب طّاليانييا⸮
1673	"Pass me the salt, please." "Here you are."	7352130	"جوّزلي لملح، مادابيك." "هاو ليك."
1671	He's very sexy.	7352132	هووا مليح.
1670	Not wanting is the same as having.	7352134	لواحد كيما ما يحبش حاجا، كلّي عندو.
1669	Life is what happens to you while you're busy making other plans.	7352135	لحيات هيّا واش يصرالك كيما تكون مشغول تپلانيفيي حوايج واحدوخرين.
1668	Love is never wasted.	7352139	لامور ژامي ما يتنخسر.
1666	I have lost my wallet.	7352140	تبحّرلي لپۆرتفاي ديالي.
1665	Is it bad?	7352142	حاجا ماشي مليحا؟
1664	Open your mouth!	7352143	افتح فومّك!
1663	Where are the showers?	7352144	وين راهي دّوش؟
1662	Is there a youth hostel near here?	7352146	كاين ۆتال تاع ليژان قريب علا هنا⸮
