1112479	The door is locked.	5408965	Døra er låst.
6021868	Sh! He's sleeping!	5924563	Hysj! Han søv!
2111725	I'm home.	5924600	Eg er heime.
404046	I'm at home.	5924600	Eg er heime.
29049	I am at home.	5924600	Eg er heime.
1871567	I am bored.	5926109	Eg keiar meg.
707526	Count to thirty.	5926297	Tel til tretti.
72757	Count up to thirty.	5926297	Tel til tretti.
750644	I never read the book.	396893	Eg las aldri boka.
1523679	I have black eyes.	1512512	Eg har svarte augo.
1400784	Mary has big eyes.	1980621	Maria har store augo.
17150	Where do you come from?	1980626	Kor kjem du frå?
322941	My name is Ichiro Tanaka.	1983354	Eg heiter Ichiro Tanaka.
255914	I am listening to the radio.	1983779	Eg høyrer på radio.
2047614	I've got to be careful.	2977286	Jeg må være forsiktig.
2481346	Have you a dog?	5007544	Har du ein hund?
1037893	The Tatoeba Project, which can be found online at tatoeba.org, is working on creating a large database of example sentences translated into many languages.	2059666	Tatoebaprosjektet, som finst online på tatoeba.org, går ut på å skape ein stor database med eksempelsetningar omsett på mange språk.
444019	Take the oranges out of the fridge.	1983773	Ta appelsinane ut av kjøleskåpet.
508282	I have a cat and a dog. The cat's black and the dog's white.	1981127	Eg har ein katt og ein hund. Katten er svart og hunden er kvit.
255347	I have a cat and a dog. The cat is black and the dog is white.	1981127	Eg har ein katt og ein hund. Katten er svart og hunden er kvit.
316724	She is living an unhappy life.	1980729	Ho lever eit ulukkeleg liv.
3060588	Do you like my new straw hat?	4110758	Likar du den nye stråhatten min?
2247270	What do I need?	5928746	Kva treng eg?
1563477	We need rules!	5928761	Me treng reglar!
2524299	Who's hungry?	6455195	Kven er svolten?
2524322	Who is hungry?	6455195	Kven er svolten?
319319	My father is tall.	396664	Far min er høg.
385392	Excuse me, what time is it?	944777	Unnskyld, hva tid det?
33182	Bob is my friend.	1980627	Bob er venen min.
2107594	Tom's sick.	1980952	Han Tom er sjuk.
1776600	Why are you speaking in French?	1983258	Kvifor snakkar du fransk?
2248309	I'm very sad.	1983268	Eg er veldig trist.
251768	Come into my room.	1983384	Kom til rommet mitt.
255090	I know the girl playing tennis.	1981132	Eg kjenner jenta som speler tennis.
456097	It hurts here.	5926524	Det gjer vondt her.
6455439	In Italy, there are many houses with large gardens.	6455438	I Italia er det mange hus med store hagar.
6873252	I'm drinking coffee.	5409006	Eg drikk kaffi.
1392478	I am drinking coffee.	5409006	Eg drikk kaffi.
895854	Vladivostok is a city in Russia.	2059620	Vladivostok er ein by i Russland
303727	He is not from Hokkaido.	1980581	Han er ikkje frå Hokkaido.
441942	Whose fault is it?	1983366	Kven si skuld er det?
1719	It's too expensive!	5926202	Det er for dyrt!
757502	That's too expensive!	5926202	Det er for dyrt!
506536	I don't believe in God.	5826322	Eg trur ikkje på Gud.
812362	A bird can fly.	6014537	Ein fugl kan flyge.
8037432	Tonight's the night.	1981391	Kvelden i kveld er kvelden.
5859358	Can you not speak English?	5007558	Kan du ikkje snakka engelsk?
483613	Can't you speak English?	5007558	Kan du ikkje snakka engelsk?
2249374	It's very sad.	4110539	Det er verkeleg trist.
42804	That's really sad.	4110539	Det er verkeleg trist.
1923694	I think about you all the time.	5926172	Eg tenkjer på deg heile tida.
252805	I think of you all the time.	5926172	Eg tenkjer på deg heile tida.
3665614	All these movies are boring.	5926156	Alle desse filmane er keisame.
1028862	Tom goes to the same school as Mary does.	4110668	Tom går på samme skule som Mary.
252983	I don't drink much wine.	4110745	Eg drikk ikkje mykje vin.
2644157	All you have to do is talk.	5408922	Alt du treng gjera er å snakka.
282931	I don't know when he'll come back.	5928853	Eg veit ikkje når han kjem tilbake.
5408831	Team A won the game against team B.	5408830	Lag A vann kampen mot lag B.
290307	He has already said yes.	5927959	Han har allereie sagt ja.
313363	She has three times as many dictionaries as you do.	6015861	Ho har tre gonger så mange ordbøker som deg.
370716	They are my brothers.	4110625	Dei er brørne mine.
246223	It is easier than I thought.	5926906	Det er enklare enn eg trudde.
253117	I got up early as usual.	5929853	Eg stod opp tidleg, som vanleg.
260505	I have three times as many books as he.	6015863	Eg har tre gonger so mange bøker som han.
1948703	I have three times as many books as him.	6015863	Eg har tre gonger so mange bøker som han.
1017064	I'm an American citizen.	5410078	Eg er ein amerikansk statsborgar.
436307	I am an American citizen.	5410078	Eg er ein amerikansk statsborgar.
6572148	The people look like ants.	5391941	Menneske ser ut som maur.
18082	How long does a bear sleep?	5924567	Kor lenge søv ein bjørn?
2782722	I want an apple.	5408999	Eg vil ha eit eple.
2039949	Why are you under the table?	5934325	Kvifor er du under bordet?
253808	I haven't read all of these books.	5926993	Eg har ikkje lese alle desse bøkene.
5409942	The cat is lying under the table.	5409940	Katten ligg under bordet.
816077	I see a book.	8127141	Eg ser ei bok.
6379279	Tom was hit by an arrow.	6379281	Tom vart treft av ei pil.
249329	We were poor, but we were happy.	2059536	Vi var fattige, men glade.
64396	Let me help you.	6452362	La meg hjelpa deg.
497986	Read as many books as possible.	1983398	Les så mange bøker som mogeleg.
6379276	God is dead. We killed him.	6379278	Gud er daud. Vi drap han.
5707850	Can you help me find my keys?	396863	Kan du hjelpe meg å finne nøklane mine?
5353342	Guess who won.	8144198	Gjett kven som vann.
1723795	Why are you tormenting me with that?	6958223	Kvifor plagar du meg med det?
2649243	Tom sneezed.	8159336	Tom naus.
4972781	Tom is missing a few teeth.	8160373	Tom manglar eit par tenner.
5006726	We voted against the proposal.	8162219	Me røysta imot framlegget.
2993141	Have you seen Tom lately?	8162519	Har du sett han Tom i det siste?
6360719	Dave has your money.	6455436	Dave har pengane dine.
8175290	Tom didn't look tired if you ask me.	8140493	Tom såg ikkje trøytt ut, spør du meg.
1463505	She has green eyes.	8142987	Ho har grøne augo.
2858627	She knows Mary.	8180013	Ho kjenner Maria.
2505911	She has white teeth.	8160355	Ho har kvite tenner.
295258	He died of cancer last year.	8157111	Han døydde av kreft i fjor.
5796917	When the weather is clear one can see the island.	8163222	I klarvêr kan ein sjå øya.
2062748	Tom is searching for something.	5925602	Tom leitar etter noko.
33536	I don't like coffee.	8147052	Eg likar ikkje kaffi.
3826759	Do you not know who I am?	8159301	Veit du ikkje kven eg er?
1886009	Don't you know who I am?	8159301	Veit du ikkje kven eg er?
618615	Next time, I'll do it myself.	5928417	Neste gong gjer eg det sjølv.
1120403	When's the wedding?	8144832	Når er bryllaupet?
37840	It was really cheap.	4110533	Det var verkeleg billeg.
16300	Can you swim?	8157873	Kan du symja?
1885965	Have you slept?	8159305	Har du sove?
1929630	It's annoying to hear people talking loudly in a library.	4110754	Det er irriterande å høyre folk snakke med høg stemme på biblioteket.
244138	My wife died of cancer.	8157196	Kona mi døydde av kreft.
261906	I want to live.	8145340	Eg vil leva.
601808	He is Swiss.	8157390	Han er sveitsar.
465479	He's Swiss.	8157390	Han er sveitsar.
5011630	No, I don't sing.	8144350	Nei, eg syng ikkje.
2267665	Pork has a lot of fat.	8154885	Svinekjøtt inneheld mykje feitt.
1512757	That must have hurt!	5926349	Det må ha gjort vondt!
69328	He has twice as many books as I do.	6015868	Han har dobbelt so mange bøker som meg.
260962	I'm waiting for him.	6455134	Eg ventar på han.
6678288	Tom would've missed the train if he'd stopped to buy a chocolate bar.	1984039	Tom ville ha miste toget om han hadde stoppe for å kjøpe ein sjokolade.
6870469	Tom would have missed the train if he'd stopped to buy a chocolate bar.	1984039	Tom ville ha miste toget om han hadde stoppe for å kjøpe ein sjokolade.
1396338	She'll probably come.	4110656	Det er sannsynleg at ho kjem.
40564	It is probable that she will come.	4110656	Det er sannsynleg at ho kjem.
1434	I love you.	8198155	Eg elskar deg.
8069623	I can't drive home.	8206979	Eg kan ikkje køyre heim.
1026476	Tom did it carefully.	8207211	Tom gjorde det med omhug.
18089	There is a hole in your sock.	8207365	Du har hòl i sokken.
2314842	I did it on purpose.	8208049	Eg gjorde det på gjerst.
2314842	I did it on purpose.	8208054	Eg gjorde det med vilje.
15913	I'm proud of you.	5408815	Eg er stolt av dykk.
2506876	I am proud of you.	5408815	Eg er stolt av dykk.
1971385	Hurry up! We are waiting for you.	4110622	Skund deg! Vi ventar på deg.
3722043	Tom lowered his sword.	6452353	Tom lægde sverdet sitt.
6872910	I'm accustomed to cold weather.	1982615	Eg er vand til kaldt vêr.
6872909	I'm used to cold weather.	1982615	Eg er vand til kaldt vêr.
1979693	My brother works in France.	1983290	Broren min jobbar i Frankrike.
5603254	We're reading the same book.	6452350	Vi les den same boka.
287976	He is, so to speak, a bookworm.	6450267	Han er så å seia ein bokorm.
1123421	It's been a pleasure talking to you.	1983321	Det har vore ei glede å snakka med dykk!
1369200	My arm hurts.	5926572	Eg har vondt i armen.
374827	Thank you!	4110752	Takk!
2199424	It's against my principles.	6014679	Det går imot mine prinsipp.
42366	That runs against my principles.	6014679	Det går imot mine prinsipp.
71396	Do it yourself.	1982561	Gjer det sjølv.
2757003	She is almost as tall as you are.	1982602	Ho er nesten like høg som du.
1182972	There are very few sentences in Faroese here. I wonder, why is that so?	1982646	Det finst særs få setningar på færøysk her inne, og eg spør meg sjølv kvifor.
594724	Are you looking for something?	5925589	Ser du etter noko?
2543390	Tom has everything he needs.	6366634	Tom har alt han treng.
456125	It is night. The family is eating dinner.	1983390	Det er natt. Familien et middag.
7493672	Tom is so old.	1983832	Tom er svært gammal.
1093024	Tom saw a snake slither across the path.	8210055	Tom såg ein orm krype over stien.
5840402	I walked past Tom's house.	8210064	Eg gjekk forbi huset til Tom.
7540702	Tom walked past Mary without saying anything.	8210070	Tom gjekk forbi Mary utan å seia noko.
6462618	Alexander, a friend of mine, speaks Spanish.	6379288	Aleksander, ein ven av meg, snakkar spansk.
2548755	I'll stop by later.	8210100	Eg tek ein tur innom etterpå.
2650032	I was stopped by a police car last night.	8210106	Eg vart stogga av ein politibil i går kveld.
2203622	Who's coming?	6455132	Kven er det som kjem?
619673	Who is coming?	6455132	Kven er det som kjem?
1664583	She's right behind you.	5926964	Ho er rett bak deg.
3977374	My dad cheated on my mom.	8210349	Far min var utru mot mor mi.
3920157	I'll ask him tomorrow.	8210389	Eg spør han i morgon.
1024314	Tom put the key into his pocket.	8210411	Tom la nykelen i lomma.
1886633	Where did Tom go?	8210431	Kvar vart det av Tom?
5366236	Every house in our neighborhood is practically identical.	8210904	Alle husa i vårt nabolag er so å seia heilt like.
8037684	Every even number greater than 2 is the sum of two primes.	8210907	Alle like tal større enn 2 er summen av to primtal.
69338	You have the same camera as mine.	8210937	Kameraet ditt er maken til mitt.
5901144	Tom disappeared three weeks ago.	8210949	Tom forsvann for tre veker sidan.
453117	What would I do without you?	8210979	Kva skulle eg gjort utan deg?
2470839	What would Jesus do?	8210993	Kva ville Jesus ha gjort?
3959981	I don't know either.	8211081	Eg veit ikkje, eg heller.
2111497	Stop lying.	8211152	Slutt å ljuge.
2993141	Have you seen Tom lately?	8211302	Har du sett noko til han Tom i det siste?
417891	I have a sore throat.	8211366	Eg er sår i halsen.
428787	My knife is broken.	8211506	Kniven min er øydelagd.
284850	He can't afford a new car.	8212656	Han har ikkje råd til ny bil.
1832199	I can't afford it.	8212661	Eg har ikkje råd.
628763	I love you, too.	8212683	Elskar deg òg.
628763	I love you, too.	8212685	Glad i deg òg.
3729429	The path was narrow.	8213391	Stien var smal.
44680	The road is too narrow for cars.	8213393	Vegen er for smal for bilar.
3382696	Mary has narrow shoulders and wide hips.	8213396	Mary har smale skuldrer og breie hofter.
2955999	Tom asked me if I was sleepy.	8213543	Tom lurte på om eg var trøytt.
4666949	Don't let the dog out.	8213675	Ikkje slepp ut hunden.
2064830	Something strange is going on.	8213699	Det er noko rart på gang.
1563293	Look at the woman over there!	8214646	Sjå på ho der borte!
2270559	Who's the woman with the red hat?	8214653	Kven er ho med raud hatt?
4529098	Why wasn't the woman who attacked Tom arrested?	8214670	Kvifor vart ikkje ho som angreip Tom arrestert?
8215503	Tom hit snooze.	8215507	Tom trykte på «slumre».
3199854	Tell Tom I miss him.	8228793	Fortel Tom at eg saknar han.
873821	What makes you say that?	8241092	Kva får deg til å seia det?
321998	We have nothing in common.	8204490	Me har ingenting til felles.
45933	The star is so bright as to be seen with the naked eye.	8163246	Stjerna er så lys at ein kan sjå ho med det blotte auga.
5251703	I'm going to play tennis tomorrow.	8159293	Eg skal spela tennis i morgon.
261921	I am going to play tennis tomorrow.	8159293	Eg skal spela tennis i morgon.
6443418	Whom are you giving that book to?	5924593	Kven skal du gjeve boka til?
1664580	I'm right behind him.	5926966	Eg er rett bak han.
6008193	You write very illegibly.	5926614	Du skriv veldig uleseleg.
435751	Lemons are sour.	8211362	Sitroner er sure.
3543597	That's incredibly boring.	5926150	Det er utruleg keisamt.
1882957	It's incredibly boring.	5926150	Det er utruleg keisamt.
1311871	There is a red rose in the pot.	4110771	Det er ei raud rose i blomepotta.
1311870	There's a red rose in the pot.	4110771	Det er ei raud rose i blomepotta.
2730921	Luxembourg is a small country.	8204504	Luxembourg er eit lite land.
4603777	I don't have to get up until 1 o'clock tomorrow.	4603780	Eg treng ikkje stå opp før klokka 1 i morgon.
427822	What countries border on Slovenia?	8204505	Kva land grensar til Slovenia?
1664592	They're right behind me.	5926961	Dei er rett bak meg.
2149117	Have you seen my son?	8211259	Har du sett son min?
2628718	I lived there for five years.	8147094	Eg budde der i fem år.
6157231	I do not believe it.	8147095	Det trur eg ikkje.
1841693	I don't believe it.	8147095	Det trur eg ikkje.
1839484	I don't believe that.	8147095	Det trur eg ikkje.
1683046	Africa is not a country.	8204499	Afrika er ikkje eit land.
7493088	Africa isn't a country.	8204499	Afrika er ikkje eit land.
3024400	Have you seen Tom today?	8211327	Har du sett Tom i dag?
508463	I'm in a hurry.	4668621	Eg har det travelt.
436379	I am in a hurry.	4668621	Eg har det travelt.
305403	They have twelve children.	8156213	Dei har tolv ungar.
1330505	I will ask him tomorrow.	8210389	Eg spør han i morgon.
461155	His son died last year.	8157053	Son hans døydde i fjor.
3826760	Does Tom know where I am?	8157590	Veit Tom kvar eg er?
39020	Who left the door open?	8147098	Kven lét døra stå open?
6033531	I am at the beach.	8163280	Eg er på stranda.
2127255	I'm at the beach.	8163280	Eg er på stranda.
5926988	I've read some of these books.	5928324	Eg har lese nokre av desse bøkene.
1886026	Does Tom know who I am?	8157577	Veit Tom kven eg er?
6008185	I have read some of these books.	5926978	Eg har lese nokon av desse bøkene.
5926988	I've read some of these books.	5926978	Eg har lese nokon av desse bøkene.
2688199	I love you too.	8212683	Elskar deg òg.
4889848	I am proud of my son.	8159299	Eg er stolt av son min.
25239	Something must be done!	5925976	Noko må gjerast!
681371	The medicine was a brown liquid.	4110700	Medisinen var ei brun væske.
244051	I didn't believe him at first.	5926875	Eg trudde ikkje på han i byrjinga.
485154	Everything is better without you.	8210972	Alt er betre utan deg.
1087984	Helga is a Swedish name.	8157392	Helga er eit svensk namn.
7079780	Turtles lay eggs.	8204650	Skjelpadder legg egg.
2997391	I'm a little curious.	8207338	Eg er litt nyfiken.
1886087	Do you know Tom?	8211188	Kjenner du Tom?
5453068	What is the Greek word for "owl"?	8139930	Kva er det greske ordet for «ugle»?
32263	Bees make honey.	8239875	Bier lagar honning.
3222983	What are you sitting on?	8139951	Kva sit du på?
680944	What's your favorite movie?	8212681	Kva er yndlingsfilmen din?
2843432	We have no water.	8147089	Me har ikkje vatn.
569759	It snowed a lot last year.	8157079	Det snødde mykje i fjor.
3923524	Tom wrote a letter to himself.	8239938	Tom skreiv eit brev til seg sjølv.
762691	I'm against the war.	8162248	Eg er imot krigen.
1664581	I'm right behind her.	5926965	Eg er rett bak ho.
6389367	They're saying that Tom won't do it.	6388839	Dei seier at Tom ikkje kjem til å gjera det.
497934	I've got a headache.	1982530	Eg har vondt i hovudet.
280125	My head aches.	1982530	Eg har vondt i hovudet.
5651820	Please wash your hands.	6380479	Ver snill og vask hendene.
5651252	Please, wash your hands.	6380479	Ver snill og vask hendene.
263894	Time heals all wounds.	6379292	Tida lækjer alle sår.
20747	He looks pale.	5924581	Han ser bleik ut.
430166	What do you know about him?	8157917	Kva veit du om han?
6379268	Delphi is also a small town.	6379271	Delfi er òg ein liten by.
932531	She's got a cat. The cat's white.	516454	Ho har ein katt. Katten er kvit.
1498844	She's almost the same height as you.	1982602	Ho er nesten like høg som du.
18308	I saw something strange in the sky.	8290994	Eg såg noko rart på himmelen.
2425757	Sleep well!	8141821	Sov godt!
21140	I'm freezing.	8291155	Eg frys.
405379	Close the door.	5823473	Lukk att døra.
38992	Shut the door.	5823473	Lukk att døra.
405379	Close the door.	5823474	Lukk igjen døra.
38992	Shut the door.	5823474	Lukk igjen døra.
18547	I'm broke.	5926994	Eg er blakk.
868955	I don't have money.	5926994	Eg er blakk.
433613	I have no money.	5926994	Eg er blakk.
2412748	The bread is fresh.	8162145	Brødet er ferskt.
456389	Me neither.	8211073	Ikkje eg heller.
262338	Nor am I.	8211073	Ikkje eg heller.
262337	I don't, either.	8211073	Ikkje eg heller.
2248738	It isn't funny.	1982507	Det er ikkje morosamt.
1284161	Where did you see them?	1982782	Kor såg du dei?
1845513	Don't look at me.	1983301	Ikkje sjå på meg.
2252572	The dog growled.	8160507	Hunden knurra.
7386741	She's proud of her son.	8286402	Ho er stolt av son sin.
314705	She takes pride in her son.	8286402	Ho er stolt av son sin.
314704	She is proud of her son.	8286402	Ho er stolt av son sin.
3132269	I'm drinking milk.	8139945	Eg drikk mjølk.
1661057	I am drinking milk.	8139945	Eg drikk mjølk.
3304449	I drink milk.	8139945	Eg drikk mjølk.
1530689	He is reading.	8335368	Han sit og les.
3804749	He was sleeping.	8335376	Han låg og sov.
2648444	Tell Tom to hurry.	8335415	Bed Tom om å skunde seg.
242793	You should stay at home today.	8335418	Du får halde deg heime i dag.
411069	A man can live and be healthy without killing animals for food; therefore, if he eats meat, he participates in taking animal life merely for the sake of his appetite. And to act so is immoral.	1980755	Ein mann kan leva sunn, utan å måtta drepa dyr for å få mat, så om han likevel et kjøtt, er han med på å drepa dyr berre for matlysta si skuld. Og å gjere det er umoralsk.
987495	Please move the chair. It's in the way.	8342329	Kan du flytta stolen? Han står i vegen.
1848786	I thought he was joking.	8360422	Eg trudde han kødda, eg.
1977777	Keep your eyes on the road.	8423329	Hald augo på vegen.
3763394	I only have two hands.	8360691	Eg har berre to hender.
1141220	Tom fell asleep at the wheel.	8423353	Tom sovna bak rattet.
1025813	Tom fell asleep in class.	8423358	Tom sovna i timen.
2335884	I fell asleep on the couch.	8423364	Eg sovna på sofaen.
1855099	Do you want to sleep on the couch?	8423377	Vil du liggje på sofaen?
6820435	I didn't look under the couch.	8423378	Eg keik ikkje under sofaen.
49747	Don't look at me that way.	8423387	Ikkje sjå på meg sånn.
1529654	I'm allergic to dust.	8423458	Eg er allergisk mot støv.
1493541	Tom was attacked by a shark.	8423591	Tom vart angripen av ein hai.
270907	Can you swim underwater?	8423609	Kan du symja under vatn?
682258	Tom is hiding under the table.	8423610	Tom gøymer seg under bordet.
249781	I have nothing to hide.	8423635	Eg har ingenting å løyne.
843929	He hid behind the door.	8423641	Han gøymde seg bak døra.
1318534	I broke a nail.	8423685	Eg brakk ein nagl.
5916112	Tom got home from work early today.	8424013	Tom kom tidleg heim frå jobb i dag.
1739386	Cows have udders.	8424052	Kyr har jur.
19170	Don't be afraid.	8425329	Ikkje ver redd.
6002283	I know what you did last summer.	8425775	Eg veit kva du gjorde i fjor sumar.
5361850	Tom has selective hearing. He only hears what he wants to hear.	8425876	Han Tom har sånn selektiv høyrsle. Han høyrer berre det han vil høyre.
253934	I sat next to John.	8426208	Eg sat ved sida av John.
278384	It's across the street.	8426220	Det ligg tvers over gata.
31565	I almost drowned.	8427460	Eg heldt på å drukne.
300670	He drowned in the river.	8427462	Han drukna i elva.
261908	I didn't turn off the light.	8427660	Eg sløkte ikkje lyset.
4979578	I haven't read it yet.	8427980	Eg har ikkje lese ho enno.
300690	He was wounded in the war.	8428547	Han vart skadd i krigen.
2006513	Tom opened a can of tuna fish.	8428737	Tom opna ein boks med tunfisk.
238532	Never speak ill of others.	8431818	Aldri tal stygt om andre.
6457952	Tom knew the poem by heart.	8432157	Tom kunne diktet utanåt.
2150578	What is your favorite movie?	8212681	Kva er yndlingsfilmen din?
6389369	What's your new friend called?	6388804	Kva heiter den nye venen din?
2457449	What happened between you and Tom?	6388812	Kva har hendt mellom deg og Tom?
684925	What would German be without commas!	8424003	Kva ville tysk vore utan komma!
305403	They have twelve children.	8156208	Dei har tolv born.
463168	They are watching a movie.	1983360	Dei ser på ein film.
1664585	They're right behind you.	5926960	Dei er rett bak dykk.
1664585	They're right behind you.	5926962	Dei er rett bak deg.
4098826	In countries like Norway or Finland, in winter there's a lot of snow.	1982623	I land som Noreg og Finland har dei mykje snø om vetteren.
6681218	They must've known it all along.	1981802	Dei må ha visst det heile tida.
305637	They are on good terms with their neighbors.	1980984	Dei går godt i lag med grannane.
2011919	I want to stay with you.	4110683	Eg vil bli hos dykk.
73683	"I'm hungry," said the small white rabbit, so they stopped and ate the flower from a large hyacinth.	396880	«Eg er svolten,» sa den vesle kvite kaninen, så dei stoppa og åt blomen av ein stor hyasint.
3563964	Are you both drunk?	8554463	Er de fulle begge to?
6005628	Is that a bear?	8554494	Er det ein bjørn?
1550941	I don't eat meat.	8139941	Eg et ikkje kjøtt.
1095653	Tom can hardly fit into the jeans he bought last year.	8598874	Tom får nesten ikkje på seg buksene han kjøpte i fjor.
2235795	I'm Tom's neighbor.	8291141	Eg er naboen til Tom.
680224	I'm really sorry.	4110528	Eg er verkeleg lei for det.
436425	I am really sorry.	4110528	Eg er verkeleg lei for det.
279651	I feel more tired in the wintertime.	4646490	Om vintaren følar eg meg trøttare.
3256233	My throat hurts.	5926592	Eg har vondt i halsen.
1776761	Why are you cutting up the meat?	6455122	Kvifor skjer du opp kjøtet?
4198278	It's been a long time since I've written anyone a letter.	8163019	Det er lenge sidan eg har skrive eit brev til nokon.
2509994	She has narrow hips.	8289494	Ho har smale hofter.
3970776	He walked past without greeting me.	8210076	Han gjekk forbi meg utan å helse.
315604	She has small feet.	8155758	Ho har småe føter.
1768241	Do you drink green tea?	8335412	Drikk du grøn te?
1867443	Are you drinking green tea?	8335412	Drikk du grøn te?
2994262	He came hoping to meet you.	5924598	Han kom i vona om å få sjå deg.
266343	The leaves change color in autumn.	6366340	Blada endrar farge om hausten.
67046	Whose shoes are those?	1983381	Kven sine sko er det?
69003	Do you know him?	8426148	Kjenner du han?
8784202	Those who live in glass houses shouldn't throw stones.	1981079	Dei som bur i glashus burde ikkje kaste stein.
2176938	In the shadow of the Leaning Tower of Pisa sits the town storyteller, eating a bowl of pea soup. After that he tells some children the fairy tale "The Princess and the Pea".	2176932	I skyggen av det Skjeve Tårn i Pisa sitter byens eventyrforteller og spiser en tallerken ertesuppe. Etterpå forteller han barna eventyret om "prinsessen på erten".
2016878	I just want to know what's going on.	8825580	Eg vil berre vita kva som hender.
4494624	It was pretty chaotic.	8825590	Det var temmeleg kaotisk.
4972779	Tom enjoys telling jokes.	8825603	Tom likar å fortelja vitsar.
5301733	They're behind schedule.	8825609	Dei ligg bak skjema.
5820795	The sun isn't yellow in the evening. It's orange.	8825616	Sola er ikkje gul om kvelden. Ho er oransje.
6069615	Layla doesn't see anybody else.	8825621	Layla ser ingen andre.
6111490	Layla felt she knew the area so well.	8825634	Layla følte at ho kjende området so godt.
6336227	I wonder whether Tom will tell me to do that.	8825649	Eg undrast på om Tom kjem til å seia at eg må gjera det.
4500262	Thirteen firefighters were injured.	8828401	Tretten brannmenn vart skada.
4649570	Tom tried to kiss me, but I didn't let him.	8828408	Tom freista å kyssa meg, men eg lét han ikkje.
