9164968	She has many skirts.	9164991	Ел аве мулте фалдас.
9165091	He has to buy some pants because he lost weight.	9165108	El debe compra alga pantalones perce el ia magri.
9165091	He has to buy some pants because he lost weight.	9165113	Ел дебе компра панталонес перке ел иа магри.
9165190	I have several pairs of shoes.	9165195	Me ave duples diversa de sapatos.
9165190	I have several pairs of shoes.	9165208	Ме аве дуплес диверса де сапатос.
9165393	A spider climbed up on my leg.	9165397	Un arania ia asende sur mea gama.
9165393	A spider climbed up on my leg.	9165400	Ун араниа иа асенде сур меа гама.
9165413	The spiders climbed down from the ceiling.	9165415	La aranias ia desende de la sofito.
9165413	The spiders climbed down from the ceiling.	9165416	Ла араниас иа десенде де ла софито.
9165436	Is there any milk in the refrigerator?	9165439	Esce on ave lete en la friador?
9165436	Is there any milk in the refrigerator?	9165442	Еске он аве лете ен ла фриадор?
9056451	Tom is not a socialist.	8986158	Том но ес ун сосиалисте.
9056451	Tom is not a socialist.	8986157	Tom no es un sosialiste.
9165904	I love this world.	9165912	Me ama esta mundo.
2011366	I want to be safe.	9167203	Me vole es secur.
2011366	I want to be safe.	9167205	Ме воле ес секур.
3820832	No one got sick.	9167263	Nun ia maladi.
3820832	No one got sick.	9167265	Нун иа малади.
9168105	But, because he was dressed in the Turkish way, the astronomers did not believe he was telling the truth.	9168263	Ma par causa de sua vestes turces, la astronomistes no ia crede ce el parla veria.
9168105	But, because he was dressed in the Turkish way, the astronomers did not believe he was telling the truth.	9168289	Ма пар кауса де суа вестес туркес, ла астрономистес но иа креде ке ел парла вериа.
7192326	These mushrooms are poisonous.	9170916	Esta xampiniones es venenosa.
7192326	These mushrooms are poisonous.	9170927	Еста шампинионес ес вененоса.
9170952	When two people are in love, they are only aware of each other.	9171015	Cuando du persones ama la un la otra, los du sola esiste en la mundo.
9170952	When two people are in love, they are only aware of each other.	9171021	Куандо ду персонес ама ла ун ла отра, лос ду сола есисте ен ла мундо.
9093640	Tom doesn't come from Australia.	9171622	Tom no veni de Australia.
9075005	In general, Tom likes to do things himself.	9171634	Jeneral, Tom gusta fa la cosas sin aida.
9075003	Tom likes to do almost everything himself.	9171657	Tom gusta fa cuasi tota cosas sin aida.
8994862	Tom might be a communist.	9171738	Tom es cisa un comuniste.
9171742	Tom could be a communist.	9171738	Tom es cisa un comuniste.
9165928	Your own health is also important.	9171824	Ance tua propre sania es importante.
9175911	My girlfriend loves rings.	9175967	Mea xica de cor multe gusta anelos.
9175911	My girlfriend loves rings.	9175969	Меа ами де кор мулте густа анелос.
9176128	Can I speak to the director?	9176216	Esce me pote parla con la dirijor?
9176128	Can I speak to the director?	9176221	Еске ме поте парла кон ла дирижор?
9177353	My brother's girlfriend has black hair and green eyes.	9177371	La ami de cor de mea frate ave capeles negra e oios verde.
9177353	My brother's girlfriend has black hair and green eyes.	9177372	Ла шика де кор де меа фрате аве капелес негра е оиос верде.
9177415	But my drawing was not of a hat.	9177552	Ma mea desinia no ia presenta un xapo.
9177415	But my drawing was not of a hat.	9177557	Ма меа десиниа но иа пресента ун шапо.
3109193	Can I touch your beard?	9177945	Esce me pote palpa tua barba?
3109193	Can I touch your beard?	9177949	Еске ме поте палпа туа барба?
9178429	They left at what time?	9178444	Cuando los ia sorti?
9178429	They left at what time?	9178451	А куал ора лос иа сорти?
9179496	I read this book once when I was little.	9179513	Me ia leje esta libro a un ves cuando me ia es peti.
9179496	I read this book once when I was little.	9179526	Ме иа леже еста либро а ун вес куандо ме иа ес пети.
9179789	We saw this movie and we loved it.	9179833	Nos ia vide esta filma e nos ia gusta multe lo.
9179789	We saw this movie and we loved it.	9179838	Нос иа виде еста филма е нос иа густа мулте ло.
244646	I bought it yesterday.	9179944	Me ia compra lo ier.
244646	I bought it yesterday.	9179949	Ме иа компра ло иер.
5715987	Both of them survived.	9181372	Ambos de los continua vive.
5715987	Both of them survived.	9181373	Амбос лос континуа виве.
5715987	Both of them survived.	9181427	Nun de ambos ia mori.
5715987	Both of them survived.	9181430	Нун де амбос иа мори.
9181541	When are you getting out of bed?	9181565	Cuando tu leva de leto?
9181541	When are you getting out of bed?	9181569	Куандо ту лева де лето?
9181765	You must not cross here.	9181790	No es permeteda traversa asi.
9181765	You must not cross here.	9181792	Но ес перметеда траверса аси.
9182334	The river is shallow here.	9182727	La rio es nonprofonda asi.
9182334	The river is shallow here.	9182731	Ла рио ес нонпрофонда аси.
4319225	Why was money invented?	9183045	Perce la mone ia es inventada?
4319225	Why was money invented?	9183046	Перке ла моне иа ес инвентада?
5858478	I'm with friends.	9183060	Ме ес кон амис.
5858478	I'm with friends.	9183061	Me es con amis.
2252600	The two smiled.	9183138	Ambos de los ia surie.
2252600	The two smiled.	9183139	Амбос де лос иа сурие.
9183169	They weren't with me.	9183179	Los no ia es con me.
9183169	They weren't with me.	9183180	Лос но иа ес кон ме.
387379	Dogs have a keen sense of smell.	9184992	La canes ave un ole multe sensosa.
387379	Dogs have a keen sense of smell.	9185005	Ла канес аве ун оле мулте сенсоса.
9187541	I'm going to make sure of that.	9188117	Me va es serta sur esta.
9187541	I'm going to make sure of that.	9188120	Ме ва ес серта сур еста.
2555756	Learning a new language is like meeting someone for the first time who always claims you are wrong, and worse - has the ability to prove it.	9188689	Aprende otra lingua es como encontra a la ves prima algun ci sempre va dise ce tu no razona bon, e – lo ce es plu mal – ave la capasia de demostra lo.
2555756	Learning a new language is like meeting someone for the first time who always claims you are wrong, and worse - has the ability to prove it.	9188700	Апренде отра лингуа ес комо енконтра а ла вес прима алгун ки ва семпре дисе ке ту но резона бон, е – ло ке ес плу мал – аве ла капасиа де демостра ло.
9188287	Is she pregnant?	9189087	Esce el es ensinta?
9189091	Is he pregnant?	9189087	Esce el es ensinta?
8020749	We are the ones we've been waiting for.	9189674	Nos es los ci nos ia espeta.
9126698	Donald Trump's a piece of shit.	9126740	Donald Trump apesta.
9192464	This is a picture of my wife.	9192500	Esta es un foto de mea sposa.
9192464	This is a picture of my wife.	9192504	Еста ес ун фото де меа споса.
9192277	I’m on the same boat as you.	9192523	Me e tu es en la mesma barco.
9192277	I’m on the same boat as you.	9192525	Ме е ту ес ен ла месма барко.
9192207	Both Tom and I do this.	9192542	Ambos de nos – Tom e me – fa esta.
9192207	Both Tom and I do this.	9192543	Амбос де нос – Том е ме – фа еста.
1830396	Tom ate like a pig.	9193296	Tom ia come como un porco.
1830396	Tom ate like a pig.	9193297	Том иа коме комо ун порко.
2917323	Who ordered pizza?	9193590	Ci ia comanda piza?
2917323	Who ordered pizza?	9193592	Ки иа команда пиза?
2245538	Have a croissant.	9194055	Come un cresente.
2245538	Have a croissant.	9194058	Коме ун кресенте.
1531026	I haven't seen you for so long!	9194632	Me no ia vide tu en multe tempo.
1531026	I haven't seen you for so long!	9194633	Me no ia vide vos en multe tempo.
4073382	Short sentences are better.	9196269	Frases corta es preferable.
4073382	Short sentences are better.	9196290	Фрасес корта ес преферабле.
6324260	What is the meaning of this sentence?	9196878	Cual cosa esta frase sinifia?
6324260	What is the meaning of this sentence?	9196880	Куал коса еста фрасе синифиа?
57230	You should rewrite this sentence. It doesn't make sense.	9197077	Tu debe rescrive esta frase. Lo no es lojical.
57230	You should rewrite this sentence. It doesn't make sense.	9197092	Ту дебе рескриве еста фрасе. Ло но ес ложикал.
9199114	I put the key on the table.	9199210	Me ia pone la clave sur la table.
9199114	I put the key on the table.	9199211	Ме иа поне ла клаве сур ла табле.
9199104	How can I get what I want?	9199219	Como me pote oteni lo cual me vole?
9199104	How can I get what I want?	9199222	Комо ме роте отени ло куал ме воле?
9199074	I don't want soup.	9199270	Me no vole sopa.
9199074	I don't want soup.	9199275	Ме но воле сопа.
9199072	What can I give you?	9199288	Cual cosa me pote dona a tu?
9199072	What can I give you?	9199289	Куал коса ме поте дона а вос?
1660412	The apple is red.	9199325	La poma es roja.
9199021	I don't want a pet anymore.	9199327	Me no plu vole un animal de casa.
8925085	The apple isn't red.	9199326	La poma no es roja.
9199021	I don't want a pet anymore.	9199328	Ме но плу воле ун анимал де каса.
9199204	She's an Esperantist.	9200316	El es un esperantiste.
6692585	He's an Esperantist.	9200316	El es un esperantiste.
6692584	He is an Esperantist.	9200316	El es un esperantiste.
6393064	She writes poems.	9201746	El scrive poesias.
6393064	She writes poems.	9201747	Ел скриве поесиас.
1008611	The equator divides the earth into two hemispheres.	9201919	La ecuator divide la tera en du emisferas.
1008611	The equator divides the earth into two hemispheres.	9201920	Ла екуатор дивиде ла тера ен лу емисферас.
5165765	I don't like anybody.	9203066	Me gusta nun.
5165765	I don't like anybody.	9203071	Ме густа нун.
6440431	I know that you lied.	9203541	Me sabe ce tu ia menti.
6440431	I know that you lied.	9203546	Ме сабе ке вос иа менти.
9152356	Humans are mammals.	9203919	Umanas es mamales.
9145529	My cat ate an olive.	9204669	Mea gato ia come un oliva.
2011362	I don't want them.	9207310	Me no vole los.
8934123	I wasn't loved.	9207371	Me no ia es amada.
8934123	I wasn't loved.	9207372	On no ia ama me.
8932868	A lot of people don't understand cats.	9207375	Multe persones no comprende gatos.
8932866	Many people don't understand cats.	9207375	Multe persones no comprende gatos.
8932295	We'll live together.	9207378	Nos va coabita.
8923305	Don't you guys see the birds?	9207381	Esce vos no vide la avias?
8923145	Don't you see birds?	9207383	Esce tu no vide avias?
8923144	Don't you see the birds?	9207384	Esce tu no vide la avias?
8927204	We will live together.	9207378	Nos va coabita.
9197873	We will be living together.	9207378	Nos va coabita.
9197866	We'll be living together.	9207378	Nos va coabita.
6076676	Work is a necessary evil.	9207961	Labora es un mal nesesada.
6076675	Labor is a necessary evil.	9207961	Labora es un mal nesesada.
8925493	They didn't love me.	9207372	On no ia ama me.
8954043	My fork is too small.	9208708	Mea force es tro peti.
471426	My spoon is too big!	9208732	Mea culier es tro grande!
8923144	Don't you see the birds?	9207381	Esce vos no vide la avias?
8796516	He's with you.	9209525	El es con tu.
8796359	He is with you.	9209525	El es con tu.
9209524	She's with you.	9209525	El es con tu.
9209529	She is with you.	9209525	El es con tu.
9211168	A lot of people don't get cats.	9207375	Multe persones no comprende gatos.
265614	Put the car into the garage.	9211180	Pone la auto en la garaje.
265614	Put the car into the garage.	9211181	Поне ла ауто ен ла гараже.
64040	There was no bathroom.	9211195	On ia ave no sala de banio.
64040	There was no bathroom.	9211196	Он иа аве но сала де банио.
265435	The car broke down, so that we had to walk.	9211213	La auto ia rompe, alora nos ia debe pasea.
265435	The car broke down, so that we had to walk.	9211215	Ла ауто иа ромпе, алора нос иа дебе пасеа.
9083299	I'm going to drink water.	9211625	Me va bevi acua.
9083298	I'll drink water.	9211625	Me va bevi acua.
9077047	How can I be sure?	9211628	Como me pote es serta?
9075080	I won't ask you for anything.	9211632	Me no va demanda tu per alga cosa.
9075080	I won't ask you for anything.	9211634	Me no va demanda tu per cualce cosa.
9152216	We have to help each other.	9211707	Nos debe aida lunlotra.
247920	We must help each other.	9211707	Nos debe aida lunlotra.
9211685	He couldn't mend it.	9212255	El no ia pote repara lo.
9211685	He couldn't mend it.	9212263	Ел но иа поте репара ло.
569046	Do tigers purr?	9213267	Esce tigres ronrona?
3821316	Why do cats purr?	9213272	Perce gatos ronrona?
9215851	On December 31, 1946, President Truman officially declared the end of World War II.	5275628	A 31 desembre 1946, Presidente Truman ia proclama ofisial la fini de la gera mundial 2.
9215851	On December 31, 1946, President Truman officially declared the end of World War II.	5518776	А 31 десембре 1946, Пресиденте Труман иа проклама офисиал ла фини де ла гера мундиал 2.
3605388	This is a knife.	9216536	Esta es un cotel.
9216613	It's a knife.	9216962	Lo es un cotel.
9216919	Tom is a necromancer.	9217014	Tom es un necromansiste.
9217156	Tom was a golem.	9217185	Tom ia es un golem.
9216482	Tom was a zombie.	9217190	Tom ia es un zombi.
9190694	Life is an exile.	9226581	La vive es un esclui.
9210521	Why did Tom buy it?	9226808	Perce Tom ia compra lo?
9210521	Why did Tom buy it?	9226810	Перке Том иа компра ло?
9139707	I don't need you yet.	9230553	Me ancora no nesesa tu.
9139707	I don't need you yet.	9230554	Me ancora no nesesa vos.
9231158	The fields are dry.	9231293	La campos es seca.
9231158	The fields are dry.	9231294	Ла кампос ес сека.
9231353	I'm addicted to cocks.	9231382	Me es dependente de pixas.
2250093	That can wait.	9231729	Esta pote espeta.
2250093	That can wait.	9231732	Еста поте еспета.
2647789	Where are you guys?	5444708	До вос ес?
6898529	You're available, aren't you?	9234938	Tu es disponable, no?
6898529	You're available, aren't you?	9234947	Вос ес диспонабле, но?
2412891	The house is small.	8433577	La casa es peti.
680700	Which direction will he choose?	9235167	Cual dirije el va eleje?
680700	Which direction will he choose?	9235170	Куал дириже ел ва ележе?
1182643	Not choosing is choosing already.	9235271	No eleje es ja un eleje.
1182643	Not choosing is choosing already.	9235274	Но ележе ес жа ун ележе.
69932	You may choose any of them.	9235680	Tu pote eleje cualcun de los.
69932	You may choose any of them.	9235683	Вос роте ележе куалкун де лос.
240680	You may choose what you like.	9235725	Tu pote eleje lo cual tu vole.
240680	You may choose what you like.	9235732	Вос поте ележе ло куал вос воле.
6381654	You can't choose your parents.	9235899	No person pote eleje sua padre o sua madre.
6381654	You can't choose your parents.	9235930	Нун поте ележе суа падре о суа мадре.
9238883	Are centipedes poisonous to cats?	9238903	Esce sentopedes es venenosa a gatos?
9240859	That's not a knife.	9240862	Acel no es un cotel.
9240863	That isn't a knife.	9240862	Acel no es un cotel.
5415791	Recognition of the inherent dignity and of the equal and inalienable rights of all members of the human family is the foundation of freedom, justice and peace in the world.	5458112	Ла реконосе де ла диниа инеренте е ла диретос егал е ноналиенабле де тота ла мемброс де ла фамилиа умана ес ла фунда де либриа, жустиа, е пас ен ла мундо.
9116085	I hate strawberries.	9246381	Me odia fresas.
318380	The hospital is near here.	9252633	La ospital es proxima a esta loca.
318380	The hospital is near here.	9252639	Ла оспитал ес просима а еста лока.
1194034	I'm not a doctor.	9253403	Ме но ес ун дотор медикал.
9203443	Facts are facts.	9253740	Fatos es fatos.
9254623	There's a misunderstanding.	9257574	On ave un malcomprende.
9254627	There is a misunderstanding.	9257574	On ave un malcomprende.
1561324	I am there.	9257592	Me es ala.
5152737	I'm there.	9257592	Me es ala.
4706619	Mission accomplished.	9262024	Mision realida.
4721105	It is all because of you.	9267318	Tota esta ia aveni par causa de tu.
4721105	It is all because of you.	9267324	Тота еста иа авени пар кауса де ту.
3405459	I don't have enough time.	9267477	Me no ave bastante tempo.
3405459	I don't have enough time.	9267481	Ме но аве бастанте темпо.
9270807	The kitten mewed.	9270816	La gateta ia miaui.
2549627	The cat meowed.	9270817	La gato ia miaui.
8998952	You've never done drugs.	9271384	Tu nunca ia usa drogas.
6845039	I've read your book. It was very interesting.	9277639	Me ia leje tua libro. Me ia trova lo multe interesante.
6845039	I've read your book. It was very interesting.	9277663	Ме иа леже туа либро. Ме иа трова ло мулте интересанте.
7779609	There's no hope for you.	9279811	On ave no espera per tu.
9286088	I love hedgehogs.	9287091	Me ama erisos.
9065365	Everything's horrible.	9288050	Tota cosas es desplasente.
9057546	Could I be wrong?	9288052	Esce me ta pote es erante?
9054891	What's a lightning rod?	9288053	Cual es un paralampo?
9054440	We didn't study.	9288060	Nos no ia studia.
9054439	We weren't studying.	9288060	Nos no ia studia.
9054436	We're eating beans.	9288061	Nos come favas.
9054435	This isn't very big.	9288062	Esta no es multe grande.
9054429	It's better this way.	9288067	Lo es plu bon tal.
9054421	You're nothing like your sister.	9288069	Tu es en no modo como tua sore.
9054394	We won't go on foot.	9288071	Nos no va vade par pede.
9053486	I need to know what the problem is.	9288072	Me nesesa sabe cual es la problem.
8953759	Where's the midwife?	9288935	Do es la comadre?
9240214	Tom and Mary are cautious.	9289882	Tom e Maria es cauta.
9216938	That house is haunted by Tom's ghost.	9289890	Acel casa es infestada par la fantasma de Tom.
9216935	This house is haunted by Tom's ghost.	9289891	Esta casa es infestada par la fantasma de Tom.
9216860	Tom lives in a haunted house.	9289896	Tom abita un casa fantasmosa.
1397038	Am I my brother's keeper?	9290417	Esce me es la gardor de mea frate?
9302237	The birds were singing in the sky.	9302296	La avias ia canta en la sielo.
9302237	The birds were singing in the sky.	9302300	Ла авиас иа канта ен ла сиело.
9302028	Tesla's life's full of mystery.	9302367	La vive de Tesla es plen de misterio.
9302028	Tesla's life's full of mystery.	9302372	Ла виве де Тесла ес плен де мистерио.
9302023	May I see my daughter?	9302399	Esce me pote vide mea fia?
9302023	May I see my daughter?	9302403	Еске ме поте виде меа фиа?
9302488	History is a story that attempts to be true.	9303204	La istoria es un nara cual atenta es vera.
9302488	History is a story that attempts to be true.	9303210	Ла историа ес ун нара куал атента ес вера.
4690652	The children were swimming in the nude.	9303300	La infantes ia nada nuda.
4690652	The children were swimming in the nude.	9303307	Ла инфантес иа нада нуда.
9302459	I stood totally nude before him.	9303424	Me ia es stante asoluta nuda ante el.
9302459	I stood totally nude before him.	9303430	Ме иа ес станте асолута нуда анте ел.
9302436	Who has a key to this building?	9303572	Ci ave un clave de esta construida?
9302436	Who has a key to this building?	9303582	Ки аве ун клаве де еста конструида?
9302272	All my sentences were checked by native speakers.	9303806	Tota mea frases ia es esaminada par parlores nativa.
9302272	All my sentences were checked by native speakers.	9303816	Тота меа фрасес иа ес есаминада пар парлорес натива.
9304480	Tom can still win.	9304527	Tom pote ancora gania.
9301100	Tom thinks he's a cat.	9307884	Tom crede ce el es un gato.
9307899	Tom thinks she's a cat.	9307884	Tom crede ce el es un gato.
9311237	Tom is a Satanist.	9313945	Tom es un sataniste.
9311244	Tom's a Satanist.	9313945	Tom es un sataniste.
9311302	Tom's a sun worshiper.	9314016	Tom es un adoror de la sol.
9311300	Tom is a sun worshiper.	9314016	Tom es un adoror de la sol.
9311413	Tom's a moon worshiper.	9314401	Tom es un adoror de la luna.
9311411	Tom is a moon worshiper.	9314401	Tom es un adoror de la luna.
9311182	Tom joined a cult.	9314800	Tom ia junta se a un culto.
9311404	Tom is an Earth worshiper.	9314802	Tom es un adoror de la Tera.
9311406	Tom's an Earth worshiper.	9314802	Tom es un adoror de la Tera.
9311400	Tom is a cat worshiper.	9314804	Tom es un adoror de gatos.
9311401	Tom's a cat worshiper.	9314804	Tom es un adoror de gatos.
9311416	Tom's a nature worshiper.	9314810	Tom es un adoror de natur.
9311415	Tom is a nature worshiper.	9314810	Tom es un adoror de natur.
9314354	Good kitty!	9314811	Bon gateta!
8198188	He doesn't have cancer.	9314812	El no ave canser.
9314813	She doesn't have cancer.	9314812	El no ave canser.
2006598	Approximately how large is the community?	9317101	Plu o min, cual es la grandia de la comunia?
2006598	Approximately how large is the community?	9317108	Плу о мин, куал ес ла грандиа де ла комуниа?
349064	I don't know.	5467962	Me no sabe.
33150	It's been raining for around a week.	9317168	Lo pluve tra plu o min un semana.
33150	It's been raining for around a week.	9317169	Ло плуве тра плу о мин ун семана.
64828	What's their approximate worth?	9317184	Cuanto los es valuada, plu o min?
64828	What's their approximate worth?	9317185	Куанто лос ес валуада, плу о мин?
4050348	She's more or less my age.	9321074	El ave plu o min mea eda.
4050348	She's more or less my age.	9321091	Ел аве плу о мин меа еда.
8358478	"May I continue?" "By all means."	9324722	"Esce me pote continua?" "En tota modos."
8358478	"May I continue?" "By all means."	9324733	"Еске ме поте континуа?" "Ен тота модос."
8993090	That's a bear.	9325398	Acel es un urso.
9325414	This is a bear.	9325422	Esta es un urso.
9249120	I have ten of them.	9199031	Me ave des de los.
9249120	I have ten of them.	9199039	Ме аве дес де лос.
8505175	Buddhism is a really cool religion.	9331920	Budisme es un relijio multe fresca.
9331923	The Baha'i Faith is a really cool religion.	8788716	Bahaisme es un relijio multe fresca.
8505162	Judaism is a very cool religion.	9331929	Iudisme es un relijio multe fresca.
8505164	Islam is a very cool religion.	9331933	Islam es un relijio multe fresca.
9215818	Tie me up.	9333786	Lia me.
8646625	Tom is a thinker.	9333824	Tom es un pensor.
2269300	Doesn't that smell good?	9335459	Esta bonodori, no?
2269300	Doesn't that smell good?	9335465	Еста бонодори, но?
9333759	Cats are weird.	9335629	Gatos es strana.
9333895	Are you a normal person?	9335761	Esce tu es un person normal?
1389243	The race is over.	9339467	La corsa ia fini.
1389243	The race is over.	9339472	Ла корса иа фини.
5871056	Do you speak Romanian?	9340262	Esce tu parla romanian?
5871056	Do you speak Romanian?	9340265	Esce vos parla romanian?
9333753	Are you speaking Romanian?	9340265	Esce vos parla romanian?
9333753	Are you speaking Romanian?	9340262	Esce tu parla romanian?
9332462	That seems excessive.	9340343	Acel pare esedente.
54489	How do you feel today?	9340957	Como tu senti oji?
54489	How do you feel today?	9340960	Комо ту сенти ожи?
6261629	Are you reluctant to go there?	9341106	Esce tu esita si debe vade a ala?
6261629	Are you reluctant to go there?	9341107	Еске ту есита си дебе ваде а ала?
9330230	How did she do what?	9341645	Como el ia fa cual cosa?
9330230	How did she do what?	9341651	Комо ел иа фа куал коса?
5836861	Prisons are overcrowded.	9342476	La prisones es suprafolida.
5836861	Prisons are overcrowded.	9342487	Ла присонес ес супрафолида.
9345843	Tom is a man, and I'm a woman.	9346162	Tom es un om e me es un fem.
2650901	You like apples.	9348101	Tu gusta pomas.
2650901	You like apples.	9348102	Vos gusta pomas.
