2360582	I have to stay here.	9003622	Musím tu zostať.
2387306	I must stay here.	9003622	Musím tu zostať.
2359770	I've got to stay here.	9003622	Musím tu zostať.
2270528	Don't rush yourself.	9003629	Neponáhľaj sa.
2111906	Don't rush.	9003629	Neponáhľaj sa.
3953793	Don't hurry.	9003629	Neponáhľaj sa.
4771541	Welcome!	2428460	Vitajte!
4771541	Welcome!	9003637	Vitaj!
138919	Welcome.	9003637	Vitaj!
32672	See you soon!	9003643	Uvidíme sa skoro!
456665	See you soon.	9003643	Uvidíme sa skoro!
953811	I'll see you soon.	9003643	Uvidíme sa skoro!
3825478	Is this your daughter?	9003653	Toto je tvoja dcéra?
2751743	Morning!	855310	Dobré ráno!
2258234	Good morning.	855310	Dobré ráno!
499689	Good afternoon.	9003661	Dobré popoludnie!
3552554	Good afternoon!	9003661	Dobré popoludnie!
3552554	Good afternoon!	855295	Dobrý deň!
855284	Good day!	855295	Dobrý deň!
1844755	Good day.	855295	Dobrý deň!
2265983	Good evening!	8962092	Dobrý večer!
2362724	Good night.	2428451	Dobrú noc!
1068125	Goodnight!	2428451	Dobrú noc!
7822164	Goodnight.	2428451	Dobrú noc!
883787	I didn't know anything.	1338280	Nič som nevedel.
883787	I didn't know anything.	9003703	Nič som nevedela.
2547716	I'm not going to lie.	9003708	Nebudem klamať.
2247631	I won't lie.	9003708	Nebudem klamať.
18096	Take off your shoes.	9003714	Vyzujte sa.
5825662	Take off your boots.	9003714	Vyzujte sa.
1912212	I see the rose.	2431658	Vidím ružu.
472089	I go to school.	9003718	Chodím do školy.
396887	I am going to school.	8977168	Idem do školy.
2545415	I'm going back to school.	9003719	Vraciam sa do školy.
3783761	I'm also going to school.	9003720	Aj ja idem do školy.
249430	We see with our eyes.	9003721	Vidíme očami.
2254680	Where's your father?	7708213	Kde je tvoj otec?
5648637	Talk less, do more.	9003723	Menej hovor a viac rob!
410596	Well, let's go.	9003724	Dobre teda, poďme!
410595	Well, let's get going!	9003724	Dobre teda, poďme!
1411248	We found out that what he said wasn't true.	9003725	Zistili sme, že to, čo povedal, nie je pravda.
2111523	Start now.	9003726	Začnite teraz.
1525403	I catch a cold easily.	9003727	Ľahko nachladnem.
3131725	When was the last time that happened?	9003728	Kedy sa to stalo naposledy?
248815	We are getting off at the next station.	9003730	Vystupujeme na nasledujúcej stanici.
3311008	We're getting off at the next station.	9003730	Vystupujeme na nasledujúcej stanici.
2408485	I think we'd better start over again.	9003731	Myslím, že by sme mali začať odznova.
5137546	Thank you very much for your detailed explanation.	9003732	Ďakujem vám veľmi pekne za podrobné vysvetlenie.
1434	I love you.	1338489	Milujem ťa.
2365642	I love you!	1338489	Milujem ťa.
2365642	I love you!	735094	Ľúbim ťa.
265910	There's nothing to be done about it.	9003752	Nedá sa s tým nič robiť.
269982	Man's skin is very sensitive to temperature changes.	9003754	Ľudská koža je veľmi citlivá na zmeny teplôt.
487828	Swimming is easy.	9003755	Plávanie je ľahké.
26405	It is easy to swim.	9003755	Plávanie je ľahké.
6710498	You have a lot of great ideas.	9004503	Máš veľa skvelých nápadov.
6710498	You have a lot of great ideas.	9004504	Máte veľa skvelých nápadov.
8981676	Every child knows that.	9004512	Každé dieťa to vie.
242709	It's very cold today.	9004514	Dnes je veľmi chladno.
853094	Today is very cold.	9004514	Dnes je veľmi chladno.
242732	It is very cold today.	9004514	Dnes je veľmi chladno.
6532307	I like orange juice.	9004522	Mám rád pomarančovú šťavu.
5361615	This pen is mine.	9004525	Toto je moje pero.
60535	This pen belongs to me.	9004528	Toto pero patrí mne.
903488	Do you mind if I open the door?	9004532	Bude ti vadiť, ak otvorím dvere?
39004	Would you mind my opening the door?	9004532	Bude ti vadiť, ak otvorím dvere?
3417167	Tom is still your friend, isn't he?	9004536	Tom je stále tvoj priateľ, však?
20712	I almost missed the train.	9004543	Skoro som zmeškal vlak.
20712	I almost missed the train.	9004545	Skoro som zmeškala vlak.
6866258	I nearly missed the bus.	9004548	Skoro som zmeškal autobus.
6866257	I almost missed the bus.	9004548	Skoro som zmeškal autobus.
2407719	I think about that from time to time.	9004553	Čas od času nad tým premýšľam.
467337	There's no more salt.	9004564	Došla soľ.
508333	The salt ran out.	9004564	Došla soľ.
2713633	There's no salt left.	9004564	Došla soľ.
25759	There is no salt left.	9004564	Došla soľ.
325043	We are going to have a baby next month.	9004570	Budúci mesiac sa nám narodí dieťa.
6874179	We're going to have a baby next month.	9004570	Budúci mesiac sa nám narodí dieťa.
300532	He has a blue coat on.	9004575	Má na sebe modrý kabát.
3842235	That was your decision.	9004582	Bolo to tvoje rozhodnutie.
4494472	The decision was yours.	9004582	Bolo to tvoje rozhodnutie.
4500915	The decision was yours to make.	9004582	Bolo to tvoje rozhodnutie.
2647078	That was your choice.	9004590	Bola to tvoja voľba.
2648093	It was your choice.	9004590	Bola to tvoja voľba.
2659015	I learned it by heart.	9004595	Naučil som sa to naspamäť.
432878	No, thanks.	9004612	Nie, vďaka.
1895748	You have no evidence.	8987324	Nemáte dôkaz.
270618	He made fun of me in public.	9004625	Na verejnosti si zo mňa robil srandu.
1936577	I'm sore all over.	9004627	Bolí ma celé telo.
1936577	I'm sore all over.	9004630	Všetko ma bolí.
817966	He's running very quickly.	9004635	Beží veľmi rýchlo.
291572	He runs very fast.	9004635	Beží veľmi rýchlo.
2360278	I haven't seen Tom in years.	9004665	Toma som nevidel roky.
2331918	I hadn't seen Tom in years.	9004665	Toma som nevidel roky.
4133486	I haven't seen Tom for years.	9004665	Toma som nevidel roky.
2451477	Tom can't speak French, can he?	9004670	Tom nevie hovoriť francúzsky, však?
1868288	Tom has been crying all night.	9004673	Tom preplakal celú noc.
1026544	Tom cried all night.	9004673	Tom preplakal celú noc.
3174762	Tom kept crying all night.	9004673	Tom preplakal celú noc.
1026545	Tom cried all night long.	9004673	Tom preplakal celú noc.
17456	I'll lend it to you.	9004681	Požičiam ti to.
1588785	There is nothing here.	9004685	Tu nič nie je.
2252669	There's nothing here.	9004685	Tu nič nie je.
3286824	There's nothing in here.	9004685	Tu nič nie je.
1588785	There is nothing here.	9004692	Tu ničoho niet.
2252669	There's nothing here.	9004692	Tu ničoho niet.
3286824	There's nothing in here.	9004692	Tu ničoho niet.
2649083	Tom's not busy.	9004699	Tom nie je zaneprázdnený.
2046664	Tom isn't busy.	9004699	Tom nie je zaneprázdnený.
313463	She forgot to feed her dog.	9004702	Zabudla nakŕmiť svojho psa.
1027259	This land belongs to Tom.	9004708	Táto zem prináleží Tomovi.
1027259	This land belongs to Tom.	9004711	Táto zem patrí Tomovi.
3442133	Tom owns this land.	9004713	Tom vlastní túto zem.
2047632	You've got to be careful.	8992151	Musíš byť opatrný.
2020560	You need to be careful.	8992151	Musíš byť opatrný.
2853048	Tom was welcome wherever he went.	9004724	Tom bol vítaný kdekoľvek šiel.
2360291	I've seen you do amazing things.	9004726	Videl som vás robiť úžasné veci.
3733051	Tom works for me.	9004728	Tom pracuje pre mňa.
6357020	Tom is working for me.	9004728	Tom pracuje pre mňa.
2693510	Tom writes well.	9004730	Tom dobre píše.
4198394	Tom is good at writing.	9004730	Tom dobre píše.
2360219	I haven't reached any conclusions.	9004731	Nedospel som k žiadnym záverom.
4268453	How many years have you been working here?	9004732	Koľko rokov tu pracuješ?
61870	How long have you been working here?	9004733	Koľko dlho tu pracuješ?
3636345	When did you start working here?	9004734	Kedy ste tu začali pracovať?
2583230	These shoes don't fit me anymore.	9004735	Tieto topánky mi už nesedia.
1025752	Tom finds it much easier to speak English than French.	9005756	Pre Toma je oveľa ľahšie hovoriť anglicky ako francúzsky.
1656492	You must keep calm!	9005757	Musíš zostať v pokoji!
4665878	Tom wasn't at school today.	9005758	Tom dnes nebol v škole.
6637602	Tom wasn't in school today.	9005758	Tom dnes nebol v škole.
4135445	Tom slept much longer than he had intended.	9005764	Tom spal omnoho dlhšie, ako mal v úmysle.
3737195	I wish I knew what I should say.	9005765	Kiež by som vedel, čo povedať.
7843614	They are not all poor.	9005766	Nie všetci z nich sú chudobní.
4501930	Tom said he was bored.	8862809	Tom povedal, že sa nudí.
6439398	Tom said that he was bored.	8862809	Tom povedal, že sa nudí.
7180200	Tom said that he's bored.	8862809	Tom povedal, že sa nudí.
7819389	This is a fast and effective way of communication.	9005769	Toto je rýchly a účinný spôsob dorozumievania sa.
3599275	Mary has more money than any of us can imagine.	9005770	Mária má viac peňazí, než si dokáže ktokoľvek z nás predstaviť.
4850150	Tom deserves a second chance.	9005772	Tom si zaslúži druhú príležitosť.
4497215	Tom deserves another opportunity.	9005772	Tom si zaslúži druhú príležitosť.
3405224	Tom is still out of town.	9005773	Tom je stále mimo mesta.
3970249	Don't forget your ticket.	9005774	Nezabudni si lístok.
2424	Don't forget the ticket.	9005774	Nezabudni si lístok.
2199748	She's my guardian angel.	9005778	Ona je môj strážny anjel.
257753	I was in bed all day long yesterday.	9005780	Včera som celý deň preležal v posteli.
1923399	I don't think they're married.	9005784	Nemyslím si, že sú manželia.
2254677	Where's your computer?	9005786	Kde je tvoj počítač?
2254677	Where's your computer?	9005788	Kde máš počítač?
287695	His aim is to become a lawyer.	9005796	Jeho cieľom je stať sa právnikom.
66858	Ann has a weakness for chocolate.	9005797	Anna má slabosť pre čokoládu.
1954263	Ask Tom.	9005798	Spýtaj sa Toma.
2638976	Did Tom eat all the cookies?	9005800	Zjedol Tom všetky sušienky?
2619673	Tom is my half brother.	9005801	Tom je môj nevlastný brat.
3422022	Tom is my half-brother.	9005801	Tom je môj nevlastný brat.
8858066	If you will come we will come as well.	9005803	Ak prídete vy, prídeme i my.
1860408	Don't tell anyone.	9005806	Nikomu to nehovor.
2092602	Don't tell anybody.	9005806	Nikomu to nehovor.
2458534	I think you'd better give up.	9005807	Myslím, že by si sa mal radšej vzdať.
1954662	I can't open the door.	9005809	Nemôžem otvoriť dvere.
2451286	Does anyone in your family speak French?	9005811	Hovorí niekto z vašej rodiny francúzsky?
4551874	I waited for an hour and a half.	9005813	Čakal som hodinu aj pol.
252463	I have been waiting for an hour and a half.	9005813	Čakal som hodinu aj pol.
27745	I've been waiting for one and a half-hours.	9005813	Čakal som hodinu aj pol.
681248	Are you looking for a job?	9005817	Hľadáte prácu?
1959341	Are you looking for work?	9005817	Hľadáte prácu?
309627	Her hair is long.	9005819	Jej vlasy sú dlhé.
315861	She has long hair.	9005820	Má dlhé vlasy.
526281	She has got long hair.	9005820	Má dlhé vlasy.
705440	He has long hair.	9005820	Má dlhé vlasy.
2759914	He's beginning to believe.	9005821	Začína veriť.
2819579	I really like this singer.	9005824	Veľmi sa mi páči tento spevák.
16224	You look pale.	9005825	Vyzeráš bledo.
20747	He looks pale.	9005826	Vyzerá bledo.
2648785	It's not for you.	9005828	Nie je to pre teba.
1898077	This isn't for you.	9005828	Nie je to pre teba.
3818150	This is not for you.	9005828	Nie je to pre teba.
3917412	That's not for you.	9005828	Nie je to pre teba.
8320021	What do you want ?	7680848	Čo chceš?
8320021	What do you want ?	7431921	Čo chcete?
698966	Where is he?	4706212	Kde je?
1886646	Where are they?	9005835	Kde sú?
255212	Where am I?	9005836	Kde som?
687628	Where is it?	9005839	Kde je to?
2147545	Where is she?	9005840	Kde je ona?
8319969	What do they want ?	9005843	Čo chcú?
1877101	What do they want?	9005843	Čo chcú?
409602	I am hungry.	8957952	Som hladný!
409602	I am hungry.	8957954	Mám hlad!
376338	I feel hungry.	8957952	Som hladný!
376338	I feel hungry.	8957954	Mám hlad!
1839531	I'm hungry.	8957954	Mám hlad!
1839531	I'm hungry.	8957952	Som hladný!
2743304	I am hungry!	8957954	Mám hlad!
2743304	I am hungry!	8957952	Som hladný!
8320096	Where is she ?	4706212	Kde je?
2147545	Where is she?	4706212	Kde je?
8320096	Where is she ?	9005840	Kde je ona?
64536	Thank you for coming.	7524924	Ďakujem, že si prišiel.
331791	Thank you for coming!	7524924	Ďakujem, že si prišiel.
3620828	Thanks for coming!	7524924	Ďakujem, že si prišiel.
242724	Thank you for today.	9005859	Ďakujem za dnešok.
2643356	Thank you for the suggestion.	9005862	Ďakujem za návrh.
1227202	Thanks for the suggestion.	9005862	Ďakujem za návrh.
71676	Thank you for your advice.	9005865	Ďakujem za radu.
2592598	Thanks for your advice.	9005865	Ďakujem za radu.
2715434	Thanks for the tip.	9005865	Ďakujem za radu.
4474852	Thank you for the advice.	9005865	Ďakujem za radu.
953854	I'm sorry for making you cry.	9005867	Je mi ľúto, že som ťa rozplakal.
2046869	"I've been busy." "Busy doing what?"	9005869	„Bol som zaneprázdnený.“ „Zaneprázdnený s čím?“
2054381	I am in Rome now.	9005872	Teraz som v Ríme.
1876041	Thank you.	1065447	Ďakujem.
1743501	We learned English.	9005876	Učili sme sa anglicky.
262905	We studied English.	9005876	Učili sme sa anglicky.
274353	Thank you for the present.	9005881	Ďakujem za darček.
34097	Thank you for your present.	9005881	Ďakujem za darček.
750992	Thank you for your gift.	9005881	Ďakujem za darček.
2647604	Thanks for the gift.	9005881	Ďakujem za darček.
3134788	Thanks for your gift.	9005881	Ďakujem za darček.
2400487	I thank you for your gift.	9005881	Ďakujem za darček.
1528604	Sorry for being late.	9005887	Ospravedlňujem sa za meškanie.
277376	I'm sorry I'm late.	9005887	Ospravedlňujem sa za meškanie.
277388	I'm sorry for being late.	9005887	Ospravedlňujem sa za meškanie.
808702	Sorry I'm late.	9005887	Ospravedlňujem sa za meškanie.
277384	Sorry to be late.	9005887	Ospravedlňujem sa za meškanie.
4728682	Sorry, I'm late.	9005887	Ospravedlňujem sa za meškanie.
7185893	I'm sorry that I was late.	9005887	Ospravedlňujem sa za meškanie.
3823173	I'm sorry to be late.	9005887	Ospravedlňujem sa za meškanie.
1587981	I apologize for being late.	9005887	Ospravedlňujem sa za meškanie.
7186080	I'm sorry that I'm late.	9005887	Ospravedlňujem sa za meškanie.
404046	I'm at home.	9005986	Som doma.
29049	I am at home.	9005986	Som doma.
2111725	I'm home.	9005986	Som doma.
5853114	I'm at my place.	9005986	Som doma.
257596	I am in Tokyo today.	9005990	Dnes som v Tokiu.
254004	I have been busy.	9005992	Bol som zaneprázdnený.
2046651	I was busy.	9005992	Bol som zaneprázdnený.
2272758	Tom is a believer.	9006117	Tom je veriaci.
6877452	Tom is a religious man.	9006117	Tom je veriaci.
405767	They're eating apples.	2229128	Jedia jablká.
2787378	They're eating the apples.	2229128	Jedia jablká.
29612	I am eating an apple.	9006127	Jem jablko.
2445198	I'm eating an apple.	9006127	Jem jablko.
1098565	I eat an apple.	9006127	Jem jablko.
4165873	I am eating the apple.	9006127	Jem jablko.
405769	We're eating apples.	4915318	Jeme jablká.
2664182	I'll eat an apple.	9006136	Zjem jablko.
7851197	I will eat an apple.	9006136	Zjem jablko.
405764	He's eating an apple.	9006138	Je jablko.
405766	She's eating an apple.	9006141	Ona je jablko.
2242326	I, you, he, she, it, we, you, they are personal pronouns.	9006147	Ja, ty, on, ona, ono, my, vy, oni, ony sú osobné zámená.
71169	I think he will be glad to see you.	9006149	Myslím, že ťa rád uvidí.
38331	I seem to have caught a cold.	9006150	Zdá sa, že som prechladol.
38376	I'm afraid I caught a cold.	9006151	Obávam sa, že som prechladol.
7217462	I'm afraid that I caught a cold.	9006151	Obávam sa, že som prechladol.
2458558	I think you'll find it very interesting.	9006153	Myslím, že to bude pre vás veľmi zaujímavé.
323315	Tomorrow is Mother's Day.	9006156	Zajtra je Deň matiek.
544611	Where is the station?	9006165	Kde je stanica?
26041	Where is the railroad station?	9006169	Kde je železničná stanica?
638544	Where is the train station?	9006169	Kde je železničná stanica?
4048962	Where's the train station?	9006169	Kde je železničná stanica?
1806390	Which way is the train station?	9006174	Kadiaľ sa ide na železničnú stanicu?
307544	They have a large stock of information.	9006177	Majú veľké množstvo údajov.
16948	Your answer is right.	9006178	Vaša odpoveď je správna.
862501	It is enough for today.	9006181	Pre dnešok to stačí.
70439	Your answer is correct.	9006178	Vaša odpoveď je správna.
2254558	What has happened?	2858258	Čo sa stalo?
3735411	I didn't give up.	9006195	Nevzdal som sa.
2359542	I haven't given up.	9006195	Nevzdal som sa.
59345	The accent of this word is on the second syllable.	9006199	Prízvuk v tomto slove je na druhej slabike.
38464	Please drive carefully.	9008146	Prosím, jazdite opatrne.
265500	Drive carefully.	9008148	Jazdite opatrne.
2408289	I think Tom is sick.	9008149	Myslím, že Tom je chorý.
5494446	I think that Tom is sick.	9008149	Myslím, že Tom je chorý.
734057	Both pronunciations are correct.	9008151	Obidve výslovnosti sú správne.
2649241	Do it for me.	9008155	Urob to pre mňa.
2649165	Do that for me.	9008155	Urob to pre mňa.
313617	She can jump high.	9008161	Vie vysoko skákať.
1024283	Tom refused to give up.	9008164	Tom sa odmietol vzdať.
2960511	Tom refused to surrender.	9008164	Tom sa odmietol vzdať.
719222	The Italians often drink coffee.	9011105	Taliani často pijú kávu.
8856202	Actually, I don't know.	9013019	Vlastne, neviem.
2060252	Where did you buy flowers?	9013022	Kde si kúpil kvetiny?
2063821	Where did you buy the flowers?	9013022	Kde si kúpil kvetiny?
7494515	Where did he buy the flowers?	9013023	Kde kúpil kvetiny?
2360236	I haven't seen a doctor.	9013026	Nebol som u lekára.
1975681	Have you actually ever tried it?	9013027	Naozaj si to niekedy skúšal?
1413807	He'll run out of luck sooner or later.	9013032	Skôr či neskôr mu dôjde šťastie.
274101	Sooner or later, he will run out of luck.	9013032	Skôr či neskôr mu dôjde šťastie.
277323	Sooner or later, his luck will run out.	9013032	Skôr či neskôr mu dôjde šťastie.
1622613	Sooner or later his luck will run out.	9013032	Skôr či neskôr mu dôjde šťastie.
1745292	They sell meat in this store.	8947936	V tomto obchode sa predáva mäso.
1745288	In this shop we sell meat.	9013059	V tomto obchode predávame mäso.
3921824	Tom is hiding something from you.	9013065	Tom pred tebou niečo skrýva.
3921824	Tom is hiding something from you.	9013070	Tom pred vami niečo skrýva.
2429830	Wake Tom up.	9013090	Zobuď Toma.
2429830	Wake Tom up.	9013091	Zobuďte Toma.
1932032	Wake up Tom.	9013090	Zobuď Toma.
1932032	Wake up Tom.	9013091	Zobuďte Toma.
433678	I made a mistake.	9013104	Urobil som chybu.
5228918	I made a mistake!	9013104	Urobil som chybu.
2359938	I've made a mistake.	9013104	Urobil som chybu.
408293	What's your name?	1816748	Ako sa voláš?
1304610	What are you called?	1816748	Ako sa voláš?
4156151	Now we understand.	9013163	Teraz rozumieme.
2360558	I have to put my shoes on.	9013169	Musím sa obuť.
1619944	I can not give you an immediate answer.	9013178	Nemôžem vám dať okamžitú odpoveď.
1991714	I can't give you an answer right away.	9013178	Nemôžem vám dať okamžitú odpoveď.
1991713	I can't give you an immediate answer.	9013178	Nemôžem vám dať okamžitú odpoveď.
4027764	Dan is a linguist.	9013184	Dan je jazykovedec.
1601178	Tom is just warming up.	9013190	Tom sa iba zahrieva.
3449069	Tom is just getting warmed up.	9013190	Tom sa iba zahrieva.
2458550	I think you'll be pleasantly surprised.	9013197	Myslím, že budete príjemne prekvapení.
9013248	Who wants to go with me?	9013250	Kto chce ísť so mnou?
6203837	Tomorrow is Thursday.	8322124	Zajtra je štvrtok.
2546910	Tomorrow is a big day.	9013267	Zajtra je veľký deň.
3825472	Tomorrow is the big day.	9013267	Zajtra je veľký deň.
349064	I don't know.	1058083	Neviem.
3378136	I do not know.	1058083	Neviem.
4997155	Don't know.	1058083	Neviem.
580774	I'm a man.	8962957	Som muž.
2203198	We're popular.	9013299	Sme obľúbení.
2451273	Tom translated the contract into French.	9013305	Tom preložil zmluvu do francúzštiny.
7446455	Tom is here, right?	9013316	Tom je tu, však?
3417132	Tom is here, isn't he?	9013316	Tom je tu, však?
7446449	Tom's here, isn't he?	9013316	Tom je tu, však?
7446442	Tom's here, right?	9013316	Tom je tu, však?
1286504	She's in the hospital now.	9014113	Teraz je v nemocnici.
313733	She is in hospital now.	9014113	Teraz je v nemocnici.
36596	Anyone can do that.	9014123	Každý to môže urobiť.
276466	Anyone can do it.	9014123	Každý to môže urobiť.
2097849	Anybody can do this.	9014123	Každý to môže urobiť.
36608	Anybody can do that.	9014123	Každý to môže urobiť.
445021	What are you cooking?	8179290	Čo varíš?
4754245	I didn't know you were so rich.	9014480	Nevedel som, že si taký bohatý.
7518028	I didn't know that you were so rich.	9014480	Nevedel som, že si taký bohatý.
2346068	Don't cry. It's okay.	9014483	Neplač. To je v poriadku.
2033437	We just want you to be happy.	9014487	Chceme len, aby si bol šťastný.
1575122	Little is known about Pluto.	9014488	O Plute sa vie málo.
2821675	Tom walks to work.	9014491	Tom chodí do roboty peši.
5987680	Man overboard!	9014496	Muž cez palubu!
278628	The thief slipped into the house.	9014500	Zlodej vkĺzol do domu.
1826978	Islamabad is the capital of Pakistan.	9014516	Islamabad je hlavné mesto Pakistanu.
8396437	Islamabad is Pakistan's capital.	9014516	Islamabad je hlavné mesto Pakistanu.
311995	She left for Paris.	9014523	Odišla do Paríža.
17394	Is this your glass or your sister's?	9014525	Tento pohár je tvoj alebo tvojej sestry?
1895592	You're not alone.	9014527	Nie si sám.
2208353	You aren't alone.	9014527	Nie si sám.
1895592	You're not alone.	9014528	Nie si sama.
2208353	You aren't alone.	9014528	Nie si sama.
3911816	We need him.	9014530	Potrebujeme ho.
3911817	We need her.	9014535	Potrebujeme ju.
2241418	We need it.	9014537	Potrebujeme to.
1486358	It's a picture of Mary and her long-haired boyfriend.	9014540	Je to obrázok Márie a jej dlhovlasého priateľa.
1779761	He's in grave danger.	9014544	Je vo vážnom nebezpečenstve.
5598745	He is in grave danger.	9014544	Je vo vážnom nebezpečenstve.
57811	I need some medicine to kill the pain.	9014546	Potrebujem nejaké lieky od bolesti.
2408368	I think Tom should go.	9014549	Myslím, že Tom by mal ísť.
3162010	Tom asked me to help him paint his house.	9014550	Tom ma požiadal pomôcť mu vymaľovať dom.
2238715	Tom started sobbing.	9014556	Tom začal vzlykať.
3511330	Not everything that you read on the Internet is true.	9014559	Nie všetko, čo čítate na nete je pravda.
2765317	I'm thirty now.	9014560	Teraz mám tridsať rokov.
2111679	I'm thirty.	9014561	Mám tridsať rokov.
6872934	I'm 30 years old now.	9014560	Teraz mám tridsať rokov.
252248	I am 30 years old now.	9014560	Teraz mám tridsať rokov.
5865062	I'm 30 now.	9014560	Teraz mám tridsať rokov.
6872935	I'm thirty years old now.	9014560	Teraz mám tridsať rokov.
7832498	I'm 30 years old.	9014561	Mám tridsať rokov.
3449669	I am 30 years old.	9014561	Mám tridsať rokov.
2547669	I'm thirty years old.	9014561	Mám tridsať rokov.
3388202	I am thirty.	9014561	Mám tridsať rokov.
3388203	I am thirty years old.	9014561	Mám tridsať rokov.
790847	Open Sesame!	1336501	Sézam, otvor sa!
2043955	Open, Sesame!	1336501	Sézam, otvor sa!
274066	Soon learnt, soon forgotten.	1338078	Rýchlo naučené, rýchlo zabudnuté.
8427821	The hunter killed a fox.	1338552	Lovec zabil líšku.
37441	Tommy, can you hear me?	1338559	Tomi, počuješ ma?
774875	I learn Quechua.	1338455	Učím sa kečuánsky.
5780413	I'm learning Quechua.	1338455	Učím sa kečuánsky.
773326	I am learning Quechua.	1338455	Učím sa kečuánsky.
1012341	Open a book and it will open your soul.	1338421	Otvor knihu a ona otvorí tvoju dušu.
1102794	This boy is lazy.	1338402	Tento chlapec je lenivý.
267880	The girl went to school in spite of her illness.	1338291	Dievča šlo do školy aj keď bolo choré.
8401312	The girl went to the school even though she was ill.	1338291	Dievča šlo do školy aj keď bolo choré.
8401314	The girl went to the school despite being sick.	1338291	Dievča šlo do školy aj keď bolo choré.
356200	Who are you?	1338575	Kto si?
289596	He married a pretty girl.	9014627	Oženil sa s peknou dievčinou.
1290447	Little Sophie was not obedient.	1336496	Malá Sofia nebola poslušná.
70194	You are always late.	1336537	Chodiš stále neskoro.
2713698	You're always late.	1336537	Chodiš stále neskoro.
314502	She passed the examination.	1336539	Urobila skúšku.
289372	He passed the examination.	1336525	Urobil skúšku.
66453	Draw your chair closer to the fire.	1336587	Prisuň si sloličku bližšie k ohňu.
311414	She has to pay for the book.	1336612	Musí zaplatiť za knihu.
5780545	Here's a letter for you.	9014639	Tu je list pre vás.
18067	Here is a letter for you.	9014639	Tu je list pre vás.
2369535	Is your mom at home?	1338451	Je doma tvoja matka?
2369536	Is your mom home?	1338451	Je doma tvoja matka?
2345890	Is your mum at home?	1338451	Je doma tvoja matka?
8650332	It's necessary that you do that.	1338397	Je potrebné, aby ste to urobili.
8358375	It is necessary that you do it.	1338397	Je potrebné, aby ste to urobili.
