1577	Those who live in glass houses should not throw stones.	1981079	Dei som bur i glashus burde ikkje kaste stein.
1712	I have a headache.	1982530	Eg har vondt i hovudet.
1712	I have a headache.	1982531	Eg har hovudverk.
1860	I don't want to go to school.	3633401	Eg vil ikkje gå på skule.
2085	I spent twelve hours on the train.	396883	Eg var på toget i tolv timer.
15983	You really have a passion for food.	1981810	Du har sanneleg glød for mat.
17812	Your o's look like a's.	1981042	O-ane dine liknar på a-ar.
19990	Imagine, for the sake of argument, a tribal group in which mother-son incest was countenanced.	399758	Sjå føre deg, for skuld argumentet, ei stammegruppe der insest mellom mor og son var godteke.
20664	I will gladly help you.	2059670	Eg hjelper deg gjerne.
21398	Some of the students like to play the guitar.	1981113	Nokre av elevane likar å spelle gitar.
22271	There's a lot of room left for improvement.	1981253	Det er mykje betring å gå på.
22437	The meeting is held twice a month.	1980978	Møtet finn stad to gonger i månaden.
22820	Every one of us is more or less interested in art.	396852	Alle av oss er meir eller mindre kunstinteresserte.
23136	We flew to Paris, where we stayed a week.	1982737	Vi flaug til Paris, som vi blei ei veke i.
25688	Round trip or one-way?	396679	Tur-retur eller ein veg?
26230	The best way to learn English is to go to America.	1983772	Den beste måten å lære seg engelsk på, er å fara til USA.
27110	Will you give me a drink?	1981090	Kunne du gjeve meg noko å drikke?
29749	I'm listening to the radio.	1983779	Eg høyrer på radio.
32578	I'll call him later.	1984023	Eg ringjer han seinare.
33627	Throw the ball back to me.	1981330	Kast att ballen åt meg.
33982	You must not stay in bed.	1981817	Du får ikkje verte sengeliggjande.
35199	Butter is made from cream.	1980963	Smør vert laga av fløyte.
35746	In such countries as Norway and Finland, they have lots of snow in winter.	1982623	I land som Noreg og Finland har dei mykje snø om vetteren.
36852	I have no idea how long it will take.	1981822	Eg har ikkje peiling på kor lang tid det kjem til å taka.
38875	Don't be so noisy, please.	1981382	Ikkje bråk så fælt, er du snill.
38875	Don't be so noisy, please.	1981384	Ikkje bråk så fælt, er de snille.
39048	The door was opened by a tall man.	1983421	Døra vart opna av ein høg mann.
40255	Will you teach me how to play chess?	1981261	Kan du lære meg korleis eg speler sjakk?
41486	Don't walk so fast.	1981807	Ikkje gå så kjapt.
41781	I don't know how to put it in Japanese.	1980971	Eg veit ikkje korleis eg kan seia det på japansk.
42944	How did you see that?	1981255	Kva syntest du om det?
43331	The old woman has no one to wait on her.	1982736	Den gamle kona har ingen til å vente på seg.
43350	The old man had a noble countenance.	3014178	Den gamle mannen hadde et edelt ansikt.
43899	Give me the book.	1982519	Gjev meg boka.
44203	The room was littered with scraps of paper.	1981788	Rommet var fullt av papirstrimlar.
46435	The girl began to cry at the sight of the big dog.	1981373	Jenta byrja å gråte då ho såg den store hunden.
48088	His misspelling of that word eliminated him from the contest.	1981365	Av di han stava det ordet gale, vart han send ut av tevlinga.
50165	The load of the truck was in excess of three tons.	1980946	Det var tre tonn overvekt på lastebillasset.
54451	Please feel free to link to my page.	1981412	Legg gjerne att peikarar hit på andre sider.
57673	It's wasteful to leave the land lying idle.	1981797	Det er bortkasta å lata jorda liggje uutvunnen.
58170	The trains are running in this snow.	1981111	Toga held fram sjølv med all denne snøen.
59766	This rule applies to you, too.	396864	Denne regelen gjeld deg òg.
61223	This camera is less expensive than that one.	1981430	Dette kameraet er rimelegare enn det der.
62300	A button has come off my coat.	1981015	Den eine knappen har losna frå frakken.
62449	Ken learned many Japanese songs by heart.	1981252	Ken lærte seg mange japanske songar utanåt.
62478	Ken is happy.	1982738	Ken er glad.
62641	I need some sugar to make a cake.	1981771	Eg treng litt sukker til kakebakinga.
65106	I did nothing out of the ordinary.	1981112	Eg gjorde ikkje noko utanom det vanlege.
66629	The most careful man sometimes makes mistakes.	1981110	Sjølv den varsamste tek somme tider gale.
67034	That is his house.	1981075	Det er huset hans.
67546	The United States borders Canada.	396868	Dei sameinte statane grensar opp til Canada.
70304	Do you have a hobby - for example, painting?	396662	Har du ein hobby – måling, til dømes?
71579	It is not necessary for you to quit the job.	396830	Du treng ikkje seie opp jobben.
72341	See you a little before 7.	1984020	Vi sest like føre sju.
73835	"Who is it?" "It's me."	1982618	"Kven er det?" "Det er meg."
238151	The police held him in custody.	1981804	Politiet pågreip han.
238906	Ken is the youngest of the four.	1983771	Ken er yngst av alle fire.
241471	The United Nations Charter was signed in 1945.	1981447	SN-pakta vart skriven under i 1945.
244616	My uncle dropped in on me yesterday.	1981395	Farbror kom innom i går.
244616	My uncle dropped in on me yesterday.	1981396	Morbror kom innom i går.
245067	Have you ever seen a bear in the mountain?	2977289	Har du noen gang sett en bjørn på fjellet?
246602	There are many words with meanings I don't know.	1981835	Det finst mange ord som tydingar eg ikkje veit om.
248069	We painted the house green.	1984058	Vi måla huset grønt.
248130	We named the boat the Half Moon.	1982614	Vi døypte båten "Halvmånen".
248229	We enjoyed ourselves very much.	1981832	Vi hadde det kjempemorosamt.
251953	My daughter is fast asleep.	1982566	Dotter mi søv djupt.
252578	I have been studying English for four years.	1981057	Eg har lært engelsk i fire år.
253660	I'll remember this incident for good.	1980499	Eg kjem til å hugse denne hendinga for alltid.
254547	I met the man, who showed me the way.	1981437	Eg møtte mannen som synte meg vegen.
255756	I have another friend in China.	1981363	Eg har ein ven til i Kina.
255845	Each time I tried, I failed.	1982735	Kvar gong eg prøvde, mislukkast eg.
256066	I walked in the woods by myself.	1982617	Eg gjekk i skogen åleine.
256713	I am accustomed to cold weather.	1982615	Eg er vand til kaldt vêr.
259673	I'm from Tokyo.	1981443	Eg kjem frå Tokyo.
260532	I interpreted what he said in French into Japanese.	1981422	Eg tolka det ho sa på fransk til japansk.
264098	Now and then I think of divorcing him.	1981362	Stundom vurderer eg å skilja meg frå han.
265251	As it is, I am awake.	1981037	Det har seg sånn at eg er vaken.
265519	Could you open the car window?	1981432	Kunne du opna bilvindauga?
265769	Young people usually have more energy than the old.	1980998	Unge har som oftast meir ork enn gamle.
268732	Don't eat for at least three hours.	1981254	Ikkje et på minst tre timar.
272679	The goods ordered from England last month have not arrived yet.	1981421	Varene som vi tinga frå England førre måned er ikkje komne enno.
272985	The teacher listened attentively to my explanation.	1981777	Læraren høyrde merksamt etter på forklåringa mi.
274294	You will soon come up with him if you run.	396859	Du tek han snart igjen viss du lauper.
274388	Your son must be quite tall by now.	1982734	Son din må vera vorten nokså høg no.
275803	The traffic was interrupted by the heavy snow.	1981418	Trafikken vart råka av det kraftige snøvêret.
281669	People often say that Japanese is a difficult language.	396862	Folk seier ofte at japansk er eit vanskeleg språk.
283448	He had hardly left home when it began to rain.	1981431	Han hadde så vidt faren heimantil då regnet byrja.
285020	In case you see him, please say hello to him for me.	1980928	Hels om de skulle møtast.
286170	I don't know how to interpret his words.	339217	Eg veit ikkje korleis eg skal tolke orda hans.
286692	He writes correct English.	1981820	Han skriv rett engelsk.
288913	You can trust him to some degree but not wholly.	396858	Du kan lite på han til ein viss grad, men ikkje heilt.
292447	He came here all the way from London.	1981399	Han er komen heilt frå London.
293414	He kicked me on purpose.	1981341	Han sparka til meg med vilje.
295812	People say he never dies.	396866	Folk seier at han aldri døyr.
300542	He put his finger to his lips as a sign to be quiet.	1981360	Han heldt fingeren opp mot leppa for å bede om togn.
301163	He tried to reduce his weight.	1981427	Han prøvde å gå ned.
301163	He tried to reduce his weight.	1981428	Han prøvde å gå ned i vekt.
301339	He appears to have been a great sportsman.	1981847	Han var visst ein stor idrottsmann.
301400	He is known to everyone.	1981410	Han er kjend for alle.
304095	He is leaving for Peru tomorrow, isn't he?	1981839	Han fer til Peru i morgon, ikkje sant?
304317	He broke his word.	1982524	Han braut det han hadde lovt.
304317	He broke his word.	1982525	Han heldt ikkje ord.
304799	He will be in time for the train.	1981425	Han kjem til å nå toget i tide.
305758	They went around the lake.	1981329	Dei gjekk rundt innsjøen.
305885	They must have known it all along.	1981802	Dei må ha visst det heile tida.
306953	They eat half the world's wheat.	1980959	Dei et helvta av all kveiten i verda.
307294	They must have failed through lack of enthusiasm.	1980548	Dei må ha mislukkast på grunn av manglande entusiasme.
307785	We failed to bring him to agree to our plan.	1984041	Vi mislukkast i å få han til å seia seg samd i planen vår.
308795	She doesn't have any enemies.	396881	Ho har ingen fiendar.
309549	The old chair groaned under her weight.	1981801	Den gamle stolen stunde av vekta hennar.
310272	She will be able to answer your question.	1981052	Ho vil kunna svara på spørsmålet ditt.
313360	She is almost as tall as you.	1982602	Ho er nesten like høg som du.
315459	She is a teacher.	1982513	Ho er lærarinne.
315459	She is a teacher.	1982515	Ho er lærar.
316113	She wants to keep a cat.	1981393	Ho har lyst på katt.
316114	She has a cat. The cat is white.	516454	Ho har ein katt. Katten er kvit.
316709	She was still weak after her illness.	1981792	Ho var endå svak etter sjukdomen.
318582	I was thrown off guard.	1981055	Eg vart teken på senga.
321279	Hokkaido is very far, isn't it?	1981350	Hokkaido er veldig langt unna, ikkje sant?
321899	I aimed my gun at the target.	1982596	Eg méda skytaren på målet.
321899	I aimed my gun at the target.	1982597	Eg retta skytaren mot målet.
322501	He failed the examination again.	1984017	Han strauk om att.
323686	You needn't suffer in silence.	1981790	Du lyt ikkje li i togn.
326141	The train was so crowded that we were obliged to stand all the way to Osaka.	1981787	Toget var så fullt at vi måtte stå heile vegen til Osaka.
327656	Do it by yourself.	1982561	Gjer det sjølv.
355604	Let's decide by coin toss.	1981829	Vi slår mynt om det.
371916	I am from Norway.	1982624	Eg kjem frå Noreg.
387459	Grace looked angry.	1981776	Grace verka sur.
388622	Kate was forced to read the book.	1982619	Kate vart tvingt til å lesa boka.
389077	Here's my flag for Nynorsk. Because the philosophy of Nynorsk is based on the maximum divergence from Danish, Danish background of the flag is to be replaced with Icelandic, because Icelandic served as inspiration for the language creators. The flag is not rectangular in form, because... Well, that Nynorsk is strange after all.	389097	Her er flagget mitt for nynorsk. Sidan filosofien til nynorsk er basert på maksimal skilnad frå dansk, vert den danske bakgrunnen på flagget erstatta med ein islandsk en, då islandsk var ein inspirasjon for dei som laga språket. Flagget er ikkje rektangelforma, sidan... Vel, at nynorsk trass alt er rart.
398746	Hello, world!	1078329	Hallo verden!
400642	Is it really wise for marketing folks to satisfy people's desire for instant gratification?	400643	Er det eigentleg klokt at reklamefolk innfrir ønsket som folk har om umiddelbar tilfredsstilling?
416289	Necessity knows no law.	1984038	Naud kjenner ingen lover.
416890	How did you reply?	1982527	Korleis svara du?
434344	Call me!	2920294	Ring meg!
436901	I need to rinse my mouth.	1981072	Eg må skòle munnen.
452264	They're digging a hole.	1980920	Dei driv og grev eit hol.
453057	I was in the train for twelve hours.	396883	Eg var på toget i tolv timer.
456627	Please speak more slowly.	1981262	Snakk litt rolegare, er du snill.
462438	Since you're here, you can help me.	1984059	Medan du er her, kan du jo hjelpe meg.
484055	Our mother bought us a puppy.	1982599	Mor vår kjøpte kvalp åt oss.
511849	He's my older brother.	1981336	Han er storebror min.
528825	I sent him a letter to let him know my decision.	1983436	Eg sende han eit brev om det eg har bestemt meg for.
578786	Don't forget that we have chores.	1983407	Ikkje gløym at me har skyldnadar.
584354	Christopher Columbus once walked into a McDonald's and ordered a Happy Meal. It did not make him happy, but he liked the toy.	1981389	Kristoffer Columbus gjekk ein gong på McDonald's og bad om Happy Meal. Han vart ikkje glad, men han likte leika.
600494	I love pizza very much.	1981250	Eg er kjempeglad i pizza.
657156	An ice pack will numb the pain.	1981114	Ein ispose vil hemja smerta.
662672	He lost his patience and hit the boy.	1981449	Han miste tolmodet og slo til guten.
664076	Two souls, one spirit.	1982740	To sjeler, ein tanke.
679871	Do you have any cheaper ones?	1983405	Har du nokre som er billegare?
680407	Mary's bikini bottom is black.	1981786	Bikinitrusa til Mary er svart.
680828	The swimmers are entering the water.	1981403	Symjarane er på veg ut i vatnet.
680828	The swimmers are entering the water.	1981408	Symjarane går uti.
687594	Where can I place these beers?	1982610	Kvar kan eg setja frå meg ølet?
689750	He walked awkwardly down the street.	1981442	Han gjekk kleint ned gata.
693776	Don't you get bored when you're alone?	1981334	Keiar du deg ikkje når du er åleine?
693776	Don't you get bored when you're alone?	1981335	Keiar de dykk ikkje når de er åleine?
697200	She doesn't own many books.	1981842	Ho har ikkje mange bøker.
702472	Colorless green ideas sleep furiously.	719091	Fargelause grøne idéar søv rasande.
706997	The Van Horn family was rich.	1984284	Van Horn-familien var rik.
719301	She smokes a lot.	1982511	Ho røykjer mykje.
750222	Writing two separate words when it should be written as one is a big problem in Norway.	1982626	Særskriving er eit stort problem i Noreg.
750674	A big car flew off the road today.	396889	I dag flaug ein stor bil av vegen.
751045	I was on the train for twelve hours.	396883	Eg var på toget i tolv timer.
751047	Who would look after my children if I died?	396882	Kven ville teke vare på borna mine om eg døydde?
751048	She has no enemies.	396881	Ho har ingen fiendar.
751050	"I'm hungry," said the little white rabbit, so they stopped and ate the bloom of a large hyacinth.	396880	«Eg er svolten,» sa den vesle kvite kaninen, så dei stoppa og åt blomen av ein stor hyasint.
751051	I'm fed up with homework.	396875	Eg er lei av lekser.
751053	We'll meet at the station at nine o'clock.	396870	Me skal møtast på stasjonen klokka ni.
755280	This rule applies to you as well.	396864	Denne regelen gjeld deg òg.
841120	The 100 most common words in English are Anglo-Saxon words.	1981834	Dei hundre vanlegaste orda i engelsk er anglosaksiske ord.
847927	Pleased to meet you. I am an anteater.	3677455	Hyggjeleg å møte deg. Jeg er en maurslukar.
899409	Language reflects daily experience.	1981436	Målet speglar av kvardagslege opplevingar.
945078	I frequently think about my mother who passed away.	1981415	Eg tenkjer ofte på mi avlidne mor.
978314	What did you say yesterday?	1984035	Kva var det du sa i går?
983650	This is a horse.	983657	Dette er ein hest.
1001625	I'm reading this book.	1473434	Eg leser denne boka.
1003817	Where am I from?	1983782	Kvar er eg frå?
1003905	We're married to each other.	1982613	Vi er gifte.
1009332	He doesn't have any strength left.	1981416	Han har ikkje styrke att.
1023727	Yesterday Tom stayed home all day.	1981845	I går heldt Tom seg heime heile dagen.
1023823	Tom's younger daughter is married.	1983796	Tom si yngre dotter er gift.
1023824	Tom's work is selling second-hand cars.	1983799	Tom sin jobb er å selje bruktbilar.
1023825	Tom's wife would probably leave him if she knew the truth.	1983802	Tom si kone ville sikkert ha forlate han om ho visste sanninga.
1023826	Tom's way of talking gets on my nerves.	1983803	Tom sin måte å snakke på går meg på nervane.
1023827	Tom's troublemaking days are over.	1983806	Tom si bråkmaking er endeleg over.
1023828	Tom's third marriage was unhappy and he was considering yet another divorce.	1983808	Toms tredje ekteskap var ulykkelig og han tenkte seg å skilles nok en gang.
1023828	Tom's third marriage was unhappy and he was considering yet another divorce.	1983811	Tom sitt tredje ekteskap var ulukkeleg og han hadde tenkt seg å skillast nok ein gong.
1023829	Tom's taste in music is similar to mine.	1983815	Tom sin musikksmak er temmeleg lik min.
1023830	Tom's speech was quite interesting.	1983821	Tom sin tale var temmeleg interessant.
1023831	Tom's son was killed in a traffic accident last winter.	1983828	Tom sin son vart drepen i ei trafikkulukka sist vinter.
1023832	Tom's so old.	1983832	Tom er svært gammal.
1023833	Tom's response was immediate.	1983837	Tom svarde med ein gong.
1023834	Tom's plane leaves for Boston at 2:30 p.m.	1983840	Flyet Tom skal ta til Boston drar kl. 14.30.
1023835	Tom's parents were both teachers.	1983841	Tom sine foreldre var lærarar.
1023836	Tom's opinions don't carry much weight around here.	1983844	Tom sine meiningar gjer ikkje mykje forskjell her.
1023837	Tom's operation was going to cost a small fortune.	1983852	Tom sin operasjon ville ha kosta ein halv formue.
1023838	Tom's older daughter is still unmarried.	1983853	Tom si eldstedotter er framleis ugift.
1023839	Tom's not breathing.	1983856	Tom pustar ikkje meir.
1023840	Tom's mother is a very good cook.	1983857	Tom si mor er ein veldig god kokk.
1023841	Tom's mother died just one week before Tom graduated from college.	1983861	Tom si mor døydde berre éin veke før han vart uteksaminert.
1023842	Tom's mother chased Tom as he ran naked around the lobby.	1983866	Tom vart jaga av mora si medan han sprang naken rundt i lobbyen.
1023843	Tom's living room was tastefully furnished.	1983869	Tom si stova vart smakefullt innreidd.
1023844	Tom's house is for sale.	1983871	Tom sitt hus er til sals.
1023845	Tom's house is easy to find.	1983875	Tom sitt hus er lett å finne.
1023846	Tom's heart suddenly began to beat faster.	1983881	Hjartet til Tom byrja plutseleg å slå fortare.
1023847	Tom's hat blew off.	1983907	Tom sin hatt bles vekk.
1023848	Tom's hairline is receding.	1983922	Tom byrjar å få vikar.
1023849	Tom's fingers got smashed while working on the assembly line.	1983937	Tom sine fingrar vart knuste medan han jobba på samlebandet.
1023850	Tom's family lives in Boston.	1983940	Tom sin familie bur i Boston
1023851	Tom's face is red.	1983949	Tom sitt ansikt er raudt.
1023852	Tom's eyesight isn't as good as it used to be.	1983954	Tom hadde betre syn før i tida.
1023853	Tom's eyes are bloodshot.	1983959	Tom sine auge er blodraude.
1023854	Tom's duties include raking the leaves.	1983961	En av Tom sine plikter er å rake lauv.
1023855	Tom's dog bit him playfully.	1983965	Tom sin hund beit han leikent.
1023856	Tom's diet is deficient in protein.	1983967	Tom sitt kosthald har for lite protein.
1023857	Tom's death came as a surprise.	1983970	Tom sin død kom brått.
1023858	Tom's days are numbered.	1983971	Tom sine dagar er talde.
1023859	Tom's company is drilling for oil.	1983974	Tom sitt firma borar etter olje.
1023860	Tom's company imports tea from India.	1983975	Tom sitt firma importerer te frå India.
1023861	Tom's company imports coffee from Brazil.	1983979	Tom sitt firma importerer kaffi frå Brasil.
1023862	Tom's clothes were old, but clean.	1983981	Tom sine klede var gamle, men reine.
1023863	Tom's business is doing very well.	1983985	Forretninga til Tom gjer det ganske bra.
1023864	Tom's bicycle was blue before he painted it red.	1983995	Tom sin sykkel var blå før han måla honom raud.
1023865	Tom's behavior wasn't acceptable.	1984004	Tom oppførte seg dårleg.
1023866	Tom's an irritating person to work with because he'll never admit it when he's made a mistake.	1984005	Det er irriterande å jobbe med Tom fordi han innrømmer aldri feila sine.
1023867	Tom's advice was very helpful.	1984008	Rådet til Tom var ganske hjempsamt.
1023868	Tom's advice didn't help at all.	1984010	Rådet til Tom hjelpte ikkje i det heile teke.
1023869	Tom, I need your help.	1984014	Tom, eg trengjer at du hjelper meg.
1023870	Tom, could you keep an eye on the kids?	1984015	Tom, kunne du halde eit auge med borna?
1023871	Tom zipped up his coat.	1984019	Tom drog opp glidelåsen på frakken sin.
1023872	Tom yelled for help.	1984021	Tom ropte etter hjelp.
1023873	Tom writes everything down so he won't forget it.	1984027	Tom skriv ned alt slik at han ikkje gløymer det.
1023874	Tom wouldn't mind eating meat and potatoes every day of the week.	1984029	Tom kunne gjerne ha ete kjøtt og poteter kvar dag i veken.
1023875	Tom would like to become a simultaneous interpreter.	1984037	Tom har lyst til å bli ein tolk.
1023876	Tom would have missed the train if he had stopped to buy a chocolate bar.	1984039	Tom ville ha miste toget om han hadde stoppe for å kjøpe ein sjokolade.
1023877	Tom works the night shift.	1984043	Tom jobbar nattskift.
1023878	Tom works the evening shift.	1984044	Tom jobbar kveldsskift.
1023879	Tom works out in a gym near his house.	1984050	Tom trener på eit treningssenter nært huset hans.
1023880	Tom works from nine to five.	1984046	Tom arbeider frå ni til fem.
1023881	Tom works from early in the morning until late at night every day.	1984047	Tom arbeider frå tidleg om morgonen til seint om kvelden kvar dag.
1023882	Tom works for a trading company in Boston.	1984048	Tom arbeider for eit handelsføretak i Boston.
1023883	Tom works for a large company.	1984049	Tom arbeider for eit stort selskap.
1023884	Tom worked for a construction company in Boston.	1985202	Tom jobbet for eit byggjefirma i Boston.
1023885	Tom worked all day and was completely worn out.	1984052	Tom arbeidde heile dagen, og vart heilt utmødd.
1023886	Tom wore a new coat to school today.	1984053	Tom hadde på seg ein ny frakk på skulen i dag.
1023887	Tom won't go alone.	1984054	Tom vil ikkje gå åleine.
1023888	Tom won't admit that he's done anything wrong.	1984055	Tom vil ikkje vedgå at han har gjort noko gale.
1023889	Tom wishes that he could be a better French speaker.	1984056	Tom skulle ynskje at han var betre i fransk.
1023890	Tom wishes he didn't have to help with the housework.	1985217	Tom skulle ynskje han ikkje måtte hjelpe til med husarbeidet.
1023891	Tom will visit Boston this summer for sure.	1985220	Tom vil garantert drage til Boston i sommar.
1023892	Tom will remember this weekend as long as he lives.	1985221	Tom kjem til å hugse denne helga for resten av livet.
1023893	Tom will go to Boston next month.	1985225	Tom dreg til Boston neste månad.
1023894	Tom will carry those suitcases for you.	1985230	Tom skal bere desse koffertane for deg.
1023895	Tom will be thirty in March.	1985242	Tom vert tretti i mars.
1023896	Tom will be here any minute now.	1985257	Tom er her om nokre få augeblikk.
1023897	Tom will be back home soon.	1985261	Tom kjem snart heim att.
1023898	Tom will be back by 2:30.	1985272	Tom er tilbake før kl. 02.00.
1023899	Tom will be arriving here soon from Australia.	1985277	Tom kjem snart hit frå Australia.
1023900	Tom will be absent today because he has a cold.	1985290	Tom vert borte i dag fordi han er vorte forkjølt.
1023901	Tom will be a university student this year.	1985293	Tom vert universitetsstudent i år.
1023902	Tom whistled a tune as he walked along the river.	1985304	Tom plystra på ein song medan han gjekk langs elva.
1023903	Tom went without lunch because he didn't have enough time to eat.	1985310	Tom hoppa over lunsjen fordi han hadde ikkje nok tid til å ete.
1023904	Tom went to the counter and bought us both a drink.	1985313	Tom gjekk til disken og kjøpte ein drink til oss begge.
1023905	Tom went to school to learn how to tune pianos.	1985321	Tom drog til ein skule for å lære korleis å stemme piano.
1023906	Tom went to Boston to study music.	1985329	Tom drog til Boston for å studere musikk.
1023907	Tom went to Boston to attend a conference.	1985334	Tom drog til Boston for å gå på ein konferanse.
1023908	Tom went to Boston three years ago.	1985341	Tom drog til Boston for tre år sidan.
1023909	Tom went to bed at midnight.	1985344	Tom la seg ved midnatt.
1023910	Tom went to the beach last week.	1985348	Tom drog til stranda førre veke.
1023911	Tom went out to look for something to eat.	1985349	Tom gjekk ut for å sjå etter noko å ete.
1023912	Tom went for three weeks without shaving before his wife complained.	1985357	Tom gjekk tre veker utan å barbere seg før kona klaga.
1023913	Tom went fishing, but didn't catch anything.	1985361	Tom drog for å fiske, men han fekk ikkje noko.
1023914	Tom went downtown to do shopping.	2331467	Tom drog til byen for å handle.
1023915	Tom went down the river on a rubber raft.	2331468	Tom drog ned elva på ein gummiflåte.
1023916	Tom went bonkers.	2331471	Tom klikka.
1023918	Tom wasn't ready to die.	2331472	Tom var ikkje klar for å døy.
1023920	Tom wasn't afraid of death.	2331475	Tom var ikkje redd for døden.
