2491	No tengo palabras.	1728219	a! mi ken ala toki.
2997	¡Quiero un MP3!	1725610	mi wile e ilo pi kalama musi. a!
3075	La palabra es plata y el silencio oro.	655623	toki li kiwen walo. toki ala li kiwen jelo.
180721	¿Cuál es su nombre?	1729180	nimi sina li seme?
329889	Él tiene dos gatos.	642606	ona li jo e soweli tu.
333597	Yo trabajo.	1723448	mi pali.
339237	¡Buen viaje!	1720471	tawa pona!
356203	¿Quién eres?	617577	sina jan seme?
380868	Ella habla mucho.	1016806	ona li toki mute.
380916	Quiero dormir.	658851	mi wile lape.
409564	¿Qué es la felicidad?	1793579	pilin pona li seme?
435083	¡Hola! ¡Buenos días!	618518	toki! tenpo suno kama pona!
436276	Soy alto.	614700	mi suli.
436326	Tengo frío.	1730621	mi pilin lete.
442198	¿Dónde está tu casa?	1725781	tomo sina li lon seme?
449153	¿Cómo te llamas?	1729180	nimi sina li seme?
461028	¿Cómo se llama?	1729180	nimi sina li seme?
463428	Soy americano.	1795775	mi jan Mewika.
475003	Hola, soy Nancy.	1720513	toki! mi jan Nensi.
477931	¡Qué bella es ella!	1720874	a! ona li pona lukin.
479870	No.	1726253	ala.
481931	¿Dónde está su casa?	1725781	tomo sina li lon seme?
482390	¿Eres chino o japonés?	1793558	sina jan Sonko anu jan Nijon?
496818	Me gusta este perro.	1725156	soweli ni li pona tawa mi.
504515	Betty es una asesina en serie.	1725441	jan Pesi li moli e jan mute.
505727	¿Qué quieres? Quiero un perro.	663938	"sina wile e seme?" "mi wile e soweli."
531592	No puedo concentrarme con todo este ruido.	1790962	pakala! mi ken ala pilin tan kalama!
534290	Eres estúpido.	1733514	sina nasa.
534291	Eres un estúpido.	1733514	sina nasa.
535017	Los conejos tienen las orejas grandes.	665468	soweli pi noka wawa li jo e kute suli.
537820	Todo va bien.	639820	ale li pona.
553345	¿Eres estadounidense o francés?	1723442	sina jan Mewika anu jan Kanse?
574399	Los rusos nunca sonríen.	1725107	jan Losi li musi uta ala.
583945	Todo está bien.	639820	ale li pona.
585506	En Canadá hablan inglés y francés.	1725248	jan Kanata li kepeken e toki Kanse e toki Inli.
589783	No me gustan los ricos.	1725497	jan pi mani mute li ike tawa mi.
611132	La manzana no cae lejos del árbol.	614702	kili li tawa anpa poka kasi.
618330	Hablo interlingua.	719050	mi toki lon toki Intelinwa.
618852	Ella habla demasiado.	1016806	ona li toki mute.
639203	Jesús te odia.	639791	sina ike mute tawa jan Jesu.
652953	Estoy congelado.	1730621	mi pilin lete.
652955	Estoy helado.	1730621	mi pilin lete.
652957	Me estoy helando.	1730621	mi pilin lete.
652985	Nadie lo sabía.	1792065	jan ala li sona e ni.
670972	A Tatoeba le falta el botón de cerrar sesión.	1720592	tomo pali Tatowepa li jo ala e ilo "o pini pali".
687369	¿Cómo se llama usted?	1729180	nimi sina li seme?
3666894	¿Quién es usted?	617577	sina jan seme?
730048	Él saludó a la mujer.	618299	ona li toki e "toki" tawa meli.
809748	La compañía tiene problemas financieros.	1725372	tomo pali li jo lili e mani.
832100	¡Qué guapa es ella!	1720874	a! ona li pona lukin.
854874	¿Quién es esa chica?	617566	meli ni li jan seme?
858775	Llamé al gatito Tama.	1723435	mi pana e nimi Tama tawa soweli lili ni.
863661	Odio estas palabras.	1720837	nimi ni li ike mute tawa mi.
866951	No, yo no lo he escrito.	1793524	mi sitelen ala e ni.
874273	¿De dónde es tu amigo?	1793515	jan pona sina li kama tan lon seme?
926901	Papá es un buen hombre.	926907	mama mije mi li mije pona.
942495	Todos desean la felicidad.	1795057	jan ali li wile pilin pona.
952960	El conejo tiene orejas largas.	665468	soweli pi noka wawa li jo e kute suli.
1023049	Siempre está ocupado.	1726201	tenpo ali la ona li pali.
1036282	No puedo beber alcohol.	1722926	mi ken ala moku e telo nasa.
1043529	Necesito esto.	1725841	mi wile e ni.
1070864	Estoy remodelando mi dormitorio.	1072353	mi tawa e supa lon tomo mi.
1143588	El agua es importante.	1120809	telo li suli.
1143589	Yo soy importante.	614700	mi suli.
1192171	No se puede sobrevivir sin dinero.	1795858	jan li jo ala e mani la ona li moli.
1193194	El gatito quiere dormir.	658855	soweli lili li wile lape.
1207168	Vete a la escuela.	1725009	o tawa tomo sona!
1213833	¿Cuál es tu nombre?	1729180	nimi sina li seme?
1248459	Soy grande.	614700	mi suli.
1268422	El mamífero está muerto.	643126	soweli li moli.
1284289	Esto es mahjongg.	1725204	ni li musi lipu Mason.
1286070	¿Es usted chino o japonés?	1793558	sina jan Sonko anu jan Nijon?
1286865	Ahora no está en casa.	1790971	tenpo ni la ona li lon ala tomo ona.
1292006	¡Está en Europa!	1723552	sina lon ma Elopa! a!
1302840	El tiempo todo lo cura.	620729	tenpo li pona e sijelo ike ale.
1323394	Atrapé una hermosa mariposa.	1720614	mi alasa e pipi. ona li pona lukin.
1329248	Ella sabe hablar japonés.	1731347	ona li ken kepeken e toki Nijon.
1357539	Yo uso Firefox.	1728226	mi kepeken e ilo "soweli loje seli".
1387750	Ellos tomaron comida y vestiduras.	1836722	ona li alasa e moku e len.
1396944	La muerte del rey provocó una guerra.	1790964	jan lawa li moli. ni li kama e utala.
1411181	Tom no ha cambiado.	1792615	jan Ton li ante ala.
1419080	Él es alto.	1725069	ona li suli.
1427351	Limpia la pieza.	618845	o pona e tomo!
1432391	Ella se sube arriba de la roca.	1121344	ona li tawa sewi kiwen.
1482897	La comida es buena.	1120804	moku li pona.
1483935	Quiero ir a la ciudad.	1022193	mi wile tawa ma tomo.
1490423	Todos nosotros somos felices.	1720731	mi ali li pilin pona.
1546442	Como fruta.	657705	mi moku e kili.
1546443	La gente es buena.	1120807	jan li pona.
1546445	Soy bueno.	1120791	mi pona.
1593504	Ella tiene una cara bonita.	1795021	sinpin ona li pona lukin.
1612243	¿Usted es americano o francés?	1723442	sina jan Mewika anu jan Kanse?
1621818	Este coche ha sido hecho en Japón.	1731292	jan Nijon li pali e tomo tawa ni.
1754811	Le dijo hola a la señora.	618299	ona li toki e "toki" tawa meli.
1811080	¿Sabes hablar Toki Pona?	1892886	sina ken ala ken toki kepeken toki pona?
1829247	¡Joder! ¡No me puedo concentrar en nada con este ruido!	1790962	pakala! mi ken ala pilin tan kalama!
1840141	¿Quién te dio esto?	1839845	jan seme li pana e ni tawa sina?
1862435	El hebreo es mi lengua materna.	1893135	toki Juta li toki mama mi.
1894292	Ella solo quiere divertirse.	2302966	ona li wile musi taso.
2463902	¿Qué comiste tú?	2307504	sina moku e seme?
2734843	Soy normal.	2734991	mi sama jan pi mute mute.
3115492	¿Eres músico?	1843585	sina jan pi kalama musi anu seme?
3782731	Desafortunadamente no lo entiendo. Es demasiado complejo para mí.	2970567	toki ni li kama suli ala tawa mi. ni li ike tawa mi.
3783129	Ellos son humanos.	3783132	ona mute li jan.
4096429	Todos piensan que me estoy volviendo loco.	4091908	jan ali li pilin e ni: mi kama nasa.
4096440	Gente de todo el mundo habla inglés.	4061843	jan pi ma ali li kepeken e toki Inli.
4096444	El calor del sol calienta mi casa.	1120896	seli suno li seli e tomo mi.
4371684	Tom entró en la habitación.	3005350	jan Ton li tawa insa tomo.
4485579	Tu cabello es bonito.	4485555	linja sina li pona lukin.
3666295	No tengo hijos.	4485590	mi jo ala e jan lili.
4486079	¿Puedes usar toki pona?	4384852	sina ken ala ken kepeken e toki pona?
1552872	Espera tu turno.	4487367	o awen e tawa sina.
4487481	¿Vas a usar eso?	4487395	sina pali kepeken ni anu seme?
4487713	Los niños no pueden tomar vino.	4487352	jan lili li ken ala moku e telo nasa.
2257145	Mi hermana es una cantante famosa.	4489153	jan sama mi li jan suli pi kalama musi.
4489160	Mi hermano es un cantante famoso.	4489153	jan sama mi li jan suli pi kalama musi.
603697	Un, dos, tres, cuatro, cinco, seis, siete, ocho, nueve, diez.	640550	wan, tu, tu wan, tu tu, luka, luka wan, luka tu, luka tu wan, luka tu tu, luka luka.
4548686	¡Los ángeles llorarán por ti!	4549501	waso sewi li pana e telo oko tan sina.
4548668	¿Quieres trabajar aquí?	4549512	sina wile ala wile pali lon ni?
4548668	¿Quieres trabajar aquí?	4549514	sina wile pali lon ni anu seme?
4549590	No comas demasiados dulces.	4549633	o moku ala e suwi mute.
4549589	"¿Busca algo?" "No, solo estoy viendo."	4549642	"sina lukin jo e ijo anu seme?" "mi lukin jo ala li lukin taso."
4548688	Soy una mujer de treinta y cuatro años.	4549656	mi meli li jo tenpo sike mute luka luka tu tu.
4548638	Si tuviera dinero, te lo daría.	4549671	mi jo e mani la mi pana e ona tawa sina.
4548627	Quiero hablar de una cosa con vuestra madre.	4549681	mi wile toki tawa mama meli sina.
4550093	Escucha mis palabras.	4550359	o kute e nimi mi.
4550018	Nadie quiere morir.	4550423	jan ala li wile moli.
4550013	Él no es tan guapo como Tom.	4550538	jan Ton li pona lukin mute. ona li pona lukin lili.
4550011	Ellos tienen diferentes prioridades.	4550569	ona mute li wile ala e ijo sama.
4550005	Tom y Mary tienen tres hijos y una hija.	4550869	jan Ton en jan Mali li jo e mije lili tu wan e meli lili wan.
4551451	¿Me siento joven?	4552577	mi pilin ala pilin lili?
4551451	¿Me siento joven?	4552578	mi pilin sama jan pi sike lili anu seme?
4558755	¿Quién tiene las llaves?	4563294	jan seme li jo e ilo open?
1061016	¿Hay alguien aquí?	4563304	jan li lon ala lon ni?
4566614	Alguien diga algo.	4566867	jan o toki e ijo.
4567245	¡Gracias por las respuestas!	4567504	toki sina li pona tawa mi. pona!
4570186	Reconozco mi error.	4571041	mi pilin e ni: mi pali e ijo ike.
4572393	¿Conoces a algún doctor que hable japonés?	4573310	sina sona e jan pi pona sijelo la ona li sona ala sona e toki Nijon?
4576818	¿Por qué soy agnóstico?	4577910	jan sewi li lon ala lon? mi sona ala e ni tan seme?
4577017	Necesito comprar algo.	4577918	mi wile kama jo e ijo lon esun.
981655	Los puntos cardinales son cuatro: norte, sur, este y oeste.	4590260	pini ma lawa li tu tu li ni: open pi nasin suno en pini pi nasin suno en poka pilin pi nasin suno en poka lawa pi nasin suno.
4624694	Nuestros hijos necesitan algo que hacer.	4625551	jan lili pi mi mute li wile pali e ijo.
342277	Ella es admirada por sus amigos.	4630171	ona li pona mute tawa jan pona ona.
3098094	María es guapa.	4647212	jan Mewi li pona lukin.
1180002	No habéis estado nunca en Europa, ¿verdad?	4648429	tenpo ala la sina mute li tawa ma Elopa anu seme?
4650042	Que Dios nos ayude.	4651173	sewi o pana e pona tawa mi.
928545	¡Jesús!	4656943	jan Isa a!
2127824	¡Termina tu trabajo!	4673348	o pini e pali sina!
4486079	¿Puedes usar toki pona?	4709411	sina ken kepeken toki pona anu seme?
1442663	Bill ha encendido la tele.	4754567	jan Pilu li open e ilo pi sitelen tawa.
1590208	Por favor muéstrame dónde estoy en el mapa.	4754930	o pana e sona ni tawa mi kepeken sitelen ma: mi lon seme?
1827559	El dolor compartido es medio dolor.	4763191	sina toki e pilin ike sina tawa jan, la pilin ike sina li wawa ala.
1384624	¿De quién es este coche?	4799785	ni li tomo tawa pi jan seme?
3377771	Somos una familia de cinco personas.	4857501	mi mute li kulupu mama pi jan luka.
3377771	Somos una familia de cinco personas.	4857508	mi mute li kulupu mama pi jan tu tu wan.
4960175	La muerte carece de sensibilidad, todo lo que carece de sensibilidad es nada para nosotros, la muerte es nada para nosotros.	4960172	moli li pilin ala la ijo li pilin ala tawa mi mute la ni li ala.
2102113	No quiero pelear.	2796682	mi wile ala utala.
5134469	Anoté su número en un trozo de papel.	5075336	mi sitelen e nanpa pi ilo toki ona lon lipu lili.
992515	Mira mi coche nuevo.	5184904	o lukin e tomo tawa sin mi.
1706313	¿De dónde viene esto, hija mía?	5227016	meli lili mi o, ni li kama tan seme?
445833	¿Este libro es de Takeo?	5227019	jan Takejo li jo ala jo e lipu ni?
451631	Dime algo importante que hayas aprendido este fin de semana.	5227021	pini pi tenpo esun ni la sina kama sona e ijo suli seme?
475568	Cuando se empieza a soñar, la respiración se vuelve irregular y menos profunda.	5227025	jan li open pali e sitelen lape la kama kon li kama sama ala li kama wawa lili.
3666334	Tom se moría.	3080343	jan Ton li kama moli.
1135721	Con su muerte culmina una etapa de nuestra historia.	5227030	moli ona la wan pi tenpo pi mi mute li pini.
1705622	Cada palabra tuya es mentira.	5227031	nimi sina ali li lon ala.
1713533	Le pedí que viniera conmigo, y él estuvo de acuerdo.	5227034	mi toki wile e ni tawa ona: ona li kama poka mi. ni li pona tawa ona.
1555807	Tom nunca ha estado enfermo.	5227036	tenpo ala la jan Ton li kama ike sijelo.
453622	John sacó una llave de su bolsillo.	5227038	jan San li kama jo e ilo open tan poki len ona.
477147	Finalmente estaba frente a su enemigo.	5227041	tenpo suli li tawa la ona li lon sinpin pi jan ike.
1713333	Necesito un bolso en que llevarlo.	5227044	mi wile e poki tawa ni: mi tawa e ona.
1127400	Estoy listo para irme.	5227046	tenpo ni la mi ken tawa.
1127400	Estoy listo para irme.	5227047	mi ken tawa.
1687173	Grecia sufre una crisis económica y social.	5232117	ma Elena li pakala mani li pakala jan.
750147	La Tierra es redonda.	4537449	ma li sike.
1290909	La tierra es redonda.	4537449	ma li sike.
861928	No sé por qué.	5535804	mi sona ala e tan.
5455490	No sé la causa.	5535804	mi sona ala e tan.
1009180	Ella estudia a los cocodrilos.	5538436	ona li kama sona e akesi.
4650042	Que Dios nos ayude.	6041523	mama sewi o pana e pona tawa mi mute.
5995345	Ella usó su mano para proteger sus ojos de la luz del sol.	5995355	ona li selo e oko tan suno kepeken luka.
5995351	No me gusta sentarme tan cerca de la pantalla.	5995358	ni li ike tawa mi: mi awen lon sinpin lili sitelen.
5995353	La joven quería ser una estrella de cine.	5995362	meli li wile suli lon pali pi sitelen tawa.
6058773	Quiero ir a Corea del Norte.	6058769	mi wile tawa ma Soson.
6145366	El locutor puede hablar rápidamente.	6145365	jan toki li ken toki mute kepeken tenpo pi lili a.
2160424	¡Entra adentro, hace frío ahí fuera!	6446812	ni li lete lon ma. o tawa lon tomo.
4573079	¡Liberen a Palestina!	4655528	o pana e ken ale tawa ma Pilisin!
1100804	Ella me explicó lo ocurrido con todo lujo de detalles.	6707312	ona li toki e kama tawa mi e wan ale.
4035638	Puedo verlos.	6708599	mi ken lukin e ona.
1941361	Este pescado es bueno.	6712129	kala ni li pona.
1243170	Los vasos descartables están prohibidos en la escuela.	6712280	tomo sona la jan li ken ala kepeken poki pi tenpo wan taso.
2178702	Los caballos corren en el campo verde.	6719385	soweli tawa li tawa wawa lon ma laso.
5834068	Ellos se gobiernan a sí mismos.	6724576	ona li lawa e ona sama.
6714442	Vivimos en una hermosa ciudad.	6724681	mi mute li awen lon ma tomo pi pona lukin.
3564769	Necesito que Tom vea esto.	6769007	mi wile e ni: jan Ton li lukin lili e ona.
2414947	Tom aprendió a nadar hace dos años.	6844654	sike suno pini tu la jan Ton li kama sona e tawa telo.
356071	El dolor ha empeorado mucho.	6596934	pilin pakala li kama ike pi mute sin.
462475	Se habla español en veinte países.	6844693	jan li toki lon toki Epanja lon ma mute.
2711475	Tom se lo estaba pasando bien.	6850044	jan Ton li pilin pona.
1249538	Él aprende rápido.	6851194	ona li kama sona lon tenpo lili.
816964	Él aprende rápidamente.	6851194	ona li kama sona lon tenpo lili.
3298737	Dije que Tom lucía cansado.	6853611	mi toki e ni: tawa lukin la jan Ton li wile lape.
436104	¿En qué puedo ayudarle?	6856719	nasin seme la mi ken pana e pona tawa sina?
1518438	¡Ve!	6862336	o tawa!
1313046	Tom sostiene que puede degustar la diferencia entre estas dos marcas de sal.	6862342	jan Ton li toki wawa e ni: kepeken uta la ona li ken pilin e ante lon ko sin walo tu ni.
332227	Bienvenida.	6864637	kama pona.
375830	¡Cuidado!	6864640	o lukin!
568101	Pregúntaselo.	6864642	o toki e ni tawa ona.
576611	Síguele.	5930007	o kute e ona.
578818	¡Perfecto!	6864630	pona a!
580879	Tráemelo.	6578447	o tawa e ona tawa mi.
583494	¡Despierta!	2277738	o pini lape!
588045	Mírame.	6864648	o lukin e mi.
592250	¿Recuerdas?	6864651	sina awen sona anu seme?
602059	Volví.	4430542	mi kama sin.
622281	Bésame.	6767008	o uta e mi.
623622	¡Piérdete!	6864657	o weka!
625796	Dímelo.	6171425	o toki e ona tawa mi.
627825	Vámonos.	6864661	mi o tawa.
630513	Achícalo.	6628673	o lili e ona.
630770	Sal.	6449843	o weka.
630772	Salí.	6864663	mi weka.
630772	Salí.	6864664	mi tawa.
630776	Salid.	6301707	o tawa.
630776	Salid.	6449843	o weka.
642197	¿Morirá?	6864667	ona li moli ala moli lon tenpo kama?
645779	Hagámoslo.	6864669	mi o pali e ona.
646136	Voy.	6864670	mi kama.
646136	Voy.	6864664	mi tawa.
687855	¡Anótalo!	6864672	o sitelen e ona!
697489	¡Estudia!	6741119	o kama sona!
699431	¡Lávate!	6864675	o telo!
718760	Comencemos.	6864677	mi o open.
723232	¡Ciérrala!	3080385	o pini!
723333	Espérate.	6589401	o awen.
725652	Juguemos.	6864680	mi o musi.
1550980	¿Hablas español?	6864681	sina toki ala toki kepeken toki Epanja?
2011085	Hablo español.	6864683	mi toki kepeken toki Epanja.
1562985	Lo lamento, el vuelo ya está lleno.	6872608	mi pilin ike tan ni: insa ale pi tomo tawa kon li kama jo e jan mute.
6618088	Te invito a un café.	6907317	mi wile pana e telo wawa tawa sina.
3027567	¿Este pasaporte es mío?	6916621	lipu wawa ni pi jan tawa li ijo mi anu seme?
4505784	Escribir es útil.	6930687	sitelen li pona.
867419	Hay varios volcanes activos en Japón.	6932637	nena seli open mute li lon ma Nijon.
639355	Puedo amar.	6962660	mi ken olin.
5137666	Tomás y María fueron al mismo colegio.	6963098	jan Ton en jan Mewi li tawa tomo sona sama.
4527234	¿Dónde está la comida?	7043137	moku li lon seme?
1551083	Eso es lo que dice la gente.	7725115	ni li toki jan.
5964560	Tienes que estar en la estación de trenes antes de las cinco.	7742070	sina wile lon tomo pi tomo tawa lon kama pi tenpo lili nanpa luka pi tenpo suno.
7773085	Debemos descansar.	4690773	mi mute li wile lape.
7773086	te lastimaron?	4774121	ona mute li pakala e sina anu seme?
5144714	¿Puedes arrojar alguna luz sobre esto?	7775357	sina ken ala ken pana e sona lon ni?
2213961	¿Quieres un sándwich de pavo?	7775358	sina wile ala wile e waso lon pan?
7011960	La ciudad fue abandonada.	7775359	jan li weka e ma tomo.
1140630	Divorciémonos.	7775361	mi mute o tu.
7782239	Tom estuvo ocupado?	4950172	jan Ton li pali ala pali e ijo lon tenpo pini ni?
1246472	Había nevado.	7782417	tenpo pini la, ko lete li kama tan sewi.
750144	Él me dio algo de dinero.	7782414	tenpo pini la, ona li pana e mani tawa mi.
1468314	¿Me escuchás bien ahora?	4675722	sina ken ala ken kute e mi?
1563772	Es hora de que hagan las paces.	7783310	tenpo ni la, mi mute o utala ala.
1623687	¿Quién es este extraño que ha comenzado a conquistar mi corazón?	7783315	mi kama olin e jan seme?
1245020	Pronto me nombrarán embajador.	7783317	tenpo kama lili la, mi jan toki pi ma ante.
1316954	¿Qué te gusta más, las manzanas o los plátanos?	7783386	kili sike loje anu kili linja jelo li pona mute tawa sina?
1449492	¡Estás chiflado!	2320738	sina nasa!
6804921	Tengo un teléfono en el despacho.	7783389	mi jo e toki ilo lon tomo pali.
874175	Un animal grande se escapó del zoo.	7783417	soweli suli li tawa weka tan tomo soweli.
931571	Japón y Corea del Sur son países limítrofes.	7783441	ma Nijon en ma Anku li ma poka.
2744201	Después de la muerte de Tom, nadie estaba dispuesto a cuidar a sus perros.	7783456	jan Ton li moli. jan ala li wile jo e soweli pi jan Ton.
1633550	Él abandonó su pueblo natal para nunca volver.	7783457	ona li weka e ma tomo mama. ona li kama sin tawa ma tomo mama lon tenpo ala.
1937819	La carne quedó cruda.	7783458	soweli li lete.
3326696	Por fin se acabó todo, ahora podemos descansar.	7783459	ali li pini. tenpo ni la, mi mute li ken lape.
1599579	Él siempre le lleva regalos a su mujer.	7783460	tenpo ali la, ona li pana e ijo pona tawa meli ona.
1393837	Las hojas de lechuga se marchitan debido al fenómeno de la ósmosis.	7783461	lipu kala li kama jo ala e telo.
435031	Él lava el coche.	2302010	ona li telo e tomo tawa.
638546	No sé dónde esperarla.	7783464	seme la mi ken awen lon weka ona? mi sona ala.
609721	¿Me puedo comer este pastel?	7783468	mi ken ala ken moku e suwi ni?
1999968	Él no es un tipo muy meticuloso.	7783478	ijo lili li lili tawa ona.
1503624	Los movimientos de este robot son desastrosos.	7783487	ilo pi sijelo jan li tawa li pakala.
1527126	Todo tiene su "pero" y su "si".	7783491	ali li jo e nimi taso e nimi ken.
1468345	La lengua es la pintura de nuestras ideas.	7783493	toki li kule e sona.
634306	Todo tipo de personas viven en Tokio.	7783498	jan pi kulupu ali li lon ma tomo Tokijo.
558603	Todos estos libros son míos.	7783501	mi jo e ali pi lipu ni.
3274268	Quiero hacer una fiesta de cumpleaños para mi madre, pero no tengo dinero.	7783504	mama meli mi li sike e suno. mi wile pali e musi kulupu tawa ona. taso mi jo e mani ala.
1628196	¡Ayuda, por favor!	7783507	o pona a!
1477174	Nada nos puede separar más que la muerte.	7783513	moli taso li ken tu e mi mute.
1336647	Ellos nos conocen.	7783519	ona mute li sona e mi mute.
1671143	Es la torre más alta de Japón.	7783528	ni li tomo palisa pi suli mute ali lon ma Nijon.
2866022	Estoy cansado de tanta payasada.	7783529	toki nasa li lape e mi.
4423688	Mi mamá está enojada.	6617907	mama meli mi li pilin utala.
4606482	¡Despierten, condenados de la tierra!	7783531	jan ma pi mani ala, o lape ala a!
1828477	Solo puedes cruzar la calle cuando el semáforo está en verde.	7783532	suno li laso taso, la sina ken tawa lon nasin.
2169605	Queremos nuestro dinero.	7783533	mi mute li wile e mani pi mi mute.
1977397	Totoro se hace amigo de todos.	7783534	jan ali li jan pona pi jan Totolo.
949045	Tengo un coche rojo nuevo.	7783535	mi jo e tomo tawa sin pi kule loje.
3302079	Vi ese partido de principio a fin.	7783536	tenpo pini la, mi lukin e ni tan open tawa pini.
3201332	Nunca había visto a mi profesor de física tan asustado.	7783537	jan sona mi pi ijo tawa li lukin e ni: ona li wile ala moli.
748628	Desmantelé la radio para repararla.	7783538	mi ike e ilo kalama tan ni: mi wile pona e ona.
1617948	¡Qué bellas piernas!	7784699	noka ni li pona lukin a!
463117	Estos son regalos.	7784704	ni li ijo pona.
1286823	¡No hay quien te aguante!	7784706	sina ike tawa jan ali!
1683501	No puedo vivir en el agua. No soy un pez.	7784713	lon mi ken ala lon telo. mi lon ala e kala.
1518616	Cerrá los ojos y contá hasta diez.	7784720	o pini e sike lukin sina. o nanpa tawa luka luka.
777863	Necesito tu pasaporte y tres fotos.	7784729	mi wile e lipu sina pi tawa ma e sitelen tu wan.
1066941	Micro es una abreviación de microcomputadora.	7784767	toki Inlia la nimi "Micro" li selo lili pi nimi "Microcomputer".
1281818	Su libro está repleto de utopías.	7784771	lipu ni li jo e toki pi ma pona mute.
2944811	Antes ella lo detestaba.	7784774	tenpo pini la, jan mije li ike tawa jan meli.
1270606	Los egipcios fueron uno de los primeros pueblos en utilizar el papiro para sus escritos.	7784791	ken la, jan pi ma Masu li jan nanpa wan pi sitelen toki kepeken lipu.
398331	Es tiempo de irme.	7784793	tenpo ni la, mi wile tawa.
3626691	Yo tengo que ir al baño.	7784832	mi wile pana e ko jaki.
3626691	Yo tengo que ir al baño.	4710016	mi wile pana e telo jelo.
2038308	A Tom le gusta cantar.	7784833	kalama musi uta li pona tawa jan Ton.
863681	¿Qué porcentaje de gente habla tres idiomas?	7784834	jan pi nanpa seme li sona e toki tu wan?
1332070	Todo hombre es un cadáver en potencia.	7784837	jan ali li jan moli lon tenpo kama.
502067	Paz y Amor.	7788070	utala ala en olin.
1556154	Tom es sociólogo.	7788071	jan Ton li jan sona pi kulupu jan.
1242656	¿Tú le hablas a tus plantas?	7788072	sina toki ala toki tawa kasi sina?
5854756	Ella es una completa golfa.	7788073	ona li meli ike mute.
1292064	Me gustaría hablar con Johano.	7788075	mi wile toki tawa jan Sokano.
375905	No puedes decir "no".	7788076	sina ken ala toki e nimi ala.
2169636	Queremos saber.	7788077	mi mute li wile sona.
1901101	Esta es tuya.	7788078	ni li ijo sina.
3675426	Detesto trabajar.	7788079	pali li ike tawa mi.
1279146	Este animal está adaptado a los ambientes de agua dulce.	7788080	soweli ni li lon telo pi moku pona.
858863	Tiene que haber salido.	7788081	tenpo pini la, ona li tawa.
543568	Estábamos muy cansados.	7789249	tenpo pini la, mi mute li wile lape.
2177164	No estoy escuchando.	4692424	mi kute ala.
1167592	Él murió por el frío anoche.	7789250	tenpo pimeja pini la, lete li moli e ona.
7789274	Tom no entiende la broma.	5992910	jan Ton li sona ala e musi pi toki musi.
7789279	Déjame ir primero.	5176325	o ken e ni: mi tawa nanpa wan.
1646180	Te huelen los pies.	7789287	noka sina li pana e kon jaki.
7411022	¿No vamos a Grecia?	7789288	mi mute li tawa ala tawa ma Elena?
6399896	Ella no tiene sesos.	7789289	ona li ken ala sona.
7576004	Me gusta mucho Hokkaido.	7789290	ma tomo Okato li pona mute tawa mi.
940089	Uno es rojo y el otro es blanco.	7789291	ijo wan li loje. ijo tu li walo.
631760	El que a hierro mata a hierro muere.	7789292	jan li moli kepeken ilo utala li kama moli tan ilo utala.
449754	Ella se casó con un rico comerciante.	7789293	tenpo pini la, ona en mije esun pi mani mute li wan.
816284	Las pinturas de Picasso me parecen extrañas.	7789294	sitelen kule pi jan Pikaso li nasa tawa mi.
3564973	Tráeme mi taza.	7789295	o pana e poki moku mi tawa mi.
1266451	El niño está allí.	7789296	jan lili li lon ni.
1279994	Yo crío ganado.	7789297	mi lawa e soweli.
1674224	Te voy a dejar mañana.	7789298	tenpo suno kama ni la, mi tawa weka tan sina.
5283153	Se pintaron las uñas de los pies.	7789300	ona mute li kule e kiwen pi palisa noka lili.
2169576	Quiero lo que es mío.	7789305	mi wile e ijo mi.
2185121	¿Has comprado zumo?	7790103	tenpo pini la, sina esun ala esun e telo kili?
5110858	No me des la lata.	7790126	o ike ala tawa mi.
