3735404	Everybody looked up.	5647684	Tuminingaha toinsanan.
2282341	Look up to me.	5647685	Antangai oku po.
239424	You look down.	5647688	Lumuung ko'.
2237190	Tom looked down.	5647689	Luminuung i Tom.
252527	I studied for more than two hours, and afterward I went to bed.	5652451	Mininsingilo oku do lobi po mantad ko duo jaam. Kalapas dilo, minoi oku odop.
4501129	No tickets are needed.	5652520	Au tagal tikit.
2270145	What time do you have dinner?	5718907	Jaam kopiro mangakan dougotuong?
44961	The garden was surrounded by a wooden fence.	5718912	Haro tansar do kayu id posorili do tumo.
4306295	The children are playing under the lime tree.	5718932	Mamain i tangaanak id siriba do guas toonsom.
681438	Addition and subtraction are functions of mathematics.	5718950	Fungsi nopo poruhangan om pokurian nga pongintaban.
1864717	I have been living in Rio de Janeiro for four years.	5718960	Nokoumbal oku poingiyon hilo'd Rio de Janerio solinaid apat toun.
282083	There's more ways than one to kill a cat.	5718964	Haro lobi po mantad ko songulun mamatai do tungau.
282083	There's more ways than one to kill a cat.	5718971	Haro lobi po mantad ko tiso mamatai do tungau.
56406	Put the garbage outside.	5718985	Poopio ilo rinomos id labus.
276541	Everyone seeks happiness.	5719033	Mogihum toinsanan do kataadan.
47039	We also went to the temple.	5719034	Minoi tokou hilo'd walai sasambayang.
2740411	There are no pyramids in Europe.	5719050	Ingaa no piramid hilo'd pomogunan do Eropah.
2111479	Take this.	5719058	Onuo ti.
903046	Her health has been declining these past few months.	5719060	Amu osonong kolidasan tinan disido id piipiro tulan.
4008795	Did you bring the book?	5719064	Mongowit ko' do buuk?
3172239	Do you think Tom is ugly?	5719067	Araat o kokitanan di Tom?
2315269	I don't have any nice clothes.	5719082	Ingaa nopo do nunu pakayan ku.
454466	Is Mrs. Smith an English teacher?	5719088	I Andi Smith songulun mongigia boros Inggilis?
69841	How long did you stay in Canada?	5719107	Songkuro linaid dot iyonon nu hilo'd Kanada?
68497	Have a look at that picture.	5719151	Antangai gambar lo.
29071	I have a friend whose father is a famous pianist.	5719164	I tapa di tambalut ku nopo nga songulun pamain piano do nointutunan.
2285065	I'm going to find you wherever you are and kill you.	5719201	Ihumon ku ndo diya id hinonggo-nonggo nopo om patayon tiya.
20454	He asked me to wait there until he came back.	5719218	Suminunud iyau doho moi pagandad hilo gisom do gulion dau.
749341	I stopped by a bookstore and bought and interesting book.	5750167	Saya dihentikan oleh kedai buku dan dibeli dan buku yang menarik.
1774049	There's a lot to do.	5768213	Ogumu moti maan dilo.
315688	She was born and brought up in Osaka.	5768214	Nosusu isido om guminayo nondo hilo'd Osaka.
27962	The doctor advised my father to give up smoking.	5768224	Mamason i dukutur kumaa di tama ku do tingkodon momungkus.
3731595	How do you stop this?	5768227	Poingkuro ma popotingkod diti?
2020552	I'm not sure what I was thinking.	5768228	Uka nunu pomusarahan ku?
35058	Harry is only 40.	5768231	Ih Harry nopo nga 40 toun nodi.
1905861	He beat the shit out of me.	5768234	Bobogon dau ilo hodi mantad doho.
313437	She was a Smith before her marriage.	5768236	Ngaran nopo sampaganakan dau nga Smith tintod do pisasawaan dau.
3472432	Tom may have taken the wrong train.	5768246	Nakasalu i Tom suminakai do kuritapui.
408046	Let's see who wins!	5768249	Intangai po isai nopo kamanang!
2643277	Tom didn't let Mary kiss him.	5768252	Au i Tom pinotungubon di Mary.
4666500	Don't let Tom use my car.	5775099	Kada pologoso i Tom sakayon do korita ku.
297483	He showed me how to make a cake.	5775286	Minonuduk iyau doho poingkuro ma pomomonsoi do kiik.
37542	Which house did you live in?	5775291	Hombo tiso walai kinoiyonon nu?
1140813	Tom wrote the report.	5775292	Minonurat i Tom do laporan.
266703	After he had done his homework, he watched TV.	5775299	Kopongo do karaja sikul dau, mintong iyau do TV.
398543	I do my homework after school.	5775306	Momonsoi oku do karaja sikul ku katalib muli mantad id sikul.
289000	He rose from his chair to welcome me.	5775313	Minangangat iyau do tirikohonon dau mooi do porikoton montok doho.
1695	Mathematics is the part of science you could continue to do if you woke up tomorrow and discovered the universe was gone.	5777685	Matomatik nopo nga boogian sains dot tumilombus soira nopo koposik id suab nga natagakan diri posorili do sompomogunan.
3442587	You like swimming.	5777687	Orohian ko' do kumaau.
2214296	Am I fat?	5777688	Olombon oku toi?
238773	The blood test is normal.	5777693	Kootusan nopo raha nga onomal.
3912749	I really liked them.	5777696	Orohian oku kopio diolo.
4431239	That's extra.	5777699	Ilo nopo nga poimbagu.
1886633	Where did Tom go?	5777701	Hinonggo tongoyon di Tom?
637314	I like to decorate my room with flowers.	5777709	Orohian oku do polumison bilik ku maya do tusak bunga.
250696	My brother smokes a great deal.	5777714	Adalaan i tabang ku do momungkus.
1504414	I have no time for games.	5777717	Ingga no maso' ku do pamainan.
2243589	They're always fighting.	5777741	Asaru iyolo mogisaap.
750905	Haven't seen you for a while, and you've grown taller!	5777742	Alaid au nokopiruba kito, gugumayo ko nodi.
5148450	What time do you think Tom will be back?	5777747	Jaam kopiro muli di Tom do tiinu?
3409348	Tom tried to sneak out of the office without being seen.	5777752	Umbalan i Tom moi idu mantad id tupis om au pinologos dau pokitonon do wokon.
256949	I tried to learn the melody by heart.	5777756	Umbalan ku pohondomon dilo loyuk.
242071	What we need now is a rest.	5777759	Nunu nopo pokionuan ku nga mundorong.
2891096	Do you know what Tom is doing?	5777762	Nokoilo ko' di nunu maan di Tom?
430442	What horrible weather.	5777764	Araat tawan.
3428403	You haven't touched your food.	5777766	Amu po mangakan ko dilo taakanon nu.
1399479	Burj Khalifa is currently the tallest skyscraper in the world.	5777768	Burj Khalifa nopo nga walai kagagampot tawan dot akawas hiti'd sompomogunan.
2007155	Today I'm working from home.	5777774	Kumaraja oku hiti'd walai ku baino.
434640	Does anyone speak English?	5777776	Haro tulun dot koilo momboros do Inggilis?
40056	Will you kindly let me have a look at it?	5777777	Mintong ko po dilo hodi do toruhai?
3050551	Tom lay on his bed and cried softly into his pillow.	5777790	Lumii i Tom id toodopon dau om mihad-ihad id timpak do bantal dau.
2214146	We went to a movie.	5777792	Minoi yahai intong do wayang.
23038	We can get along very well without you.	5777796	Osonong yahai kopio miampai do aiso iya.
1919	Yes, it happens from time to time.	5777824	Oh, dau-dau no kaantakan diri.
4980152	I thought it was awesome.	5777918	Andasan ku daa om osonong ilo.
3908709	Maybe you should tell her.	5777926	Apatut no popoilo' ko disido matu.
1844201	Get that thing off of me.	5777927	Insodu oku mantad dilo hodi.
39773	Don't get upset about small things. Try to think of things like a rich person who can afford not to argue.	5777932	Kada kokuai no hal diri. Soroho po toruhai dot poingkaa tulun nopo topuhawang nga amu sumongkiwal.
4271909	I don't think I've heard that word in a long time.	5777934	Alaid matu au nokorongou diri boros dot sorohon ku.
31574	It's about time to start.	5778033	Otimpuun nodi maso'.
321005	A trouble arose after school.	5778042	Nokoimbulai no kobolingkangan kalapas do sikul.
2846159	Don't eat inside the laboratory.	5778130	Pogoduhan do mangakan id suang do bilik pomoriksaan.
35835	Will you marry me?	5780652	Kotorimo ko' nangku doho manansawo?
2163844	Go ahead! Don't be shy!	5780653	Umbalai po! Kada koikum-ikumai!
25772	Please write with a pencil.	5780655	Posurato maya do pinsil.
841830	After you get to the traffic lights, turn right.	5780657	Katalib ko nopo lampung torapik nga ongoi woyo id wanan.
569018	The spider web glistened in the morning dew.	5780659	Nayapasan do walai korut o bolobou dongkosuabon.
259153	I was born in the year that Grandfather died.	5780666	Nosusu oku id tontok toun kinapatayan di taki ku.
2261183	Can you help Tom?	5780667	Milo' ko moi uhup di Tom?
241641	You had better do it right now.	5780673	Mogot no daa maan do baino.
285228	His advice encouraged me to try it again.	5780675	Boros dau lo minonuduk doho umbalan po kawagu.
3023611	Tom is reading a magazine.	5780677	Mambasa i Tom do majala'.
1661156	I am laughing at you.	5780680	Koirak oku kaka diya.
2614980	What do you love about me?	5780681	Nunu nopo lisih nu doho?
732592	The bride is American with Polish origins.	5780684	Ih sawo tondu nopo nga songulun Amorika mantad do taki todu di tinaru Poland.
1067130	She was beautiful when she was young.	5780686	Olumis isido id tontok do komulakan disido.
431108	But I don't know how to cook kebabs!	5780698	Nga au oku koilo poingkuro ma mongonsok do kebab!
5758070	We know all this.	5780724	Nokoilo yahai dilo ngawi.
66840	Ann is a little girl.	5780726	Ih Ann nopo nga songulun tanak tondu.
3161912	Tom is ready to help.	5780727	Nokosodia i Tom do monguhup.
3860110	The collapse of the new concrete platform killed four workers.	5780729	Kinorotuon nopo palampag watu wagu nga mamatai apat tulun pakaraja.
767698	Why are you angry with me?	5780730	Nokuro tu tumogod ko doho?
5690331	Tom is apparently a truck driver.	5780732	Pakarajaan di Tom nopo dinondo nga papapanau luri.
2361517	I don't think you really understand.	5780736	Au ko kopio orotian kangku daa.
3819099	Tom didn't know where to burn the trash.	5780738	Au i Tom koilo hombo potutudan do rinomos.
278546	My brother watches television.	5780744	Mintong i tobpinai kusai ku do TV.
3723347	I don't know how to be happy anymore.	5780745	Au oku koilo songkuro daa kataadan diri.
242280	I am right for once.	5780811	Insan nopo katapatan ku.
898529	I never feed my dog raw meat.	5780813	Ingaa nopo pinapaakan oku do tasu ku do daging taata.
254799	I will give it a try.	5780814	Umbalan ku ndo dilo.
240513	Don't speak with your mouth full.	5780815	Kada boroso miampai do noponu taakanon id suang kabang nu.
23676	Could you carry my bags for me?	5780816	Milo ko' mangangat do biig ku?
464348	We are from France.	5780819	Mantad yahai hilo'd Poransis.
3151253	Tom gave me his address.	5780930	Minanahak i Tom doho disio kinoiyonon.
1749420	That's not even the worst part.	5780934	Ilo okon ko boogian dot araat.
61279	I would rather throw the money away than give it to him.	5780938	Asaga oku do pataaman do tusin mantad ko manahak dau.
1064475	What does this sentence mean?	5780940	Nunu komoyon ayat ti?
2245030	Call the police.	5780943	Lohowo pulis.
2645805	Tom needs your support.	5780951	Manu i Tom do sokodungon nu.
2047626	You'd better be careful.	5780953	Mogot daa intang-intangan nu.
305403	They have twelve children.	5780958	Hopod om duo no kitanak diolo.
322719	In order to stay awake, I may have to drink more coffee.	5780964	Ih tomodon ku nopo au koodop nga ogumu do inumon kupi.
72148	Here comes the train!	5780965	Nokorikot no koritapui!
2797126	I played trumpet in our high school band.	5780974	Nokoumbal oku pinopouni do torumpit id tontok posikulan do tiim.
430064	There were two cakes.	5780980	Haro duo kiik.
1868398	Tom cut school.	5781011	Mogidu i Tom mantad do sikul.
1118673	My cat barks.	5781022	Mongiau o tungau ku.
400216	I don't know anything about their plan.	5781035	Au oku oilaan nunu nopo pomomonsoyon diolo.
56209	This is my business address.	5781039	Iti no kinoiyonon pogindopuan ku.
237798	The army was advancing in the wrong direction.	5781044	Nakasalu' i susumangod do wayaan.
2040079	She was almost run over by a car.	5781066	Oruhai po tohubon isido do korita di tiinu.
65620	It is against my principles to tell a lie.	5781070	Iti nopo nga kababakan do undang-undang ku nung poiloon ku do tudut.
71601	I will help you in selecting the best from these clothes.	5781079	Uhupan tiya ndo pilion pakayan dot osonong.
1534343	Eat your soup, John!	5781097	Akan no waig rinapa nu oi John!
3904949	You underestimated me.	5781105	Pologoson nu doho.
2870986	He arrested me.	5781117	Guminakom iyau doho.
1037155	The bus has a ten-minute delay.	5781149	Aadahan ilo bas do hopod minit.
4526638	The hardest part of learning a language is knowing the vocabulary by heart.	5781189	Ih apagon nopo pisingilaan do boros nga popohondom do piipiro boros-boros.
2267407	It was very cold that winter.	5781201	Adalaan om osogit.
238160	The thief ran away when he saw a policeman.	5781206	Nokoidu i manakau soira nokokito iyau do pulis.
2725751	He is as strong as I am.	5781209	Agaras iyau miagal doho.
252126	I object to you going to Europe alone.	5781238	Au oku rumamit diya mongoi hilo'd Eropah songulunan.
288570	He promised me that he would come at four.	5781254	Minamatos iyau korikot id jaam kaapat.
17225	What you say is right.	5781265	Nunu nopo boros nu nga otopot.
602885	Don't forget your money.	5781282	Kada lihuai tusin nu.
16455	What prevented you from coming earlier?	5781301	Nunu kobolingkangan nu rikoton hiti'd tosopung?
3200451	Tell me how you're feeling.	5781303	Sunudai oku do topurimanan nu.
2731970	We drowned in the ocean.	5781327	Londodon dahai id saralom do rahat.
1881	I read a book while eating.	5781369	Mambasa oku do buuk om mangakan po.
2361117	I don't believe we've been introduced.	5781389	Au oku kotumbaya dot nointutunan dahai.
1836203	You have no right to be here.	5781415	Au ko' milo rumikot hiti.
1765137	I read the old documents.	5781425	Mambasa oku do dokumen talaid.
3819303	Stop talking about Tom.	5781437	Ula nodi boboroson kaka i Tom.
1847843	Do you know any good places to eat around here?	5781458	Nokoilo ko do hombo pangakanan dot osonong hiti posorili tiiyonon?
50353	The computer is new.	5781493	Wagu ilo kompiuto.
1028467	Tom is waiting for Mary to call.	5781500	Mangandad i Tom do tolipounan di Mary.
72459	I have expected his death for six months.	5782887	Kapatai matu iyau id onom tulan kangku daa.
5165753	I didn't know anybody there.	5782893	Au oku nokoilo do toinsanan hilo.
1095197	Tom could hear birds chirping outside his window.	5786420	Korongou i Tom do tuni tombolog id soliwan do liligaon dau.
55374	This is a green notebook.	5786455	Iti nopo nga buuk nota totomou.
44154	The beginning of the story was interesting.	5786463	Kolihis ginawo ilo potimpuunan do tangon.
322666	Let's drink to our charming hostess!	5786466	Kanou moginum miampai do pakaraja tondu tolumis tokou!
2293303	Tom never wants to see Mary again.	5786477	Au i Tom siongoi ruba di Mary nodi.
2647672	Is everybody hungry?	5786480	Louson tian toinsanan?
42134	It is of great use.	5786495	Osonong ilo kogunaan.
839732	How can something so wrong feel so right?	5786504	Nokuro tu haro nopo kisala' nga otopot nogi?
2547469	Why did you tell Tom?	5786538	Nokuro tu pinopoli ko di Tom?
1028771	Tom has a date with Mary this afternoon.	5786616	Haro timpu pinirubaan i Tom miampai di Mary dangadau diti.
256100	I was busy all day.	5789450	Atangkangau oku no monikid tadau.
51010	What did you do there?	5789544	Nunu maan nu dilo hodi?
3287338	You said you needed me to sign something.	5794126	Manu ko doho mananda longon ku dilo hodi kanu dii.
5377757	She's been looking a little green lately.	5794808	Mintong isido do totomou di tiinu.
387469	Christmas is just two weeks from now.	5794827	Haro po duo minggu do Krismas mantad baino.
311940	She got a part-time job as a typist.	5794861	Kikaraja isido dot oruhai sabaagi do mananaip.
62630	She divided the cake between the two.	5794892	Miniduo isido do kiik.
773320	I like to eat.	5794956	Orohian oku do mangakan.
1951518	I can't do that unless I have Tom's help.	5794995	Au oku milo wonsoyon dilo nga mogot daa haro uhupan di Tom.
392288	Borrow and return, then you can borrow again. Borrow and don't return, and then the borrowing gets difficult.	5795122	Pogulion ko nopo oloson nu nga milo ko oloson id kawagu. Nga nung au ko pogulion nopo oloson nu nga apagon nogindo moi olos diri.
497129	She wrote a book about birds.	5795195	Minonurat isido do buuk kaka tombolog.
3378937	Whose fault is that?	5795202	Isai nopo kasala diri?
2248741	It isn't locked.	5795230	Au nokokunsi ilo.
33811	He seated himself on the bench.	5795234	Minirikau isio id tirikohonon do sondiri.
3422006	I took a deep breath.	5795255	Paparalom oku do pinuhobo.
349838	I eat noodles.	5795266	Mangakan oku do mii.
292721	He took something out of his pocket.	5795294	Onuan iyau id suang do pakit dau.
651597	Give it back!	5795305	Pogulio!
1791290	Has he come?	5795316	Nokorikot iyau no?
954237	Please do your chores before you go out to play.	5795325	Maai po karaja nu id walai tintod do moi pamain id labus.
1675315	Whatever it is, I didn't do it.	5795358	Nunu nopo kaantakan lo nga au oku numaan dilo.
757416	Mr Ou has come to Japan to study Japanese.	5795370	Mongoi i Gundoling Ou pisingilo do boros Gipun hilo'd Gipun.
387389	I wonder if she'll recognize me after all these years.	5795390	Kosorou isido po nangku doho id piipiro toun nakatalib diti?
1017064	I'm an American citizen.	5795424	Yoho tulun Amorika.
1739479	I can teach you how to bake a pizza.	5795434	Milo' oku monuduk diya poingkuro ma momolugu do piza.
1230486	It might rain.	5795468	Rumasam matu.
2898083	Sushi is a repulsive food.	5795693	Sushi nopo nga taakanon do poporoloi ginawo.
2238769	Tom stopped everything.	5795711	Tuminingkod i Tom do ngawi.
2011841	Who would want to kill Tom?	5795716	Isai sipatai di Tom?
2375968	I know how you feel about Tom.	5797500	Nokoilo oku diya'd topurimanan kaka i Tom.
63252	Your explanation lacks concreteness.	5797504	Okuri po poiloon nu.
243795	A recent survey revealed that the population density in the metropolis was decreasing.	5797516	Tumanud ponoriukan dinondo, okuri no tulun ginumuan do poingiyon hilo'd bandar metropolis.
2431797	I'm from Estonia.	5797981	Mantad oku hilo'd Estonia.
983756	So that's why!	5797994	Oh mala'!
1886831	Was Tom alone?	5798008	Osongulun i Tom?
1866460	Your accent's good, but your pronunciation's a little bit off.	5800375	Abalantas boroson nu nga pamadawot nu au sumongkuro tosonong.
1009333	He left the room without even saying goodbye.	5801366	Sumoliwan iyau mantad do bilik miampai aiso boros "hino ko no".
2254588	The sun's glare is strong today.	5801372	Anawau kopio ilo binabang tadau baino.
3200955	Tom told Mary he was a doctor.	5801395	Pinoilo di Tom kumaa di Mary isio nopo nga dukutur.
3916095	Get us something to eat.	5801453	Ihumo taakanon montok tokou.
433502	Don't move.	5801477	Kada kogura.
866728	Maybe it's true.	5801493	Otopot matu.
2240837	We're not staying.	5801520	Au tokou miiyon hiti.
3125857	Tom has a good grasp of grammar, but is weak in spelling.	5801537	Abaal i Tom do puralanboros nga araat kopio ijaan dau.
3756439	Is the 't' pronounced in this word?	5801547	Nadawatan do pimato 't' id boros ti?
2648871	You're so weird.	5803645	Suai ko dii.
3818726	Tom wasn't able to do what he wanted.	5803649	Au i Tom koilo do nunu kopio wonsoyon dau.
254438	I had never seen her before that time.	5804592	Au oku nokoumbal nokokito disido.
2296177	Who betrayed us?	5804690	Isai minogolimut dahai?
34907	A piano is expensive, but a car is more expensive.	5804718	Apagon gatang ilo piano nga lobi apagon gatang nogi iri korita.
2380426	I made that up.	5807135	Maan oku dilo.
1645782	I had a dream where a baby was playing with a knife.	5807783	Noipion ku do buragang minamain diri pais.
2891091	Do you know Tom's girlfriend's name?	5809766	Nokoilo ko'd ngaran sumandak di Tom?
5109535	Tom was shot in the arm.	5809772	Naantakan do longon di Tom o timbakan.
3417721	Tom made an apology.	5812050	Minokiampun i Tom.
906990	We do not travel to travel, but to have traveled.	5812062	Au yahai moi tombului om tombuluyon, nga mositi do tombuluyon.
3738860	Didn't anybody tell you that you didn't have to be here today?	5812594	Ingaa toi tulun poiloon tiya au tagal moi rikot hiti baino?
2271349	Don't tell anyone that.	5813854	Kada sunudai toinsanan.
271436	The government will provide interest-free loans to firms that participate in the program.	5813859	Pohoroon o kopolintaan do oloson dot au gatangon montok popokito do kohompit id abaabayan.
2439774	He didn't give me his real name.	5813915	Au isio minanahak ngaran dau tootopot.
2544486	Why doesn't Tom like Mary?	5814053	Nokuro tu au i Tom orohian di Mary?
2242986	They're interns.	5814057	Minsingiloh iyolo.
2007445	Let's get back to the party.	5814068	Kanou gumuli hodi karamaian.
3727523	Tom left school right after class.	5814071	Mongoi labus i Tom mantad sikul kalapas do kalas.
508121	When I was a baby, what could I do?	5814271	Nunu minaan ku id tontok do buragang oku dii?
1283	The password is "Muiriel".	5825623	Paswod nopo nga "Muiriel".
453505	They provided food for the war victims.	5844734	Pinoposodia iyolo do taakanon montok tulun di poimpasi mantad do pisangadan.
2256876	That's a lie.	5869379	Oudut.
705440	He has long hair.	5869433	Kitobuk isido tanaru.
2760886	I don't speak Arabic.	5869446	Au oku koilo mimboros Arab.
277774	Water the flowers before you eat breakfast.	5869461	Tuntugai ilo tusak tintod do mangakan dongkosuabon.
26186	Speaking English is not easy.	5869471	Au oulan momboros do Inggilis.
27747	It stopped snowing an hour ago.	5869477	Tuminingkod nodi salju sajaam tiinu.
2251267	That's the issue.	5869503	Iri no kobolingkangan.
2961213	I like to visit cemeteries. Is that normal?	5869518	Siongoi oku hilo'd pamalabangan. Obuli?
264370	Jiro wants to drink Coke.	5869536	Siinum i Jiro do Koka-kola.
34187	Artists are highly respected in France.	5869565	Pantangon o atis-atis hilo'd pogun Poransis.
2239829	Tom was out.	5869575	Luminabus i Tom.
462406	She washes her skirt.	5869592	Momupu isido do gonob dau.
2772553	She has been planting roses since 12 o'clock.	5869608	Minananom isido do tusak ros mantad jam ko-12 nodi.
1028979	Tom drove Mary's car to Boston.	5869626	Papapanau i Tom korita di Mary montok pakayaan hilo'd id Boston.
3821921	Tom should already be in Australia by now.	5869630	Apatut no korikot i Tom hilo'd pogun Australia dinondo.
2245418	Everybody believes it.	5869636	Ongotumbayaan i toinsanan.
316429	She is very anxious about his health.	5872033	Tumongob i ginawo disido kokomoi kolidasan disio.
4992883	Are there still men yet who don't drink?	5872069	Haro ko kokusaian dit au koilo moginum?
293948	He can't read English, much less German.	5872091	Au isio milo basaan do Inggilis, mantad ko boros Jorman piya nga au milo basaan nogi.
2012681	I want to make Tom jealous.	5872131	Manu oku poposolon di Tom.
463234	They wash their car every Saturday.	5874981	Asaru iyolo monusi korita diolo tikid tadau koonom.
3109375	This popular German singer only sings in English.	5874989	Ih susuminding tulun Jorman di nointutunan nopo suminding do Inggilis.
29222	We'd like another bottle of wine.	5875010	Onuai yahai do sombotol wain po kaagu.
3956176	Tom's body was found along a deserted road.	5875018	Haro tinan di Tom hilo'd wayaan do tindal.
2426363	I don't even know where she is right now.	5876011	Uka moti hombo isido baino?
2471	I hope he'll be able to come! I'd like to see him.	5907787	Alansan no daa korikot isio di! Siruba oku disio.
24692	What should I bring?	5907750	Nunu apatut o owitan ku?
26715	The rain continued all day.	5899534	Tumilombus iri masam-rasam sangadau.
27337	Generally speaking, history repeats itself.	5899379	Ih kosoruan nga mimban-simban iri susuyan dau.
28633	How easily one acquires bad habits!	5909569	Orulan nopo sosongulun do kikoboboyoon dit araat!
29194	There is a church near my house.	5894522	Haro gorija poinsomok do walai ku.
30143	Hence 50 percent of the muscle can give way to fat.	5894466	Sigog ka om posimbanan no ilo tonsi tinan kumaa do lunok soginumu 50 pihatus.
33513	I'm Tom Hunter.	5894376	Yoho nopo nga i Tom Hunter.
36323	Why have the apes evolved more than other animals?	5894368	Nokuro tu ogumu tongo kara mantad ko dupot wokon?
40978	The taxi is waiting outside.	5899419	Mangandad nopo ilo tiksi id labus.
42143	Keep it quiet.	5907902	Pakadaada.
51970	Not all of the staff was present.	5899504	Aiso koinsanai pakaraja tuminindapou.
52908	Was Joe with you yesterday evening?	5899478	Mongoruhang i Joe nangku diya kosodop do minsosodop?
55836	This is Mike's bicycle.	5907789	Iti nopo nga bunsiling di Mike.
73541	"Is she young?" "Yes, she is."	5907793	"Omulok isido?" "Oh"
238928	My health is my only capital.	5894490	Oponsol nopo kolidasan tinan ku.
242564	Do you have any tickets for today's performance?	5907882	Aiso tikit nu montok abaabayan dinondo di?
242949	Two students are absent today.	5906597	A'haro duo susumikul hiti'd kalas dinondo.
244392	The house was struck by lightning yesterday.	5894436	Notinggorudan do walai kosodop.
246363	The death penalty should be abolished.	5894508	Mongotus no kama ilo sogit kapatayan.
249252	We gave way to their demands.	5894464	Minanahak yahai do pokionuan kopio diolo.
250878	My idea went against his.	5894474	Kitoilaan ku mantad ko disio.
251304	Where is my seat?	5899352	Hombo o tirikohonon ku?
251994	My aim is to be a doctor.	5906592	Iman-imanon ku nopo nga mongugusap.
253173	I have to go to the airport to meet my cousin.	5894384	Mongoi oku ruba kama di pinsan ku hilo'd tutumpoon kapal tutumulud.
255736	I have been waiting for almost half an hour.	5894548	Mangandad oku do solinaid satanga jam.
263468	What grade did you get on the test?	5921991	Nunu dot onuan diya'd ponisaan?
264302	When does the next train leave?	5907875	Soira tongoyon ilo koritapui do kawagu?
264923	I go to school at seven.	5907803	Mongoi oku hilo'd sikul jaam koturu.
270002	One should love one's own mother.	5901253	Apatut no tulun ginawaan di tina sondiri.
284038	We were in the middle of lunch when he gave me a ring.	5894540	Mangakan yahai id dangadau mikuwo do tinahak disio do pondulung montok doho.
