5765418	I would like you to add my name to your mailing list for the course.	5765417	Bu toil leam gun cuiridh sibh m' ainm dhan stòr-data agaibh airson na cùrsa.
5765539	Hasn't Tom seen her?	5765538	Nach eil Tòmas oirre fhaicinn?
5765541	Tom won't have seen us.	5765540	Cha bhi Tòmas oirnn fhaicinn.
5765545	Had Tom seen you last week?	5765543	An robh Tòmas ort fhaicinn an t-seachdain a chaidh?
5765548	Tom says that he has seen you.	5765547	Tha Tòmas ag ràdh gu bheil e oirbh fhaicinn.
5768320	Didn't she only have five quid?	5768318	Nach robh aice ach còig notaichen?
5768333	I won't drink anything.	5768332	Chan òl mise càil.
5768336	She will drink red wine.	5768335	Òlaidh ise fìon dearg.
5768339	Tom won't be tired.	5768338	Cha bhi Tòmas sgìth.
5768344	Will Tom be going to French class?	5768343	Am bi Tòmas a' dol dhan clas Fraingis?
5768353	Tom would not be in a good mood.	5768352	Cha bhiodh Tòmas gu sunndach.
314219	She sent me a letter.	5768363	Chuir ise litir dhomh.
268224	The evidence was against me.	5768367	Bha an fhianais nam aghaidh.
3148908	Her book is red.	5768376	Tha an leabhar aice dearg.
1210860	I'm in Hong Kong right now.	5768377	Tha mi ann an Hong Kong an-dràsta.
5768432	Will it be an easy class? No, it is the hardest class!	5768431	Is e clas soirbh a bidh ann? Chan e, is e clas as doirbh a tha ann!
5768461	Tom wouldn't be unhappy with her.	5768459	Cha bhiodh Tòmas mì-toilichte oirre.
5768584	Did Tom fall in love with Mary?	5768562	An do thuit Tòmas a-bhàn air Màiri?
5768584	Did Tom fall in love with Mary?	5768570	An do thuit Tòmas ann an gaol le Màiri?
5768584	Did Tom fall in love with Mary?	5768579	An do ghabh Tòmas gaol air Màiri?
5769071	I think it's silly that Tom is learning French.	5769068	Is neònach leam gu bheil Tòmas ag ionnsachadh Fraingis.
5769079	I think it's silly that Tom didn't learn the language that everyone speaks.	5769078	Is neònach leam nach do dh'ionnsaich Tòmas an cànan a tha aig a h-uile duine.
5769806	They're talking among themselves.	5751829	Tha iad a’ bruidhinn ri chèile.
5769807	I'm a carpenter.	5749977	Tha mi nam shaor.
5769807	I'm a carpenter.	5749979	'S e saor a th' annam.
1529624	Where's the bread?	5782606	Càite bheil an t-aran?
4552586	Where is the bread?	5782606	Càite bheil an t-aran?
5809798	"I can sing," said Tom.	5809797	"Tha seinn annam," thuirt Tòmas.
5809800	His brother can't sing.	5809799	Chan eil òran na bhràthar.
5809804	He won't do.	5809803	Cha dèan e feum.
2203560	You're useless.	5809805	Chan eil feum annad.
5809807	You're really useless.	5809806	Is beag feum a tha ort.
5809809	Dire necessity forced us to leave.	5809808	'S e am feum a thug oirnn falbh.
2821695	Tom can't sing.	5810595	Chan eil òran ann am bràthair Thòmais.
2549250	Tom has a temper.	5810634	Tha sràdag ann an Tòmas.
1894572	It's not possible.	5810637	Chan eil casan ann.
5881639	Tom will come to Australia next year.	5881638	Thig Tòmas a dh'Astràilia an-ath-bhliadhna.
5881641	Tom will give it to us tomorrow.	5881640	Bheir Tòmas dhuinn a-màireach e.
5881643	Tom will give it to Mary tomorrow.	5881642	Bheir Tòmas do Mhàiri a-màireach e.
3823335	Who's going to do it?	5881644	Cò a nì seo?
5881645	Who's going to do this?	5881644	Cò a nì seo?
4498033	What did Tom drink?	5881646	Dè a dh'òl Tòmas?
5881648	It was a dry day.	5881647	'S ann tioram a bha an latha.
5881654	Two months ago, Tom began to learn French.	5881652	'S ann dà mhìos air ais a thòisich Tòmas ag ionnsachadh an Fhraingis.
5881656	Tom promised that he would be back soon.	5881655	Gheall Tòmas gun tilleadh e a dh'aithghearr.
5881657	Tom promised that he would return soon.	5881655	Gheall Tòmas gun tilleadh e a dh'aithghearr.
5881672	They would like to see me.	5881671	Bu toigh leotha m' fhaicinn.
5881675	I promised that I would return soon.	5881674	Gheall mi gun tillinn a dh'aithghearr.
5881676	I promised that I would be back soon.	5881674	Gheall mi gun tillinn a dh'aithghearr.
5881683	Tom doesn't like to buy them.	5881682	'S beag air Tòmas an ceannach.
5881690	Tom was with me all day.	5881688	Bha Tòmas ri m' thaobh fad an latha.
5881699	Would you like to see us today?	5881698	Am bu toil leibh ar faicinn an-diugh?
2235724	I know Tom.	5881700	'S aithne dhomh Tòmas.
5881702	I own that island.	5881701	Is leamsa an eilean ud.
5881705	Tom is going upstairs.	5881704	Tha Tòmas a' dol suas an staidhre.
5881707	Tom is going downstairs.	5881706	Tha Tòmas a' dol sìos an staidhre.
5881705	Tom is going upstairs.	5881708	Tha Tòmas a' dol a-nìos an staidhre.
5881707	Tom is going downstairs.	5881709	Tha Tòmas a' dol a-nuas an staidhre.
5881711	Tom expects to marry me, but I don't have to marry him.	5881710	Tha dùil aig Tòmas mo phòsadh, ach chan eil agam ris a phòsadh.
5881712	Tom expects to marry me, but I am not obliged to marry him.	5881710	Tha dùil aig Tòmas mo phòsadh, ach chan eil agam ris a phòsadh.
5881715	Tom expected to marry Mary, but she didn't have to marry him and didn't.	5881714	Bha dùil aig Tòmas Màiri a phòsadh, ach cha robh aice ris a phòsadh agus cha do phòs.
5881717	Would Tom like to marry Mary?	5881716	Am bu toil le Tòmas Màiri a phòsadh?
409116	I'd be happy to help you.	5881720	Bhithinn toilichte do chuideachadh.
2543138	I would be happy to help you.	5881720	Bhithinn toilichte do chuideachadh.
2543138	I would be happy to help you.	5881722	Bhithinn toilichte ur cuideachadh.
5881725	I used to go to Uist in the summer.	5881724	B' àbhaist dhomh a dhol a dh'Uibhist as t-samhraidh.
5881728	Tom used to go to Australia in the summer.	5881727	B' àbhaist do Thòmas a dhol a dh'Astràilia as t-samhraidh.
5881732	"Could I buy this book?" "Yes."	5881731	—Am faod dhomh an leabhar seo a cheannach? —Faodaidh.
5881736	"Would you like to marry Mary?" "I would."	5881735	—Am bu toil leat Màiri a phòsadh? —Bu toil.
5881739	"Do you know Tom?" "No."	5881738	—An aithne dhut Tòmas? —Chan aithne.
5881739	"Do you know Tom?" "No."	5881740	—An aithne dhuibh Tòmas? —Chan aithne.
5881745	"Should I do that?" "No."	5881743	—Am bu chòir dhomh sin a dhèanamh? —Cha bu choir.
5881748	"Was that the right thing to do?" "No."	5881743	—Am bu chòir dhomh sin a dhèanamh? —Cha bu choir.
5881757	"Do you hate Tom?" "Of course not, I am quite fond of him!"	5881755	—An lugha ort Tòmas? —Cha lugha idir, tha gràdh agam air!
5881764	Who wouldn't like to speak Gaelic?	5881761	Cò nach eil airson Gàidhlig a bhruidhinn?
5881767	Who wouldn't like to speak French?	5881766	Cò nach eil airson Fraingis a bhruidhinn?
5881782	When was Tom in danger?	5881780	Cuin nach robh Tòmas sàbhailte?
5881785	Where would I be going? I won't tell you!	5881784	Càite a bhithinn a' dol? Chan innsidh mi dhut!
5881785	Where would I be going? I won't tell you!	5881790	Cà bhithinn a' dol? Chan innsidh mi dhut!
1437	Congratulations!	5881851	Meal do naidheachd.
1437	Congratulations!	5881852	Meal ur naidheachd.
5881854	"How are you?" "Good."	5881853	—Dè do chor? —Cor math.
5881856	"How are you?" "Quite well." "That's good."	5881855	—Dè do chor? —Deagh chor. —'S math sin.
5881858	"How are you?" "Not well." "That's unfortunate."	5881857	—Dè ur cor? —Droch chor. —Nach bochd sin.
5881868	Tom will need a place to stay.	5881866	Bidh àite-fuirich a' dhìth air Tòmas.
5881871	Tom needs a place to stay.	5881869	Tha dìth àite-fuirich air Tòmas.
5881882	Tom likes to write poetry.	5881881	'S toigh le Tòmas bàrdachd a dhèanamh.
5881885	"Do you like to write poetry?" "Yes."	5881884	—An toigh leat bàrdachd a dhèanamh? —'S toigh.
5881887	Does anyone know what happened?	5881886	A bheil fios aig duine dè thachair?
16196	I suppose you're hungry.	5884216	'S dòcha leam gu bheil an t-acras ort.
17423	I don't agree with you.	5922015	Chan eil mi a' dol leat.
24697	Come on!	5918939	Siuthad.
24697	Come on!	5918940	Tiugainn.
36557	I don't think so.	5922015	Chan eil mi a' dol leat.
51064	I suppose so.	5884214	'S dòcha leam.
51104	I don't agree.	5922015	Chan eil mi a' dol leat.
54468	I wish you good luck.	5884185	Gura math a thèid leat!
54468	I wish you good luck.	5884186	Gura math a thèid leibh.
57674	Who owns this land?	5884641	Cò leis a tha am fearann seo?
60136	Who owns this house?	5884643	Cò leis a tha an taigh seo?
60147	This house is mine.	5884617	'S ann leamsa a tha an taigh seo.
60148	This house is mine, not yours.	5884622	Is leamsa a tha an taigh seo.
63473	Karen is angry with me.	5884291	Tha fearg aig Ciorstag orm.
68156	I wonder who they are.	5884344	'S iongnadh leam cò iad.
68996	I suppose you like her.	5884224	'S dòcha leam gu bheil gràdh agad oirre.
69041	I suppose you like him.	5884227	'S dòcha leam gu bheil gràdh agad air.
70841	What's your opinion?	5919013	Dè do bheachd?
71256	Are you students?	5883891	A bheil sibh nur oileanaich?
242080	I wish I were young.	5884190	Is miann orm a bhith òg.
251687	Father is angry with me.	5884296	Tha fearg aig m' athair orm.
254935	I have but one wish.	5884205	Chan eil ach aon mhiann agam.
260866	I suppose they are coming.	5884229	'S dòcha leam gun thig iad.
260900	I remember him well.	5884140	Tha cuimhne mhath agam air.
260971	I have made him angry.	5884303	Chuir mi fearg air.
276247	I wonder who invented it.	5884356	'S iongnadh leam cò dh'innlich e.
276391	I wonder who has come.	5884363	'S iongnadh leam cò thàinig.
284044	No wonder he is so angry.	5884274	Chan iongnadh gu bheil fearg mhòr aige.
286637	His letter made her angry.	5884314	Chuir an litir aige fearg oirre.
288982	How old is he?	5919081	Dè cho sean 's a tha e?
289406	I think he was angry.	5884316	Saoilidh mi gun robh fearg aige.
315727	I wonder who she is.	5884366	'S iongnadh leam cò ise.
370609	The students laughed.	5883895	Rinn na h-oileanaich gàire.
383835	I don't remember!	5884146	Cha chuimhne leam.
410597	Wait a moment.	5918995	Fuirichibh dà dhiog.
434458	Come with me.	5919012	Thig còmhla rium.
434614	Do you remember us?	5884148	A bheil cuimhne agad oirnn?
435429	I dislike coffee.	5884124	Is coma leam cofaidh.
476326	Are you angry?	5884278	A bheil fearg agad?
550246	I can't remember.	5884146	Cha chuimhne leam.
550248	I don't remember.	5884146	Cha chuimhne leam.
560933	It's the truth.	5919033	’S e an fhìrinn a tha agam.
593244	I dislike eggs.	5884125	Is coma leam uighean.
697243	Wait a minute.	5918997	Fuirich mionaid.
914029	What do you think?	5919013	Dè do bheachd?
984618	I suppose you love him.	5884230	'S dòcha leam gu bheil gaol agad air.
984619	I suppose you love her.	5884231	'S dòcha leam gu bheil gaol agad oirre.
989041	I wonder what will happen.	5884374	'S iongnadh leam dè tachraidh.
1025299	Tom has three children.	5883819	Tha triùir chloinne aig Tòmas.
1025416	Tom has been studying French for three years.	5881893	Thòisich Tòmas ag ionnsachadh na Fraingis o choinn trì bliadhna.
1025416	Tom has been studying French for three years.	5881894	Thòisich Tòmas ag ionnsachadh na Fraingis trì bliadhna air ais.
1025418	Tom has been studying French for about three years.	5881896	Thòisich Tòmas ag ionnsachadh na Fraingis faisg air trì bliadhna air ais.
1095961	Tom and Mary have one daughter and two sons.	5883800	Tha nighean agus dithis bhalach aig Tòmas agus Màiri.
1098155	Those students are Korean.	5883906	Tha na h-oileanaich seo nan Coirèanaich.
1495864	Tom has two children.	5883822	Tha dithis chloinne aig Tòmas.
1572847	They have many students.	5883914	Tha mòran oileanaich aca.
1572935	This house is not mine.	5884621	Chan ann leamsa a tha an taigh seo.
1868134	Tom is working.	5883829	Tha Tòmas ag obair.
1891146	I'm telling the truth.	5919033	’S e an fhìrinn a tha agam.
2011464	Do you want to come?	5919794	Eil thu airson tighinn?
2107656	Tom's working.	5883829	Tha Tòmas ag obair.
2163133	I suppose you are right.	5884233	'S dòcha leam gu bheil thu ceart.
2203897	Tom will work.	5883842	Bidh Tòmas ag obair.
2203899	Tom works.	5883826	Tha obair aig Tòmas.
2203899	Tom works.	5883829	Tha Tòmas ag obair.
2230769	Go home.	5919010	Thalla dhachaigh.
2235830	It's Tom's house.	5884629	'S e taigh Thòmais a tha ann.
2235912	That's Tom's house.	5884631	Sin taigh Thòmais.
2236011	Tom began working.	5883837	Thòisich Tòmas obair.
2239874	Tom was working.	5883867	Bha Tòmas ag obair.
2252582	The students left.	5883897	Dh'fhàg na h-oileanaich.
2254869	Who owns it?	5884639	Cò leis a tha?
2255298	You weren't invited.	5919637	Cha tug mi cuireadh dhutsa.
2258317	He dislikes me.	5884130	Is coma leis mi.
2273938	Where is Tom's house?	5884632	Cà bheil taigh Thòmais?
2392573	I remember many things.	5884174	Is cuimhne leam mòran rudan.
2392579	I remember that guy.	5884177	Is cuimhne leam an duine sin.
2507115	These are students.	5883899	Seo oileanaich.
2549248	Tom has children.	5883810	Tha clann aig Tòmas.
2549516	I'm from Boston.	5884445	'S ann à Boston a tha mi.
2853036	Tom hasn't had much education.	5919383	Chan eil sgoil mhòr aig Tòmas.
2957999	Tom said that he thought that education was important.	5919387	Thuirt Tòmas gun do shaoil e gun robh am foghlam cudromach.
3351085	Say no to racism.	5885044	Seasamaid an aghaidh na gràine-chinnidh.
3735978	Tom has one son and two daughters.	5883792	Tha balach agus dithis nighean aig Tòmas.
3914374	I didn't invite you.	5919637	Cha tug mi cuireadh dhutsa.
4016302	There's a lot of work to be done.	5881888	Tha mòran obair ri dhèanamh.
4141171	Tom was highly educated and spoke several languages fluently.	5919390	Bha sgoil mhòr agus tòrr chànanan aig Tòmas.
4401083	Go to Tom's house.	5884634	Rach do thaigh Thòmais.
4493563	Tom and Mary have three sons and a daughter.	5883802	Tha nighean agus triùir bhalaich aig Tòmas agus Màiri.
4493567	Tom and Mary have a daughter and a son.	5883803	Tha nighean agus balach aig Tòmas agus Màiri.
4494945	We're all students.	5883920	'S e oileanaich a tha annainn uile.
4501310	Tom owns this property.	5884647	'S le Tòmas an sealbh seo.
4949944	No wonder Tom hates us.	5884269	Chan iongnadh gur lugha le Tòmas sinne.
5006725	We're both students.	5883939	'S e oileanaich a tha ann an dithis dhinn.
5104947	Tom's daughter married Mary's son.	5883805	Phòs nighean Thòmais balach Mhàiri.
5105761	Nobody disliked Tom.	5884132	Cha robh duine am bu coma le Tòmas.
5147308	Tom wasn't drunk.	5919634	Cha robh smùid air Tòmas.
5272446	Tom has a son and a daughter.	5883794	Tha balach agus nighean aig Tòmas.
5294777	Where is the student?	5883944	Cà bheil an t-oileanach?
5306655	Tom has three sons and one daughter.	5883796	Tha triùir bhalaich agus nighean aig Tòmas.
5817813	Tom is a highly-educated man.	5919384	Tha sgoil mhòr aig Tòmas.
5881891	"Could you close the door?" "You could."	5881890	"Am faod thu an doras a dhùnadh?" "Faodaidh tusa."
5882298	"Which of you did it?" "Not me."	5882288	"Cò dhibh a rinn seo?" "Cha mhi."
5882309	"Whose is the book?" "It's Tom's."	5882306	"Cò leis a tha an leabhar?" "'S e le Tòmas."
5882320	Why didn't French last in this country?	5882317	Carson nach mhàir Fraingis anns an dùthaich seo?
5882331	Tell us where you came from.	5882328	Innsibh dhuinn cò às a thàining sibh.
5882355	Why did you say that I should learn French?	5882353	Carson a thuirt thu gum bu choir dhomh Fraingis ionnsachadh?
5882392	"Won't you say that I was right?" "I will."	5882389	"Nach can tusa gun robh mi ceart gu leòr?" "Canaidh."
5882409	I'll try to answer this question if I may.	5882408	Feuchaidh mi an ceist seo fhreagairt ma dh'fhaodas mi.
5882416	I asked you to stop it.	5882415	Dh'iarr mi oirbhse sguir dheth.
5882418	I asked you to stop.	5882415	Dh'iarr mi oirbhse sguir dheth.
5882429	Tom had learned French.	5882428	Bha Tòmas air Fraingis ionnsachadh.
5882431	Tom had just learned French.	5882428	Bha Tòmas air Fraingis ionnsachadh.
5882436	"Would you come to Australia?" "Yes indeed."	5882435	"An tigeadh tu a dh'Astràilia?" "Thigeadh gu dearbh."
5882439	"Would you come to Boston?" "No."	5882438	"An tigeadh tu do Bhoston?" "Cha tigeadh."
5883772	"Do you drink wine?" "Yes."	5883769	"An òl thu fìon?" "Òlaidh."
5883774	"Will you drink the wine?" "No."	5883773	"An òl thu am fìon?" "Chan òl."
5883790	Tom has two sons and three daughters.	5883789	Tha dithis bhalaich is triùir nigheanan aig Tòmas.
5884119	I remembered where I was born.	5884118	Bu chuimhne leam far an do thogadh mi.
5884141	I have good memories of him.	5884140	Tha cuimhne mhath agam air.
5884304	I irritated him.	5884303	Chuir mi fearg air.
5884306	I provoked him.	5884303	Chuir mi fearg air.
5884379	He'll say that she's his mother.	5884378	Canaidh e gur ise a mhàthair.
5884386	I'm the one who's hungry.	5884385	'S ann ormsa a tha an t-acras.
5884391	They were the ones who were hungry.	5884390	B' ann orra a bha an t-acras.
5884408	She wasn't born yesterday.	5884406	Chan ann an-dè a rugadh ise.
5884411	I was born and raised in Australia.	5884410	Rugadh is thogadh mise ann an Astràilia.
5884437	"Can we come?" "You may as long as you are polite."	5884435	"Am faod sinn a dhol ann?" "Faodaidh air chòir 's gum bi sibh modhail."
5884443	I came from Boston.	5884441	'S ann à Boston a thàinig mi.
5884467	I go to bed early because I have to wake up early.	5884464	Bidh mi a' dol tràth dhan leabaidh air sgàth 's gum feumaidh mi dùsgadh tràth.
5884484	There are puddles because it was raining yesterday.	5884478	Tha lodan uisge ann air sgàth 's gun robh an t-uisge ann an-dè.
5884652	"Do you own the house?" "No."	5884651	"An leatsa an taigh?" "Chan e."
5884658	"Are you a student?" "Yes."	5884657	"An e oileanach a tha annad?" "'S e."
5884663	"Were you a cook on that boat?" "No, I wasn't."	5884661	"An robh thu nad chòcaire air a' bhàta sin?" "Cha robh."
5884671	"Aren't you often home?" "No, I'm not."	5884670	"Nach ann tric a bhios sibh aig an taigh?" "Chan ann."
5884681	"Did you see that movie?" "Yes."	5884680	"Am faca sibh am film sin?" "Chunnaic."
5884687	"Will you see the museum again?" "Yes."	5884686	"Am faic thu taigh-tasgaidh a-rithist?" "Chì."
5884696	"Were you the director of that charity?" "Yes."	5884692	"An robh sibh nur stiùiriche am buidheann-carthannachd sin?" "Bha."
5884707	"Was the dog under the table?" "Yes."	5884704	"Am b' ann fon bhòrd a bha an cù?" "B' ann."
5884716	"Will you see the film tonight?" "No."	5884715	"An ann a-nochd a chì sibh am film?" "Chan ann."
5884725	"Don't you think we saw the ferry yesterday?" "Yeah."	5884723	"Nach saoil thu gur ann an-dè a chunnaic sinn an aiseag?" "Saoilidh."
5884740	Wouldn't one suppose that Tom did it?	5884738	Nach shaoileadh duine gur e Tòmas a rinn e?
5885034	We have to stand up against racism.	5885032	Feumaidh sinn seasamh an aghaidh na gràine-chinnidh.
5885761	"Are you going to the Isle of Skye in August?" "Yes."	5885760	"An tèid thu dhan Eilean Sgiathanach san Lùnastal?" "Thèid."
5885761	"Are you going to the Isle of Skye in August?" "Yes."	5885762	"An tèid sibh dhan Eilean Sgiathanach anns an Lùnastal?" "Thèid."
5885769	"Will you go to Glasgow via Mallaig?" "Yes, I will."	5885768	"An ann do Ghlaschu slighe Mallaig a thèid thu?" "'S ann."
5897272	"Would you like tea or coffee?" "Neither."	5897271	"An gabh thu tì no cofaidh?" "Cha ghabh idir."
5897275	You will get an interesting book if you go to Comhairle nan Leabhraichean.	5897274	Gheibh thu leabhar innteanach ma thig thu do Chomhairle nan Leabhraichean!
5897278	We made a lot of progress when we went to that French class.	5897277	Thàinig sinn air adhart nuair a chaidh sinn dhan cùrsa Fraingis sin.
5897287	I'm going to go for a walk around town in an hour and a half. Would anyone like to come with?	5897286	Thèid mi air siubhal a' bhaile ann an uair gu leth. Am bu toigh le duine tiginn cuide rium?
5897289	I ran into a policeman but he didn't notice me at all.	5897288	Thachair mi ri poileas ach cha do thug e toighe dhomhsa idir.
5916833	Tom is a well-educated person.	5919384	Tha sgoil mhòr aig Tòmas.
5918871	"What did you get?" "Two Gaelic books."	5918870	"Dè a fhuair thu?" "Fhuair mi dà leabhar Gàidhlig."
5918876	"What did you give her this year?" "Two frying pans."	5918875	"Dè a thug thu dhi am-bliadhna?" "Thug dà adhann."
5918879	"What would you like?" "I'd like three cups of coffee, please."	5918878	"Dè a ghabhas sibh?" "Gabhaidh trì cupannan cofaidh."
5918882	"Would you like whiskey or wine?" "I'll pass, thank you."	5918880	"An gabh thu uisge-beatha neo fìon?" "Cha gabh idir, tapadh leat."
5918887	"Who gave us this video?" "Tom did."	5918886	"Cò a thug dhuinn a' bhideo seo?" "Tòmas."
5918896	"Was it Tom who gave us this video?" "No, it wasn't."	5918895	"Am b' e Tòmas cò a thug dhuinn a' bhideo seo?" "Cha b' e."
5918899	"Did you buy the Audi?" "No, it was so expensive."	5918897	"An do cheannaich thu an Audi?" "Cha do cheannaich, bha e uabhasach daor."
5918901	I wouldn't be pleased with that.	5918900	Cha bhithinn toilichte le sin.
5918948	I'm against painting it again because it was painted just last year.	5918946	Tha mi an aghaidh a pheantadh a-rithist a chionn ’s gun deach e a' peantadh dìreach an-uiridh.
5918954	At the end of three years, I became fluent.	5918953	An ceann trì bliadhna, ràinig mi fileantachd.
5918968	At the end of fifty-one years, Tom and Mary divorced.	5918967	An ceann dàichead bliadhna 's a aon deug, dhealasaich Tòmas is Màiri ri chèile.
5918970	Won't you go to the cèilidh tonight?	5918969	Nach tèid thu dhan taigh cèilidh a-nochd?
5918974	The magazine only costs two pounds, including shipping.	5918973	Cha chosg an iris gu lèir ach dà not gus a chur sa phost.
5918976	I can't write good French.	5918975	Cha tèid agam air deagh Fhraingis a sgrìobhadh.
5918978	Tom can't write good French.	5918977	Cha tèid aig Tòmas air deagh Fhraingis a sgrìobhadh.
5918980	"You speak French well." "I'm not as fluent as you are."	5918979	"Tha mòran Fraingis agad." "Chan eil mi cho fileanta riut."
5918983	We'd have to paint the blade of the sword in order to change the color.	5918981	B' fheudar dhuinn lann an claidheamh a pheantadh airson dath ùr a chur air.
5918989	Let's see if they have a distance-learning French course.	5918988	Feuch a bheil cùrsa Fraingis air astar aca.
5919016	Isn't the trip to Australia quite expensive?	5919015	Saoil an tùras gu Astràilia caran daor?
5919019	Two hundred eight pounds per person and a hundred fifty three for students.	5919017	Dà cheud not 's a h-ochd an duine agus ceud dà fhichead not ’s a trì deug airson oileanaich.
5919021	This is easier than Tom expected.	5919020	Tha seo nas fhurasta na bha Tòmas an dùil.
5919023	We can catch the bus from this town.	5919022	Faodaidh sinn am bus fhaighinn às a' bhaile seo.
5919025	I don't have to go, but you do.	5919024	Chan fheum mise a dhol, ach feumaidh tusa.
5919027	Either you have to come up or I have to go down, I don't care either way.	5919026	Feumaidh tu a dhol a-nìos neo feumaidh mise a dhol sìos, tha mi coma co-dhiù.
5919029	Five dollars are worth one pound.	5919028	’S fhiach còig dolaran aon not.
5919208	Tom didn't want to leave at all.	5919206	Cha robh Tòmas airson fàgail idir.
5919393	French-medium education isn't useful.	5919391	Chan eil foghlam tro mheadhann na Fraingis gu feum.
5919464	French-medium education isn't necessary.	5919391	Chan eil foghlam tro mheadhann na Fraingis gu feum.
5919636	What on Earth is that?	5919635	Dè fon ghrèin a tha sin?
5919639	Tom invited Mary.	5919638	Thug Tòmas cuireadh dha Mhàiri.
5919643	Can Tom make it? He can't? Well, that's unfortunate.	5919642	An tèid aig Tòmas air tighinn ann? Nach tèid? Uill, tha sin duilich.
5919645	I can't come, sorry.	5919644	Cha tèid agam air tighinn ann, duilich.
5919646	I can't make it, sorry.	5919644	Cha tèid agam air tighinn ann, duilich.
5919648	I'll call him on Friday.	5919647	Fònaidh mise Dihaoine e.
5919653	"Will the exam be difficult?" "It will be more difficult than the last one."	5919652	"Am bi an deuchainn doirbh?" "Bidh nas doirbhe na fear sa chaidh."
5919759	This TV show is growing on me, anyway.	5919756	Thèid prògram telebhisein seo leth riumsa, co-dhiù.
6057672	I'm working as a carpenter.	5749977	Tha mi nam shaor.
5769626	My name's Ricardo.	6393762	'S e Ricardo an t-ainm a th' orm.
3389238	It is certainly a tasty delicacy. To all of you I say "bon appetit."	6486913	Làmh fhada is cead a sìneadh.
7853243	I'm well, thank you.	7853241	Tha mi gu math, tapadh leibh.
8049730	That was on the news.	8050295	Bha sin air an naidheachdan.
1474793	Tom lives in Wales.	8095995	Tha Tom a’ fuireach anns a’ Chuimrigh.
2318277	I like music.	8692598	Is toil leam ceòl.
2713785	It's warm.	8692608	Tha e blàth.
5205267	It is wet.	8692610	Tha e fliuch.
8692611	It's dry.	8692612	Tha e tioram.
5165092	It is very wet.	8692620	Tha e glè fhliuch.
1615217	It's very dry.	8692621	Tha e glè thioram.
4206989	It is very dark.	8692624	Tha e glè dhorcha.
1619684	It's a fine day.	8692640	Tha latha brèagha ann.
433659	It's a nice day.	8692641	Tha latha snog ann.
2701432	The weather is bad.	8692646	Tha an t-sìde dona.
20324	It's a lovely day.	8692650	Tha an latha àlainn ann.
3729551	It's a great day.	8692652	Tha latha sgoineill ann.
2646222	What are your hobbies?	8697110	Dè na cur-seachadan a th’ agad?
2258234	Good morning.	8109644	Madainn mhath.
1529624	Where's the bread?	8759751	Càite a bheil an t-aran?
1529624	Where's the bread?	8759752	Càit' a bheil an t-aran?
1686132	Tomorrow's laundry day.	8760065	'S e latha na nigheadaireachd a th' ann a-màireach.
2249097	It's laundry day.	8760067	'S e latha na nigheadaireachd a th' ann an-diugh.
69379	You had to come yesterday.	8760079	B' fheudar dhut tighinn an-dè.
