1564	Thank you very much!	773263	Mòran taing!
1564	Thank you very much!	773264	Taing mhòr!
1631	This is my friend Rachel. We went to high school together.	3282763	Seo mo charabaidh Rachel. Chaidh sinn dhan àrd-sgoil còmhla.
1813	It's cold.	1515925	Tha e fuar.
15909	Are you meeting someone here?	770475	Am bheil thu a' coinneamh le duine an-seo?
16145	Have you ever seen a kangaroo?	877864	Am faca tu cangarù riamh?
16145	Have you ever seen a kangaroo?	877871	Am faca sibh cangarù riamh?
16492	What are you doing?	770525	Dè tha thu a' dèanamh?
16492	What are you doing?	852104	Dè tha sibh a' dèanamh?
16669	You are fortunate for having such good friends.	1516062	Tha thu fortanach gu bheil càirdean cho math agad.
16669	You are fortunate for having such good friends.	1516064	Tha sibh fortanach gu bheil càirdean cho math agaibh.
16744	You haven't any money.	1516364	Chan eil airgead sam bith agad.
23295	We got to the station at six.	879032	Ràinig sinn an stèisean aig sia uairean.
28974	I'm from Kyoto.	1187082	'S ann à Kyoto a tha mi.
32210	Will you give me another glass of milk?	1514060	Nach toir thu dhomh glainne bainne a bharrachd?
32516	Madeira is the name of a wine.	878977	'S e ainm fìona a th' ann am "Madeira".
33141	Here is my bicycle.	1516526	Seo an rothair agam.
33926	Betty killed her.	1528310	Mharbh Betty i.
33928	Betty killed him.	1514168	Mharbh Betty e.
38387	I'm sorry.	1516324	Tha mi duilich.
39175	I'll do my homework after I watch television.	1516657	Nì mi m' obair-dachaigh às dèidh dhomh coimhead air an telebhisean.
44327	The ice is very thick.	770508	Tha an t-éigh glè thiugh.
52013	It was great. I went to Kyoto.	1526243	Bha e sgoinneil. Chaidh mi a Kyoto.
52673	Where does John live?	882029	Càite bheil Iain a' fuireach?
55629	This is the house where my uncle lives.	3338295	Seo an taigh far a bheil m' uncail ri còmhnaidh.
63227	Were you at home yesterday?	852107	An robh sibh aig an taigh an-dè?
63227	Were you at home yesterday?	852108	An robh thu aig an taigh an-dè?
63650	Do they speak French in Canada?	1515509	Am bruidhinnear an Fhraingis ann an Canada?
65641	You look gloomy.	1516327	Tha coltas brònach ort.
67150	One day she met a wolf in the woods.	1516397	Aon latha, thachair i le madadh-allaidh anns a' choille.
67781	Who is that old woman?	1516303	Cò tha a' chailleach ud?
67781	Who is that old woman?	1527902	Cò tha a' chailleach sin?
68533	Look at that house.	880127	Seall air an taigh sin.
68533	Look at that house.	1516537	Seall air an taigh ud.
69047	Didn't you know that he passed away about two years ago?	1516395	Nach robh fhios agad gun do shiubhail e bho chionn mu dà bhliadhna?
69047	Didn't you know that he passed away about two years ago?	1527808	Nach robh fhios agaibh gun do shiubhail e bho chionn mu dà bhliadhna?
69215	You ought not to go out.	883328	Cha bu chòir dhuibh dol a-mach.
69215	You ought not to go out.	1516539	Cha bu chòir dhut dol a-mach.
69407	You are busy now, aren't you?	852126	Tha thu trang an-dràsda, nach eil?
69407	You are busy now, aren't you?	852127	Tha sibh trang an-dràsda, nach eil?
69874	Why are you alone?	878970	Carson a tha thu nad aonar?
69879	Can you speak German?	1516518	A bheil Gearmailtis agaibh?
70623	What is your name?	773172	Dè an t-ainm a th' ort?
71812	I have to buy one tomorrow.	1607588	Tha agam ri fear a cheannaich a-màireach.
73090	It was Janet that won first prize.	1526172	B' e Janet a bhuannaich a' chiad duais.
240413	There are a great many people in the park.	1516329	Tha an t-uabhas de dhaoine anns a' phàirc.
241566	I'm busy now.	852128	Tha mi trang an-dràsda.
241849	Are you busy now?	852131	A bheil thu trang an-dràsda?
241849	Are you busy now?	852133	A bheil sibh trang an-dràsda?
242190	It is terribly hot this morning.	3323478	Tha e uabhasach blàth madainn an-diugh.
242709	It's very cold today.	3095086	Tha e glè fhuar an-diugh.
242836	It is Monday today.	852049	’S e Diluain a tha ann an-diugh.
243603	Would you like some sugar?	1516546	A bheil thu ag iarraidh siùcar?
244533	It was Sunday yesterday.	852069	’S e Didòmhnaich a bha ann an-dè.
244533	It was Sunday yesterday.	852071	'S e Là na Sàbaid a bha ann an-dè.
244533	It was Sunday yesterday.	852073	'S e Latha na Sàbaid a bh' ann an-dè.
244607	I was free from work yesterday.	852111	Cha robh mi ag obair an-dè.
244736	I was very tired last night.	3095233	Bha mi glè sgìth a-raoir.
245691	The children were playing in the park.	770518	Bha na cloinn a' cluich anns a' phàirc.
246595	The boy I love doesn't love me.	1514151	Chan eil gràdh orm aig a' bhalach is tha gaol agam air.
251883	What did you do with my book?	1516071	Dè rinn thu leis an leabhar agam?
251921	My sister is famous.	885830	Tha mo phiuthar ainmeil.
252193	I'm very tired.	3094967	Tha mi glè sgìth.
253848	I have a computer.	3254454	Tha coimpiutair agam.
254241	I could not sleep because of the noise.	1514187	Cha b' urrainn dhomh cadal air sgàth na fuaim.
255050	I have a book about fishing.	3282769	Tha leabhar mun t-iasgach agam.
255347	I have a cat and a dog. The cat is black and the dog is white.	1526225	Tha cat is cù agam. Tha an cat dubh agus tha an cù geal.
256329	I talked about music.	1514141	Bhruidhinn air ceòl.
256358	I want to drink something.	1793439	Tha mi ag iarraidh rudeigin òl.
257058	I agree with you.	1182033	Tha mi ag aontachadh ribh.
257266	I have lost my key.	1515926	Tha mi air an iuchair agam a chall.
257447	I am busy now and can't play with you.	852143	Tha mi trang an-dràsda, agus chan urrain dhomh a chluich còmhla riut.
257810	I wasn't busy yesterday.	1516375	Cha robh mi trang an-dè.
257934	I am from Shikoku.	878347	Tha mi à Siakoku.
259335	I was born in Osaka.	1516347	Rugadh mi ann an Osaka.
261418	I was very tired.	3095232	Bha mi glè sgìth.
263683	My car was badly damaged in the accident.	1514032	Chaidh cron mòr a dhèanamh air a' chàr agam san tubaist.
268174	Tell me what you did in Shounan.	880296	Innis dhomh dè ni thu ann an Shounan.
269174	I need a new bicycle.	1607597	Tha feum agam air rothair ùir.
272178	I used to drink beer.	879067	B' àbhaist dhomh leann òl.
275177	Taro died two years ago.	878387	Chaochail Taro o chionn dà bhliadhna.
276028	Tell me the name of the ninth month.	1514061	Innis dhomh an t-ainm a tha air an naoidheamh mìos.
276028	Tell me the name of the ninth month.	1514062	Innisibh dhomh an t-ainm a tha air an naoidheamh mìos.
276835	Is it a boy or a girl?	1516311	An e balach no nighean a th' ann?
276875	He stopped by Tom's chair.	879552	Stad e faisg air cathair Thòmais.
276875	He stopped by Tom's chair.	879554	Stad e ri taobh cathair Thòmais.
278160	The birds are singing.	3047423	Tha na h-eòin a' seinn.
278873	The weather is as fine as can be.	877771	Tha an aimsir cho math sa ghabhas.
279713	Do you know where Tokyo Tower is?	1515927	A bheil fios agad càite bheil tùr Tokyo?
280749	Nara is as old as Kyoto.	1515924	Tha Nara cho sean ri Kyoto.
284775	He has two brothers, one lives in Osaka and the other in Kobe.	878809	Tha dà bhrathair aige. Tha fear dhiubh a' fuireach ann an Osaka agus am fear eile ann an Kobe.
287057	His son is in college now.	1525328	Tha a mhac aig a' cholaiste a-nis.
287882	His speech was suitable for the occasion.	901225	Bha a chainnt iomchaidh san t-suidheachadh.
288509	He went abroad two years ago.	1516517	Chaidh e thall thairis bho chionn dà bhliadhna.
288540	He will return within 3 hours.	1525329	Tillidh e ro cheann trì uair a thìde.
288977	He comes from England.	1516066	'S ann à Sasainn a tha e.
288982	How old is he?	773170	Dè an aois a tha e?
296902	He died yesterday.	877993	Chaochail e an-dè.
296940	He was working at the office yesterday evening.	852110	Bha e ag obair anns an oifis a-raoir.
299556	He sat down to read a novel.	880115	Shuidh e sìos ri ùr-sgeul a leughadh.
301279	He is a good carpenter.	1516056	Tha e na dheagh shaor.
304790	He has a lot of books on history.	901371	Tha mòran leabhraichean air eachdraidh aige.
309627	Her hair is long.	1516396	Tha a falt fada.
310821	She must visit England this summer.	877984	Feumaidh i dol a Shasainn san t-samhradh.
312127	I don't think she can speak French.	880114	Cha chreid mi gu bheil Fraingis aice.
313032	She did the work without any difficulty.	1516057	Rinn i an obair gun dragh sam bith.
313623	She is a woman of noble birth.	879064	'S e bean uasal a th' innte.
315861	She has long hair.	1527883	Tha falt fada oirre.
316015	She made the same mistake again.	1514172	Rinn i an aon mearachd a-rithist.
316163	She had white shoes on.	770500	Bha brògan geala oirre.
317359	I expect to come.	1515904	Tha mi an dùil a thighinn.
322178	Many thanks.	773263	Mòran taing!
323684	Shut up and listen!	878007	Ist is èisd.
356200	Who are you?	773369	Cò thusa?
373320	How are you?	877976	Ciamar a tha thu?
374827	Thank you!	1516051	Tapadh leat!
374827	Thank you!	1516052	Tapadh leibh!
404096	I'm hungry!	773097	Tha an t-acras orm.
408293	What's your name?	773172	Dè an t-ainm a th' ort?
412026	I was a student at that time.	877939	Bha mi nam oileanach aig an àm sin.
1205289	Welcome to Tatoeba!	1526205	Fàilte gu Tatoeba.
426950	Good night!	877952	Oidhche mhath.
433594	Try it again.	1525324	Feuch a-rithist e.
433594	Try it again.	1525326	Feuchaibh a-rithist e.
434766	Fuck!	1526213	Murt!
435030	He washes the car.	3587359	Tha e a' nighe a' char.
436163	How many plates do we have?	1186098	Cia mheud truinnseir a th' againn?
442983	Not even one taxi stopped.	878957	Cha stad fiù 's aon tacsi.
448645	Thanks!	1516052	Tapadh leibh!
456205	It's cold today!	1535618	Tha e fuar an-diugh!
456487	My toy is broken.	1514166	Tha an dèideag agam briste.
462424	Shit.	1526213	Murt!
463320	This is my sister. She is called Julia.	3282752	Seo mo phiuthar. 'S e Sìleas an t-ainm a th' oirre.
463322	This is my teacher. He is called Mr. Haddad.	3282756	Seo mo fhear-teagaisg. 'S e Maighstir Haddad an t-ainm a th' air.
464260	Today is Tuesday. I am buying fishes.	852063	’S e Dimàirt a tha ann an-diugh. Tha mi a' ceannach iasgan.
485064	Why don't you listen to me?	1516535	Carson nach èist thu rium?
495580	She's teaching us French.	882027	Tha i a' teagaisg na Fraingis dhuinn.
508620	You're the love of my life.	879035	'S tusa gràdh mo bheatha.
511147	I saw a star today.	1516374	Chunnaic mi reul an-diugh.
513522	He lost everything he owned.	1516379	Chaill e a h-uile rud a bh' aige.
516745	Goodbye!	773225	Tìorraidh ma-thà!
522397	Do you speak German?	1516518	A bheil Gearmailtis agaibh?
526281	She has got long hair.	1527883	Tha falt fada oirre.
531173	Where are we going tonight?	1516337	Càite am bi sinn a' dol a-nochd?
531489	He doesn't sing well.	1182014	Chan eil e math air seinn.
553847	I've only had two or three drinks.	1516310	Chan eil mi ach air dà no trì deochannan òl.
651035	I want to go to London.	3254450	Tha mi ag iarraidh dol do Lunnainn.
663084	I work in a bank.	1514143	Tha mi ag obair ann am banca.
664096	In Africa there are many lions.	1514051	Tha iomadh leòmhainn ann an Afraga.
680337	Smoking is banned in restaurants in California.	884263	Tha smòcadh toirmisgte anns na taighean bidh ann an California.
694432	The father is very tired.	3339427	Tha an t-athair glè sgìth.
704749	I'm waiting for the train.	1514157	Tha mi a' feitheamh air an trèan.
716158	I'm reading a book about languages.	852106	Tha mi a’ leughadh leabhar mun chànain.
735080	I need a stamp.	1514154	Tha feum agam air stampa.
750825	I know that I do not know.	844423	Tha fios agam nach eil fhios agam.
764169	I know that you know that I know.	844408	Tha fios agam gum bheil fios agad gum bheil fios agam.
768070	Yesterday I listened to a very beautiful song.	768173	Bha mi ag èisteachd ri òran glè bhòidheach an-dè.
773103	Close the door please.	773102	Duin an dòras, mas e do thoil e.
773122	I'm not afraid at all.	773121	Chan eil an t-eagal orm idir.
773124	The big dog is frightening them.	773123	Tha an cu mòr a' cur eagal orra.
773128	Why are you angry?	773126	Cairson a tha fearg ort?
773131	This makes her angry.	773130	Tha sin a' cur fearg oirre.
773142	My mother speaks little English.	773140	Tha beagan Beurla aig mo mhàthair.
773144	Hi, how are you, my dear friend?	773143	Halò, ciamar a tha thu, a chàraid choir?
773151	I like to write here.	773150	Is toigh leam a bhith a' sgrìobhadh an-seo.
773156	Do you like to read Tatoeba?	773152	Am toigh leat a bhith a' leughadh Tatoeba?
773162	English is the language that dwells in my heart.	773160	Tha Beurla an cànan a tha a' fuireach 'nam chrìdhe.
773167	I need you to help me.	773166	Tha feum agam air do chuideachadh.
773169	I'm sorry, but I'll have to go home now.	773168	Tha mi duilich, ach feumaidh mi dol dhachaigh an-dràsta.
773175	What's her name?	773174	Dè an t-ainm a th' oirre?
242789	What are you going to do today?	773178	Dè tha thu a' deànamh an-diugh?
773185	What were they doing yesterday?	773180	Dè bha iad a' deànamh an-dè?
773189	Are you going to be on vacation tomorrow?	773188	Ann an a-màireach a bhios tu a' falbh air saor-làithean?
773192	I am really sorry to hear that.	773191	Tha mi uabhasach duilich seo a chluinntinn.
773196	When will you be coming to Scottland?	773193	Cuine a bhios tu a' tighinn a dh'Alba?
773198	Whom are you going to come with?	773197	Cò còmhla ris a bhios tu a' tighinn?
773202	There is nobody at home who knows that.	773199	Chan eil an duine aig a bheil fios a-staigh.
773206	I'm sure she is going to sing at church tomorrow.	773205	Tha mi cinnteach gum bi i a' sein anns an eaglais a-màireach.
773209	I think that there is a man there.	773208	Tha mi a' saoilsinn gu bheil fear ann an-sin.
773212	I think that it was a lot of fun, indeed!	773210	Tha mi a' smaoineachadh gur e deagh spòrs a bh' ann, gu dearbh!
773216	The fish was swimming in the water.	773214	Bha an t-iasg a' snàmh anns an uisge.
773221	I'm having a very delicious meal at home.	773219	Tha mi a' gabhail biadh uabhasach blasta dhachaidh.
773224	It's lovely weather today.	773218	Tha i glè bhrèagha an-diugh.
773233	It is not raining.	773232	Chan eil an t-uisge ann.
773239	I will see them next week.	773236	Chì mi iad an-ath-sheachdain.
773247	I don't want to see this either.	773246	Chan eil no mise ag iarraidh seo fhaicinn cuideachd.
773249	I will go to the restaurant at 7:30 pm.	773248	Thèid mi dhan taigh-bìdh aig leth-uair an dèidh seachd anns an fheasgar.
773255	He does nothing but read books all day long.	773254	Tha e a' leughadh leabhraichean a-mhain fad an latha.
773262	My family is fine, thanks.	773261	Tha mo theaghlach gu math, tapadh leat.
773268	It was a good and interesting night.	773267	'S oidhche mhath 's inntineach a bh' innte.
793284	He used to drink beer.	1516532	B' àbhaist dha leann òl.
793285	She used to drink beer.	1516533	B' àbhaist dhi leann òl.
813309	She has a white cat.	1515504	Tha cat geal aice.
847770	I speak a little Scottish Gaelic.	847768	Tha beagan Gàidhlig agam.
847773	Do you speak English and Scottish Gaelic?	847771	A bheil Beurla agus Gàidhlig agad?
847777	We don't live in Scotland yet.	847774	Chan eil sinn a' fuireach ann an Alba fhathast.
851937	Aren’t they going to the ceilidh in the town?	851929	Nach eil iad a’ dol dhan chèilidh anns a’ bhaile?
851939	The new house is near the fast burn.	851926	Tha an taigh ùr faisg air an allt luath.
851940	There is green grass on the field.	851924	Tha feuch grom ann anns an achadh.
851942	The floor was wet with water.	851923	Bha an làr fliuch le uisge.
851943	A day on the road is good for you.	851920	Tha an latha air a’ mhonadh math dhut.
851944	I was on the road to the town.	851918	Bha mi air an rathad dhan bhaile.
851947	Do you think that brown hair is very beautiful?	851917	A bheil thu a' smaointinn gum bheil falt donn glè bhòidheach?
851949	There is some coal in the stream.	851907	Tha gual ann anns an t-sruth.
851951	The dog was in the box under the table.	851906	Bha an cù anns a’ bhocsa fon bhòrd.
851953	There is a house across the stream.	851905	Tha taigh ann thairis air an t-sruth.
851955	The person with the dog was so slow on the hill.	851904	Bha an duine, leis a’ chù, cho mall air a’ chnoc.
851957	Was there fresh bread in the box?	851901	Nach eil aran ùr anns a’ bhocsa ann?
851959	Is the milk from this deer really good?	851900	A bheil am bainne bhon fhiadh sin uabhasach math?
851960	There was peace all over the world.	851898	Bha sìth ann tron t-saoghal.
851962	Was he quick with the sail?	851897	An robh e luath leis an t-seòl?
851964	There is good fire from this coal.	851896	Tha teine math teth ann bhon ghual seo.
851965	There is no water in the stream.	851894	Chan eil uisge ann anns an t-sruth.
851967	It was very stormy in the afternoon.	851893	Bha e uabhasach stoirmeil anns an fheasgar.
851969	There was a seal on the shore.	851891	Bha ròn ann air a’ chladach.
851970	The butter on the bread is very good.	851890	Tha an t-ìm air an aran glè mhath.
851971	Were you in the moor yesterday?	851888	An robh sibh air a’ mhonadh an-dè?
851972	There is a small brown dog under that table.	851887	Tha an cù donn beag ann fon bhòrd sin.
851973	There is a beautiful girl on the paper.	851886	Tha caileag bhòidheach anns a’ phàipear ann.
851976	There is no fish in the burn.	851975	Chan eil iasg anns an allt ann.
851979	The table in that room is very nice.	851977	Tha am bòrd anns an t-seòmar sin glè shnog.
851981	I think that there is water under the table.	851978	Tha mi a' smaoineachadh gum bheil uisge ann fon bhòrd.
851984	The boat was under sail.	851983	Bha am bàta fo sheòl.
851986	There was a seal in the water and another on the shore.	851985	Bha ròn ann anns an uisge, agus air a’ chladach.
851989	This letter is to the old woman.	851988	Tha an litir seo dhan chaillich.
851991	Aren’t they on the sea during the night?	851990	Nach robh iad aig a’ mhuir tron oidhche?
851994	The story about the girl was in the news.	851992	Bha sgeul mun chaileig sin anns an naidheachd.
851997	There was an interesting story in the letter to the boy.	851996	Bha sgeulachd inntinneach anns an litir dhan bhalach.
852004	The black dog on the grass was exposed to the sun.	852001	Bha an cù dubh air an fheur ris a’ ghrèin.
852005	Weren’t they a long time in the town?	852000	Nach robh iad ùine fhada anns a’ bhaile?
852006	There’s a new long fishing rod in the shop.	851998	Bha slat fhada ùr ann anns a’ bhùth.
852015	The lass is at the window, because the sun is very hot today.	852013	Tha an nighean ris an uinneig oir tha a’ ghrian glè bhlàth an-diugh.
852018	Scottish Gaelic is very interesting, isn’t it?	852012	Tha a’ Ghàidhlig glè inntinneach, nach eil?
852024	She was in bed during the morning reading a book.	852011	Bha i anns an leabaidh tron mhadainn a leughadh leabhar.
852030	The sun was warm in the morning, but it's cold at this moment.	852009	Bha a’ ghrian blàth anns a’ mhadainn, ach tha i fuar an-dràsda.
852079	Will it be Saturday tomorrow?	852078	An e Disathairne a bhios ann a-màireach?
852082	It's Monday today and it will be Tuesday tomorrow.	852081	'S e Diluain a tha ann an-diugh agus 's e Dimàirt a bhios ann a-màireach.
852087	What day is it again?	852086	Dè an latha a tha ann a-rithist?
852092	It's Thursday and the bin lorry will be coming today.	852091	’S e Diardaoin a th’ ann, agus bidh làraidh an sgudail a’ tighinn an-diugh.
852098	Friday is bin day in England.	852093	’S e Dihaoine là an sgudail ann an Sasainn.
852100	The bin lorry will not be coming tomorrow, then.	852099	Cha bhi an làraidh a’ tighinn a-màireach, ma-thà.
852102	I hope it'll come, because the trash can is full.	852101	Tha mi an dòchas gum bi, oir tha am bion làn.
852121	Will you be working at the hotel tomorrow in the morning?	852116	Am bi sibh ag obair aig an taigh-osda a-màireach anns a' mhadainn?
852149	We are working hard on the field today.	852144	Tha sinn ag obair gu trang anns an achadh an-diugh.
852150	The man was working hard on the field yesterday.	852145	Bha am fear ag obair gu trang anns an achadh an-dè.
852151	They will be working hard on the field tomorrow.	852146	Bidh iad ag obair gu trang anns an achadh an-màireach.
852153	He was working hard on the field last night.	852147	Bha e ag obair gu trang anns an achadh a-raoir.
852155	My son is working hard on the field right now.	852148	Tha mo mhac ag obair gu trang anns an achadh an-dràsda.
852167	I am really glad to hear that you want to live in Scotland.	852162	Tha mi uabhasach toilichte a' cluinntinn gu bheil thu ag iarraidh fuireach ann an Alba.
852170	I am glad to hear that you know how she is called.	852164	Tha mi toilichte a' cluinntinn gu bheil fìos agaibh, dè an t-ainm a th' oirre.
852177	I hope that your family is fine, my friend.	852175	Tha mi an dòchas gu bheil an teaghlach agad gu dòigheal, a charaid.
854117	Hello everyone!	1516599	Halò, a h-uile duine.
854500	Get lost.	1516331	Thalla.
860466	Shit!	1526213	Murt!
869091	This is difficult.	1535616	Tha seo doirbh.
869559	I don't know what kind of person he is.	1182029	Chan eil fhios agam dè seòrsa duine a th' ann.
871631	There's a man at the door who wants to talk to you.	878421	Tha fear aig an doras a tha ag iarraidh bruidhinn riut.
873050	I bought a car in Derry yesterday.	878423	'S ann an-dè a cheannaich mi carbaid ann an Doire.
873050	I bought a car in Derry yesterday.	1529508	Cheannaich mi carbaid ann an Doire an-dè.
878364	Don't sleep too deeply.	773242	Na dèan cadal trom.
883048	I know that I don't know.	844423	Tha fios agam nach eil fhios agam.
901320	Taro, dinner is ready.	877946	Taro, tha an dìnnear deiseil.
901393	He sat down to read a story.	880115	Shuidh e sìos ri ùr-sgeul a leughadh.
937846	I've forgotten my email address.	1514056	Tha mi air mo sheòladh post-dealain a dhìochuimhneachadh.
945295	It is cold.	1515925	Tha e fuar.
950609	Juliana told me you're from São Paulo.	1514042	Thuirt Juliana dhomh gur ann à São Paulo a tha thu.
950609	Juliana told me you're from São Paulo.	1514043	Thuirt Juliana dhomh gur ann à São Paulo a tha sibh.
957429	This is hard.	1535616	Tha seo doirbh.
984512	May I ask how old you are?	1514028	Am faod mi faighneachd dè an aois a tha sibh?
984512	May I ask how old you are?	1514030	Am faod mi faighneachd dè an aois a tha thu?
1012676	I opened the box. It was empty.	1514146	Dh'fhosgail mi am bogsa. Bha e falamh.
1025577	Tom had lots of fun at the party.	1516582	Chòrd am pàrtaidh glan le Tòmas
1025604	Tom had a lot of fun at the party.	1516582	Chòrd am pàrtaidh glan le Tòmas
1037132	I was very tired today.	3095236	Bha mi glè sgìth an-diugh.
1037264	Why aren't you listening to me?	880117	Carson nach eil thu ag èisteachd rium?
1064331	It wasn't my fault.	1514054	Chan e mise as coireach.
1068125	Goodnight!	877952	Oidhche mhath.
1079060	She is teaching us French.	882027	Tha i a' teagaisg na Fraingis dhuinn.
1105399	Sorry!	1516324	Tha mi duilich.
1112158	What is wrong with him?	1182021	Dè tha ceàrr leis?
1142084	I want to go to Sweden.	3254444	Tha mi ag iarraidh don t-Suain.
1164887	The day is beautiful.	3077659	Tha an là brèagha.
1189719	I'm eating.	3077667	Tha mi ag ithe.
1195679	I like eating cake.	3282748	'S toil leam cèic ithe.
1304610	What are you called?	773172	Dè an t-ainm a th' ort?
1448081	I need to buy stamps.	1514139	Tha agam ri stampaichean a cheannach.
1476466	Are you always busy?	1514038	Am bi thu daonnan trang?
1476466	Are you always busy?	1514039	Am bi sibh daonnan trang?
1489947	The woman is right.	1516301	Tha am boirreanach ceart.
1492423	Do you want sugar?	1516546	A bheil thu ag iarraidh siùcar?
1509831	He was so poor that he couldn't buy bread.	880294	Bha e cho bochd nach b' urrainn dha aran a cheannach.
1514070	I like languages!	894447	Is caomh leam cànanan!
1514176	These books are very old.	1514179	Tha na leabhraichean seo gu math sean.
1515505	Don't go to sleep with the light on.	1515507	Na dèan cadal leis an t-solas air.
1516377	I'll do something.	1516376	Nì mi rudeigin.
1516528	This story is far more interesting than that one.	877929	Tha an sgeul seo fada nas inntinniche na am fear ud.
1520245	I like it.	3339435	'S toigh leam e.
1521671	Where does Iain live?	882029	Càite bheil Iain a' fuireach?
1527811	Why do people go to the cinema?	1516655	Carson a thèid daoine don taigh-dealbh?
1527819	Tom really enjoyed the party.	1516582	Chòrd am pàrtaidh glan le Tòmas
1527881	I heard a beautiful song yesterday.	1516525	Chuala mi òran breagha an-dè.
1527893	Put a stamp on the parcel and post it.	1516373	Cuir stampa air a' phasgan agus chuir anns a' phost e.
1528314	I don't like big cities.	1514160	Cha toil leam bailtean mòra.
1528336	One of us is wrong.	877831	Tha fear dhuinn ceàrr.
1529506	Whose is this food?	878426	Cò leis a tha am biadh seo?
1529519	You need it.	877999	Tha feum agaibh air.
1682275	I cannot live in water. I'm not a fish.	3282904	Chan urrainn dhomh mairsinn anns an t-uisge. Chan eil mi nam iasg.
1725998	What do we call you?	773172	Dè an t-ainm a th' ort?
1742463	He went abroad last year.	1527885	Chaidh e thall thairis an-uiridh.
1782081	I'm eating here.	3077674	Tha mi ag ithe an seo.
1839605	Were you there?	2801290	An robh thu ann?
1839605	Were you there?	2801293	An robh sibh ann?
1895809	You can go now.	3691878	Faodaidh tu falbh a-nis.
1977717	I want to go.	3335215	Tha mi ag iarraidh dol.
2002501	The city is small.	3282560	Tha a' chathair beag.
2002502	The city is big.	3282561	Tha a' chathair mòr.
2002505	The house is warm.	3282563	Tha an taigh blàth.
2002510	The neighbors are noisy.	3282566	Tha na nàbaidhean gàirich.
