259069	I am a teacher.	8760082	'S e tidsear a th' annam.
9007385	They're eating their apples.	1515921	Tha iad ag ithe nan ùbhlan aca.
5871076	Do you speak Scottish Gaelic?	9018961	A bheil thu a’ bruidhinn Gàidhlig?
773365	Who is Pedro?	9042968	Cò a th' ann am Pedro?
2243085	They caught Tom.	9042977	Ghlac iad Tom.
433727	I'm really tired.	3094967	Tha mi glè sgìth.
9042983	They're not helping.	3475991	Chan eil iad a’ cuideachadh.
2635206	My name is Ricardo.	6393762	'S e Ricardo an t-ainm a th' orm.
69236	Do you have a car?	8760070	A bheil càr agad?
16881	Where are your eyes?	8760068	Càite a bheil ur sùilean?
370703	Where are you from?	9256225	Cò às a tha thu?
1891086	I'm not tired.	9256313	Chan eil mi sgìth.
9256336	She's not happy.	9256334	Chan eil i toilichte.
317830	Are you tired?	9256354	A bheil thu sgìth?
9256382	I am reading.	9256381	Tha mi a’ leughadh.
1349059	I'm reading.	9256381	Tha mi a’ leughadh.
9256402	She is learning Gaelic.	9256399	Tha i ag ionnsachadh Gàidhlig.
9256448	James played with a sword.	9256446	Chluich Seumas le claidheamh.
9256483	That's something else.	9256480	'S e sin rudeigin eile.
4394846	How was that?	9269200	Ciamar a bha sin?
569283	How are things?	9269203	Ciamar a tha cùisean?
286873	How tall is he?	9269221	Dè an àirde a tha e?
9269228	How painful is it?	9269225	Dè am pian a tha ann?
4228287	How many people were there?	9269248	Co mheud duine a bha ann?
9276361	We understood it.	9276360	Bha sinn ga thuigsinn.
9276364	I won't be meeting her.	9276363	Cha bhi mi ga tachairt.
2044396	Were you happy?	9276374	An robh thu toilichte?
9276391	The water was not warm.	9276389	Cha robh an t-uisge blàth.
30970	Are you there?	9276406	A bheil thu ann?
9276420	There are two sides to it.	9276418	Tha dà thaobh air.
9276428	There will be no delay.	9276427	Cha bhi fadal ann.
6558336	My grandmother has grey hair.	9282789	Tha falt glas air mo sheanmhair.
9282793	My grandmother has white hair.	9282789	Tha falt glas air mo sheanmhair.
9282824	I'll check whether they are in.	9282822	Chì mi feuch a bheil iad a-staigh.
9282854	I'll see you.	9282851	Bidh mi gad fhaicinn.
9282861	I'll see what I'll do.	9282858	Chì mi dè nì mi.
9282869	The sorcerer put a spell on the children.	9282866	Chuir am buidsear a' chlann fo gheasaibh.
9282880	Will you put the milk in the cup?	9282879	An cuir thu am bainne anns a' chupa?
9282887	He sent them a letter.	9282885	Chuir e litir thuca.
9282894	James scored a goal.	9282890	Chuir Seumas gòl.
9282900	You're somewhat late.	9282898	Tha thu car fadalach.
9282926	The story came to an end somewhat abruptly.	9282924	Thig an stòiridh gu ceann car obann.
9295512	There is a cure for everything except for death.	9295511	Tha leigheas air gach càs ach chan eil leigheas air a' bhàs.
9295517	I can't make head nor tail of it!	9295516	Chan eil mi a' dèanamh bun no bàrr dheth!
61326	This chair is made of wood.	9295518	Tha a' chathair seo air a dèanamh à fiodh.
9295520	I was doing as well as anyone here.	9295519	Bha mise a' dèanamh cho math ri fear an seo.
9295523	I'm certain that he would be happy.	9295522	Tha mi cinnteach gum biodh e toilichte.
9295525	I’ll wait until eight o’clock.	9295524	Fanaidh mi gu ochd uairean.
9295527	I sent a letter to my parents.	9295526	Chuir mi litir gu mo phàrantan.
9295529	He likes going to parties.	9295528	Is toil leis a bhith a' dol gu partaidhean.
35665	Are you coming to the party?	9295530	A bheil thu tighinn chun a' phartaidh?
9295532	I think that they have children.	9295531	Tha mi a’ smaoineachadh gu bheil clann aca.
9295534	They don't have tickets.	9295533	Chan eil ticeadan aca.
436555	I don't understand you.	9295537	Chan eil mi leat.
6927482	I'm not following.	9295537	Chan eil mi leat.
9295540	I'm not sure about it at all.	9295539	Chan eil mi cinnteach às is mu dheidhinn idir.
4012267	That's not completely true.	9295541	Chan eil sin buileach fìor.
9295546	Has he lost it altogether?	9295545	A bheil e air a chall buileach?
9295549	I came face to face with a bull.	9295548	Bhuail tarbh nam aghaidh.
9295551	I came across him.	9295550	Thàinig mi na lùib.
9295552	I ran into him.	9295550	Thàinig mi na lùib.
9295554	James was certain that the train was coming.	9295553	Bha Seumas cinnteach gun robh an trèan a' tighinn.
9295557	We were sure of the result.	9295556	Bha sinn cinnteach às an toradh.
9295559	They are confident of themselves.	9295558	Tha iad cinnteach asta fhèin.
2713185	You're busy now, aren't you?	852126	Tha thu trang an-dràsda, nach eil?
2713185	You're busy now, aren't you?	852127	Tha sibh trang an-dràsda, nach eil?
9700638	Pay attention on the road.	3577547	Aire air an rathad!
356200	Who are you?	9854945	Cò sibhse?
