1356	This is always the way it has been.	8862472	Takto to bolo vždy.
1357	I think it is best not to be impolite.	8862474	Myslím, že najlepšie je nebyť nezdvorilý.
1358	One can always find time.	8862476	Vždy sa dá nájsť čas.
1359	I'd be unhappy, but I wouldn't kill myself.	8862477	Bol by som nešťastný, ale nezabil by som sa.
1360	Back in high school, I got up at 6 a.m. every morning.	8862479	Na strednej škole som sa zobúdzal o šiestej každé ráno.
1361	When I woke up, I was sad.	8862484	Keď som sa zobudil, bol som smutný.
1363	I thought you liked to learn new things.	8862491	Myslel som, že sa rád učíš nové veci.
1364	Most people write about their daily life.	8862495	Väčšina ľudí píše o svojom každodennom živote.
1367	Every person who is alone is alone because they are afraid of others.	8862503	Každý, kto je sám, je sám, pretože sa bojí druhých.
1369	I am not an artist. I never had the knack for it.	8862505	Nie som umelec. Nikdy som na to nemal nadanie.
1370	I can't tell her now. It's not that simple anymore.	8862506	Teraz jej to nemôžem povedať. Už to nie je také jednoduché.
1371	I am a flawed person, but these are flaws that can easily be fixed.	8862507	Mám svoje nedostatky, ale sú to nedostatky, ktoré sa dajú ľahko napraviť.
1372	Whenever I find something I like, it's too expensive.	8862508	Vždy, keď nájdem niečo, čo sa mi páči, je to príliš drahé.
1374	Maybe it will be exactly the same for him.	8862511	Možno to bude pre neho úplne rovnaké.
1375	Innocence is a beautiful thing.	8862514	Nevinnosť je prekrásna vec.
1379	That is intriguing.	8862517	Je to pozoruhodné.
6357930	Tom didn't watch TV.	8862530	Tom nepozeral televízor.
2868013	Mary made breakfast.	8862533	Mária urobila raňajky.
6439138	Tom left here at about 2:30.	8862748	Tom odtiaľto odišiel okolo pol tretej.
6357579	I don't often laugh.	8862750	Nesmejem sa často.
5263804	I asked Tom to be quiet.	8862752	Požiadal som Toma, aby bol ticho.
2541921	I'm being treated like a child.	8862754	Zaobchádzali so mnou ako s dieťaťom.
2255033	You look disappointed.	8862755	Vyzeráš sklamane.
2111964	Be creative.	8862757	Buď tvorivý!
1092796	Tom thought everything was in order.	8862760	Tom si myslel, že všetko je v poriadku.
246451	The fact that I'm here proves that I'm innocent.	8862765	Skutočnosť, že som tu, dokazuje, že som nevinný.
7768530	You cannot die.	8862773	Nemôžeš zomrieť.
7752803	Slice the cucumbers as thinly as possible.	8862776	Nakrájajte uhorky čo najtenšie.
5216726	I'll have to try it again.	8862781	Musím to skúsiť znova.
3309985	We've got to stick together.	8862784	Musíme sa držať spolu.
2276424	You're drawing attention to yourself.	8862786	Priťahuješ na seba pozornosť.
1546934	Time to get the hell out of here.	8862788	Je čas odtiaľto vypadnúť.
329155	The lion bared its teeth even further.	8862794	Lev ešte väčšmi vyceril zuby.
303151	He resigned his post on account of illness.	8862797	Odstúpil zo svojho miesta z dôvodu choroby.
289839	Whenever he comes to this place, he orders the same dish.	8862799	Vždy, keď sem príde, objedná si to isté jedlo.
8538763	Tom would like to know all the languages in the world.	8862801	Tom by chcel vedieť všetky jazyky sveta.
7186201	Tom doesn't doubt Mary will arrive on time.	8862804	Tom nepochybuje, že Mária dorazí včas.
6274447	Tom said he's bored.	8862809	Tom povedal, že sa nudí.
6254146	Tom has been sleeping all afternoon.	8862814	Tom spal celé popoludnie.
5112025	Tom says that he can speak six languages.	8862817	Tom hovorí, že vie rozprávať šiestimi jazykmi.
3201991	What am I supposed to tell Tom now?	8862822	Čo mám akože teraz povedať Tomovi?
2876804	She filled a bottle.	8862823	Naplnila fľašku.
1951585	I can't explain it now.	8862825	Nemôžem to teraz vysvetliť.
8536838	He only eats vegetables that he grows himself.	8862826	Je iba zeleninu, ktorú si sám vypestoval.
7410360	They said they were prepared.	8862830	Povedali, že sú pripravení.
6637106	Capers are like little olives.	8862832	Kapary sú ako malé olivy.
5822523	Tom finished third in the race.	8862833	Tom skončil v závode tretí.
5357064	Put the pizza in the oven.	8862835	Daj pizzu do trúby.
3528688	Everyone should be able to express their opinion.	8862837	Každý by mal mať možnosť vyjadriť svoj názor.
2953318	That was just a joke.	8862840	Bol to iba vtip.
59636	Three large buildings near here are under construction.	8862841	Tri veľké budovy v blízkosti sú vo výstavbe.
38117	There's a long line at every cash register.	8862842	Pri každej pokladni je dlhá rada.
7774497	She has Ukrainian citizenship.	8862843	Ona má ukrajinské občianstvo.
6852735	Tom lives on the other side of the city.	8862845	Tom žije na druhej strane mesta.
2538952	I'll explain everything when I see you.	8862849	Keď ťa uvidím, všetko ti vysvetlím.
546007	The idea isn't bad.	8862850	Myšlienka nie je zlá.
7521680	Everyone knows it worked.	8862852	Každý vie, že to išlo.
3724730	I don't think I've ever seen anything so beautiful.	8862854	Nemyslím si, že som niekedy videl niečo tak prekrásne.
6126421	Could you help me move the table?	8862855	Mohli by ste mi pomôcť posunúť stôl?
4010337	Tom removed his fake beard.	8862857	Tom si zložil svoju falošnú bradu.
3909279	I'm going to surprise him.	8862858	Idem ho prekvapiť.
3904425	We've got to go warn her.	8862859	Musíme ju varovať.
3713724	I like clothes.	8862860	Páči sa mi oblečenie.
2355815	Please turn right.	8862861	Prosím, zabočte doprava.
1024175	Tom shot himself in the leg accidentally.	8862862	Tom sa omylom postrelil do nohy.
6576700	I'm not against it.	8862863	Nie som proti tomu.
5184775	I can't wait to get out of here.	8862866	Nemôžem sa dočkať, až sa odtiaľto dostanem.
4500398	Keep the lights on.	8862867	Nechajte zapnuté svetlá.
2451104	We all took it for granted that Tom could speak French.	8862871	Všetci sme brali ako samozrejmosť, že Tom vie hovoriť po francúzsky.
680615	A treatment will cure the disease.	8862872	Liečba vylieči chorobu.
5168389	I wish I had paid my bills on time.	8862876	Kiež by som zaplatil účty včas.
7977937	I'll have to tell Tom the truth tomorrow.	8862881	Zajtra musím povedať Tomovi pravdu.
3133202	Nothing unexpected happened today.	8862889	Nič neočakávané sa dnes nestalo.
2646313	Tom sent Mary flowers.	8862892	Tom poslal Márii kvety.
7869335	I would say exactly the same.	8862895	Povedal by som presne to isté.
3739569	Many Christian rituals have pagan origins.	8862915	Mnohé kresťanské zvyky majú pohanský pôvod.
3958642	Nicolaus Copernicus was born in Poland in 1473.	8862922	Mikuláš Kopernik sa narodil v Poľsku roku 1473.
6526453	I'm not happy with how the painters painted my office.	8862948	Nie som spokojný s tým, ako maliari vymaľovali moju kanceláriu.
5842290	Who threw a pie at Tom?	8862953	Kto hodil koláč na Toma?
5753955	They had no success.	8862954	Nemali žiadny úspech.
2236753	Tom is learning.	8862967	Tom sa učí.
2145956	We haven't seen him anywhere.	8862969	Nikde sme ho nevideli.
1547672	I came earlier than her.	8862971	Prišiel som skôr než ona.
2859437	She tried that.	8862973	Skúsila to.
5695933	I washed the dishes after I'd eaten dinner.	8862979	Po večery som umyl riady.
5141935	Every great achievement was once considered impossible.	8862987	Každý veľký úspech bol raz považovaný za nemožný.
3918815	I think we can catch him.	8862990	Myslím, že ho môžeme chytiť.
435058	He's already beginning to talk.	8862992	Už začína hovoriť.
323586	I had to take shelter under a tree.	8862997	Musel som sa schovať pod strom.
252614	I'll stay there till six o'clock.	8863001	Zostanem tam do šiestej.
6658000	I told Tom he should stop drinking.	8863005	Povedal som Tomovi, že by mal prestať piť.
6248766	How many loaves of bread did you buy?	8863011	Koľko pecňov chleba si kúpil?
3728719	You have to follow your heart.	8863014	Musíš nasledovať svoje srdce.
8182788	I won't be back until next week.	8863018	Vrátim sa až budúci týždeň.
7386710	He's on his way to work.	8863019	Je na ceste do práce.
6526828	Tom should've told Mary why he wanted to do that.	8863021	Tom mal povedať Márii prečo to chcel urobiť.
6427433	I helped Mary do her homework.	8863022	Pomohol som Márii urobiť domácu úlohu.
3204632	Should we tell Tom he doesn't need to do that?	8863024	Mali by sme povedať Tomovi, že to nemusí robiť?
2244275	I didn't expect it to cost so much.	8863026	Nečakal som, že to bude toľko stáť.
2241003	We're survivors.	8863027	Sme preživší.
2038353	Do not eat in class.	8863028	Nejedzte v triede.
18575	I will give you the money tomorrow.	8863030	Dám ti peniaze zajtra.
7494272	Where did she learn to dance?	8863033	Kde sa naučila tancovať?
6995540	Portugal and Spain are neighbors.	8863037	Portugalsko a Španielsko spolu susedia.
6440117	How much butter is left?	8863038	Koľko zostalo masla?
6090785	Tom was obviously in a hurry.	8863041	Tom sa očividne ponáhľal.
2541480	I wonder why Tom isn't here yet.	8863048	Zaujímalo by ma, prečo tu Tom ešte nie je.
2323035	I don't remember any of their names.	8863050	Nepamätám si žiadne z ich mien.
45803	That teacher is in charge of the third-year class.	8863054	Ten učiteľ má na starosti triedu tretieho ročníka.
7786198	If you want to be happy, make someone else happy!	8863057	Ak chceš byť šťastný, urob šťastným niekoho druhého!
7733846	Why does Tom look so pale?	8863060	Prečo vyzerá Tom tak bledo?
6522895	Tom and Mary lost their pencils.	8863062	Tom a Mária stratili svoje ceruzky.
5481161	We were all thirsty.	8863065	Všetci sme boli smädní.
3374771	It's still very early.	8863067	Stále je veľmi skoro.
2592593	Tom learned French perfectly studying by himself.	8863072	Tom sa sám dokonale naučil francúzsky.
2245038	Can I begin?	8863073	Môžem začať?
8300144	Where shall we go tonight?	8863074	Kam pôjdeme dnes večer?
6884492	Write a sentence that isn't vague in meaning!	8863075	Napíšte vetu, ktorá nemá nejasný význam!
6865021	Neither of those boys can speak French.	8863077	Ani jeden z tamtých chlapcov nevie francúzsky.
3920453	Didn't I warn you about him?	8863079	Nevaroval som ťa pred ním?
2645855	Tom is really confused.	8863081	Tom je naozaj zmätený.
2405863	I said I'd wait.	8863082	Povedal som, že počkám.
8412786	What I'm really interested in is astronomy.	8863084	To, čo ma skutočne zaujíma, je hvezdárstvo.
8272676	Could you bring me a glass of water?	8863085	Mohli by ste mi priniesť pohár vody?
6797113	Why didn't someone stop me?	8863086	Prečo ma niekto nezastavil?
3318903	Tom was born on a plane.	8863087	Tom sa narodil na lietadle.
305129	We are three points ahead of their team.	8863088	Vedieme tri body pred ich družstvom.
8173717	He doesn't want to disturb you.	8863089	Nechce vás vyrušovať.
5108386	You have a child-like face.	8863091	Máš detskú tvár.
1970110	I'm glad we're best friends.	8863092	Som rád, že sme najlepší priatelia.
6738373	Who makes the best cakes in the city?	8863093	Kto robí najlepšie koláče v meste?
5731752	You need to play by the rules.	8863094	Musíte hrať podľa pravidiel.
1380	You are saying you intentionally hide your good looks?	8865518	Hovoríš, že zámerne skrývaš svoj dobrý vzhľad?
1382	If anyone was to ask what the point of the story is, I really don't know.	8865535	Ak by sa niekto spýtal, že aký je zmysel príbehu, naozaj neviem.
1383	I didn't know where it came from.	8865544	Nevedel som, odkiaľ sa to vzalo.
1384	I think my living with you has influenced your way of living.	8865548	Myslím, že naše spolunažívanie ovplyvnilo tvoj spôsob života.
1386	I didn't like it.	8865550	Nepáčilo sa mi to.
1387	She's asking how that's possible.	8865552	Pýta sa, ako je to možné.
1388	You're just running away from life's problems.	8865555	Ty iba utekáš od ťažkostí života.
1389	If you look at the lyrics, they don't really mean much.	8865559	Ak sa pozrieš na slová básne, naozaj veľa neznamenajú.
1391	You can do it.	8865560	Ty to dokážeš.
1392	My physics teacher doesn't care if I skip classes.	8865561	Môjmu fyzikárovi je jedno, či pôjdem za školu.
1393	I wish I could go to Japan.	8865563	Kiež by som mohol ísť do Japonska.
1395	I have to go to bed.	8850048	Musím ísť spať.
1396	After that, I left, but then I realized that I forgot my backpack at their house.	8865582	Potom som odišiel, ale následne som si uvedomil, že som si zabudol batoh v ich dome.
1397	I won't ask you anything else today.	8865585	Dnes sa vás už na nič iné neopýtam.
1402	That wasn't my intention.	8865594	To nebol môj zámer.
1403	Thanks for your explanation.	8865596	Ďakujem za vysvetlenie.
1406	If you didn't know me that way then you simply didn't know me.	8865601	Ak si ma z tej strany nepoznal, tak si ma nepoznal vôbec.
1408	I don't know what you mean.	8865603	Neviem, čo máš na mysli.
1409	My computer has got to be useful for something.	8865605	Môj počítač musí byť na niečo užitočný.
1410	You wanted to tell me about freedom?	8865608	Chcel si mi povedať o slobode?
1411	Uh, now it's really weird...	8865610	Oh, teraz je to naozaj čudné...
1412	If I wanted to scare you, I would tell you what I dreamt about a few weeks ago.	8865611	Ak by som ťa chcel vystrašiť, povedal by som ti, čo sa mi snívalo pred pár týždňami.
1414	There are many words that I don't understand.	8865612	Je veľa slov, ktorým nerozumiem.
1415	I don't like it when mathematicians who know much more than I do can't express themselves explicitly.	8865616	Nepáči sa mi, keď sa matematici, vediaci oveľa viac ako ja, nevedia jasne vyjadriť.
1416	You're really not stupid.	8865618	Ty naozaj nie si hlúpy.
1417	I need to ask you a silly question.	8865620	Musím ti položiť hlúpu otázku.
1418	I don't know how to demonstrate it, since it's too obvious!	8865623	Neviem, ako to dokázať, keďže je to príliš očividné!
1420	Can it be phrased in another way?	8865625	Môže to byť vyjadrené iným spôsobom?
1421	No one will know.	8865627	Nikto to nebude vedieť.
1422	I found a solution, but I found it so fast that it can't be the right solution.	8865629	Našiel som riešenie, ale našiel som ho tak rýchlo, že nemôže byť správne.
1423	It seems interesting to me.	8865630	Zdá sa mi to zaujímavé.
1424	Except that here, it's not so simple.	8865631	Až na to, že tu to nie je tak jednoduché.
1425	I like candlelight.	8865632	Mám rád svetlo sviečok.
1426	What did you answer?	8865634	Ako si odpovedal?
1427	No, he's not my new boyfriend.	8865637	Nie, on nie je môj nový priateľ.
1429	You never have class or what?!	8865638	To nikdy nemáš vyučovanie alebo čo?!
1432	I can only wait.	8865640	Môžem iba čakať.
1433	It's not much of a surprise, is it?	8865641	Nie je to žiadne prekvapenie, však?
1436	I am curious.	8865642	Som zvedavý.
1439	Why don't you come visit us?	8865646	Prečo nás neprídete navštíviť?
1440	But the possibility seems unlikely.	8865648	Ale tá možnosť sa zdá nepravdepodobná.
1442	I shouldn't have logged off.	8865651	Nemal som sa odhlásiť.
1443	I don't know what to do anymore.	8865655	Už neviem, čo si počať.
1444	It is inevitable that I go to France someday, I just don't know when.	8865658	Je nevyhnutné, že jedného dňa pôjdem do Francúzska, len neviem kedy.
1446	I didn't want this to happen.	8865661	Nechcel som, aby sa toto stalo.
1447	You can probably guess what happens though.	8865664	Pravdepodobne však tušíte, čo sa stane.
1449	What other options do I have?	8865671	Aké iné mám možnosti?
1450	I am not much of a traveller.	8865675	Nie som veľmi cestovateľ.
1451	I have nothing better to do.	8865678	Nemám nič lepšieho na práci.
1452	I can't explain it either.	8865681	Ani ja to neviem vysvetliť.
1453	Everyone has strengths and weaknesses.	8865686	Každý má silné i slabé stránky.
1455	It only shows you're not a robot.	8865701	Iba to ukazuje, že nie si robot.
1456	How could I be a robot? Robots don't dream.	8865707	Ako by som mohol byť robotom? Roboti nesnia.
1458	It's not something anyone can do.	8865718	Je to niečo, čo každý môže urobiť.
1459	I don't know if I still have it.	8865720	Neviem, či to ešte stále mám.
1387294	Let him wait!	8867175	Nechaj ho čakať!
4303577	Through the window, I see a river.	8867180	Cez okno vidím rieku.
4303545	He had respiratory problems.	8867187	Mal dýchacie ťažkosti
2270338	Don't come in here.	8867194	Nevchádzaj sem!
325765	I hear you are good at cooking.	8867196	Počul som, že dobre varíš.
3070064	Nobody noticed me.	8867198	Nikto si ma nevšimol.
59318	This park reminds me of my childhood.	8867203	Tento park mi pripomína moje detstvo.
3916835	They found her.	8867204	Našli ju.
6244552	I did exactly the same thing Tom did.	8867208	Urobil som presne to isté, čo aj Tom.
6244553	Tom did exactly what we wanted him to do.	8867211	Tom urobil presne to, čo sme chceli, aby urobil.
3142647	Tom couldn't answer that question.	8867216	Tom nemohol odpovedať na tú otázku.
3246561	Shortly after, they were married.	8867223	Krátko nato sa vzali.
1745	The key question is not what can I gain but what do I have to lose.	8867232	Kľúčové je nie to, čo môžem získať, ale to, čo musím stratiť.
408037	I'm not sure how much we should wait.	8867233	Nie som si istý, ako dlho by sme mali čakať.
3825019	Why are you here so early?	8867234	Prečo ste tu tak skoro?
7367683	I'm ready for the next step.	8867235	Som pripravený k ďalšiemu kroku.
1785568	I'm going to write a sentence in German.	8867240	Napíšem vetu v nemčine.
8665765	I've already started learning Russian.	8867243	Už som sa začal učiť rusky.
5871053	Do you speak Portuguese?	8867246	Hovoríte portugalsky?
8316165	I admire native speakers of English who are learning Czech.	8867253	Obdivujem tých, ktorých rodný jazyk je angličtina a učia sa česky.
70402	What is your mother tongue?	8867257	Aký je tvoj materinský jazyk?
3700383	Her French is not fluent.	8867272	Jej francúzština nie je plynulá.
7355493	The people thirst for freedom.	8867320	Ľudia žíznia po slobode.
1676743	The cat likes sleeping.	8867343	Mačka rada spí.
1476885	Birds have wings.	8867347	Vtáci majú krídla.
1806274	My cat loves toys.	8867350	Moja mačka zbožňuje hračky.
3835187	Mosquitoes are carriers of diseases.	8867354	Komáre sú prenášačmi chorôb.
3234527	Do you like insects?	8867355	Máte radi hmyz?
2535332	How many bees live in a hive?	8867356	Koľko včiel žije v úli?
20120	You like elephants.	8867359	Máte radi slony.
2216498	"Moo, moo," said the cow.	8867371	"Mú, mú," zamučala krava.
1550026	The dogs barked all night.	8867372	Psy štekali celú noc.
1357070	Dogs bark.	8867378	Psy štekajú.
2761168	Squirrels eat seeds and nuts, as well as insects and mushrooms.	8867396	Veveričky jedia semienka a oriešky, ako aj hmyz a huby.
301615	He knows a lot about butterflies.	8867409	Vie veľa o motýľoch.
2940756	Have you ever seen a monkey?	8867412	Videl si už niekedy opicu?
65169	Parrots imitate human speech.	8867414	Papagáje napodobňujú ľudskú reč.
295256	He has ten cows.	8867415	Má desať kráv.
1345901	Find the cat.	8867421	Nájdi mačku!
6330771	What do foxes eat?	8867422	Čo jedia líšky?
18079	A bear can climb a tree.	8867424	Medveď vie vyliezť na strom.
866505	The cow goes "moo," the rooster goes "cock-a-doodle-doo," the pig goes "oink, oink," the duck goes "quack, quack" and the cat goes "meow."	8867443	Krava robí "mú", kohút "kikirikí", prasa "kroch-kroch", kačka "kač-kač" a mačka robí "mňau".
484882	Do you like eating fish?	8867444	Máš rád ryby?
1785569	I'll write a sentence in German.	8867240	Napíšem vetu v nemčine.
1460	What do you think I've been doing?	8867502	Čo si myslíš, že som robil?
1461	Don't underestimate my power.	8867503	Nepodceňujte moju moc.
1464	I was wondering if you were going to show up today.	8867507	Premýšľal som, či sa dnes ukážeš.
1467	All you can do is trust one another.	8867511	Jediné, čo môžete urobiť, je dôverovať si navzájom.
1468	Everyone wants to meet you. You're famous!	8867513	Každý vás chce stretnúť. Ste slávni!
1469	Why are you sorry for something you haven't done?	8867514	Prečo cítiš ľútosť za niečo, čo si neurobil?
1474	You'd be surprised what you can learn in a week.	8867515	Boli by ste prekvapení, čo všetko sa môžete naučiť za týždeň.
377816	Fine. And you?	8867558	Dobre. A vy?
299486	He hopes he'll win and I hope so too.	8867568	Dúfa, že vyhrá a ja tiež.
321998	We have nothing in common.	8867732	Nemáme nič spoločné.
1891003	I'm here to help you.	8867801	Som tu, aby som ti pomohol.
1475	I don't have anyone who'd travel with me.	8868965	Nemám nikoho, kto by so mnou cestoval.
1476	You're not fast enough.	8868966	Nie si dosť rýchly.
1479	Stop it! You're making her feel uncomfortable!	8868972	Prestaň! Kvôli tebe sa cíti nepríjemne!
1480	Nothing is beautiful but the truth.	8868976	Jedine pravda je krásna.
1481	Tomorrow, he will land on the moon.	8868978	Zajtra pristane na Mesiaci.
1482	I don't speak Japanese.	8868989	Nehovorím japonsky.
1483	This is a pun.	8869003	Je to slovná hra.
1488	I just wanted to check my email.	8869040	Len som si chcel skontrolovať elektronickú poštu.
1489	Do you really need to ask the question to know the answer?	8869053	Naozaj sa musíš pýtať, aby si vedel odpoveď?
1490	You can't expect me to always think of everything!	8869070	Nemôžeš očakávať, že budem vždycky myslieť na všetko.
1491	I suppose that behind each thing we have to do, there's something we want to do...	8869110	Myslím, že za všetkým, čo musíme urobiť, sa skrýva niečo, čo urobiť chceme...
1494	You never have time for important things!	8869126	Nikdy nemáš čas na dôležité veci!
1496	It would take me too much time to explain to you why it's not going to work.	8869158	Zabralo by mi príliš veľa času vysvetliť vám, prečo to nepôjde.
1504	Would you like something to drink?	8869206	Dáte si niečo na pitie?
1505	"Who is it?" "It's your mother."	8869217	„Kto je to?“ „Tvoja matka."
1506	"When will you be back?" "It all depends on the weather."	8869233	„Kedy sa vrátiš?“ „Záleží na počasí.“
1507	"What's the matter?" asked the little white rabbit.	8869248	"Čo sa deje?" spýtal sa malinký biely králik.
1508	"What's going on in the cave? I'm curious." "I have no idea."	8869258	„Čo sa deje v jaskyni? Som zvedavý.“ „Netuším.“
1509	We must learn to live together as brothers, or we will perish together as fools.	8869264	Musíme sa naučiť žiť spolu ako bratia, inak zahynieme spolu ako hlupáci.
1511	"To tell you the truth, I am scared of heights." "You are a coward!"	8869268	„Aby som povedal pravdu, bojím sa výšok.“ „Si zbabelec!“
8873732	It's unfortunately true.	1058174	Bohužiaľ je to pravda.
4529729	Tom should've told the truth.	8874042	Tom mal povedať pravdu.
2549793	Go back, Tom.	8874043	Vráť sa, Tom.
244079	I will do my best.	8874046	Urobím, čo je v mojich silách.
1026289	Tom didn't sleep at all last night.	8874049	Tom minulú noc vôbec nespal.
23784	It has been raining since Tuesday.	8874051	Od utorka prší.
3182046	Tom looked around to see who was talking.	8874237	Tom sa rozhliadol, aby zistil, kto hovorí.
8874231	It was him who broke the vase.	8874240	Bol to on, kto rozbil vázu.
1023895	Tom will be thirty in March.	8874241	Tom bude mať v marci tridsať rokov.
261171	I am glad to see her.	8874243	Som rád, že ju vidím.
268249	An elephant is a strong animal.	8874247	Slon je silné zviera.
268258	An elephant has a long nose.	8874248	Slon má dlhý nos.
63324	A fox is a wild animal.	8874249	Líška je divé zviera.
489749	A cat scratched me.	8874250	Poškriabala ma mačka.
47453	The boy caught the cat by the tail.	8874252	Chlapec chytil mačku za chvost.
537045	My monkey ran away!	8874254	Moja opica utiekla!
63624	A canary is a small bird and people sometimes keep it as a pet.	8874255	Kanárik je malý vtáčik a ľudia ho niekedy chovajú ako domáce zvieratko.
53504	A baby deer can stand as soon as it's born.	8874256	Jelenča môže stáť hneď po narodení.
258980	I've never seen a live whale.	8874259	Nikdy som nevidel živú veľrybu.
309604	Her cat had another four kittens.	8874263	Jej mačka mala ďalšie štyri mačiatka.
268252	Elephants live in Asia and Africa.	8874264	Slony žijú v Ázii a Afrike.
264929	A turkey is a little bigger than a chicken.	8874267	Morka je o čosi väčšia ako sliepka.
305643	They hunted deer and foxes.	8874268	Poľovali na jelene a líšky.
627426	Dogs can't tell colors apart.	8874271	Psy nevedia rozoznať farby.
305596	They hunted foxes.	8874272	Poľovali na líšky.
246101	The kitten couldn't get down from the tree.	8874275	Mačiatko nemohlo zliezť zo stromu.
282381	The horse is a very useful animal.	8874277	Kôň je veľmi užitočné zviera.
19495	Cows provide us with milk.	8874279	Kravy nám dávajú mlieko.
239217	The dog bit the man.	8874282	Pes pohrýzol muža.
48224	The dog ran after the cat.	8874283	Pes bežal za mačkou.
67056	This is my dog.	8874284	Toto je môj pes.
1512	"Trust me," he said.	8876323	„Ver mi,“ povedal.
1513	"This is what I was looking for!" he exclaimed.	8876328	"Toto som hľadal!" zvolal.
1515	Their communication may be much more complex than we thought.	8876336	Ich dorozumievanie môže byť oveľa zložitejšie, než sme si mysleli.
