2367636	A lot of snow had just fallen.	4809123	Мъногъ снѣгъ палъ.
2367636	A lot of snow had just fallen.	4809125	Мъного снѣга пало.
1687643	As soon as I see him, I'll kill him.	4809134	Оли оузьрѭ и́ а оутьнѫ.
400191	What would you like to eat?	4809149	Чего бы хотѣлъ ѣсти?
400191	What would you like to eat?	4809150	Чего бы хотѣла ѣсти?
400191	What would you like to eat?	4809152	Чего бысте хотѣли ѣсти?
400191	What would you like to eat?	4809153	Чего быста хотѣла ѣсти?
2643065	Buy yourself something to eat.	4809157	Коупи собѣ чьто ѣсти.
2643065	Buy yourself something to eat.	4809158	Коупи собѣ чего ѣсти.
2643065	Buy yourself something to eat.	4809159	Крьни собѣ чего ѣсти.
2643065	Buy yourself something to eat.	4809162	Коупите собѣ чьто ѣсти.
2759524	I don't burn them.	4809173	Не жьгѫ ѣ.
2759524	I don't burn them.	4809174	Не палѭ ѣ.
2759524	I don't burn them.	4809176	Я їх не палю.
250796	Please answer me.	1116321	Дажь ми отъвѣтъ добро сътвори.
250796	Please answer me.	1116322	Отъвѣти ми добро сътворѧ.
250796	Please answer me.	1116323	Дажьте ми отъвѣтъ добро сътворѧ.
250796	Please answer me.	1116326	Отъвѣтите ми добро сътворѧ.
250796	Please answer me.	1116328	Отъвѣтита ми добро сътворѧ.
7306638	"Why are you not coming here?" "Because I don't want to."	558406	"Чємѹ тамо нє идєши?" "Бо нє хочѭ."
8332955	You're everything to me.	2709769	Вьсе ми єси.
8332955	You're everything to me.	2709770	Ѥси ми вьсе.
2025467	Zero, one, two, three, four, five, six, seven, eight, nine, ten.	493822	Ничьто жє, одинъ, дъва, триѥ, чєтырє, пѧть, шєсть, сємь, осмь, дєвѧть, дєсѧть.
66782	No, I don't know.	548487	Ни нє вѣмь.
1348673	I want to dance.	1557459	Хочѭ плѧсати.
302334	He is old.	1557554	Старъ єсть.
321441	Tell me the truth.	584002	Рьци ми право.
488205	I hear you, but I don't see you.	725717	Чюѭ тѧ нъ нє вижѭ.
