1434	I love you.	4269285	Ez tora heskena.
4432246	I'm tired. I'm going to bed.	4432599	Ez a'dizyaya. Ezo şıra rakeva.
4431830	She is not jealous.	4432830	A pexil niya.
4431192	There is an apple in the boy's pocket.	4432833	Tunıka lacekid sa esta.
4430609	Don't go out because it is cold.	4432837	Meşo teber serdo.
4430364	They're not jealous.	4432838	é pexil niyé.
4430109	I saw his daughter was crying.	4432844	Mé di keynaya ey bermayé.
4430040	I don't work today.	4432850	Ez evro né gırweyena.
4429469	I heard his voice in my sleep.	4432874	Mé vengé ey hewnéxud peyhesyaya.
4429468	I heard her voice in my sleep.	4432878	Mé vengé ay hewnéxud peyhesyaya.
4429420	I don't know why I'm laughing.	4432882	Ez nézana qandé çı eza huwena.
4429030	I love this language.	4432886	No zuwanira ez heskena.
4427204	One day, we will understand.	4432905	Rojé, madé fea'mkeré
4425737	I was late for work.	4432911	Ez karéxüra berey menda.
4424564	I'm going out today.	4432917	Evro ezo şıra teber.
4424535	The cat which you found is mine.	4432921	A ké pisinga to diya a émına.
4422396	Do you have dinner plans?	4432922	Qandi şamiya şani to sered çiyı esto?
4422372	We heard.	4432930	Ma peyhesyai.
4419657	This game is not bad.	4432934	Na kay xırab niya.
4419624	Mary is my wife.	4432940	Mary ciniya ména.
4417075	We will rescue them.	4432949	Madé ina béreynı.
4405225	"Me?" "Yes, you!"	4432987	"Ez?" "E, Tı!"
4404613	If I want, they will kill you.	4432988	Ez buwaza, édé to bıkşé.
4404612	If I want, they will kill her.	4432989	Ez buwaza, édé ay bıkşé.
4403660	This is the house.	4432990	No keyeo.
4402239	Sleep well, Timmy.	4432991	Weş rakew, Timmy.
4401094	Do I look tired?	4432994	Ez a'dizyaye asena?
4401083	Go to Tom's house.	4432996	Şo ké Tomi.
4401076	I didn't sleep.	4432997	Ez né rakewta.
4401063	I like children.	4432998	Ez qeçkara heskena.
4401009	We're finished.	4432999	Ma qedina.
4398733	You don't remember?	4433002	To viri nino?
4397941	Hanni and Nanni are twins.	4433016	Hanni u Nanni Dıleté.
4397642	I have no kids.	4433017	Qeçémı çınyé.
4397633	I'm here, too.	4433019	Edzi tiyada.
4397602	It's expensive.	4433024	O vayo.
4397601	It's very cheap.	4433026	O ercano.
4397597	Let's end this.	4433027	Bé ma ney bé qediné.
4397520	We can do this.	4433031	Ma şené ney bıkeré.
4393579	Why is your mouth open?	4433032	Çıré feké to akerdeo?
5257037	The horse is white.	4433043	Istor sıpeya.
2250003	Stay and watch.	4433045	Vınd u temaşeké.
2038371	Owls are active at night.	4433046	Kundi şew vıcéné.
2354171	I'm hungry. How about you?	4433048	Ez veyşana. ya tı?
3181167	Can we talk tomorrow?	4433054	Ma meşt qısey bé kerı beno?
2260610	What's your wife's job?	4433063	Cıniya to çé kar kena?
2235901	That's not Tom.	4433084	O Tom niyo.
3200476	He didn't tell me his name.	4433091	Ey mıré name é xü né va.
4410160	Tom does not have friends.	4433106	Imbazé Tomi çınyé.
4410147	The children will be happy.	4433107	Qeçid şa bé.
4409880	She has husband and two daughters.	4433113	Mérdeyi u dı keyneyé ay esta.
4409852	Tell her I'm hungry.	4433115	Ayré vac ez veyşana.
4407634	He blinked.	4433130	Ey çım şıkıt.
4406795	It is better than yesterday.	4433142	No vızéṙa rındo.
4406792	It's better than yesterday.	4433142	No vızéṙa rındo.
4404973	Tom, don't listen to them!	4433148	Tom, goştare é ina meké!
1583725	Wait for me next to that tree.	4433157	Na dar het mé bé paw.
2261898	Here comes Tom now.	4433160	Tom'o nika yeno.
1028243	Tom only saw Mary once.	4433169	Tom fıné tenya Mary di.
810614	Few people speak my language.	4433177	Tayn merdémi zuwanémı qısey kené.
877850	My name is Maria Sara.	4433187	Name é mé Maria Saraya.
1637154	He has holes in his clothes.	4433201	Çına é eyd qulli esté.
3910505	I never saw her before today.	4433211	Bé ewro mé qe a né diya.
1397712	Mary's shoes are dirty.	4433231	Sewl é Mary limıné.
2548544	Tom was a nice man.	4434732	Tom merdémo rınd bi.
3906607	Go talk to her.	4434737	Şo aya qısey bıkı.
3860096	I think Tom and Mary like each other.	4434748	Mırékı Tom u Mary péra h'eskené.
2821460	Who did you get this from?	4434758	To no kami ra gırot?
2375795	I knew you'd come back.	4434768	Mı zanayé şıma do peyd béré.
3903779	I came here with him.	4434776	Ma piya amey tiya.
3919141	Did you buy him a dog?	4434787	To eyri kûtıké erina?
2487657	How many people still speak your language?	4434792	Çend merdémi zıwané to qısey kené?
3150589	Tom didn't buy anything.	4434798	Tom çiyé né erina?
3471967	They could not swim.	4434802	İna né şa asnaw bé keré.
1635491	What's this dog's name?	4434806	Name yé no kûtıki çı çio?
3738450	Do you like my clothes?	4434808	Çına émı weşté to şıno?
2549240	Tom isn't hungry.	4434829	Tom veyşan nio.
2892871	Who is your mother?	4434834	Ma to kama?
4017310	Come back and see us again.	4434835	Peyd bé u fına ma bıviné.
843595	She seems OK now.	4434836	Nıka a ya rınd asena.
3177985	Go to sleep now.	4434838	Şo nıka rakew.
291456	He wants to eat both of them.	4434841	O wazeno hordınazi buro.
1461892	Who is this woman?	4434842	Na ceni kama?
3918347	We'll find her.	4434849	Ma dé ay bé viné.
276106	Is somebody there?	4434852	Ujad kes esto?
897307	The dog is yours.	4434854	Kûtık é to yo.
1138355	My grandmother cannot see.	4434858	Pirıka mé néşena bé vina.
2013579	I want to grow old with Mary.	4434864	Ez wazena ké Mary a piya kal ba.
2770033	She can't love you.	4434868	A to ra né şena heskero.
2335878	What did you say? I can't hear you.	4434870	To se va? Néşena aşnaw kera.
3821882	Are you lying right now?	4434873	Tı nıka derg biyé raşt?
3917043	Wait for them.	4434875	Qandé ina bé paw.
2698777	You look tired. You must have been working too hard.	4434877	Tı yé edizyaye asené. Qey karé to gran bi.
37426	Uncle Tom is my mother's brother.	4434880	Xalo Tom béra yé ma émıno.
4409461	Do not speak for others.	4434882	Qalé é bina mek.
2764122	I want to try riding a horse.	4434883	Ez qayila dınıştışé ıstoré cerıbna.
2541944	I'll never forget what you did.	4434886	O ké to kerd ezo qet xu viri nékera.
1463505	She has green eyes.	4434889	Çımê ay kıh'oê.
293058	He will soon come back.	4434891	Nezdid o do pey béro.
4102899	Now I don't know what to do.	4434892	Nıka nézana ké ez sekera.
3918155	I want to find him.	4434893	Qayila ez ey bé vina.
38755	How did you come to hear of it?	4434897	Seni to o pey h'esiyai?
72312	Get me up at eight.	4434898	Mı h'eşt werzané.
2544572	Tom is your son, not mine.	4434908	Tom lajé to yo, é mé nio.
2254706	Who came here?	4434914	Kam ame tiya?
2245196	Come get it.	4434915	Bé ey bigi.
2249608	No one's here.	4434920	Tiyad kes çınyo.
4266736	If you don't do that, you will be a dead man.	4434922	Tı ney nékeré, tı dé bı bé merde.
4016713	It's a game for children.	4434923	Na kay qandé qeçana.
2265983	Good evening!	4269281	Şanê şima xeyr!
636998	It's been ten years since my father died.	4434928	Mergé pi é mı ra des ser'i o ravérd.
2646110	Are you doing anything?	4434930	Tı yé çi yé kené?
4426228	Are they big?	4434937	Ê gırdê?
4426339	We want to speak with Tom.	4434941	Ma qayılé Toma qısey bé keré.
3927458	Dan is my new friend.	4434944	Dan émbaz é mı no neweo.
1977697	Do you want to do this?	4434951	Tı qayılé ney bé keré?
1164323	Tom played with his kids.	4434971	Tom qeçana kay kerd.
2361880	I'm not dead, am I?	4434982	Ez merde niya, né?
328246	What? You can't do it? You coward! Chicken!	4434987	Çé? Tı néşené ey bıkeré? Tı tersoneké! kerg!
3494926	Are all of them your friends?	4434994	é péro émbazé to yé?
3914188	I didn't want to kill him.	4435001	Ez qayıl né biya ey bıkşa.
2019159	I want to know why you're doing this.	4435007	Ez qayıla bé mısa qandé çé tı yé ney kené.
421984	I can't do any more than this.	4435013	Ney ra veşi ez néşena bıkera.
1951487	I can't do anything like that.	4435017	Zey ney çi ez néşena vıraza.
287574	His dream came true.	4435021	Hevné ey bé raşt.
2301247	I can hear Tom.	4435027	Eza Tom aşnewna.
1024293	Tom ran out of water.	4435030	Awa Tomi qedya.
3200160	Tom told me you were here.	4435033	Tomi mıré va tı yé tiyad.
2858876	He left this.	4435035	Ey ney verda.
4436133	Wait for me, I am coming.	4269283	Mı bıpaw eza yena.
4436135	The sun sets.	4269284	Roc şi awan.
2646763	What are they saying?	4434927	É yé se vané?
2218009	You're a beauty.	4436449	Tı xaseka.
4436567	Don't walk on other people's land.	4269288	A'rdi şari miyand me geyri.
2700850	Who sings in the summer, works in the winter.	4443719	O kê amnani dêri vaneno, zımıstani ji gırveyeno.
2348116	Analyn sold the cow.	4443729	Analyn manga rot.
3915534	Didn't you hear him?	4443737	To vengé ey né aşnawıt?
69861	Where did you see the boy?	4443744	To lajek kotid di?
2241163	We missed you.	4443759	Ma bériya to kerd.
2243362	They went inside.	4443781	Ê şi zerre.
3428420	What are we here for?	4443802	Qandi çé maé tiyad?
3905432	I told him we were friends.	4446071	Mı eyrê va ma ımbazi bi.
3905433	I told her we were friends.	4446075	Mı ayrê va ma ımbazi bi.
2011357	We want you here.	4446091	Ma to tiyad wazenê.
4015088	Can any of you tell me where Tom is?	4446100	Şımara ju şeno mı ré vaco Tom kotido?
1400445	Mary has a headache.	4446150	Sere yé Mary teweno.
3738333	Where is it that Tom wants to go?	4446154	O ké Tom o wazeno şıro kotiyo?
308118	Do you remember what she said?	4446157	Ay seva yeno to viri?
1300804	I was at home.	4446158	Ez keyed bi ya.
1335002	She asked me: "Who arrived first?"	4446172	Ay mı ra pers kerd: "Kam sıfte resa?"
1572787	I own one cat.	4446179	Ju pisinga ê mı esta.
319343	My father is two years younger than my mother is.	4446201	Piyé mı ma mı ra dı serri kıjo.
2245929	I know this.	4446206	Ez ney zana.
255281	I am talking with Tom.	4446211	Eza Tomiya qısey kena.
3434441	Tom said he'd be here.	4446214	Tomi va ezo ujad ba.
2248912	It wasn't good.	4446215	Rınd né bi.
2851573	Mary knows that.	4446217	Mary ay zana.
2644816	Tom says he's not hungry.	4446226	Tom vano ez veyşan niya.
3035041	You're in the right place.	4446229	Tiyé cayı raşt.
4445998	Nobody knew where he went.	4446235	Kes né zano o şi koti?
4440953	He looked at me and laughed.	4446241	Ey ewna mı u huwa.
4431831	Don't lie to yourself.	4446248	Xurê zuri me vac.
4430001	Who will sing tonight?	4446252	Emşo kamdo déri vaco?
4429992	I can count to a hundred.	4446255	Ez şena heta se amora.
2743108	No one has heard about this.	4446257	Kesi no né pey hesyao.
3222979	Come and sit over here.	4446258	Bé tiyad roş.
776134	Where does he want to go?	4446393	O wazeno şıro koti?
2203691	We're going.	4446405	Ma yê şıné.
3635858	My mommy went outside.	4446416	Maya mı şi teber.
1740930	My parents don't know.	4446433	Ma u piyê mı nê zanê.
2766133	I'm twenty-seven years old.	4446445	Ez vist u hewt serreya.
437146	I wash my hands before lunch.	4446451	Verê şamia dihir ez desté xu şıwena.
3123948	Yesterday was the first day of autumn.	4446459	Vızêr roca sıfte yéna wesari bi.
2646812	Tom will protect you.	4446464	Tomdo qayte é to bo.
3919229	I want to bring her here.	4446465	Ez qayıla ay biyara tiya.
3342785	You'll die out there.	4446466	Tıdo ujad bı meré.
2549016	They want it back.	4446468	Ê ey peyd wazené.
2014728	I'll tell you what I want to do.	4446471	Eza to rê vaci ez qayıla sekera.
2960548	I told him what you did.	4446473	O ké to ke mı eyré va.
2399184	You had a cat.	4446476	Pısinga to est bi.
526260	My brother Jacques is fourteen years old.	4446480	Bırayé mı no Jacques çarés (des u çe'har) serreo.
2241431	We never talk.	4446484	Ma qe pêra qısey nê kenê.
2953581	We can protect you.	4446487	Ma şené qayte é to bé.
2821190	Tom killed himself three months ago.	4446488	Tomi hiré mengi veri xu kışt.
1247011	I have one thousand and five hundred cows.	4446489	Hezar u panc sei mangeyi mı estê.
3185266	Tom stayed there for three days.	4446490	Tom ujad hirê roci mend.
1493435	He has green eyes.	4446492	Çımé ey kıh'oê.
428787	My knife is broken.	4446493	Kardiya mı şıkıteya.
297546	He told me to speak more slowly.	4446499	Ey mı rê va tayna hêdi qısey bık.
2700195	We don't know any songs.	4446510	Ma qe dêrê nê zanê.
2676832	Nobody understood me.	4446526	Kesi mı fea'm né kerd.
3736482	I don't want to do anything tonight.	4446540	Emşo ez nê wazena çiyê bé kera.
2308262	I couldn't make it stop.	4446550	Mı né şayé ey vındernayé.
2764199	Mom, I'm hungry.	4446563	Ma mı eza veyşan.
2642604	Tom said Mary was his daughter.	4446574	Tomi va Mary keynaya ê ya.
678214	Do you study or work?	4446597	Tı yê wanenê yazi gırweyenê?
2282103	She went home and cried.	4446620	A şi keye u bermê.
254852	I forgot it.	4446624	Mı ey xu viri kerd.
3171936	I think Tom is crazy.	4446655	Mı rê kê Tom xinto.
2243611	They're expecting you.	4446666	Ê yê to pawenê.
2237191	Tom looked inside.	4446675	Tom ewna zerre.
488218	She likes these cats.	4446684	A nê pısinga ra heskena.
282886	He will go in your place.	4446708	O do şıro cayê to.
37856	I'm so hungry that I could eat a horse.	4446718	Ez hend veyşana kê şena ıstoré bura.
2667332	Tom! How nice to see you again!	4446749	Tom! To fına vinayış çı weş!
2865351	Mary scared us.	4446763	Mary ma tersanê.
3911897	You missed me, didn't you?	4446794	To beriya mı kerda, nê?
2215731	Tom will stop you.	4446807	Tomdo to vınderno.
3329649	Can you come back on Monday?	4446814	Tı dışeme şenê peyd bêrê?
2210919	Why don't you talk to us now?	4446821	Nıka qandê çê tı yé maya qısey nê kenê?
3628370	I ate with my parents.	4446827	Mı ma u pi yê xuya piya we.
1572894	Which house is his?	4446834	Kanci keye é eyo?
749281	He's taller than me.	4446838	O mı ra dergêro.
2111636	Keep still.	4446840	Me leqı!
2647967	Tom didn't see you.	4446844	Tom to né vina.
3903862	I didn't go with her.	4446867	Ez aya nê şiya.
1884681	Where did you take your shoes off?	4446869	To kotid sewl ê xu veti?
3313002	We saw you come in.	4446875	Ma zerre dekevtış ê to di.
282062	The cat got through the hedge.	4446882	Pısing perçin ra ravêrd.
38246	I remember seeing you somewhere.	4446886	Mı viri yeno mı to cayêdê diyo.
3738231	Why don't you be quiet and listen?	4446888	Qandê çê şımayê bêveng nê benê u goştari nê kenê?
2237653	Tom saw it.	4446890	Tom ey di.
3098907	Don't worry. I'll look after your dog for you.	4446892	Me qehri. Qandê to ezo bewniya kutıki to.
2272115	They didn't say that.	4446895	İna no nê va.
1141095	Tom took some food home.	4446897	Tomi tayn şami berd keye.
3672971	"Do you understand?" "No, I don't."	4446913	"To fea'm kerd?" "Nê."
256172	I like to swim.	4448429	Ez asnaw kerdış ra hes kena.
2361338	I don't like Tom at all.	4448433	Ez Tomra qe hes nê kena.
3022635	Do you know whether Tom is married or single?	4448438	Tı zevıcyaye yê yazi azebê?
2299543	I brought some friends with me.	4448467	Çend ımbazi mı xud ard.
1520275	Tom is taller than me.	4448469	Tom mı ra dergériyo.
2851520	They found Mary.	4448490	İna Mary vina.
2241455	We stole it.	4448493	Ma o tırıt.
3909094	Take her out of here.	4448531	Ay tiyara vec teber.
3909093	Take him out of here.	4448532	Ey tiyara vec teber.
2094565	You're not my father.	4448536	Tı piyê mı niyé.
1955118	I can't wait until tomorrow.	4448538	H'eta meşt ez nê şena bê pawa.
3360615	Tom likes singing.	4448540	Tom dêri vatış ra hes keno.
2272724	Tom has gone away.	4448542	Tom şi duri.
2356926	You or I?	4448543	Tı yazi ez?
1956294	She's on her way home.	4448545	A raya keye yê xu serd.
2244985	Ask again later.	4448551	Dıma fına perskı.
3325827	The village was silent.	4448558	Dew béveng bi.
242781	How hot it is today!	4448559	Evro no çı germo?
2240311	We'll catch Tom.	4448560	Madé Tomi tepşé.
17520	I can't lie to you.	4448562	Ez nê şena torê zuri vaca.
801789	If it doesn't rain, let's go out.	4448565	Varış nê bose ma bı vıcyê teber.
267851	The girl walked slowly.	4448568	Keynek hêdi xu pay şi.
4426195	No one will come.	4450045	Kes to nê ro.
3909458	Nobody can stop him.	4450230	Kes nê şeno ey vındarno.
2951817	Don't swim here.	4450232	Tiyad asnaw mekerê.
3916628	I bought it from her.	4450234	Mı o ayra erina.
2240202	Tom went first.	4450238	Sıfte Tom şi.
3821051	We don't know what Tom said.	4450244	Ma nê zanê Tomi se va.
2249972	Someone has died.	4450250	Jew merd.
2255248	You tricked me.	4450258	To mı xapeyna.
2276206	I don't speak to Tom.	4450262	Ez Tomi ya qısey nê kena.
2244606	Is Tom hungry?	4450264	Tom veyşano?
3374654	I'll bring it to you.	4450266	Ezo ey torê biyara.
3392999	Is your wife home?	4450267	Cıniya to keyeda?
3825657	Nobody wants to come.	4450278	Kes nê wazeno bêro.
461155	His son died last year.	4450338	Lacê ey par merd.
65920	It is just noon.	4456672	Nıka dihira.
3822931	I hope you don't get lost.	4456674	Boka tı vıni nê bê.
1891099	I'm only joking.	4456678	Eza kuşat kena.
2011710	Tom wanted to sell it.	4456680	Tom waştê ey bê roşo.
2245404	Don't you remember?	4433002	To viri nino?
3903009	I've worked with them.	4456684	Ez inana gırveyaya.
3823264	I didn't understand the joke.	4456688	Mı na kuşatra fe'am nê ke.
3877388	I didn't kill those guys.	4456692	Nê merdıma mı nê kışt.
2243496	They were scared.	4456693	Ê tersaybi.
1719234	Have you ever milked a cow?	4456710	To qe şıtê manga dıto.
328976	Right - clear, left - clear..., OK, all clear.	4456722	Raşt - pak, çep - pak ..., pêro paki.
2548484	We're waiting, Tom.	4456751	Ma yê pawenê, Tom.
433721	Has anything changed?	4456754	Qe çiyê vırya?
1187519	The boy and the man are drinking water.	4456756	Lacek u mêrdeko aw şımeno.
4451185	I like all languages.	4456757	Ez pêro zıwananra hes kena.
2195160	I am not hungry.	4456758	Ez veyşan niya.
2752729	The day was hot.	4456761	A roj germ bi.
2738792	The cat is not mine.	4456762	Na pısing êmı niya.
2248482	Is that enough?	4456764	No beso?
2406300	I sent Tom back home.	4456766	Mı Tom peyd rışt keye.
1329262	I never saw her again.	4456768	Mı fına ay qe nê di.
2647769	Why did they do it?	4456771	Qandê çıçi ina o ke?
723671	It will grow old.	4456785	O do k'han bo.
3150789	I bought them for you.	4456786	Mı ina qandê to erina.
3183736	Tom didn't laugh, did he?	4456787	Tom nê huwa, nê?
2645427	Tom and I will help you.	4456788	Tom u ez mayê dest bıdê to.
2326577	I forgot you don't like carrots.	4456789	Mı xû viri ke tı buncikanra hes nê kenê.
1197857	Miriam wanted to marry Thomas.	4456790	Miriam waştê Thomasa bê zevıcyo.
280471	The road goes north from here.	4456791	Na ray tiyara vera rocawan şına.
3428289	Tom will soon be a father.	4456792	Tomdo nezdid bıbo pi.
2549138	I was on the road.	4456793	Ez rayra biya.
2892585	What do you think Tom will do?	4456795	To rê kê Tomdo sekero?
3452076	I've never seen her.	4456798	Mı a qe nê di.
3171076	Tom's not fat.	4456800	Tom qelaw niyo.
2091093	No one laughed.	4456804	Kes nê huwa.
63218	You look tired.	4456807	Tı edizyaye asenê.
18344	The sky is getting dark.	4456808	Azmêno beno tari.
2629816	Tom, where are you? Everyone's looking for you!	4456812	Tom, tı yê kotid? Pêro yê geyrenê to.
59381	This old house is made of wood.	4456813	No bano k'han darra vırazyayo.
4015935	I think I'm going to get fired.	4456814	Mı rê kê ezo bê qewirya.
3330441	I gave Tom a hug.	4456816	Ez pêşyaya Tomi.
3171067	We can end it.	4456817	Ma şenê bê qedinê.
2546498	I'm taking you with me.	4456821	Eza to xûd bena.
3913115	We can't all be like you.	4456824	Ma pêro zey to nê şenê bıbê.
2647333	What do you do here?	4456830	Tı yê tiyad sekenê?
3918815	I think we can catch him.	4456831	Mı rê kê ma şenê bê resê ey.
3342752	You think I'm crazy, don't you?	4456834	To rê kê ez xinta, wuni niyo?
240583	Is it true? Paul kissed Lily on the lips?	4456837	Na raşta? Pauli lewandê Lily ra maçkerdo?
2854027	He will bring Tom.	4456840	O do Tomi biyaro.
2891480	Is Tom out of his mind?	4456841	Tom xinto?
2891042	Did you do this all yourself?	4456842	Nê pêroy to tenya ke?
2241601	We'll leave now.	4456846	Nıka ma yê tiyara abıryê.
43503	The next day he went away.	4456848	Rocı dıma o şi duri.
280965	Never tell a lie again.	4456850	Qe fına zuri mekê.
1641931	Do you like your brother?	4456855	Tı bırayê xû ra hes kenê?
2507760	Tomorrow I'll turn 28.	4456872	Meşt ezo 28 serre ba.
33058	I saw her just the other day.	4456888	Mı a çend roci veri di.
433423	What did you say?	4456894	To se va?
2240308	We'll ask Tom.	4456895	Ma dê Tom ra pers kerê?
2240583	We're going out.	4456897	Ma yê şınê teber.
3620115	Tom, I'm doing this for you.	4456899	Tom, eza ney qandê to kena.
1915927	Nothing can stop him.	4456900	Qe çiyê nê şeno ey vındarno.
1801727	Let him talk.	4456904	Vera wa qısey bê kero.
19349	Do you like fish?	4456913	Tı masera hes kenê?
2549832	I did it.	4456921	Mı o ke.
29011	I wanted to go there.	4456930	Mı waştê şıra uja.
3309016	Tom is short and fat.	4456931	Tom kılm u qelawo.
978314	What did you say yesterday?	4456933	Vızêr to se va?
2713692	Don't be frightened.	4456935	Me tersê.
3910628	I saw them crying.	4456942	Mı di ê bermayê.
4344784	Tom is a friend of my friend's.	4456943	Tom ımbazê ımbazê mı no.
3439581	How did you break it?	4456945	To no seni şıkıt?
3177838	You can go to sleep now.	4456947	Nıka tı şenê şırê rakewê.
428379	Who is it?	4456949	O kamo?
60817	This door won't shut.	4456950	No kêber nê gêryeno.
2307965	I caught a fish!	4456951	Mı mase yê tepışt!
2240242	Tom works nights.	4456953	Tom bê şew gırweyeno.
3183735	Everybody laughed at Tom.	4456954	Pêro huway Tomi.
2545838	They'll know what to do.	4456955	Ê dê bê zanê ê dê sekerê.
2014232	Do you want me to tell you why?	4456958	Tı wazenê qandê çiyo ez to rê vaca?
3903913	I can't be friends with him.	4456960	Ez ê ya nê şena ımbazba.
3903914	I can't be friends with her.	4456962	Ez a ya nê şena ımbazba.
3184914	Stay away from this.	4456965	Neyra duri kew.
2546928	Tom will be home soon.	4456993	Nezdid Tomdo keyed bo.
3399628	My cat is sleeping on my bed.	4456995	Pısingamı aya cay mı sero rakewna.
3327609	She looks well. She looks good.	4456996	A weş asena. A rınd asena.
3222933	You can sit here.	4456997	Tı tiyad şenê roşê.
315729	She said to me, "Who arrived first?"	4456998	Ay mı rê va, "Kam sıfte resa ca?"
945580	Look! She's coming!	4456999	Bewni! Aya yena!
794269	That's his house.	4457000	No keye ê eyo.
2481727	Do you think it'll rain today?	4457001	To rê kê evrodo şılli bo?
2891199	Get it out of here.	4457003	Ey tiyara vecê.
2291159	I didn't forget about you, Tom.	4457004	Mı to xû viri nê ke, Tom.
325124	I'll be seventeen next year.	4457005	Serrna ezo hevtês serre ba.
4132530	No one can stop me now.	4457006	Nıka kes nê şeno mı vındarno.
2831763	Please drive slowly.	4457007	Hêdi bê ramê.
3401964	The best mirror is an old friend.	4457008	Lilikêndo rınd ımbazo kh'ano.
3914004	We all know you.	4457013	Ma pêro tı zanê.
2997139	Let somebody else do this.	4457018	Verad wa juna ney bê kero.
2033643	I want you to come with us tonight.	4457023	Ez wazena emşo tı ma ya piya bêrê.
30201	Stop, I say.	4457025	Eza vana, vındı.
3735410	Tom will never give up.	4457032	Tomdo qe fek nê verado.
2891896	Thanks to all of you.	4457034	Şıma pêro weş bê.
264618	Go tell him yourself.	4457036	Şo eyrê bê xû vac.
1125709	I miss you too!	4457038	Ezi bêriya to kena!
2545622	I don't want you to stay.	4457042	Ez nê wazena tı bê manê.
3168579	That's true too, isn't it?	4457047	No zi raşto, nê?
3360639	Tom loves to fish.	4457049	Tom mase tepıştışra hes keno.
2360626	I haven't told Tom.	4457050	Mı Tomi ra nê va.
3820779	Last night, I didn't sleep.	4457052	Bişew, Ez nê rakewta.
2239807	Tom was hungry.	4457053	Tom veyşan bi.
4454817	Emily's home.	4457057	Keye yê Emily.
3437355	This is a woman.	4457061	Na ceni ya.
4454068	This is a man.	4457064	No mêrdeko.
4454067	This is a boy.	4457066	No laceko.
4451901	I want him to be arrested.	4457069	Ez wazena o bê bo tepışyaye.
4451710	I don't want to talk to you today.	4457072	Ez evro nê wazena to ya qısey bê kera.
4451637	You did what?	4457073	To seke?
4450381	According to me we can do that.	4457077	Mı rê kê ma şenê ney bê kerê.
4450282	He saw nobody.	4457079	Ey kesi nê di.
4445361	That reminded me of you.	4457084	Ney to ard mı viri.
4444426	We are both her girlfriends.	4457087	Ma hordna ımbazê ayê.
4442624	The house was silent.	4457090	Keye bêveng bi
4442593	He kissed the back of her hand.	4457091	Ey peydê destê ay maç kerd.
4450323	There was no one home.	4457092	Ucad keyey çı nêbi.
4442736	I will find you, Charley.	4457093	Ezo to bê vina, Charley.
4442575	Show me what you have got in your hand.	4457094	Bımısnı mı to dest çı çi esto?
4424084	I can go there by foot.	4457106	Ez şena xû pay şıra uca.
4422208	Our grandfather is ill.	4457108	Kalıkê ma nêweşo.
3185211	Are you going to stay with us?	4457111	Tıdo maya piya bê manê?
1517417	They just taught me to swear.	4457112	İna mırê nengi çinayış mısna.
2157523	Tell me that was a joke!	4457113	Mırê vac na kûşat bi!
246210	What the heart thinks, the mouth speaks.	4457114	Çı çi bêro zeri, fekra o vıcêno.
