1283	The password is "Muiriel".	2428549	Heslo je „Muiriel“.
1317	I never liked biology.	1058173	Nikdy som nemal rád biológiu.
1434	I love you.	735094	Ľúbim ťa.
1564	Thank you very much!	2428453	Ďakujem vám veľmi pekne!
1646	My name is Jack.	2428509	Volám sa Jack.
1705	I'm tired.	2429390	Som unavený.
1785	I made my decision.	2926453	Spravil som svoje rozhodnutie.
1829	Life is beautiful.	600004	Život je pekný.
1860	I don't want to go to school.	3633427	Nechcem chodiť do školy.
1867	Justice is expensive.	2429450	Spravodlivosť je drahá.
1897	Close the door when you leave.	1043034	Zavri dvere keď odídeš.
2061	It is never too late to learn.	1036075	Na učenie nikdy nie je neskoro.
2068	I knew that today would be fun.	2226034	Vedel som, že dnes bude zábava.
2123	Tell them to call me before they leave.	1043037	Povedz im, aby mi zavolali predtým ako odídu.
2168	Where are you?	1317943	Kde si?
2333	Why do you want to leave today?	1043041	Prečo chceš dnes odísť?
2366	It's well done.	1413715	Dobrá práca.
6048	I buried my dog at the pet cemetery.	1035696	Pochoval som svojho psa na zvieracom cintoríne.
16148	You'd better start now.	2915866	Radšej by si mal začať teraz.
16806	Have you ever been to that village?	2912454	Bol si niekedy v tej dedine?
17006	Is this your son, Betty?	2927731	Je toto tvoj syn, Betty?
17283	Where is your school?	1753298	Kde máš školu?
17283	Where is your school?	2429474	Kde je tvoja škola?
17735	I need you.	2428898	Potrebujem ťa.
17816	Who took care of the dog while you were away?	1035699	Kto sa ti staral o psa kým si bol preč?
18019	There are a good many reasons why you shouldn't do it.	2929912	Je dosť veľa dôvodov, prečo by si to nemal robiť.
18019	There are a good many reasons why you shouldn't do it.	2929914	Existuje dosť veľa dôvodov, prečo by si to nemal robiť.
18354	Do you have any vacancies?	2929926	Máte nejaké voľné miesta?
18516	The rich sometimes despise the poor.	2914081	Bohatí niekedy opovrhujú chudobnými.
19143	Thank you for the information.	1548483	Ďakujem za informáciu.
20097	You are beautiful.	2429366	Ty si krásna.
20267	We should take into account that the train was delayed.	1035708	Mali by sme brať do úvahy meškanie vlaku.
20272	Our train stopped suddenly.	1036069	Náš vlak zrazu zastavil.
21398	Some of the students like to play the guitar.	1036087	Niektorí zo študentov radi hrajú na gitare.
22225	The sea was as smooth as glass.	2233467	More malo zrkadlovú hladinu.
22747	We were greatly surprised at the news of his sudden death.	2915836	Správa o jeho náhlej smrti nás veľmi prekvapila.
23902	The fire is burning furiously.	878930	Oheň planie.
24127	We have made numerous improvements to our house since we bought it.	1036057	Urobili sme početné vylepšenia na našom dome, odkedy sme ho kúpili.
24746	It is clear what must be done.	2914677	Je jasné, čo musí byť vykonané.
24746	It is clear what must be done.	2914678	Je jasné, čo sa musí spraviť.
25029	What's new?	2428456	Čo máte nové?
25104	Do you subscribe to any magazines?	878935	Odoberáš nejaké časopisy?
25310	What is happening?	878672	Čo sa deje?
26205	It is impossible to master English in a short time.	1036095	Je nemožné naučiť sa po anglicky za krátky čas.
26727	A bicycle will rust if you leave it in the rain.	2914236	Bicykel zhrdzavie, ak ho necháš v daždi.
27220	Move a step, and you'll be a dead man!	2929931	Jeden krok a budeš mŕtvy!
27388	It is impossible to master English in a year or so.	1036096	Je nemožné naučiť sa po anglicky za rok alebo tak.
27555	Hard work enabled him to get good marks.	1036046	Tvrdá práca mu umožnila dostávať dobré známky.
28659	Don't you think it a bad thing?	2914707	Nemyslíš, že je to zlá vec?
29846	The lion is the king of the jungle.	2788472	Lev je kráľ džungle.
30040	It is finally all over.	2230593	Konečne je to všetko za nami.
30057	Do you think we'll have good weather?	2914176	Myslíš, že budeme mať dobré počasie?
30313	Hi, Bill. How are you?	2431685	Ahoj, Bill. Ako sa máš?
30316	Hi! How are you?	1047019	Ahoj! Ako sa máš?
30542	Definitely!	2926389	Určite!
31390	No, thank you.	1047005	Nie, ďakujem.
32263	Bees make honey.	2927689	Včely robia med.
32875	What do you think about having breakfast at McDonald's?	2912457	Čo povieš na raňajky v McDonalde?
33002	Mark graduated from Harvard in 1991.	2228977	Mark promoval na Harvarde v roku 1991.
33043	He is but a child.	2926484	On je len dieťa.
33470	I found no money left in my pocket.	2926373	Nenašiel som žiadne peniaze v mojom vrecku.
34000	Beth is an odd girl who likes snakes.	1036080	Beth je čudné dievča, ktoré má rado hady.
34491	Bill was killed with a gun.	1035828	Bill bol zastrelený.
35229	Could you show me the way to the bus stop?	1046970	Mohli by ste mi ukázať cestu na autobusovú zastávku?
35564	Yes, my name is Karen Smith.	2431770	Áno, volám sa Karen Smith.
36041	What pretty flowers!	2915873	Aké krásne kvety!
36097	How cute!	2926426	Aké roztomilé!
36361	Why did you come to Japan?	408393	Prečo si prišiel do Japonska?
36397	Why do you blame me for what happened?	2914151	Prečo ma viníš za to, čo sa stalo?
36397	Why do you blame me for what happened?	2914154	Prečo ma obviňuješ za to, čo sa stalo?
36405	Why are you crying?	1060177	Prečo plačeš?
37338	Tom is the most handsome actor in the world.	2428836	Tom je najkrajší herec na svete.
37696	How old is Tony?	2428684	Koľko rokov má Tony?
38387	I'm sorry.	2429628	Ľutujem.
39476	I'd like to have cake for dessert.	1036111	Rád by som si dal koláč ako dezert.
39609	There is an apple on the table.	2684962	Na stole je jablko.
39610	There is a radio on the table.	2916537	Na stole je rádio.
39741	The tundra has a harsh climate.	2913726	Tundra má drsné podnebie.
39741	The tundra has a harsh climate.	2913727	Tundra má drsnú klímu.
40458	Tell whoever comes that I'm out.	1036091	Povedz komukoľvek kto príde, že som vonku.
41531	Please don't make so much noise.	2230581	Prosím ťa nerob toľko hluku.
41865	Don't expose it to the rain.	1036044	Nevystavujte to dažďu!
42740	That's a great idea.	2229086	To je vynikajúci nápad.
43348	The old man lived by himself.	2927634	Starý muž žil sám.
43557	Does the medicine act quickly?	1036079	Účinkuje ten liek rýchlo?
44626	The two boys are much the same in English.	878953	Tí dvaja chlapci majú zhruba rovnakú angličtinu.
44734	The island is covered with ice and snow during the winter.	1036101	Počas zimy je ostrov pokrytý ľadom a snehom.
45733	The war lasted two years.	1517192	Vojna trvala dva roky.
46105	The new law has deprived the citizens of their liberty.	2233463	Nový zákon obmedzil občianske slobody.
46251	The prize won't be given to her.	2915884	Výhra jej nebude odovzdaná.
46411	The boy has been absent from school for eight days.	1036051	Chlapec v škole chýbal osem dní.
46717	The collection is open to the public.	1036116	Kolekcia je prístupná verejnosti.
47233	I do remember the incident quite well.	2927687	Ja si pamätám ten incident celkom dobre.
48642	The money was divided among the three.	2929943	Peniaze boli rozdelené medzi troch.
48823	The machine was coated with dust.	2228967	Stroj bol pokrytí prachom.
48944	The school was established in 1650.	2226125	Škola bola založená v roku 1650.
50756	Take off your socks.	1336551	Daj si dole ponožky.
50925	I'll take you there.	2926327	Zoberiem ťa tam.
50925	I'll take you there.	2926328	Vezmem ťa tam.
51453	Excuse me. Can you direct me to the nearest subway station?	1047017	Prepáčte. Môžte ma nasmerovať na najbližšiu stanicu metra?
51454	Will you please let me go now?	2913692	Necháš ma prosím teraz ísť?
52555	John has a natural bent for tennis.	2226137	Ján je tenisový talent.
52704	What did John sing on the stage?	1036391	Čo spieval Jano na pódiu?
52966	Jorge is able to speak four languages.	2926369	Jorge dokáže hovoriť štyrmi jazykmi.
53047	There's no water coming out of the shower.	1035826	Zo sprchy nejde žiadna voda.
53747	Jane was a stewardess when she was young.	2912416	Jane bola za mladi letuška.
54013	Goodbye, Sayoko.	2429359	Dovidenia, Sayoko.
54668	This is the worst thing that has ever happened to me!	1036083	Toto je najhoršia vec, aká sa mi kedy stala!
55984	Is this your umbrella?	2913660	Je toto tvoj dáždnik?
55984	Is this your umbrella?	2913661	Je toto váš dáždnik?
56074	This is the end.	2065246	Toto je koniec.
56523	This theory is too difficult for me to comprehend.	2916547	Táto teória je pre mňa príliš zložitá na pochopenie.
56913	This book is worthy of praise.	2914717	Táto kniha je hodná chvály.
58090	This ship is driven by steam.	2915872	Táto loď je poháňaná parou.
60879	This tape doesn't stick.	2912452	Táto páska sa nelepí.
62312	The coach gave me some advice.	2226082	Tréner mi poradil.
63957	Is your mother at home?	1338451	Je doma tvoja matka?
64246	I am surprised that your family has a Japanese car.	409164	Prekvapuje ma, že tvoja rodina má japonské auto.
64443	Where is your cap?	1338445	Kde je tvoja čapica?
64653	Good night and sweet dreams.	2428449	Dobrú noc a sladké sny.
65097	I take care of my grandfather.	2914113	Starám sa o svojho starého otca.
65231	Ellen does not speak English.	539941	Ellen nehovorí po anglicky.
66381	I will come to your country some day.	2929910	Jedného dňa navštívim tvoju krajinu.
66462	I will leave tomorrow, in any event.	2921747	Odídem zajtra, v každom prípade.
66475	Anyway, if you want to know more about my country, I'll send you a letter when I get home.	1336574	V každom prípade, ak chceš vedieť viac o mojej krajine, pošlem ti list, keď budem u seba doma.
66762	Happy Easter!	2429463	Veselú Veľkú Noc!
67067	That was the most interesting novel that I had ever read.	2929925	To bol najzaujímavejší román, aký som kedy čítal.
67497	The United States is a large country.	2914173	Spojené štáty sú veľká krajina.
68009	Would you be so kind as to shut that window?	2929904	Bol by si taký milý a zatvoril to okno?
68009	Would you be so kind as to shut that window?	2929905	Bola by si taká milá a zatvorila to okno?
68088	That's the man I've been waiting for a week.	2913725	To je ten muž, na ktorého som týždeň čakal.
68547	The house is haunted.	2429375	Dom je strašidelný.
68965	What time do you usually leave home?	878929	O koľkej zvyčajne odchádzaš z domu?
68994	You must take into account the fact that she was ill.	1035707	Musíš brať do úvahy fakt, že bola chorá.
69017	You should follow his advice.	1865224	Mal by si sa riadiť jeho radou.
69112	You are very beautiful.	2151963	Si veľmi krásna.
69112	You are very beautiful.	2151964	Ste veľmi krásna.
69226	Are you ten years old?	2921843	Máš desať rokov?
69635	Do you have a pencil?	637904	Máš ceruzku?
69963	Were you reading a book at that time?	1035824	Čítal si v tom čase knihu?
70145	You speak like your mother.	2926465	Rozprávaš ako tvoja matka.
70213	You will be sorry for it some day.	2912421	Jedného dňa to budeš ľutovať.
70213	You will be sorry for it some day.	2912422	Jedného dňa ťa to bude mrzieť.
70623	What is your name?	1816747	Ako sa voláte?
70623	What is your name?	1816748	Ako sa voláš?
71534	Whichever route you take, you will get there in time.	1035688	Ktorúkoľvek cestu si vyberieš, dostaneš sa tam načas.
72588	April is the fourth month of the year.	2921788	Apríl je štvrtý mesiac v roku.
138919	Welcome.	2428460	Vitajte!
237739	Kaoru has gone to America.	2624031	Kaoru išiel do Ameriky.
237937	I hope the economy picks up soon.	2229079	Dúfam, že ekonomika sa čoskoro oživí.
238444	Shall I come for you?	1036053	Môžem po teba prísť?
239679	Saying is one thing and doing another.	2927633	Povedať je jedna vec a spraviť druhá.
239814	An individual has rights and responsibilities.	878933	Každá osoba má práva a povinnosti.
240029	Can you change a five-dollar bill?	2225974	Môžete mi zameniť päťdolárovú bankovku?
240277	The telephone operator asked the caller to hold on until a connection was made.	2226124	Telefónny operátor požiadal volajúceho aby čakal, kým nebude spojenie.
240608	The house whose roof you can see over there is ours.	2912436	Dom, ktorého strechu možeš vidieť tamto, je náš.
240712	Curiosity killed the cat.	1036413	Zvedavosť zabila mačku.
241094	It's in your interest to go.	2926480	Je v tvojom záujme ísť.
241205	I would rather die than surrender.	878928	Radšej by som umrel, než by som sa mal vzdať.
242061	You have to watch out for avalanches at this time of the year.	2228946	V tomto ročnom období si musíš dávať pozor na lavíny.
242649	Hello, I am Nancy.	2429362	Ahoj, ja som Nancy.
243844	I've taken up painting recently.	1036042	Nedávno som začal maľovať.
244700	We had much rain last year.	1865229	Za posledný rok veľa pršalo.
244719	Last year I returned home and was surprised to find both the village and the people completely changed.	2229002	Minulý rok som sa vrátil domov a bol som prekvapený tým, že aj dedina aj ľudia sa úplne zmenili.
245572	My sister has a nice piano.	1318476	Moja sestra má pekné piano.
246047	The children amused themselves by playing games.	1036086	Deti sa zabávali hraním hier.
246567	The taxi I took was very old and small.	2226104	Taxík, ktorý som si zobral, bol veľmi starý a malý.
246728	It's a house just like that I have seen.	1044853	Je to dom ako ten, čo som videl.
249194	We gave a party in celebration of his 70th birthday.	1865246	Pripravili sme mu párty pri príležitosti osláv jeho 70-tín.
249230	We might have underestimated his ability.	2912439	Je možné, že sme podcenili jeho schopnosť.
249230	We might have underestimated his ability.	2912441	Je možné, že sme podcenili jeho spôsobilosť.
250059	My family is a large one.	2913718	Moja rodina je veľká.
250718	My brother can drive a car.	1865214	Môj brat vie šoférovať.
250858	My happiness depends on you.	2914718	Moje šťastie záleží od teba.
250858	My happiness depends on you.	2914719	Moje šťastie záleží od vás.
250860	In my opinion, you are wrong.	2914136	Podľa môjho názoru, mýliš sa.
250860	In my opinion, you are wrong.	2914138	Podľa mňa sa mýliš.
250933	My job is teaching English.	2927649	Moja práca je výučba angličtiny.
251720	My father goes to church on Sunday.	2230580	Môj otec chodí v nedeľu do kostola.
251958	My daughter wants a piano.	1318449	Moja dcéra chce piano.
252039	My friend died from a wound.	2149744	Môj priateľ podľahol zraneniu.
252287	I am a student.	2428443	Som žiak.
252450	I saw a bird flying over a tree.	2228938	Videl som vtáka letieť ponad strom.
253293	I like tea.	2428893	Mám rád čaj.
253576	I will make use of this opportunity.	2914080	Využijem túto príležitosť.
254398	I saw the match on television.	2927710	Ja som videl zápas v televízii.
254953	I have no more than ten English textbooks.	1036128	Nemám nič viac než desať anglických učebníc.
255347	I have a cat and a dog. The cat is black and the dog is white.	1035689	Mám mačku a psa. Mačka je čierna a pes je biely.
255429	I have been in Paris.	2912702	Bol som v Paríži.
256274	I ran all the way to the station.	2914102	Bežal som až na stanicu.
256285	I was unable to breathe because of the smoke.	1036431	Nemohol som dýchať kvôli dymu.
257032	I am not pleased with what you have done.	2914684	Nie som spokojný s tým, čo si spravil.
257032	I am not pleased with what you have done.	2914685	Nemám radosť z toho, čo si spravil.
257249	I saw a dog. The dog held a piece of meat in its mouth.	1035690	Videl som psa. Pes držal v papuli kus mäsa.
257258	I recognized her the moment I saw her.	2921823	Spoznal som ju v momente, ako som ju uvidel.
257272	I'm fine.	2429358	Mám sa dobre.
258128	I have lost my watch.	748393	Stratil som moje hodinky.
258137	I bought a watch.	2927628	Kúpil som hodinky.
258279	It is hard for me to put my thoughts into words.	1036123	Je pre mňa ťažké pomenovať moje myšlienky slovami.
258567	I translated the poem as best I could.	2921739	Preložil som báseň najlepšie, ako som vedel.
258797	I built a new house.	1338562	Postavil som nový dom .
258845	I know the truth.	2428910	Poznám pravdu.
259378	Who am I?	1825202	Kto som?
259710	I am reading a book about animals.	2430447	Čítam knihu o zvieratách.
259872	I am pregnant.	1057845	Som tehotná.
260561	I know his family.	878571	Poznám jeho rodinu.
261049	I heard her singing in her room.	1046999	Počul som ju spievať v jej izbe.
261761	I have a large number of books on my bookshelf.	2913796	Mám množstvo kníh na mojej polici.
262865	All of us aim at success.	2226101	Všetci sa snažíme uspieť.
262914	We saw nothing strange.	2975741	Nevideli sme nič divného.
264041	The clock has just struck three.	1036099	Hodiny práve odbili tri hodiny.
264495	I don't have a bicycle.	3087116	Nemám bicykla.
264797	Her eyes ran over the list to see if her name was on it.	2226043	Jej oči prebehli po zozname, aby zistila, či je tam aj jej meno.
264823	Do good to those who hate you.	1824389	Robte dobre tým, ktorí vás nenávidia.
264933	The lost chance will never come again.	878945	Takáto šanca už druhý raz nepríde.
265751	It was yesterday that a young woman came to see me.	2914692	Včera ma prišla pozrieť mladá žena.
266725	Can I extend my stay one more night?	2914682	Môžem predĺžiť môj pobyt ešte o jednu noc?
266937	A spring rain revived the flower.	2915835	Jarný dážď oživil kvet.
267844	The girl said that she had never heard of such a person.	2921779	Dievča povedalo, že o takej osobe nikdy nepočulo.
267844	The girl said that she had never heard of such a person.	2921780	Dievča povedalo, že nikdy nepočulo o takej osobe.
268189	Make sure you go to a doctor if you get worse.	2233450	Neodkladne choď k lekárovi, ak sa ti to zhorší.
268563	Plants grow.	1036048	Rastliny rastú.
269204	New stamps will be issued next month.	2914683	Nové známky budú vydané budúci mesiac.
270504	People struggled against poverty.	1865219	Ľudia bojovali proti chudobe.
270540	The great pleasure in life is doing what people say you cannot do.	2229078	Veľkým pôžitkom v živote je robiť to, čo ti ľudia zakazujú.
273330	We had many bitter experiences during the war.	2229058	Počas vojny sme mali veľa bolestivých zážitkov.
274201	Didn't it occur to you to shut the windows?	2921848	Nenapadlo ti zavrieť okná?
274201	Didn't it occur to you to shut the windows?	2921849	Nenapadlo vám zavrieť okná?
274362	Hold your breath, please.	1036032	Prosím, zadržte dych.
275565	Trains stopped in consequence of the heavy rain.	878927	Zastavili vlaky kvôli hustému lejaku.
275695	Can I reserve a flight to Osaka?	2914166	Možem rezervovať let do Osaky?
276335	Who will help me?	1468698	Kto mi môže pomôcť?
277430	I'm looking for a hat to match a brown dress.	1040277	Hľadám klobúk, čo sa hodí k hnedým šatám.
277480	In China, they celebrate New Year by the lunar calendar.	2912672	V Číne oslavujú Nový rok podľa lunárneho kalendára.
278981	Astronomy is the science of the universe.	1317891	Astronómia je veda vesmíru.
279943	In those days, I used to get up at six every morning.	2913792	V tie dni som zvykol vstávať o šiestej každé ráno.
280228	Man is the only animal that laughs.	2913689	Človek je jediné zviera, ktoré sa smeje.
280745	Cloudy with occasional rain.	2914174	Oblačno s občasným dažďom.
280909	Two men met face to face.	2226011	Dvaja muži sa stretli tvárou v tvár.
283841	Do you know the town where he lives?	2137599	Poznáš mesto kde on žije?
284881	He has a brother who lives in Tokyo.	2921841	Má brata, ktorý žije v Tokiu.
285246	I can't make him out.	2229047	Nerozumiem mu.
285560	His English is quite good.	2929900	Jeho angličtina je celkom dobrá.
286473	His expenses exceed his income by far.	2914159	Jeho výdavky zďaleka prevyšujú jeho príjem.
286501	He died of cancer.	2926339	Zomrel na rakovinu.
287062	His son wants to be a lawyer.	2916553	Jeho syn chce byť právnikom.
287309	His pronunciation is far from perfect.	2921777	Jeho výslovnosť má ďaleko od dokonalosti.
287343	He can only criticize people behind their backs.	2913787	Vie iba kritizovať ľudí poza ich chrbát.
288433	He ordered me to go alone.	2927686	Prikázal mi, aby som išiel sám.
289505	He is taller than his father.	2929915	On je vyšší ako jeho otec.
289754	He works hardest in his class.	2914691	Pracuje nausilovnejšie z triedy.
290178	He selected a pair of socks to match his suit.	1040279	Vybral si pár ponožiek hodiacich sa k jeho obleku.
290407	He had no qualms in doing so.	2912430	Nebol v rozpakoch spraviť to.
291649	He only had 100 dollars.	2230591	Mal iba 100 dolárov.
292076	He was very fun.	2913696	Bol veľmi zábavný.
292327	He knows New York inside out.	2912356	On pozná New York naspamäť.
292327	He knows New York inside out.	2912358	On pozná New York ako vlastnú dlaň.
292619	He can also speak French.	2926475	On vie tiež hovoriť po francúzsky.
293162	He has been ill, but is not ill now.	2230601	Bol chorý, ale teraz už nie je.
293364	He let go of the rope.	2926338	Pustil lano.
293611	He is a doctor.	2429365	On je lekár.
294013	He never speaks English without making mistakes.	2916546	Nikdy nehovorí anglicky bez toho, aby robil chyby.
294066	He is well acquainted with the history of England.	1865253	Je dobre oboznámený s históriou Anglicka.
294677	It is said that he will go abroad.	2929951	Hovorí sa, že pôjde do zahraničia.
295196	He cannot afford a holiday.	2926471	On si nemôže dovoliť dovolenku.
295346	He is a teacher.	2429351	On je učiteľ.
295608	He stopped to put on his shoes.	1035780	Zastavil, aby sa obul.
296638	He is reading a book.	2430576	On číta knihu.
296931	He changed schools last year.	2915848	Minulý rok zmenil školu.
296931	He changed schools last year.	2915849	Vlani zmenil školu.
297391	He is a teacher at our school.	2429352	On je učiteľ v našej škole.
299440	He dumped the papers back into the drawer.	878941	Vrátil spisy späť do priečinku.
300459	He is by nature an artist.	2226095	Je to rodený umelec.
300812	He has poor ability to organize.	2230589	Má zlé schopnosti organizovať.
301213	He arrived in a big car.	2230582	Prišiel vo veľkom aute.
301533	He had come back from China.	1036405	Vrátil sa z Číny.
301541	He can speak Chinese a little.	2430582	On môže hovoriť trochu po čínštiny.
302017	He worked so hard that he ruined his health.	2226088	Pracoval tak veľa, že si zničil zdravie.
302677	He advised her to stop drinking.	2914716	Poradil jej, aby prestala piť.
302695	He asked her to marry him, and she accepted.	1036102	Požiadal ju o ruku a ona súhlasila.
303089	He wants to work in a hospital.	2430558	On chce pracovať v nemocnici.
303174	He is not ashamed of being poor.	2914676	Nehanbí sa za to, že je chudobný.
303215	He had an unpleasant screechy voice.	1036040	Mal nepríjemný piskľavý hlas.
303287	He was surprised his father had sold the farm.	2915881	Bol prekvapený, že jeho otec predal farmu.
304119	He leaves for Tokyo tomorrow.	2914158	Zajtra odchádza do Tokia.
304796	He will leave for the station an hour before the train leaves.	1043031	Pôjde na stanicu hodinu predtým, ako odíde vlak.
305203	Their happiness was rooted in their industry.	2233453	Ich šťastie malo korene v ich priemysle.
305506	They are always short of money.	2927667	Oni majú vždy nedostatol peňazí.
305582	They settled in Canada.	2914097	Usadili sa v Kanade.
307534	They were abandoned by their mother.	1036067	Boli opustení ich matkou.
307534	They were abandoned by their mother.	1036068	Matka ich opustila.
308290	We must take into account the fact that she is old.	1035709	Musíme brať do úvahy skutočnosť, že je stará.
308899	I bought her a new car.	2927701	Ja som jej kúpil nové auto.
308921	Dare you call her?	2226126	Odvážiš sa zavolať jej?
309291	Her behavior is consistent with her words.	2921804	Jej správanie je konzistentné s jej slovami.
309642	Her hair hung in neat coils.	878931	Jej vlasy sa pekne vlnili.
309942	She speaks French, not to speak of English.	2226029	Vie po francúzsky, nehovoriac o angličtine.
310000	She caught it for coming late.	2233458	Schytala to za to, že prišla neskoro.
310431	She was always telephoning me.	2927730	Ona mi vždy telefonovala.
310838	Did she go to the concert last Sunday?	1036435	Išla na koncert minulú nedeľu?
310894	She fell down the ladder.	2927644	Spadla z rebríka.
311348	She was not at all upset by the news.	2929950	Tá novina ju vôbec nerozrušila.
311865	She looks blue for some reason.	2926405	Z nejakého dôvodu vyzerá byť smutná.
312167	She is more beautiful than any other girl.	878924	Je krajšia než ktorákoľvek iná.
313056	She is a nurse.	2429353	Ona je zdravotná sestra.
313408	She can never keep a secret.	2921863	Ona nikdy nevie udržať tajomstvo.
314082	I think she is showing off her new dress to us.	2229028	Myslím si, že nám chce predviesť svoje nové šaty.
314171	She showed me which dress to wear.	1036038	Ukázala mi, ktoré šaty si mám obliecť.
315104	She is on a diet.	2229032	Diétuje.
315131	She selected a hat to match her new dress.	1040280	Vybrala si klobúk, ktorý sa hodil k jej novým šatám.
315459	She is a teacher.	2429350	Ona je učiteľka.
317009	She showed me her room.	1865243	Ukázala mi svoju izbu.
317756	Don't be sad.	2912336	Nebuď smutný.
