480999	Ta montre coûte plus cher que la mienne.	481174	侬个手表比我个贵。
481064	Où est la gare la plus proche ?	481171	最近个火车站垃拉阿里搭？
481106	Nous ne pouvions pas sortir à cause de la pluie.	481165	因为落雨，阿拉勿好出去。
481109	Le problème, c'est que je n'avais rien à lui dire.	481158	问题是我呒没啥要跟伊讲个。
481115	Il m'a demandé ce que j'avais acheté.	481154	伊问我买了啥。
481119	Il a acheté le terrain dans le but de s'y construire une maison.	481135	伊买土地目的是要造房子。
481419	Sais-tu de quelle taille est la tour de télévision ?	483594	侬晓得哀座电视塔有多少高𠲎？
481949	Puis-je t'appeler demain ?	483593	我明朝可以打电话拨侬𠲎？
481960	Cet événement est encore frais dans notre mémoire.	481386	搿桩事体垃海阿拉个脑子里还记忆犹新。
482211	Il a beaucoup d'argent.	480584	伊有得老多钞票。
483135	Les nouvelles ont confirmé mes soupçons.	488084	搿个消息证实了我个怀疑。
483195	Je dois acheter de nouvelles montures de lunettes.	488246	我需要买新个镜框。
483210	C'est l'un des plus grands artistes au Japon.	488307	伊是日本最伟大个艺术家之一。
483220	Ce patient peut mourir à tout moment.	488323	病人随时会走。
483305	Enfant, j'avais l'habitude de jouer seul.	488360	我小辰光经常一伽头白相。
483821	Vous êtes fatigué, n'est-ce pas ?	489780	侬吃力了，勿是吗？
483823	Il est étrange qu'il dise cela.	489837	伊搿能讲老奇怪个。
483853	Il vient de partir de chez lui.	489782	伊刚离开屋里。
484697	Ça fait des années que je ne l'ai pas vu.	731060	我交关年数呒没见过伊了。
484893	Pourquoi ne m'écoutes-tu pas ?	405431	为啥勿听我个言话？
485229	Elle a continué à pleurer toute la nuit.	489778	伊一整夜侪垃海哭。
486883	Je veux que tu lises cette lettre.	487730	我想侬读读搿封信。
486884	C'est une connaissance de ma femme.	487720	伊是阿拉太太认得个一个人。
486885	On m'a volé ma montre.	487712	我个表被偷脱了。
486888	Vous allez passer la banque et voilà son bureau à gauche.	487707	经过银行，左边就是伊个办公室了。
487002	Bonjour. Est-ce que vous voulez quelque chose à manger  ?	487688	侬好。侬想要啥个吃个𠲎？
487004	Toute femme doit faire son mari cocu.	487681	所有个女人侪应该让伊个老公戴绿帽子。
487007	À la tienne !	487664	身体健康！
487008	À la vôtre !	487664	身体健康！
487050	Puis-je faire quelque chose pour vous ?	487660	我能为侬做眼啥𠲎？
487054	Il y a des gens qui n'aiment pas déposer l'argent dans la banque.	487655	有眼人勿欢喜拿钞票存银行。
487093	C'est un journal gratuit.	487649	搿份报纸是免费个。
487117	Tu as juste fait tes devoirs.	487637	侬只勿过是做了侬个功课。
487119	Ce livre vaut la peine d'être relu.	487631	搿本书值得再看一遍。
487140	L'Inde est une région riche en culture culinaire.	487623	印度是一个烹饪文化丰富个地区。
487143	La prochaine fois ce sera à moi de conduire.	487612	下趟由我来开车。
487144	Il lave la voiture.	487609	伊汰车。
487162	Deux cafés au lait, s'il vous plaît.	487603	请来两杯奶咖。
487175	Que fait-il maintenant ?	487601	现在伊垃海做啥？
487178	Il y avait un camion au milieu du chemin.	487598	路当中有一部卡车。
487183	Lave tes pieds.	487591	汰侬个脚。
487184	Lavez vos pieds.	487591	汰侬个脚。
487311	C'est leur maison.	487587	搿是伊拉屋里。
487315	Il est dangereux de nager de nuit.	487584	夜里向游泳老危险个。
487324	N'aie pas peur de poser des questions.	487580	勿要怕提问题。
487333	Sait-il parler le français ?	487573	伊会得讲法语𠲎？
487334	Aimez-vous les vins français ?	487571	侬欢喜吃法国葡萄酒𠲎？
487336	Son épouse est française.	487569	伊拉老婆是法国人。
487337	Je ne sais pas lire le français.	487562	我看勿懂法语。
487338	Qui vous enseigne le français ?	487555	啥人教㑚法语？
487339	Je n'ai pas capté.	487547	我勿明白。
487341	Je veux manger de la cuisine française.	487541	我想吃法国菜。
487342	Je veux apprendre le français.	487540	我想学法语。
487345	Il y a un chat sous le lit.	487536	床下头有一只猫。
487347	À quoi bon la lecture de tels livres ?	487533	读搿种书有啥个用？
487352	Mon père sait nager mais ma mère, non.	487529	阿拉爷会得游泳，但阿拉娘勿会。
487353	Veuillez placer vos bagages sur cette balance.	487525	请拿侬个行李摆了搿秤高头。
487354	Essayons de nager contre le courant.	487524	试垃海逆水游游看。
487358	Tu peux emmener qui veut venir.	487522	啥人想来侬就带啥人来。
487360	Notre jardin était plein de mauvaises herbes.	487521	阿拉个花园长满了杂草。
487362	Je t'appelle à sept heures.	487517	我七点钟打电话拨侬。
487363	Je t'appellerai à sept heures.	487517	我七点钟打电话拨侬。
487364	Quel est le degré de formalisme de cette cérémonie ?	487512	搿个典礼有得多少正式？
487365	C'est absurde de ta part de faire ça.	487509	侬搿能做老荒唐个。
487366	C'est absurde de votre part de faire cela.	487509	侬搿能做老荒唐个。
487369	Quelle est la finalité de l'éducation ?	487500	教育个最终目的是啥？
487370	Je voudrais éteindre la liseuse, d'accord ?	487498	我想拿阅读灯关脱，来塞𠲎？
487372	N'oublie pas de venir me chercher à 6 heures demain.	487447	勿要忘记脱明朝6点钟来寻我。
487382	L'expérience a confirmé sa théorie.	487452	实验证明了伊个理论。
488967	Il m'a trahi.	488229	伊挪我卖脱了。
488968	Il m'a trahie.	488229	伊挪我卖脱了。
489524	Son sourire indique qu'elle m'a pardonnée.	489662	伊面孔高头个笑容，代表伊已经原谅我了。
489578	Il écrit des lettres à sa mère.	492783	伊帮伊拉姆妈写信。
490100	Il mit les mains dans ses poches.	492769	伊挪手插进了口袋。
491167	Jamais deux sans trois.	762926	一二勿过三。
493706	Elle dépense beaucoup d'argent en livres.	770640	伊垃书一方面花交关钞票。
494784	Y a-t-il des marchés ou des supermarchés près d'ici ? Est-ce pratique pour acheter les objets de la vie quotidienne ?	420383	搿搭周围有勿有小菜场跟大型超市，生活用品买起来方便𠲎？
495843	Ferme la porte.	483651	关门。
497224	Nous voulons un nouveau tapis.	515946	阿拉想要一条新毯子。
498617	Mon oncle habite à côté de l'école.	485632	阿拉爷叔住拉学堂附近。
499105	Il a peur de père.	690600	伊怕爷个。
499125	Il parlait, les yeux brillants.	857127	伊讲闲话眼睛敞敞亮个。
500332	Elle s'est enfermée dans sa chambre.	515979	伊挪自家关拉房间里。
501715	Je suis parti chercher Wang.	387917	我去拿老王寻得来。
503103	Quelle jolie petite fille !	862292	小姑娘可爱唻！
503361	Tu vas me mettre hors de moi !	861726	侬要拿我气煞脱了！
503361	Tu vas me mettre hors de moi !	861756	侬要拿我弄得火气大煞了！
504871	Où est la banque ?	504873	银行垃海阿里搭？
504897	Veuillez frapper avant d'entrer.	504886	进来之前请敲门。
504898	Frappez avant d'entrer, s'il vous plait.	504886	进来之前请敲门。
508841	Tu as habité là-bas pendant combien de temps ?	382791	侬拉哀面住了多少辰光了？
509819	Salut !	425429	侬好。
521626	La cloche n'a pas encore sonné.	916076	钟还呒没响。
521935	Comment on appelle ce légume en anglais ?	750305	搿个蔬菜英文叫啥？
530346	Joyeux anniversaire !	379376	生日快乐!
530383	Mon frère reste souvent éveillé toute la nuit.	485582	阿拉弟弟会得经常彻夜勿困。
531910	Celui-là, alors, il a vraiment un poil dans la main !	531939	搿个人啊，真是懒了出蛆了！
531910	Celui-là, alors, il a vraiment un poil dans la main !	692200	伊啦，真个懒到根个！
531910	Celui-là, alors, il a vraiment un poil dans la main !	702736	伊搿个人啊懒惰胚一只！
533424	Ne voudriez-vous pas aller à cette soirée à ma place ?	488315	侬会得代替我去派对𠲎？
537394	Le terroriste pour l'un est un combattant de la liberté pour un autre.	770840	一个人个恐怖分子为另外人个自由战士。
538766	Il a deux chats.	482941	伊有两只猫。
540282	Voici la monnaie.	488312	搿是找下来个钞票。
543461	On aime toujours ce qu'on n'a pas.	861365	自家呒没个物事总规吃香个。
543461	On aime toujours ce qu'on n'a pas.	861370	人家个物事总规吃香个。
545856	C'est mon tour ?	420935	轮到我了，是𠲎？
545858	Bien sûr que je peux, cependant je n'arrive pas trop à parler shanghaïen.	421011	当然会个，不过上海言话讲大勿来。
545863	Regarde, il y a un chat dans la cuisine.	482937	看，厨房间里有一只猫。
545872	Il sait aussi parler russe.	528030	伊还会得讲俄语。
545874	Elle portait une robe rouge.	494865	伊穿了一条红颜色个裙子。
545882	Une seule langue n'est jamais suffisante.	483628	一种语言永远勿够。
545884	Je me lève habituellement vers 8 heures.	477621	我通常8点钟起来。
545890	Il est aussi représentant de commerce.	381786	伊也是推销员。
548219	Nous irons très probablement, mais nous déciderons une fois que nous aurons vu comment est le temps.	420165	阿拉大概去个，不过要看天气哪能再决定。
549370	Ton fils est un homme maintenant.	916008	㑚儿子现在成人了。
551970	« Chéri, viens te coucher. » « Non, pas tout de suite. Je dois encore traduire quelques phrases sur Tatoeba. »	778992	「老公，上床啦。」「勿来自啊，我还要拉垃 Tatoeba 浪翻翻几句句子哦。」
553806	Cette eau est souillée par du pétrole.	755838	搿个水被石油污染了。
556442	La pendule retarde.	839144	挂钟慢了。
556443	La montre retarde.	839143	手表慢了。
557879	Ouvre un peu la porte !	405443	门开一开！
559052	Peux-tu me le dessiner sur un morceau de papier, s'il te plait ?	387755	谢谢侬帮我搿张纸头浪向画个草图。
559433	Je peux supporter une maison en désordre, mais je ne l'aime pas si elle est sale.	839552	屋里向乱七八糟也呒没问题个，但龌龊个闲话我是勿能够接受个。
559456	Je ne me rappelle pas ce que j'ai lu en dernier.	750297	我勿记得最后看个啥。
564341	Je suis surpris que vous soyez si naïves.	485392	我老惊讶㑚竟然介天真。
566610	Est-ce que je chante bien cette chanson ?	400293	我只歌唱得好勿好？
566616	Je suis vraiment confus.	374819	我老勿好意思个。
566628	L'addition ! Aujourd'hui c'est moi qui régale.	420323	买单！今朝我挺账。
566631	Il m'aida à réparer ma montre.	484552	伊帮我拿手表修理好了。
566633	Nous sommes le trois octobre.	398979	是十月三日。
567127	Vous autres, mathématiciens, n'êtes qu'une bande de pervers !	760823	㑚一眼数学家，只是一帮子下作胚！
567703	Le thé est chaud.	942019	茶热个。
571250	Le garçon ne changea pas d'avis.	916034	男小囡呒没改变主意。
572806	Qu'il fait froid !	785277	瀴唻!
573986	Tu es toujours en vie, Sysko ?	819176	侬还活垃海，斯斯克？
575169	Personne ne savait où elle était.	758032	呒没人晓得伊人拉垃啊里达。
575169	Personne ne savait où elle était.	758036	呒拨人晓得伊拉啥场化个。
583803	Tu ne voudrais pas te taire un moment ?	836855	侬勿想闭一歇嘴巴吗？
588123	Assure-toi d'éteindre toutes les lumières avant de sortir.	916281	出去之前确认一下所有个灯侪关脱了。
588124	Assurez-vous d'éteindre toutes les lampes avant de sortir.	916281	出去之前确认一下所有个灯侪关脱了。
588128	Je n'ai pas envie de sortir.	863265	我勿想出去。
591742	Quand est-ce que tu reviens de Milan ?	632227	侬啥辰光从米兰回来？
594154	Tu te moques de moi ou quoi ? Ça fait trois fois que je te demande d'arrêter de parler et de suivre le cours.	764172	侬垃海笑我还是哪能？我脱侬讲了三趟勿要讲闲话好好听课。
599389	Je n'arrive pas à savoir si beaucoup de personnes ont abandonné le projet.	772015	我勿能够晓得交关人是勿是放弃了计划。
607233	Que diriez-vous de la cuisine thaïlandaise ?	515858	泰国菜哪能？
609879	Peux-tu chanter une chanson pour tout le monde ?	400291	唱只歌拨大家听好𠲎？
611765	Cela coûtera au moins cinq dollars.	611771	迪个最起码要花五块美金。
612264	Prends cet appareil photo et donne-le-moi que je regarde.	420699	搿只照相机拿出来拨我看看叫。
612316	Tu dois étudier consciencieusement.	481553	侬必须认真学习。
612340	Je souhaite envoyer cette lettre au Japon.	612359	我要拿搿封信寄到日本去。
614278	La pièce était sens dessus dessous.	732495	一间房间真个乱七八糟。
616040	Le docteur prit mon pouls.	770941	医生帮我搭脉。
617876	Tu devrais d'abord en discuter avec tes parents.	617837	侬应该跟㑚爷娘谈清爽先。
617972	Après six mois en Chine, tu verras que tu regretteras de ne pas avoir accepté cette pizza avant de partir.	770827	拉垃中国过了六个号头之后，侬会得发现后悔走个前头呒没吃了搿只比萨。
618281	Ses efforts n'eurent aucun résultat.	485702	伊个努力呒没成果。
618286	Le vent est froid aujourd'hui.	485703	今朝刮冷风。
622922	J'ai vraiment trop la flemme d'aller bosser.	857162	我真个实在懒得上班去。
626629	C'est l'heure de dîner.	484303	吃夜饭个辰光到了。
628984	Dix, vingt, trente, quarante, cinquante, soixante, soixante-dix, quatre-vingts, quatre-vingt-dix, cent.	628991	十、廿、三十、四十、五十、六十、七十、八十、九十、一百。
633353	À tous les nouveaux venus : soyez tout de même un peu plus futés, faute de quoi les gens vont vous mener en bateau.	633338	新开豆腐店呢少许门槛精一眼，否则个言话人家会得让哪吃亏个。
633403	Quel est le numéro de téléphone de la société de taxi « Dazhong » ?	420621	大众出租汽车公司个电话号码是啥？
634645	Comment se fait-il qu'ils aient l'air ébahi et ne réagissent pas ?	634629	伊拉哪能眼垃海唔没反应垃？
635544	J'ai ramené les livres que j'avais empruntés à la bibliothèque et j'en ai emprunté des nouveaux.	489678	我还了从图书馆借个书，又借了眼新个。
635544	J'ai ramené les livres que j'avais empruntés à la bibliothèque et j'en ai emprunté des nouveaux.	636891	我拿图书馆借来个书还脱啦，再新借了两本来。
637225	Ces derniers temps, nous clavardions tous les soirs sur internet, et en plus nous discutions très tard la nuit, jusqu'à en perdre haleine.	637214	前一腔阿拉每天子夜到拉垃网浪向伽山湖，外加聊天聊得琼晏个，真讲得了没命了。
637268	Comment se fait-il que ce gosse ait toujours triste mine et les larmes aux yeux ?	637259	迪格小赤老一付腔调哪能一直眼泪汪汪哭出胡拉？
637287	C'est un vieux croûton : on ne pourra le faire changer d'attitude.	637279	伊是个老油条，态度照样改勿过个。
637291	Mon Dieu, c'est la débandade !	637213	要急煞老百姓个喂！
637295	J'adore te chercher des poux !	637294	我老欢喜牵侬头皮个！
638069	Les livres et les papiers sont éparpillés sens dessus dessous dans la chambre de ta sœur !	638042	㑚阿妹房间里书咾纸头咾侪摊得来一天世界！
640456	Tu vas me faire péter les plombs !	861732	侬要拿我逼疯脱了！
641307	J'en ai assez que tu frimes.	861811	侬出风头个样子烦煞了。
644728	Si de suite j'avais un million de yens, j'achèterais une voiture.	489018	如果我现在有100万日元，我会得买部车子。
644732	Je lui dois 10 dollars.	489033	我欠伊10块美元。
644771	Il n'est pas facile du tout de maîtriser le français.	489037	要掌握法语一眼也勿容易。
644774	Pour tout dire, je ne l'aime pas.	489038	老实讲，我勿欢喜伊。
647149	Ce voyou a le don de berner les gens.	647146	迪个贼骨头骗起人来老鬼唻。
649770	Ces derniers jours il a beaucoup neigé.	916056	搿些日节落了交关雪。
651560	On veut que je sois femme de ménage, mais je n'ai pas envie.	405423	要我做保姆，我勿情愿做。
651568	Il commence tranquillement à y aller.	420061	伊慢慢叫垃拉赶上去。
652500	J'ai besoin d'une nouvelle paire de chaussures.	915980	我需要一双新鞋子。
652558	L'avion décollera dans une heure.	652589	飞机会得垃海一个钟头以后起飞。
657461	Choisis un bon restaurant où aller manger.	420291	拣爿好吃点个饭店去吃。
657462	J'en ai, mais je ne l'ai pas pris.	387897	有是有个，呒没带来。
657463	Est-ce qu'il ferra beau demain ?	385082	明朝天气会好𠲎？
657486	As-tu encore besoin de mon aide ?	374339	侬还有啥个要我帮忙𠲎？
661078	Je voudrais discuter avec monsieur Zhang et monsieur Li.	387908	我要告张先生、李先生谈谈。
665804	Jeune, je jouais souvent au base-ball.	484301	我年轻个辰光常常去打棒球。
667550	J'aime faire de la peinture à l'huile, mais je ne veux pas en faire mon métier à vie.	420969	我喜欢画油画，但是我勿想拿伊做我个终身职业。
668490	La cabine d'essayage est occupée.	839203	试衣室占用垃海。
669078	Je pisse un bol, j'enfile une écharpe et on peut y aller.	669083	我小个便，带好围巾，就可以跑了。
669898	Il faut dix personnes pour chercher ce qu'une seule a rangé.	669862	一个人囥，十个人寻。
669921	Chacun a sa propre manière de faire.	669919	各人有自家一套个。
674080	Ça va bientôt être l'heure, comment ça se fait que tu traines encore.	420141	辰光要到快了，侬哪能还捱发捱发。
684467	Il peut nager très vite.	488234	伊可以游了老快个。
686491	Demande-lui quand elle reviendra.	485623	等伊回来个辰光问问伊。
688496	Je suis allé à toutes les expositions d'art moderne qui se sont tenues à Tokyo l'année dernière.	492739	东京去年举行个现代艺术展，我侪去过了。
688909	Je suis né en 1972.	382795	一九七二年养个。
688930	Je t'ai attendu une éternité !	382792	我等了侬半半六十日！
690153	Il est en train de le caresser dans le sens du poil : cette discussion n'est en fait qu'un faux-semblant puisqu'il a déjà une idée en tête.	690116	伊拉垃海拍伊马屁喂，实际高头是真注意假商量。
690180	Qui ne parvient pas au fleuve Jaune n'a pas l'esprit en paix, et une fois parvenu n'a plus que ses yeux pour pleurer.	669989	勿到黄河心勿死，到了黄河流眼泪。
690592	Comment se fait-il que vous puissiez être aussi abrupts de caractères ?	690585	哪人哪能会得介拗力喔？
690613	Pas de quoi s'inquiéter.	690614	用勿着急得个。
690632	La conjugaison est amusante.	691239	动词变位老好白相个。
690641	Cette façon qu'elle a de faire semblant, c'est justement ce qui m'insupporte.	690620	我就受勿了伊付假姿假眼个样子。
690733	Ma mère distribue souvent des tartes aux passants.	691295	阿拉娘经常让过路人吃耳光。
690778	C'est un garçon malin, c'est certain.	690198	伊搿个小朋友人门槛着着精个。
690778	C'est un garçon malin, c'est certain.	690604	伊搿个小赤佬人门槛着着精个。
690778	C'est un garçon malin, c'est certain.	690606	伊搿个男小位人门槛着着精个。
690784	Avez-vous un lien de parenté avec les Nagashima ?	691248	侬啊是长岛家们个亲贵伐？
690784	Avez-vous un lien de parenté avec les Nagashima ?	691250	侬啊跟长岛家们有得关系？
690800	Ce ne sera pas facile de trouver quelqu'un capable de prendre sa place.	691144	寻到一个人有能力代替伊勿会得老容易个。
690855	Il est enrhumé avec la goutte au nez et les larmes qui coulent sans cesse.	690612	伊伤风垃海侪鼻涕水眼泪水嗒嗒嘀。
690970	Les faits ne cessent pas d'exister parce qu'on les ignore.	691228	勿是只当勿晓得事体伊垃就会得勿再存在了。
690987	Il porte attention à souvent s'exercer, du coup ses pectoraux et ses abdominaux sont en acier.	420901	伊平常注意锻炼咾，胸肌腹肌侪是邦邦硬个！
691386	Où étais-tu l'année dernière au mois d'août ?	385078	去年八月份侬拉阿里啊？
691387	Le mois dernier nous étions en novembre, c'est bien ça ?	385076	上个月是十一月，是𠲎？
691388	Je suis resté à l'hôpital plusieurs semaines.	385074	我医院里住了几个礼拜。
691389	Quel mois sommes-nous ?	385077	搿个月是几月？
691396	Le bulletin météo a dit que demain soir il y aurait de l'orage.	387723	天气预报讲，今朝夜快要落雷阵雨。
691400	Ah, maintenant il y a un peu de vent, il va faire un peu plus frais.	387722	喔，现在倒有点风了，稍微风凉点了。
691406	En été à Shanghai les températures les plus hautes peuvent atteindre 38, 39 degrés, c'est vraiment à mourir de chaud !	387720	上海热天最高温度要到三十八九度，真是热煞快！
691408	Ces derniers jours il a fait très froid, on a souvent atteint moins deux, moins trois degrés.	385093	搿枪天气老冷个，常常到零下二三度。
691409	Cet après-midi le temps va à peu près se dégager.	385092	下半天大概天转晴。
691412	Ce matin le temps est couvert.	385084	一个早浪是阴天。
691416	Pouvez-vous me dire comment me rendre à Dashijie ?	387736	请问到大世界去哪能走？
691423	Tournez vers le nord et à la deuxième ruelle vous voilà arrivé.	387735	朝北转弯走到第二条弄堂就是了。
691425	Excusez-moi, où se trouve le numéro 52 de la rue du Henan ?	387734	谢谢侬河南中路五十二弄垃拉阿里搭？
691427	C'est au troisième appartement du deuxième immeuble.	387733	拉第二埭房子个第三家。
691428	Allez jusqu'à la petite ruelle et tournez à gauche.	387732	跑到搿面一条小弄堂左转弯。
691448	Continuez jusqu'au bout de cette ruelle.	387731	搿条弄堂笔直跑跑到底。
691450	Là-bas il y a une cabine téléphone et en face une banque, tu as vu ?	387744	哀面有只电话亭，搿面有爿银行，侬看到𠲎？
691451	Ce n'est pas très loin d'ici.	387743	搿搭到哀面是老近个。
691452	Pour aller là-bas depuis ici, tu as juste besoin de traverser la deuxième intersection.	387740	侬从搿搭过去到哀面，穿过第二条横马路就是。
691454	Donc comment se rend-on au parc du peuple ?	387738	葛末到人民公园哪能介走法？
691455	Tu continues la rue tout droit et c'est juste après le feu rouge.	387737	侬一埭路里朝前走，过了红绿灯就到了。
691457	Toujours tout droit, c'est ça ?	387754	一直朝前走对𠲎？
691458	Où se trouve ma position actuelle sur la carte ?	387752	我现在个位置拉地图高头阿里搭？
691460	Excusez-moi, est-ce que le restaurant « Xinqiao » est loin d'ici ?	387750	请问侬新桥饭店离搿搭远勿远？
691462	Pardonnez-moi, quelle est le nom de cette route ?	387749	勿好意思搿条路是啥个路？
691463	Excusez-moi, quel est le nom de cet endroit ?	387748	谢谢侬搿搭是啥地方？
691568	Il y a un commerce de proximité à l'opposé de la rue en diagonale.	387888	一家便利店垃拉马路斜对过。
691581	Peu importe, celui que tu veux.	387903	呒没关系，随便阿里一块。
691586	C'est lui qui m'a parlé de cela.	387913	搿桩事体伊告我讲个。
691590	Si ça te plait, manges-en.	387911	侬如果高兴，就吃一点𠲎。
691591	Ils sont tous deux très occupés en ce moment et ne veulent pas vous parler.	387909	伊拉两位现在忙勿过，勿想帮侬谈。
691597	Lequel aimes-tu un peu ?	387906	阿里一只侬欢喜一眼？
691607	J'ai fermé les six fenêtres.	387919	我六扇窗侪关上了。
691615	Tu as pris du liquide ou une carte bancaire ?	387916	侬钞票或者信用卡带来𠲎？
691617	Les anciens magazines sont tous vendus.	400286	旧杂志卖光了。
691621	Retire un peu la poussière sur l'étagère.	400285	架子高头灰尘揩一揩。
691622	Elle est belle quoiqu'elle porte.	392679	伊穿啥侪好看。
691624	Peux-tu regarder ces deux photos et dire laquelle est mieux ?	400295	侬看两张照片里阿里张好？
691629	Va faire sécher les vêtements.	400290	衣裳㫰出去了。
691637	Il a réparé les pattes de la table.	400288	台子脚拨伊装牢了。
691642	Une table ronde en verre a été brisée.	400287	一块圆台玻璃敲碎脱了。
691645	Tu as répondu finalement ?	405417	侬答应口勿啦？
691647	Évidemment j'ai accepté.	405416	我当然同意个。
691657	Plus vite, d'accord ?	405427	快一点好𠲎！
691662	Je ne pourrais sûrement pas non plus m'opposer à lui.	405424	我作兴勿会反对伊去。
691680	Tu ne prévois pas d'y aller, n'est-ce pas ?	405422	侬勿预备去，阿是？
691773	Pourquoi tu ne l'as pas dit plus tôt ?	405434	啥体勿早点讲！
691775	Comment fais-tu pour être aussi lent !	405430	侬哪能介慢个啦！
691776	Pourquoi es-tu aussi pressé !	405429	侬哪能搿能要紧啦！
691777	Je vous y conduis.	405448	我带㑚去。
691779	Vas lui dire de venir.	405447	侬去叫伊来。
691781	Prends les vêtements et va les laver !	405446	龌龊衣裳去汏汏伊！
691783	Poste cette lettre à ma place !	405445	一封信脱我寄脱伊！
691789	Je suis vraiment désolé, mes plus plates excuses.	405442	实在是抱歉，真对侬勿起！
