691791	C'est parce que je n'ai pas entendu.	405440	我呒没听见咾。
691792	Il a le visage couvert d'ecchymoses.	690610	伊面孔鼻青眼肿。
691793	Il s'est fait refaire le portrait.	690610	伊面孔鼻青眼肿。
691879	J'ai plus le temps, dépêche-toi un peu !	405458	我辰光也来勿及唻，侬快点好勿啦！
691933	Viens avec moi !	405449	跟我来！
692052	Je suis un peu pressé par le temps, j'ai juste le temps de sortir aller acheter des dapings et des youtiaos.	405468	我辰光来大勿及咾，只好出门买大饼油条。
692067	Je m'habille et ensuite je prendrai mon petit-déjeuner.	405467	我穿好衣裳以后就吃早饭。
692070	Je vais dormir jusque huit heures et demie.	405466	我要睏到八点半刚刚起来。
692073	J'aime faire la grasse matinée.	405464	我欢喜睏懒觉。
692075	Je me lève souvent particulièrement tôt.	405463	我平常醒得特别早。
692078	Je me lève tous les jours à six heures.	405465	我每天六点钟起床。
692079	Ne dis pas n'importe quoi !	405462	侬勿要瞎讲！
692081	Ne viens pas déranger ton monde !	405461	侬勿要来捣蛋好勿啦！
692084	Une fois le travail fini, habituellement vers cinq heures et demie, je rentre à la maison dîner.	420037	做完生活一般五点半回到屋里吃夜饭。
692257	Le temps est vraiment oppressant.	690595	搿爿天真挖塞。
692673	Il existe une légende qui affirme que le nom originel de Tongli était Futu.	692669	有段传说讲同里名字原来叫富土。
692690	Je n'arrive pas y croire ! Ils n'ont pas dit un seul mot.	692688	我啊想勿牢，伊垃闷声勿响。
692691	Je n'arrive pas à y croire ! Ils se sont tus.	692688	我啊想勿牢，伊垃闷声勿响。
692692	Je n'y crois pas ! Ils sont devenus muets.	692688	我啊想勿牢，伊垃闷声勿响。
692780	« Quelles piles de papiers ? » « Prends n'importe lesquels. »	692767	「啊里刀纸头啊？」 「侬瞎七搭八拿一眼 。」
692780	« Quelles piles de papiers ? » « Prends n'importe lesquels. »	692777	「啊里刀纸头啊？」 「侬杂七杂八拿一眼。」
697093	Quand il était petit, il piquait souvent des crises face à ses parents.	697051	伊小辰光经常帮伊垃爷娘作死作活。
697168	La personne là-bas est une pipelette.	697070	哀个人是个饭泡粥。
697281	Celui-là, c'est un pipelet.	697070	哀个人是个饭泡粥。
697284	Celui-là, il est très bavard.	697070	哀个人是个饭泡粥。
698584	Il est en train de glander.	698583	伊拉垃混日节。
698594	Il fait traîner.	698590	伊拉垃拖辰光。
698595	Il gagne du temps.	698590	伊拉垃拖辰光。
698628	Il est en train de tuer le temps.	698583	伊拉垃混日节。
698667	Je n'ose pas le lui dire.	698665	我勿舍得跟伊讲。
698683	Ces deux-là se tiennent côte à côte.	698675	两个人平排平。
698730	J'ai eu du nan avec du thé pour déjeuner.	837533	我早饭吃个馕跟茶。
698824	Ça va faire long feu.	697257	豆腐水做个。
698826	C'est voué à l'échec.	697257	豆腐水做个。
698827	Les Shanghaïens ont une imagination débordante.	697252	上海人会得想出刮出。
698833	C'est une authentique broderie de Suzhou.	697249	搿是喋喋骨骨苏州刺绣。
700085	Tous les membres de la famille d'en face ont un caractère incroyablement fort.	698689	伊垃对过人家一家们脾气侪老结棍个。
700098	Il s'assit et se mit à réfléchir. « Je ne comprends pas, cette histoire n'a aucun sens. »	694832	伊坐下来了，开始思考了。「勿明白，莫名其妙个事体。」
700106	Il s'assit et se mit à réfléchir. « Je ne comprends pas, c'est à dormir debout cette histoire. »	694832	伊坐下来了，开始思考了。「勿明白，莫名其妙个事体。」
700108	Qu'est-ce qu'il est grossier !	694869	伊真败潮向喔！
700383	Il est d'une grossièreté !	694869	伊真败潮向喔！
702531	Appelle un taxi pour venir nous prendre.	702522	叫步差头来接阿拉。
702531	Appelle un taxi pour venir nous prendre.	702527	叫步的士来接阿拉。
702546	Ne crains pas le ciel et la terre, mais redoute d'entendre une personne de Wenzhou parler dans sa langue locale.	702259	天勿怕，地勿怕，就怕温州人讲温州闲话。
702625	Ils n'ont vraiment rien à faire de leur temps.	702328	伊垃真戳鸡饱饭呒没事体做。
702633	Aujourd'hui elle n'a fait que penser à grignoter toute la journée.	702329	伊今朝整天垃海想戳鸡。
702774	Notre sœur a acheté quelques aubergines, des pommes de terre, des courgettes et du chou chinois au marché.	702764	阿姐拉垃小菜场买了眼落素、洋山芋、夜开花跟黄芽菜。
702789	Je ne veux pas le blesser dans ses sentiments.	702788	我勿想得罪伊。
703676	Putain ! Tu m'as foutu une de ces trouilles !	703671	杀千刀！侬吓了我一大跳！
704249	C'est une question complexe.	702327	搿问题老戳克个。
704262	C'est quelqu'un de tortueux.	702326	伊搿人老戳克个。
704269	Cette personne est souple d'esprit.	697271	哀个人吃软勿吃硬。
704296	On ne peut pas lutter contre son destin.	697260	人算勿如天一算。
704939	Leur drapeau est omnicolore.	704932	伊垃面旗帜红颜绿色个。
705128	L'autre jour, tu avais l'air dans les vapes.	705123	侬昨天子有点困睡懵懂。
705177	Ils sont sortis de très bonne heure.	705171	伊垃老哩百早就出去了。
705178	Ils sont partis très tôt.	705171	伊垃老哩百早就出去了。
705188	Ce sont des histoires immémoriales.	705185	迪个侪是老哩百早个故事。
706400	C'est un surhomme.	706393	伊人邪气来赛。
706404	Il est héroïque.	706393	伊人邪气来赛。
706442	Il n'a pas honte de dire qu'il ne sortira jamais avec une planche à pain.	706547	伊勿要面孔个讲伊从来勿会得跟个砧吨板轧朋友。
706470	Il a l'habitude de ce genre de situation.	706463	伊搿种情况有数木。
706478	Je connais bien son frère.	706464	我搭伊垃阿哥蛮有数个。
706586	L'autre jour, tu avais l'air d'avoir la tête dans le cul.	705123	侬昨天子有点困睡懵懂。
706589	L'autre jour, tu n'avais pas vraiment les yeux en face des trous.	705106	侬昨天子有点眼开眼闭。
706590	L'autre jour, tu n'avais pas l'air bien réveillé.	705106	侬昨天子有点眼开眼闭。
706590	L'autre jour, tu n'avais pas l'air bien réveillé.	705123	侬昨天子有点困睡懵懂。
706685	On n'échappe pas à son destin.	697260	人算勿如天一算。
710720	« Papy, quand est-ce qu'on ira jouer au ping-pong, hein ? » demanda-t-il.	710599	「爹爹，阿拉啥辰光打乒乓球去喔？」 伊问了。
710721	Le petit garçon était aux anges.	710598	小朋友开心煞了。
710722	Elle a donné tout un tas de piécettes au petit garçon.	710596	伊使了一大刀角子拨个小朋友。
710725	Le goût du plat de riz aux légumes cuisiné par Mme Li n'était pas au point : il était un peu fade.	710594	李阿姨炒了个一份菜饭味道勿够足 ，稍微有点淡着眼。
710744	S'il arrive qu'il retourne un jour sur sa terre natale, il se rendra certainement sur le lieu où son grand-père a grandi.	710611	假如有日天伊回老家乡去，总会得回拜伊垃啊爹长大个地方。
710774	Qui passe une nuit sans sommeil en passera dix sans repos.	710589	一夜勿困，十夜勿醒。
710779	Ensuite, tu arroseras ce bol de farine d'un peu d'eau.	710593	然后，侬搿盆面粉再拿水浇一浇。
710805	Il s'occupe de ses petites affaires dans son coin.	709651	伊偷偷噍垃海做自家个事体。
710808	Ils ont pris deux semaines de vacances sur l'île de Phuket dans le sud de la Thaïlande par l'intermédiaire d'une agence de tourisme.	708854	伊垃通过旅行社拉垃泰国南面普吉岛浪定了两个礼拜个假期。
710814	Je me sens oppressé de l'intérieur.	698632	我心里觉着老挖塞。
710816	Cela me pèse sur le cœur.	698632	我心里觉着老挖塞。
710886	Avant-hier, le vieil homme étrange qui marchait sur le trottoir avait l'air un peu mystérieux, mais il était assez marrant.	710872	前日人行道浪哀个奇怪阿伯有点阴阳怪气，不过蛮好白相个。
711093	Une nuit sans repos, dix jours sans clarté d'esprit.	710589	一夜勿困，十夜勿醒。
711672	Ça, c'était du javanais pour moi.	713790	看上去搿眼侪像天书咖。
711711	Il est fier comme un paon !	711710	伊嗲唻！
711713	Cesse de gesticuler !	711712	勿要捧手热脚了呀！
711714	Cesse donc de bouger sans arrêt !	711712	勿要捧手热脚了呀！
713378	Ne crains pas l'imprévu, mais pare-toi à toute éventualité.	698569	勿怕一万，只怕万一。
727302	L'autre jour, tu avais l'air d'être dans le cirage.	705123	侬昨天子有点困睡懵懂。
727304	L'autre jour, tu avais l'air d'être dans le coaltar.	705123	侬昨天子有点困睡懵懂。
730342	Je souhaiterais payer en liquide.	730414	我想付现钞。
730343	Je souhaiterais payer comptant.	730414	我想付现钞。
731129	Des représentants de nombreux pays ont participé à la conférence.	745204	交关国家个代表出席了会议。
732542	Ce coin est vraiment très animé.	732512	搿只角相当闹忙垃海。
732590	La mariée est américaine d'origine polonaise.	732581	新娘子是波兰血统个美国人。
732594	Ils vont tellement bien l'un avec l'autre.	732585	伊垃两家头配得真一流个。
732597	Leur faire-part de mariage est charmant.	732579	伊垃张婚礼请帖邪气精美。
732598	Nous avons reçu leur faire-part de mariage.	732557	阿拉收着了伊垃张婚礼请帖。
735349	Tout à l'heure on était en train de visiter l'exposition dans le musée de Shanghai, tu vois, et là en un instant mon grand-oncle avait encore disparu !	735345	阿拉刚刚拉垃上海博物馆里向参观展览会么，唉阿拉舅公一歇歇又跑脱啦！
735401	Quelqu'un me l'a dit.	852615	一个人跟我讲个。
735401	Quelqu'un me l'a dit.	898363	有人跟我讲个。
737329	Peux-tu me pardonner ?	485597	可以原谅我𠲎？
743733	J'ai appris à l'instant que tu étais malade, donc j'ai quitté le travail pour venir te rendre visite.	420811	我刚刚晓得侬拉生病，葛咾下仔班来望望侬。
744700	Le nombre de clients qui se rendent tous les ans pendant la période du nouvel an chinois, au grand Tang Frères, à Paris dans le treizième arrondissement, fait peur.	744689	每年春节个辰光巴黎十三区大陈氏个客人多得来吓人。
744723	Presque 90 ans et il parle encore sur ce ton, oh.	744715	貌九十岁啦还有得搿种口气喔。
744757	Qu'il est agréable de regarder le défilé du nouvel an chinois assis sur son balcon.	744746	坐垃阳台浪看春节游行勿要忒惬意哦。
744765	Je lui ai offert un briquet à double flamme que j'ai acheté aux États-Unis.	744779	我送了一个拉垃美国买个双火焰个打火机拨伊。
745172	Je m'ennuie rapidement dans tout ce que je fais.	745167	我做样啥事体侪老快就呒没劲了。
745202	Il adore voyager.	745214	伊邪气欢喜旅游。
745234	Je ne connais pas la profondeur de ce lac.	745230	我勿晓得搿条湖浜多少深垃海。
745244	Je dois avoir le mauvais numéro.	745251	我大概一只号头勿对。
745655	Il a une vie très occupée.	736573	伊生活老忙。
745656	Pas besoin de me raccompagner, je vais rentrer par moi-même.	374259	勿要送得个，我自家走。
745657	J'aurai besoin de ton aide pour un petit truc.	374239	我有点小事体想请侬帮忙。
745658	C'est bon, pas besoin de me raccompagner.	374264	留步，留步，勿要送了。
745659	Bon, je vais te raccompagner alors.	374244	葛末我来送送侬。
745660	Tata, pas besoin d'en faire tant, juste de l'eau plate, ça ira.	374237	阿姨勿要客气，倒杯白开水吃吃好了。
745663	Les cendres de ma grand-mère sont dans une urne au temple.	380196	吾个祖母个骨灰勒庙里。
745664	Ouch, je t'ai heurté, désolé !	374837	喔唷，撞着侬了，对勿起！
745665	Je viens vous aider à faire les présentations.	382772	我来帮㑚介绍一下。
745666	Nous ne nous connaissons pas.	382770	阿拉勿认得。
745667	C'est mon ami, vous le connaissez ?	382768	伊是我个朋友。㑚认得𠲎？
745668	Que font ces gens ?	381811	搿眼人做啥个事体个？
745669	Oui, c'est notre manager.	381804	对个，是阿拉经理。
747500	Il est en train de t'embrouiller.	747497	伊垃海帮侬搞七捻三。
747631	On a joué. On a perdu. On recommence ?	747664	阿拉白相过了。阿拉输脱了。再从新来过伐？
748464	Jouons à colin-maillard.	770830	阿拉白相叛夜摸摸伐。
750295	Je chasse l'élan pendant mon temps libre.	750276	我空下来个辰光打驼鹿去。
750299	Nous atteindrons Londres avant la tombée de la nuit.	750303	阿拉夜快之前会得到伦敦个。
751900	Quelle est la raison ?	751892	啥个道理?
751900	Quelle est la raison ?	751894	啥个原因呢？
752594	Quand il fait les choses, il y va à fond.	735319	伊做事体一本正经个。
753254	Hawaï est une destination touristique populaire.	770860	夏威夷是一个大众化个旅游圣地。
754407	Cette femme n'est pas du genre à transpercer le cœur d'un homme.	816959	哀个女人伐像是会得伤男人心个。
755788	Hier au restaurant, nous avons commandé des travers de porc au caramel, des aubergines en teppanyaki, du canard aux épices, une marmite aux huit trésors, des liserons d'eau et deux bols de riz, et avons été repus.	755781	昨日拉垃餐馆里点了一盘京都排骨，一份铁板茄子，一份香苏鸭子，一盘八珍豆腐宝，一盘蓊菜跟两碗白饭，挪阿拉饫饱了。
755808	Je ne vais pas au cinéma aussi souvent que je le voudrais.	755807	我实际高头看电影去个次数比我想去看电影个次数少。
755866	Je continue de dire que je suis innocent, mais personne ne m'écoute.	755872	我再三申明无罪，但是呒没人垃海听我讲。
755868	Je continue de clamer mon innocence, mais personne ne m'écoute.	755872	我再三申明无罪，但是呒没人垃海听我讲。
755873	Les objets non réclamés furent vendus aux enchères.	757929	呒没人领取个物事被拍卖脱了。
756691	Parles-tu chinois ?	835129	侬会得讲中文伐？
756793	Elle est seulement jalouse de ta jeunesse.	916053	伊只勿过是嫉妒侬年轻。
758046	Je ne l'ai pas dit.	758048	我呒没讲。
758046	Je ne l'ai pas dit.	758049	我分讲。
760036	Nous mangeons des tartines beurrées.	488475	阿拉吃面包夹黄油。
760041	Elle prend part à beaucoup d'activités scolaires.	484613	伊垃海学堂参加了交关活动。
763190	Qu'est-ce que tu racontes tout seul ?	762913	侬自说自话垃海讲点啥？
764097	Ne donnez pas de la confiture aux cochons.	1522201	勿要让乌龟吃大麦。
765754	Souviens-t'en bien : dans la carpe noire on mange la queue, dans la carpe commune on mange la tête.	765729	侬好教计牢：青鱼吃尾巴，鲤鱼吃头。
769288	Il arrive à piquer du nez où qu'il soit. Dès lors, ce qui me surprend, c'est comment peut-il toujours manquer de sommeil ?	769284	伊每个地方侪会得打瞌冲个让我觉着惊讶了，伊哪能全世困勿醒个。
770864	Sais-tu résoudre cette énigme ?	770862	侬猜得出搿只灯迷伐？
770865	Sais-tu répondre à cette devinette ?	770862	侬猜得出搿只灯迷伐？
771679	Comment ça ça prend les marchandises et ça part sans payer !	771645	啥挪子物事钞票勿付就跑了！
775707	Ce laowai, quelle classe !	775716	搿个老外大克拉啊！
781946	Par rapport à Tokyo, Londres est petit.	915978	帮东京比起来，伦敦老小个。
783722	J'ai passé toute la journée à lire ce roman.	783596	我整个一日天看了搿本小说。
785283	Le son de la radio est un peu fort.	785288	无线电个声音有点响。
785340	Je pense que tu es allé trop loin.	785337	我觉着侬忒过分了。
785340	Je pense que tu es allé trop loin.	785339	我觉着侬走过头了。
785349	Ils ne permettront pas que nous entrions dans le jardin.	785314	伊垃勿会得让阿拉进花园个。
785375	À mon travail, je suis le plus jeune.	785380	拉垃阿拉单位里，我是年记最轻个。
785384	J'ai acheté un nouveau téléviseur.	785383	我买了台新个电视机。
785385	J'ai acheté une nouvelle télé.	785383	我买了台新个电视机。
785796	Ne craignez pas l'imprévu mais soyez-y prêts.	698569	勿怕一万，只怕万一。
786146	Oui, j'arrive illico.	492801	是个，我马上来。
786414	Ajoute un peu de lait.	786416	加眼牛奶。
786449	Ma sœur prend des leçons de piano deux fois par semaine.	489696	阿拉阿妹每周上两次钢琴课。
786550	Dans ce film d'horreur, les morts peuvent revenir à la vie.	786544	搿恐怖电影里向个死人会得活过来个。
790042	C'est un joueur invétéré.	788014	伊赌性十足。
792197	Nous pensions que sa menace n'était qu'une plaisanterie.	489740	阿拉觉着伊个威胁只勿过是一个玩笑。
792358	L'ombre du bâton est visible.	792217	立竿见影。
792807	Pourquoi es-tu en colère ?	792805	侬作啥生气？
792807	Pourquoi es-tu en colère ?	792806	侬为啥发脾气？
792822	Les oiseaux construisent des nids.	792825	鸟造巢个。
793579	La douleur se situe ici, n'est-ce pas ? Ce sont des maux d'estomac.	420941	搿搭痛阿是？搿个是胃痛。
793584	Je lui ai fait balayer le sol.	793585	我让伊拿地扫脱了。
793596	Je vais rester ici quelques jours.	793597	我预备拉垃此地蹲几日天。
795013	Shanghai est surnommée le Paris de l'Orient.	795020	上海被称为东方个巴黎。
795061	C'est un Hongkongais.	795047	伊是香港人。
798924	Il est en train de procrastiner.	798916	伊垃海意摸。
799067	Il y avait de nombreux petits cours d'eau autrefois à Shanghai, parmi lesquels la rivière Zhaojia, la rivière Yangjing, qui sont tous recouverts désormais.	798899	上海老早侪是小河浜，其中么有得肇家浜、洋泾浜，现在侪填脱了。
799097	Ajoute de l'alcool de riz pendant la cuisson pour faire partir l'odeur désagréable.	798381	垃海烧个辰光，加黄酒拿腥气戒脱伊。
799113	De retour à Shanghai je me fais des bonnes pâtes de riz sautées à la chair de crabe.	798396	回到上海吃一顿蟹粉炒年糕。
799204	Sarkozy va encore au casse-pipes.	798903	萨克奇又垃奇模索了。
801668	Il se cache.	842765	伊躲垃海。
801668	Il se cache.	1021344	伊偃垃海。
804579	Je vous prie de m'excuser, quelle heure est-il ?	382781	对勿起，现在啥辰光了？
804661	Dans cette pièce se trouve un poste de télévision.	489730	搿个房间里向有个电视机。
805187	Il a exprimé sa volonté d'arrêter la cigarette.	485599	伊发誓要戒烟。
805189	Il a affirmé vouloir arrêter la cigarette.	485599	伊发誓要戒烟。
805195	Il s'est plié à l'autorité.	485612	伊向权力屈服。
4198507	Cette chaise est trop petite.	839154	搿张矮凳忒小了。
809646	Notre maison compte sept pièces, la salle à manger comprise.	809653	阿拉个房子有得七间房间，包括吃饭间。
812272	Pourrais-je avoir un café s'il vous plaît ?	857173	谢谢侬好来杯咖啡伐？
812272	Pourrais-je avoir un café s'il vous plaît ?	857184	谢谢侬可以来杯咖啡伐？
818101	Dans cette classe, il n'y a que trois filles.	484308	搿个班只有三个女生。
820353	Tu ne devrais pas manger ici.	915922	侬勿应该垃海搿搭吃饭。
822080	Qu'est-ce qu'il y a en équipement public ?	420371	公共设施有眼啥？
822082	À l'heure actuelle, les bijoux en platine sont en vogue.	420195	现在铂金首饰邪气热门。
822083	À l'heure actuelle, les bijoux en platine sont très prisés.	420195	现在铂金首饰邪气热门。
822084	Cette année nous allons célébrer les quatre-vingts printemps de papy.	420755	阿拉今年要帮阿公老头做八十大寿。
822085	En ce moment quel est le taux de change du yen en yuan ?	420587	现在日元告人民币个兑换率是多少？
822090	Une fois arrivé à la station Changshou, appelle-moi s'il te plaît.	420459	到了常熟路站，请侬叫一声我。
822431	Il a démissionné sans préavis.	1541188	伊呒没预前通知就辞职了。
822431	Il a démissionné sans préavis.	1541190	伊拍拍屁股跑路了。
825946	C'est calamiteux.	825959	作孽唻。
827023	Je sais qu'il l'a fait.	915987	我晓得伊做过了。
828732	Fait chier, qu'est-ce qu'il a à passer l'aspirateur au beau milieu de la nuit !	828727	杀千刀，伊半夜三更吸尘啥体啦！
828771	Elle a fait des raviolis de crevette et elle a ajouté des champignons parfumés avec du poivre du Sichuan.	828770	伊做了虾饺加了香菇搭花椒。
832107	Les épinards sont âcres.	832110	菠菜涩个。
832114	Les plats du nord-est de la Chine sont fades.	832106	东北菜淡呱呱。
833020	Maintenant que nous avons à peu près le même niveau, nous pouvons commencer à apprendre quelques morceaux à quatre mains.	916071	现在阿拉差勿多有同样个水平了，阿拉可以开始学习几段四手联弹了。
836085	Tu peux vraiment pas t'en empêcher hein.	835763	侬真也贱勿过。
836090	T'es vraiment incorrigible.	835763	侬真也贱勿过。
836413	Je ne vais pas, encore, le refaire pour lui.	831937	我勿见得再脱伊重新做过。
836443	Plus tôt tu exposeras le problème, plus rapidement nous pourrons le résoudre.	831940	侬越是早眼提出问题来，阿拉越快就解决得脱 。
836444	De le savoir, c'est quand même une chose.	831939	晓得呒也是桩事体。
836445	Les deux compartiments dans le réfrigérateur sont remplis à ras bord.	832010	冰箱里头两格抽兜装了啪啪满。
836864	La thermos de thé a été remplie jusqu'à ras bord.	832013	一瓶茶瓶胆灌了啪啪潽了。
836869	Le roi de la blague n'est donc pas venu ?	828761	牛逼大王呒没来么？
836871	Le roi du mytho n'est donc pas venu ?	828761	牛逼大王呒没来么？
836894	La chaussée est glissante.	836900	马路滑个。
836894	La chaussée est glissante.	836902	车行道滑个。
836921	L'effet de trois-dimensions sur cette peinture est très réussi, tiens.	798422	搿幅画立体感老灵个喂。
837573	Neptune est la huitième planète du système solaire.	916313	海王星是太阳系个第八个行星。
837699	Je vais souvent pêcher dans la rivière.	837713	我经常到河浜里向去钓鱼。
837775	Lorsque nous apprenons des langues, nous apprenons des expressions toutes faites.	837770	当阿拉学外语个辰光，阿拉学熟语。
837777	Ce dommage nous coûtera beaucoup d'argent.	837778	搿个破坏会得花费阿拉交关钞票。
838658	La vérité ?	838660	事实？
838683	L'interprète essaie de donner le plus de détails et d'informations possibles.	838679	翻译垃海试图拨尽可能多个细节跟消息。
838786	L'interprète essaie de donner autant de détails et d'informations que possible.	838679	翻译垃海试图拨尽可能多个细节跟消息。
838809	Il n'y en avait pas beaucoup de présents.	838805	呒没多少人垃海。
838809	Il n'y en avait pas beaucoup de présents.	838808	呒没多少人参加。
838865	Quand tu auras terminé avec le livre, remets-le là où tu l'as trouvé.	838864	侬用好搿本书个辰光，拿伊放回到原来寻到个地方。
839135	En fait il n'est pas con, c'est juste qu'il a l'esprit étriqué.	839136	实际高头伊人又勿戆，只勿过伊心眼小。
839140	S'il te plaît pardonne-moi de t'avoir posé une question aussi personnelle.	839139	谢谢侬原谅我问了侬一个搿能噶私人个问题。
839159	Je suis fatigué de regarder la télévision.	839187	我看电视看了怨煞了。
839190	Il a abattu quelques branches de l'arbre.	839193	伊拿树浪向几根树枝割脱了。
839252	J'étais à la fête.	839254	我垃海派对。
839256	Quel genre d'homme était-il ?	839258	伊是哪能价样子个男人啊？
839325	Toi seul peux le faire, mais tu ne peux le faire seul.	839354	只有侬一个人做得到，但是侬独自一家头是做勿来个。
839330	Vous seul pouvez le faire, mais vous ne pouvez le faire seul.	839354	只有侬一个人做得到，但是侬独自一家头是做勿来个。
839332	Toi seule peux le faire, mais tu ne peux le faire seule.	839354	只有侬一个人做得到，但是侬独自一家头是做勿来个。
839333	Vous seule pouvez le faire, mais vous ne pouvez le faire seule.	839354	只有侬一个人做得到，但是侬独自一家头是做勿来个。
839393	Il veut fumer des maquereaux aujourd'hui.	839480	伊今朝要熏鲭鱼。
839393	Il veut fumer des maquereaux aujourd'hui.	839487	伊今朝要熏马角鱼。
839753	« Jamais ! » « Si. »	916058	“没门！”“有个。”
840616	Il parle à tort et à travers.	841574	伊瞎讲八讲。
840784	Il est d'une outrecuidance !	841578	伊认为自家来自唻！
841568	Dans ce film d'épouvante, les morts peuvent revenir à la vie.	786544	搿恐怖电影里向个死人会得活过来个。
841809	À quoi sert de lire, puisqu'à vingt-deux ans, on sait déjà tout.	842119	反正到了廿二岁像啥侪晓得了，看书还有啥用场呢。
841811	Passé vingt-deux ans, soit on parle six langues soit on a raté sa vie.	842105	过了廿二岁，一个人勿会得讲六种语言么相当于一生失败了。
841812	Il est impensable que quelqu'un de vingt-deux ans puisse encore apprendre quelque chose sur sa propre langue.	842128	廿二岁个人还会得学习关于自家语言个物事是勿可能设想个事体。
841931	Il a reporté son voyage à demain.	916070	伊拿伊个旅行推迟到明朝了。
