8625019	The poets say that sleep is the brother of death.	8542383	Λέγουσιν οἱ ποιηταὶ τὸν ὕπνον ἀδελφὸν εἶναι τοῦ θανάτου.
8819205	Why are you so difficult, Sir?	2732958	Διὰ τί εἶ οὗτω χαλεπός, ὦ δέσποτα;
8819209	The acts agreed with the words.	8542400	Τὰ ἔργα τοῖς λόγοις συμφωνείτω.
373330	Hello!	8853652	Χαῖρε.
374568	Perfect!	8853653	Χαίρετε.
319990	I know.	8853654	Οἶδα.
946034	Italy is in Europe.	8853679	Ἡ Ἰταλία ἐν τῇ Εὐρώπῃ ἐστίν.
946034	Italy is in Europe.	8853680	Ἡ Ῑ̓ταλίᾱ ἐν τῇ Εὐρώπῃ ἐστίν.
20093	Get up!	8491944	Ἔπαιρε σεαυτόν.
2478232	The bag is full.	8871817	Μεστός ἐστιν ὁ σάκκος.
2931905	It's time to go back home.	8871823	Καιρός ἐστιν οἴκαδε ἐπανιέναι.
3738560	Do you want to go with us?	8871829	Ἆρα βούλῃ μεθ'ἡμῶν ἰέναι;
2528454	Athens is in Greece.	8872095	Αἱ Ἀθῆναί ἐστιν ἐν τῇ Ἑλλάδι.
3410758	Tom seems to be rich.	8874983	Ὁ Θωμᾶς φαίνεται πλούσιος εἶναι.
3410892	Tom seems to be prepared.	8874988	Ὁ Θωμᾶς φαίνεται ἑτοῖμος εἶναι.
3410916	Tom seems to be poor.	8874991	Ὁ Θωμᾶς φαίνεται πένης εἶναι.
2237576	Tom passed away.	8881204	Ὁ Θωμᾶς ἐτελεύτησεν.
2645439	They said Mary was dead.	8881205	Ἔλεγον ὅτι ἡ Μαρία τέθνηκεν.
456237	It's raining.	8881208	Ὕει.
868955	I don't have money.	8881210	Ἀργύριον μὲν οὐκ ἔχω.
7734813	Tom appeared to be happy.	8881212	Ὁ Θωμᾶς μακάριος ἐφάνη.
2111726	I'm here.	8881214	Ἐνταῦθα δ' εἰμί.
1340	So what?	8881219	Εἶτα τί τοῦτο;
8885486	I'll buy a horse.	8885489	Ἵππον ὠνήσομαι.
530044	What do I have to do?	8890049	Τί δεῖ με ποιεῖν;
1886765	What do you have to do?	8890050	Τί δεῖ σε ποιεῖν;
3178389	What do we have to do?	8890051	Τί δεῖ ἡμᾶς ποιεῖν;
68180	What happened to him?	8890052	Τί ἔπαθεν;
1023786	What happened to Tom?	8890053	Τί ἔπαθεν ὁ Θωμᾶς;
1667947	What happened to you?	8890054	Τί ἔπαθες;
6438474	Tom took Mary to the doctor's.	8890055	Ὁ Θωμᾶς τὴν Μαρίαν παρὰ τὸν ἰατρὸν ἤγαγεν.
6888948	I took Tom to see the doctor.	8890056	Τὸν Θωμᾶν παρὰ τὸν ἰατρὸν ἤγαγον.
2272722	Tom has found Mary.	8890057	Ὁ Θωμᾶς τὴν Μαρίαν ηὗρεν.
2272723	Tom has found something.	8890058	Ὁ Θωμᾶς ηὗρε τι.
8456342	Tom gave some food to his dog.	8890060	Ὁ Θωμᾶς τῷ κυνὶ σῖτον παρέσχεν.
4964257	He gave food to many.	8890061	Πολλοῖς μὲν σῖτον παρέσχεν.
6666872	Tom died fighting for his country.	8890062	Ὁ Θωμᾶς ἀπέθανεν ὑπὲρ τῆς πατρίδος μαχόμενος.
8380048	He didn't flee.	8890065	Οὐκ ἔφυγεν.
3222982	Why are we sitting here?	8890069	Διὰ τί ἐνταῦθα καθίζῃ;
1102992	Why are you sitting there?	8890070	Διὰ τί ἐκεῖ καθίζῃ;
36405	Why are you crying?	8890071	Διὰ τί δακρύεις;
2267018	I hurt my foot.	8890072	Τὸν πόδα ἔβλαψα.
8890075	I have to see your hand.	8890073	Δεῖ με τὸν σὴν χεῖρα σκοπεῖν.
2237633	Tom returned home.	8890081	Ὁ Θωμᾶς οἴκαδε ἐπανῆλθεν.
7114368	I returned home.	8890083	Οἴκαδε ἐπανῆλθον.
8798043	He returned home.	8890084	Οἴκαδε ἐπανῆλθεν.
8798045	She returned home.	8890084	Οἴκαδε ἐπανῆλθεν.
2273404	Tom is returning home.	8890085	Ὁ Θωμᾶς οἴκαδε ἐπανέρχεται.
4501837	Tom must return home.	8890086	Δεῖ τὸν Θωμᾶν οἴκαδε ἐπανιέναι.
6439957	How did you become blind?	8890090	Πῶς τυφλὸς ἐγένου;
2444	Tell me what happened.	8890091	Εἰπέ μοι τί ἐγένετο.
24758	Tell me what to do.	8890092	Εἰπέ μοι τί δεῖ ποιεῖν.
25020	Tell me what you want.	8890094	Εἰπέ μοι τί βούλῃ.
308673	Where did you see her?	8890097	Ποῦ εἶδες αὐτήν;
1284161	Where did you see them?	8890098	Ποῦ εἶδες αὐτούς;
3096074	Where did you see that?	8890099	Ποῦ εἶδες τοῦτο;
4141178	Where did you see him?	8890100	Ποῦ εἶδες αὐτόν;
4217745	Where did you see Tom?	8890101	Ποῦ εἶδες τὸν Θωμᾶν;
2546269	Where did you leave it?	8890103	Ποῦ ἔλιπες αὐτό;
1887840	I told Tom what happened.	8890104	Τῷ Θωμᾷ εἶπον τί ἐγένετο.
2543343	Tom told Mary what happened.	8890105	Ὁ Θωμᾶς τῇ Μαρίᾳ εἶπε τί ἐγένετο.
3428322	Tom hurt himself when he fell.	8890106	Ἐπεὶ ὁ Θωμᾶς ἔπεσεν, κακόν τι ἔπαθεν.
6426209	Mary hurt herself when she fell.	8890108	Ἐπεὶ ἡ Μαρία ἔπεσεν, κακόν τι ἔπαθεν.
2405828	I said I can't help you.	8890109	Εἶπον ὅτι οὐ δύναμαί σε ὠφελεῖν.
8219930	The doctor heals the sick man.	8890126	Ὁ ἰατρὸς τὸν νοσοῦντα ἰατρεύει.
1095803	Tom became friends with Mary.	8890137	Ὁ Θωμᾶς φίλος τῇ Μαρίᾳ ἐγένετο.
8749031	Take him to a doctor.	8890143	Φέρε αὐτὸν παρὰ ἰατρόν τινα.
6809123	I have to take Tom to a doctor.	8890145	Δεῖ με τὸν Θωμᾶν φέρειν παρὰ ἰατρόν τινα.
8890115	The doctor said he can't help Tom.	8890110	Ὁ ἰατρὸς εἶπεν ὅτι οὐ δύναται τὸν Θωμᾶν ὠφελεῖν.
1935307	It's getting dark.	8890148	Ἑσπέρα γίγνεται.
291912	He knocked at the door.	8890153	Ἔκοψε τὴν θύραν.
311667	She knocked on the door.	8890153	Ἔκοψε τὴν θύραν.
39026	Knock on the door.	8890155	Κόπτε τὴν θύραν.
2956095	Tom became blind.	8890166	Ὁ Θωμᾶς τυφλὸς γέγονεν.
414128	I can't see anything.	8890167	Οὐδὲν ὁρῶ ἔγωγε.
6013254	Tom told Mary everything that happened.	8890171	Ὁ Θωμᾶς πάντα τὰ γενόμενα τῇ Μαρίᾳ εἶπεν.
3723901	There's been enough talking.	8890175	Ἅλις λόγων.
1890939	I'll take you to Tom.	8890183	Κομιῶ σε παρὰ τὸν Θωμᾶν.
31195	It's late.	8890185	Ὀψέ ἐστιν.
2275762	I don't want to sleep.	8890187	Οὐ βούλομαι καθεύδειν.
7946870	They don't want to sleep.	8890188	Οὐ βούλονται καθεύδειν.
3409245	Tom doesn't want to sleep.	8890190	Ὁ Θωμᾶς οὐ βούλεται καθεύδειν.
1868258	Tom hates me.	8890192	Ὁ Θωμᾶς με μισεῖ.
2199647	Everybody hates me.	8890193	Πάντες με μισοῦσιν.
2254919	Women hate me.	8890194	Αἱ γυναῖκες με μισοῦσιν.
2863220	Mary hates me.	8890195	Ἡ Μαρία με μισεῖ.
2273948	Why didn't I die?	8890197	Διὰ τί οὐκ ἀπέθανον;
1632118	I don't want to be alone all my life.	8890201	Οὐ βούλομαι πάντα τὸν βίον μόνος εἶναι.
1662906	Tom is consoling Mary.	8890204	Ὁ Θωμᾶς τὴν Μαρίαν παραμυθεῖται.
1665208	I am consoling Mary.	8890205	Τὴν Μαρίαν παραμυθοῦμαι.
3415178	Tom lent me some money.	8890213	Ὁ Θωμᾶς ἀργύριόν μοι ἐδάνεισεν.
1479370	Listen to me.	8890217	Ἄκουέ μου.
9019881	The house is there.	8879469	Ἡ οἰκία ἐστὶν ἐκεῖ.
9019896	The boy is there.	8879467	Ὁ παῖς ἐστιν ἐκεῖ.
5041127	He is eating the animal.	9032669	Τὸ ζῷον ἐσθίει.
8737529	He is eating the apple.	9032670	Τὸ μῆλον ἐσθίει.
1346609	The cat is eating the mouse.	9032671	Ὁ αἴλουρος τὸν μῦν ἐσθίει.
1986752	The child is eating the meat.	9032672	Ὁ παῖς τὸ κρέα ἐσθίει.
1986752	The child is eating the meat.	9032673	Τὸ παιδίον τὸ κρέα ἐσθίει.
5332076	My dog is eating the grapes.	9032674	Ὁ κύων μου τὴν σταφυλὴν ἐσθίει.
3680264	The cat is eating the small mouse.	9032675	Ὁ αἴλουρος τὸν μικρὸν μῦν ἐσθίει.
1986759	As for the child, he is eating the meat.	9032676	Ὁ δὲ παῖς τὸ κρέα ἐσθίει.
1986765	It's a child that is eating the meat.	9032677	Παῖς τις τὸ κρέα ἐσθίει.
1986765	It's a child that is eating the meat.	9032678	Παιδίον τι τὸ κρέα ἐσθίει.
1986759	As for the child, he is eating the meat.	9032679	Τὸ δὲ παιδίον τὸ κρέα ἐσθίει.
7733925	Men are mortal.	9032680	Ὁ ἄνθρωπος θνητός.
315498	She was educated by her grandfather.	9032683	Ὑπὸ τοῦ πάππου ἐπαιδεύθη.
8351322	Tom was educated by his grandfather.	9032684	Ὁ Θωμᾶς ὑπὸ τοῦ πάππου ἐπαιδεύθη.
1829	Life is beautiful.	9032686	Ὁ βίος καλός.
2045752	Mary is beautiful.	9032687	Ἡ Μαρία καλή.
7260496	Tom is beautiful.	9032689	Ὁ Θωμᾶς καλός.
6358471	Tom died, but Mary didn't.	9032696	Ὁ μὲν Θωμᾶς τέθνηκεν, ἡ δὲ Μαρία οὔ.
307509	They lived in peace.	9032697	Ἐν εἰρήνῃ ἐζῶντο.
980780	Who has come?	9032698	Τίς ἥκει;
1533842	Tom ran away.	9032699	Ὁ Θωμᾶς ἀπέδραμεν.
2254877	Who ran away?	9032700	Τίς ἀπέδραμεν;
46301	The boy ran away.	9032701	Ὁ παῖς ἀπέδραμεν.
46301	The boy ran away.	9032702	Τὸ παιδίον ἀπέδραμεν.
45276	The man ran away.	9032703	Ὁ ἀνὴρ ἀπέδραμεν.
663719	The cat ran away.	9032704	Ὁ αἴλουρος ἀπέδραμεν.
2985583	My dog ran away.	9032705	Ὁ κύων μου ἀπέδραμεν.
46719	The prisoner was released.	9032708	Ὁ αἰχμάλωτος ἐλύθη.
8079033	Release the prisoners.	9032709	Λῦσον τοὺς αἰχμαλώτους.
8079033	Release the prisoners.	9032710	Λύσατε τοὺς αἰχμαλώτους.
305790	They released the prisoner.	9032712	Τὸν αἰχμάλωτον ἔλυσαν.
2273063	Tom is carrying Mary.	9032714	Ὁ Θωμᾶς τὴν Μαρίαν φέρει.
8367507	Tom is carrying something.	9032715	Ὁ Θωμᾶς φέρει τι.
8367116	Tom is carrying a bag.	9032716	Ὁ Θωμᾶς σάκκον φέρει.
8367306	Tom is carrying a torch.	9032717	Ὁ Θωμᾶς λαμπάδα φέρει.
6269227	Tom is carrying a black bag.	9032718	Ὁ Θωμᾶς μέλανα σάκκον φέρει.
9033130	Greece is beautiful.	9032691	Ἡ Ἑλλὰς καλή.
304853	He stopped talking.	9039567	Ἐπαύσατο διαλεγόμενος.
305535	They stopped talking.	9039568	Ἐπαύσαντο διαλεγόμενοι.
305535	They stopped talking.	9039569	Ἐπαύσαντο διαλεγόμεναι.
317525	She stopped talking.	9039570	Ἐπαύσατο διαλεγομένη.
2238768	Tom stopped eating.	9039571	Ὁ Θωμᾶς ἐπαύσατο ἐσθίων.
2238779	Tom stopped playing.	9039572	Ὁ Θωμᾶς ἐπαύσατο παίζων.
2238791	Tom stopped speaking.	9039573	Ὁ Θωμᾶς ἐπαύσατο λέγων.
2238796	Tom stopped walking.	9039574	Ὁ Θωμᾶς ἐπαύσατο βαδίζων.
2238797	Tom stopped working.	9039575	Ὁ Θωμᾶς ἐπαύσατο ἐργαζόμενος.
2243339	They stopped running.	9039576	Ἐπαύσαντο τρέχοντες.
2243341	They stopped walking.	9039577	Ἐπαύσαντο βαδίζοντες.
2547192	I'm heading back home.	9039578	Οἴκαδε ἐπανέρχομαι.
2548255	I'm going back home.	9039578	Οἴκαδε ἐπανέρχομαι.
3635893	We're going back home.	9039579	Οἴκαδε ἐπανερχόμεθα.
2543584	I'm going to go make dinner.	9039580	Μέλλω τὸ δεῖπνον παρασκευάζειν.
5193599	I want to go back home.	9039581	Βούλομαι οἴκαδε ἐπανιέναι.
5218003	Tom wants to go back home.	9039582	Ὁ Θωμᾶς βούλεται οἴκαδε ἐπανιέναι.
3871327	Do you want to come back home?	9039583	Ἆρα βούλῃ οἴκαδε ἐπανιέναι;
2013520	I don't want to go back home.	9039584	Οὐ βούλομαι οἴκαδε ἐπανιέναι.
6153025	I'm waiting at home.	9039585	Οἴκοι μένω.
6356419	Tom is waiting at home.	9039586	Ὁ Θωμᾶς οἴκοι μένει.
1977826	She's waiting for you at home.	9039587	Οἴκοι σε μένει.
1981475	He's waiting for you at home.	9039587	Οἴκοι σε μένει.
7112912	I'm waiting for you at home.	9039589	Οἴκοι σε μένω.
6437855	Tom is waiting for Mary at home.	9039590	Ὁ Θωμᾶς οἴκοι τὴν Μαρίαν μένει.
9341947	I came, I saw, I won	5095024	ἦλθον, εἶδον, ἐνῑ́κησα.
9341956	I see the person.	7087941	Τὸν ἄνθρωπον ὁρῶ.
9341957	I see the human.	7087941	Τὸν ἄνθρωπον ὁρῶ.
9341971	Thomas took Maria to the doctor.	8890055	Ὁ Θωμᾶς τὴν Μαρίαν παρὰ τὸν ἰατρὸν ἤγαγεν.
9341974	Thomas hurts there.	7069696	Ὁ Θωμᾶς πονεῖ ἐκεῖ.
9341975	It's hurting Thomas there.	7069696	Ὁ Θωμᾶς πονεῖ ἐκεῖ.
9342010	And you? What are you doing?	2735397	Σὺ δὲ τί ποιεῖς;
9391508	My power is the love of the people.	3103837	ἰσχύς μου ἡ ἀγάπη τοῦ λαοῦ.
4079477	I am distressed for you, my brother Jonathan; you have been very pleasant to me. Your love to me was wonderful, surpassing the love of a woman.	9463180	ἀλγῶ ἐπὶ σοί, ἄδελφέ μου Ιωναθαν· ὡραιώθης μοι σφόδρα, ἐθαυμαστώθη ἡ ἀγάπησίς σου ἐμοὶ ὑπὲρ ἀγάπησιν γυναικῶν.
8831991	How the mighty have fallen, and the weapons of war have perished!	9463184	πῶς ἔπεσαν δυνατοὶ, καὶ ἀπώλοντο σκεύη πολεμικά.
9588122	I live in Ethiopia.	9589031	Ἐν τῇ Αἰθιοπίᾳ οἰκῶ.
8347401	Are you a prophet?	9851575	σύ γάρ προφήτης εἶ;
