1342967	Eres una mujer.	1560570	דו ביסט אַ פֿרױ.
578630	En el principio creó Dios los cielos y la tierra.	9087031	אין אָנהייב האָט גאָט באַשאַפֿן דעם הימל און די ערד.
1048539	Al principio Dios creó el cielo y la tierra.	9087031	אין אָנהייב האָט גאָט באַשאַפֿן דעם הימל און די ערד.
1216408	En el principio Dios creó los cielos y la tierra.	9087031	אין אָנהייב האָט גאָט באַשאַפֿן דעם הימל און די ערד.
7949312	En el principio creó Dios el cielo y la tierra.	9087031	אין אָנהייב האָט גאָט באַשאַפֿן דעם הימל און די ערד.
695390	No matarás.	9091011	זאָלסט ניט הרגען.
2747399	¿No estás de acuerdo, Tom?	9094048	צי ביסטו נישט מסכּים, טאָם?
9098384	¿Te vas a callar, hombre?	9098418	דו וועסט פֿאַרמאַכן דײַן פּיסק שוין, ברודערקע?
9099789	Sigue cotorreando, hombre.	9099930	פּלאַפּל ווײַטער, חבֿ‏ר.
8805666	¿Por qué odias a los Estados Unidos?	9101345	פֿאַרוואָס האָסטו פֿײַנט אַמעריקע?
2436015	Tom es agresivo.	9107321	טאָם איז אַגרעסיוו.
3793034	No hablamos francés.	9107399	מיר רעדן נישט פֿראַנצייזיש.
456286	Bésame el culo.	9119814	קוש מיר אין תּחת.
8082379	"Seréis para mí un reino de sacerdotes y una nación santa." Éstas son las palabras que has de decir a los israelitas.	9122710	און איר וועט מיר זײַן אַ קיניגרײַך פֿון כּהנים, און אַ הייליק פֿאָלק. דאָס זײַנען די ווערטער וואָס דו זאָלסט רעדן צו די קינדער פֿון ישׂראל.
9126672	Donald Trump es un pedazo de mierda.	9110582	דאָנאַלד טראָמפּ איז אַ שטיק דרעק.
8761789	¡Liberen a Bolivia!	9140901	באַפֿרײַט באָליוויע!
434627	¿Hablas chino?	9144739	צי רעדסטו כינעזיש?
835120	¿Habla usted chino?	9144740	צי רעדט איר כינעזיש?
9148584	No todas las rosas son rojas.	9150198	נישט אַלע רויזן‎ זענען רויט.
9149254	Los perros son criaturas nobles.	9150429	הינט זענען נאָבעלע באַשעפֿענישן.
8787059	¡Liberad a Cataluña!	9152360	באַפֿרײַט קאַטאַלאָניע!
9151496	Rojo, amarillo y azul son colores.	9152387	רויט, געל און בלאָ זענען קאָלירן.
9151496	Rojo, amarillo y azul son colores.	9152392	רויט, געל און בלאָ זענען פֿאַרבן.
1705458	¿Quién necesita preguntas retóricas?	9154162	ווער דאַרף רעטאָרישע פֿראַגעס?
3562699	Tienes un problema.	9159733	דו האָסט אַ פּראָבלעם.
1325900	La abeja salió por la ventana.	9159800	די בין איז אַרויסגעפֿלויגן פֿון דער פֿענצטער.
1656329	Estamos aquí.	9159846	מיר זענען דאָ.
1656329	Estamos aquí.	9159847	מיר זײַנען דאָ.
4505732	Tom empezó a leer.	9187612	טאָם האָט אָנגעהויבן לייענען.
4505733	Tom comenzó a leer.	9187612	טאָם האָט אָנגעהויבן לייענען.
1019258	Él no te entiende.	9161896	ער פֿאַרשטייט דיך נישט.
2183961	No te entiende.	9161896	ער פֿאַרשטייט דיך נישט.
796853	¡Mi cuchara es demasiado grande!	9210715	מײַן לעפֿל איז צו גרויס!
5052858	Me ataron.	9214300	זיי האָבן מיך צוגעבונדן.
7148852	Esto es un cuchillo.	9216510	דאָס איז אַ מעסער.
1592900	Estamos aprendiendo español.	9246974	מיר לערנען זיך שפּאַניש.
6001506	Aprendemos español.	9246974	מיר לערנען זיך שפּאַניש.
855231	La ballena no es un pez, sino un mamífero.	9256231	דער וואַלפֿיש איז נישט קיין פֿיש, נאָר אַ זויגער.
5067893	Finlandia no es una utopía.	9258221	פֿינלאַנד איז נישט קיין אוטאָפּיע.
5067893	Finlandia no es una utopía.	9258229	פֿינלאַנד איז נישט קיין גן־עדן אויף דער וועלט.
4702551	Misión superada.	9261970	שליחות דורכגעפֿירט.
6685627	No he dicho nada.	9282125	כ׳האָב גאָרנישט געזאָגט.
2019427	No dije nada.	9282125	כ׳האָב גאָרנישט געזאָגט.
2084656	No quiero quedarme acá.	9283399	איך וויל דאָ נישט בלײַבן.
9346381	Tom es un hombre y yo soy una mujer.	9346205	טאָם איז אַ מאַנסביל, און איך בין אַ פֿרוי.
9346381	Tom es un hombre y yo soy una mujer.	9346175	טאָם איז אַ מאַן, און איך בין אַ פֿרוי.
339837	Me duele la cabeza.	9352548	דער קאָפּ טוט מיר וויי.
436630	Tengo dolor de cabeza.	9352548	דער קאָפּ טוט מיר וויי.
9353139	Tom bebe café instantáneo.	9353162	טאָם טרינקט תּיכּף־⁠קאַווע.
9353139	Tom bebe café instantáneo.	9353157	טאָם טרינקט גיכע קאַווע.
502366	¿Qué es el amor?	8617403	וואָס איז ליבע?
9365729	Amo los gatitos.	9365723	כ׳האָב ליב קעצלעך.
9365729	Amo los gatitos.	9365812	כ׳האָב ליב קעצעלעך.
1013884	Estoy en casa.	9367483	איך בין בײַ זיך.
509442	La religión es el opio del pueblo.	9373170	די רעליגיע איז דער אָפּיום פֿונעם פֿאָלק.
1585303	Tom está en casa.	9365763	טאָם איז אין דער היים.
1981286	¿Tengo razón?	9379672	צי בין איך גערעכט?
9382435	¿Los odias tanto?	9382469	צי האָסטו זיי אַזוי פֿיל פֿײַנט?
463019	Las mujeres están trabajando.	9399019	די פֿרויען אַרבעטן.
9407822	Epstein no se suicidó.	9408027	עפּשטיין האָט זיך נישט געהרגעט.
9408204	Epstein no se mató.	9408027	עפּשטיין האָט זיך נישט געהרגעט.
6864200	Un oso mató a Tom.	8366847	אַ בער האָט געהרגעט טאָמען.
5809733	Tom comprendió a Mary.	8107723	טאָם האָט פֿאַרשטאַנען מאַריען.
1248561	Es simple.	9417302	ס׳איז פּשוט.
1475368	Tom vive en Gales.	9418742	טאָם וווינט אין װײלז.
9420069	En el principio, Tom creó Boston y Australia.	9404712	אין אָנהייב האָט טאָם באַשאַפֿן באָסטאָן און אויסטראַליע.
4076847	¿Dónde está el martillo?	9431394	וווּ איז דער האַמער?
3195891	Coge mi caballo.	9439856	נעם מײַן פֿערד.
4988369	¡Contesta!	9439904	ענטפֿער!
2224933	Tom está muy enfermo.	9443253	טאָם איז זייער קראַנק.
5214207	¿Cuando?	9443620	ווען?
6063593	¿Cuándo?	9443620	ווען?
4869850	¡Yo!	9445071	איך!
1007443	¿Por qué estamos aquí?	9446654	פֿאַרוואָס זענען מיר דאָ?
9446767	No creo en la hipnosis.	9447462	איך גלייב נישט אין היפּנאָז.
9446657	¿Qué es el Area 51?	9451260	וואָס איז „עריע פֿיפֿטי-וואָן“?
8885871	Esta caja está muy pesada.	9451973	דאָס קעסטל איז זייער שווער.
5715420	Esta caja es muy pesada.	9451973	דאָס קעסטל איז זייער שווער.
2532719	Está aquí.	9452392	ער איז דאָ.
2532719	Está aquí.	9452415	ס׳איז דאָ.
2532719	Está aquí.	9452422	זי איז דאָ.
3203297	Ella está aquí.	9452422	זי איז דאָ.
9456194	Ella es búlgara.	9456225	זי איז אַ בולגאַרין.
9456194	Ella es búlgara.	9456226	זי איז אַ בולגאַרקע.
5566216	Practico judo.	9457405	איך טרעניר זיך אין דזשודאָ‎.
9458720	¿Dónde está Cabilia?	9458707	וווּ איז קאַביליע?
9458728	"¿Cómo es el francés de Tom?" "Bastante bueno."	9458745	„ווי איז טאָמס פֿראַנצייזיש?״ – „גאַנץ גוט.״
3463191	Usted es especial.	9463542	איר זענט ספּעציעל.
3250807	Mi perro está limpio.	9463725	מײַן הינטל איז ריין.
3250807	Mi perro está limpio.	9463729	מײַן הונט איז ריין.
2726569	¿Qué hacemos aquí?	9463986	וואָס טוען מיר דאָ?
7558417	¿Qué estamos haciendo aquí?	9463986	וואָס טוען מיר דאָ?
9466242	No hay zorros aquí.	9464824	ס׳איז נישטאָ דאָ קיין פֿוקסן.
8955220	Tom enseña a los niños francés.	9475456	טאָם לערנט פֿראַנצייזיש מיט די קינדער.
8955220	Tom enseña a los niños francés.	9475458	טאָם לערנט פֿראַנצייזיש מיט קינדער.
9475601	No es inteligente.	9475595	ער איז נישט קלוג.
9475601	No es inteligente.	9475593	זי איז נישט קלוג.
9475599	Ella no es inteligente.	9475593	זי איז נישט קלוג.
1215730	Hace buen tiempo.	9475721	ס׳איז אַ שיינער וועטער.
2676439	Está haciendo buen tiempo.	9475721	ס׳איז אַ שיינער וועטער.
5027580	Tomás es joven e ingenuo.	9476533	טאָם איז יונג און נאַיִוו.
1278813	Tom quiere ser exitoso.	9476723	טאָם וויל זײַן געראָטן.
1278813	Tom quiere ser exitoso.	9476731	טאָם וויל זײַן אַ מוצלח.
9476902	Tom es mi hijo mayor.	9476895	טאָם איז מײַן בכור.
9476903	Tom es mi primogénito.	9476906	טאָם איז מײַן ערשטע קינד.
9477535	¿Qué es una pandemia?	9477515	וואָס איז אַ פּאַנדעמיע?
9478262	El español y el italiano son muy similares.	9476520	שפּאַניש און איטאַליעניש זענען זייער ענלעך.
1504447	Él me respeta.	9478299	ער האָט דרך־ארץ פֿאַר מיר.
4509817	La casa de Tom tiene tres habitaciones.	9478567	טאָמס הויז האָט דרײַ צימערן.
598209	El león es un animal.	9478899	דער לייב איז אַ חיה.
2857560	Un león es un animal.	9478897	אַ לייב איז אַ חיה.
580911	¿Hablas alemán?	9480771	צי רעדסטו דײַטש?
522399	¿Habla usted alemán?	9480772	צי רעדט איר דײַטש?
2304533	¿Habláis alemán?	9480772	צי רעדט איר דײַטש?
1284308	Tom es muy viejo.	9481041	טאָם איז זייער אַלט.
1530523	¿Hablas holandés?	9481604	צי רעדסטו האָלענדיש?
1530525	¿Habla holandés?	9481605	צי רעדט איר האָלענדיש?
1530526	¿Hablan holandés?	9481605	צי רעדט איר האָלענדיש?
9482054	Soy un gato de ciencia.	9031209	איך בין אַ קאַץ פֿון וויסנשאַפֿט.
598219	La rosa pertenece a Teodoro.	9483172	די רויז געהערט טעאָדאָרן.
615573	Mi padre está sano.	9483258	דער טאַטע איז געזונט.
598227	El padre está sano.	9483258	דער טאַטע איז געזונט.
728861	Mi padre está en buen estado de salud.	9483258	דער טאַטע איז געזונט.
1691221	Un niño no es una persona madura.	9484604	אַ קינד איז נישט קיין רײַפֿער מענטש.
9484533	Mi padre me dio un pequeño préstamo de un millón de dólares.	9484737	מײַן טאַטע האָט מיר געגעבן אַ קליינע הלוואה פֿון מיליאָן דאָלאַר.
609674	Ya no llora el niño.	9488190	דאָס קינד וויינט שוין נישט.
9484325	Yo soy el presidente de los Estados Unidos. Nunca le hables así al presidente.	9488509	איך בין דער פּרעזידענט פֿון די פֿאַראייניקטע שטאַטן. רעד נישט קיין מאָל אַזוי צום פּרעזידענט.
8955312	Lo que están viendo y lo que están leyendo no es lo que está pasando.	9489253	וואָס איר זעט און וואָס איר לייענט איז נישט וואָס פּאַסירט.
8955312	Lo que están viendo y lo que están leyendo no es lo que está pasando.	9489374	וואָס איר זעט און לייענט איז נישט וואָס פּאַסירט.
9489410	Muchos enemigos atacaron Roma.	9489391	אַ סך שׂונאים זענען באַפֿאַלן רוים.
1408294	Somos personas.	9495230	מיר זענען מענטשן.
757857	Somos humanos.	9495230	מיר זענען מענטשן.
2914137	Somos seres humanos.	9495230	מיר זענען מענטשן.
1198059	Nosotros somos humanos.	9495230	מיר זענען מענטשן.
9487964	¡Amo Tejas!	9496514	איך האָב ליב טעקסאַס!
9487964	¡Amo Tejas!	9496543	כ׳האָב ליב טעקסאַס!
7160338	El micrófono nuevo va mejor.	9504853	דער נײַער מיקראָפֿאָן אַרבעט בעסער.
7160338	El micrófono nuevo va mejor.	9504863	דער נײַער מיקראָפֿאָן גייט בעסער.
7160338	El micrófono nuevo va mejor.	9504858	דער נײַער מיקראָפֿאָן פֿונקציאָנירט בעסער.
5057164	Nos vamos a caminar.	9504882	מיר וועלן גיין.
1881118	Quiero un cachorro.	9505181	איך וויל אַ הינטעלע.
652393	Siempre dice lo mismo.	9513821	ער זאָגט תּמיד דאָס זעלבע.
652393	Siempre dice lo mismo.	9513827	ער זאָגט שטענדיק דאָס זעלבע.
652393	Siempre dice lo mismo.	9513831	ער זאָגט אַלע מאָל דאָס זעלבע.
937841	Llamadme Ishmael.	9515245	רופֿט מיך ישמעאל.
3227066	Llámeme Ismael.	9515245	רופֿט מיך ישמעאל.
969658	Llámame Ishmael.	9515443	רוף מיך ישמעאל.
6403991	Soy búlgaro.	9516004	איך בין אַ בולגאַר.
2874601	Esos son mis zapatos.	9517485	יענע זענען מײַנע שיך.
1327635	La chica está sola.	9517929	די בחורטע איז עלנט.
2117864	Me empecé a preparar.	9519369	איך האָב אָנגעהויבן זיך צוגרייטן.
2117866	Empecé a preparame.	9519369	איך האָב אָנגעהויבן זיך צוגרייטן.
9519743	Nuestro hijo mayor se llama Tom.	9519749	אונדזער בכור הייסט טאָם.
803643	De acuerdo.	9522467	מסכּים.
378279	Estoy de acuerdo.	9522502	איך בין מסכּים.
2842	Yo estoy de acuerdo.	9522502	איך בין מסכּים.
4557272	Tom estuvo de acuerdo.	9522605	טאָם האָט מסכּים געווען.
1165816	Tom estaba impresionado.	9522637	טאָם איז נתפּעל געוואָרן.
5020881	Tomás quedo impresionado.	9522637	טאָם איז נתפּעל געוואָרן.
9524539	Tom me robó los zapatos.	9521725	טאָם האָט געגנבֿעט מײַנע שיך.
9477136	Quiero conversar con ella acerca de mi futuro.	9524542	איך וויל רעדן מיט איר וועגן מײַן צוקונפֿט.
9477136	Quiero conversar con ella acerca de mi futuro.	9524543	איך וויל רעדן מיט איר וועגן מײַן עתיד.
9524682	Tom no tiene televisión.	9525496	טאָם האָט נישט קיין טעלעוויזאָר.
9530185	Si no me puedes ver, no te puedo ver.	9529472	אױב דו קענסט מיך נישט זען, קען איך דיך אויך נישט זען.
972276	Ella lo admiraba.	9531691	זי האָט אים באַוווּנדערט.
9532908	Creemos que el Kabyle es un idioma y no un dialecto.	9532930	מיר האַלטן קאַביליש פֿאַר אַ שפּראַך און נישט קיין דיאַלעקט.
912827	Cada gato tiene su propia personalidad.	9533737	יעדע קאַץ האָט איר אייגענע‎ פּערזענלעכקייט.
1852257	Gracias por el regalo que le hiciste a mi hijo.	9536159	אַ דאַנק פֿאַר דער מתּנה וואָס דו האָסט געגעבן מײַן זון.
8965519	¿Existe un dios?	9537001	צי איז פֿאַראַן אַ גאָט?
8965519	¿Existe un dios?	9537012	צי איז דאָ אַ גאָט?
600457	Mucho gusto.	9538393	זייער אײַנגענעם.
456636	Encantado.	9538393	זייער אײַנגענעם.
536849	Encantado de conocerte.	9538393	זייער אײַנגענעם.
456638	Encantada de conocerte.	9538393	זייער אײַנגענעם.
456640	Encantado de conocerlo.	9538393	זייער אײַנגענעם.
578847	No hay nada nuevo bajo el sol.	9545846	אין כּל חדש תּחת השמש.
578847	No hay nada nuevo bajo el sol.	9545947	ניטאָ קיין נײַס אונטער דער זון.
3893227	No soy húngaro.	8454013	כ'בין נישט קיין אונגאַר.
2500146	Laurie tiene veinte años.	9548252	לאָרי איז צוואַנציק יאָר אַלט.
2132230	Es difícil de decir.	9549913	ס׳איז שווער צו זאָגן.
9443859	Las ranas comen moscas.	9553254	זשאַבעס עסן פֿליגן.
9553780	"Buenas noches, Tom." "Buenas noches, Mary."	9553732	„אַ גוטע נאַכט, טאָם.” ― „אַ גוט יאָר, מערי.”
9553788	Buenas noches, Tatoeba.	9553718	אַ גוטע נאַכט, טאַטאָעבאַ.
1567446	¡Trabajadores de todos los países, uníos!	8453665	אַרבעטער פֿון אַלע לענדער, פֿאַראײניקט זיך!
9432139	Tom vendrá.	9557756	טאָם וועט קומען.
4491298	¿Tienes un cuchillo?	9560052	האָסט אַ מעסער?
4491298	¿Tienes un cuchillo?	9560053	צי האָסטו אַ מעסער?
4491298	¿Tienes un cuchillo?	9560054	דו האָסט אַ מעסער?
9518851	No puedes negar la verdad.	9570780	דו קענסט נישט אָפּלייקענען דעם אמת.
9518887	¿Por qué no quiso venir Tom?	9570809	פֿאַרוואָס האָט טאָם נישט געוואָלט קומען?
700154	¡Qué bello pájaro es!	9574444	אַזאַ שיינער פֿויגל!
4797544	La gente es tan estúpida.	9574981	מענטשן זענען אַזוי נאַריש.
4797544	La gente es tan estúpida.	8606553	דער עולם איז אַ גולם.
1748284	Me siento fatal.	9583059	כ׳פֿיל זיך שרעקלעך.
9583135	Soy tan fuerte como Sansón.	9583102	כ׳בין שטאַרק ווי שמשון הגיבור.
436132	¿Qué tal?	8826427	וואָס טוט זיך?
9464328	Erdogan es el presidente de Turquía.	9583346	ערדאָאַן איז דער פּרעזידענט פֿון טערקײַ.
1698571	No es un truco.	9583372	ס׳איז נישט קיין טריק.
2789755	Lo que es mío es tuyo.	9584576	דאָס וואָס איז מײנס איז דײַנס.
9584844	Sami no tenía un cepillo de dientes.	9584843	סאַמי האָט נישט געהאַט קיין ציינבערשטל.
9511376	Tom aún estaba vivo.	9584877	טאָם איז נאָך געווען בײַם לעבן.
687363	¿Qué le pasa?	9585620	וואָס טוט זיך מיט אים?
9585674	No estoy muerto.	9585406	כ׳בין נישט טויט.
9585674	No estoy muerto.	9585408	איך בין נישט טויט.
9585673	No estoy muerta.	9585406	כ׳בין נישט טויט.
9585673	No estoy muerta.	9585408	איך בין נישט טויט.
556221	Su historia es verdadera.	9587479	זײַן מעשׂה איז אמת.
9584835	La familia de Tom está en Australia.	9587520	טאָמס משפּחה איז אין אויסטראַליע.
7852196	Un lobo está aullando.	9589848	אַ וואָלף ווויעט.
7852196	Un lobo está aullando.	9589849	אַ וואָלף וואויעט.
7852196	Un lobo está aullando.	9589859	ס׳ווויעט אַ וואָלף.
7852196	Un lobo está aullando.	9589862	ס׳וואויעט אַ וואָלף.
2109030	Todos los franceses usan boina.	9590152	אַלע פֿראַנצויזן טראָגן בערעטן.
9593900	Tom construyó una cometa.	9593910	טאָם האָט געבויט אַ פֿלישלאַנג.
2409258	¿Tom está enfermo?	9593991	צי איז טאָם קראַנק?
2409258	¿Tom está enfermo?	9593993	טאָם איז קראַנק?
9594109	Tom es traductor.	8657834	טאָם איז אַן איבערזעצער.
1327907	Es inevitable.	9611267	מע קען עס נישט אויסמײַדן.
1136464	Ella es agente del FBI.	9615365	זי איז אַן עף־⁠בי־⁠אײַ־⁠אַגענטקע.
1230817	Se parece a un pato.	9630510	ס׳זעט אויס ווי אַ קאַטשקע.
569583	No tiene muchos amigos.	9630599	זי האָט נישט קיין סך חבֿרים.
569583	No tiene muchos amigos.	9631354	ער האָט נישט קיין סך חבֿרים.
577102	En el vino está la verdad.	9632518	וואָס בײַ אַ ניכטערן אויף דער לונג איז בײַ אַ שיכּורן אויף דער צונג.
2416409	Se sentía un poco cansado.	9636037	ער האָט זיך געפֿילט אַ ביסל מיד.
8557953	Ella se sintió un poco cansada.	9636080	זי האָט זיך געפֿילט אַ ביסל מיד.
927671	Ella se sentía un poco cansada.	9636080	זי האָט זיך געפֿילט אַ ביסל מיד.
9634617	Se sentía un poco cansada.	9636080	זי האָט זיך געפֿילט אַ ביסל מיד.
2216888	Nevó en Jerusalén.	9637262	ס׳האָט געשנייט אין ירושלים.
4525489	Yo hablo lituano.	9638177	איך רעד ליטוויש.
4525487	Hablo lituano.	9638177	איך רעד ליטוויש.
4525487	Hablo lituano.	9638176	כ׳רעד ליטוויש.
2486306	Tom siempre está sonriendo.	9639524	טאָם שמייכלט שטענדיק.
9637452	Mis padres viven en Australia.	9640575	מײַנע עלטערן וווינען אין אויסטראַליע.
9637452	Mis padres viven en Australia.	9640577	מײַנע טאַטע־מאַמע וווינען אין אויסטראַליע.
9637452	Mis padres viven en Australia.	9640579	מײַנע עלטערן וואוינען אין אויסטראַליע.
9637452	Mis padres viven en Australia.	9640580	מײַנע טאַטע־מאַמע וואוינען אין אויסטראַליע.
1262198	Odio la hipocresía.	9640622	כ׳האָב פֿײַנט די היפּאָקריטישקייט.
2409192	Detesto la hipocresía.	9640622	כ׳האָב פֿײַנט די היפּאָקריטישקייט.
8006375	Mary no puede tener hijos.	9650473	מערי קען נישט האָבן קיין קינדער.
8006374	Mary no puede tener niños.	9650473	מערי קען נישט האָבן קיין קינדער.
9658487	Vivimos en una sociedad.	8643353	אונז לעבן אין א געזעלשאפט.
9658487	Vivimos en una sociedad.	7968754	מיר לעבן אין אַ געזעלשאַפֿט.
8804656	El perro no está durmiendo.	9661066	דאָס הינטל שלאָפֿט נישט.
9660771	El perro no duerme.	9661066	דאָס הינטל שלאָפֿט נישט.
9660771	El perro no duerme.	9661063	דער הונט שלאָפֿט נישט.
8804656	El perro no está durmiendo.	9661063	דער הונט שלאָפֿט נישט.
1304019	Somos el 99%.	9663076	מיר זענען די 99%.
1754026	¿Dónde has aprendido francés?	9667979	וווּ האָסטו זיך געלערנט פֿראַנצייזיש?
2185061	¿Dónde aprendiste francés?	9667979	וווּ האָסטו זיך געלערנט פֿראַנצייזיש?
9667690	¿Dónde aprendiste latín?	9667984	וווּ האָסטו זיך געלערנט לאַטײַן?
9672299	Tom vive en el campo.	9672310	טאָם וווינט אין דאָרף.
3186579	Me gustan las mariposas.	9672771	כ׳האָב ליב פֿלאַטערל⁠עך.
3187537	Me encantan las mariposas.	9672771	כ׳האָב ליב פֿלאַטערל⁠עך.
9672687	Quiero ir a España.	9672901	כ׳וויל פֿאָרן קיין שפּאַניע.
505670	Ella habla diez lenguas.	9673546	זי רעדט צען שפּראַכן.
9676267	Mary no es muy amistosa.	9676266	מערי איז נישט זייער חבֿריש.
9676264	Tom no es muy amistoso.	9676265	טאָם איז נישט זייער חבֿריש.
9676554	Hablaban un idioma que no reconocí.	9676074	זיי האָבן גערעדט אַ שפּראַך וואָס איך האָב נישט דערקענט.
9676554	Hablaban un idioma que no reconocí.	9677424	זיי האָבן גערעדט אַ לשון וואָס איך האָב נישט דערקענט.
1673432	Tom decidió convertirse en vegetariano.	9677611	טאָם האָט באַשלאָסן צו ווערן אַ וועגעטאַריער.
436594	Me siento bien.	8102642	איך פֿיל זיך גוט.
2110505	Me siento enferma.	9680170	איך פֿיל זיך קראַנק.
2110504	Me siento enfermo.	9680170	איך פֿיל זיך קראַנק.
812488	Me siento culpable.	9680188	איך פֿיל זיך שולדיק.
9681675	Todos los perros son buenos perros.	9650246	אַלע הינט זענען גוטע הינט.
929642	No se puede confiar en los políticos.	9681682	מע קען נישט געטרויען קיין פּאָליטיקערס.
9653812	¡Deja de ser tan lindo!	9683800	הער אויף צו זײַן אַזוי חנעוודיק!
1119469	El amor es una mierda.	9688136	די ליבע איז דרעק.
9043814	A nadie le importa tu conciencia.	9688158	דײַן געוויסן אַרט נישט קיינעם.
4429631	Donde hay humo, hay fuego.	9689256	דאָרט וווּ ס׳איז אַ רויך, איז אַ פֿײַער אויך.
1599015	No hay humo sin fuego.	9689256	דאָרט וווּ ס׳איז אַ רויך, איז אַ פֿײַער אויך.
9653812	¡Deja de ser tan lindo!	9694152	הער אויף צו זײַן אַזוי זיס!
1153709	Las flores son amarillas.	9694675	די בלומען זענען געל.
5752598	Voy a ir a Boston.	9694975	איך וועל פֿאָרן קיין באָסטאָן.
9674412	Vivimos en universos distintos.	9695372	מיר לעבן אין אַנדערע אוניווערסן.
9674411	Vivimos en universos diferentes.	9695372	מיר לעבן אין אַנדערע אוניווערסן.
9696078	Nadie sabe que soy gay.	9696075	קיינער ווייס נישט, אַז איך בין גיי.
9696078	Nadie sabe que soy gay.	9696074	קיינער ווייס נישט, אַז איך בין געי.
