300662	He came back home a while ago.	5894576	Muli isio dualai di tiinu.
306531	They dropped an atomic bomb on Hiroshima.	5910925	Pinorotu diolo do bodilan atom hodi Hiroshima.
308014	I'm sorry she's not here.	5899280	Siou tu aiso isido hiti.
310875	She doesn't like soccer.	5909542	Au isido orohian do mimbuul.
314271	She promised me to come.	5907920	Mamatos isido doho moi rikot.
331920	Woe to infidels.	5899271	Tulun au mumboyo kopio.
378502	I have a dog.	5899308	Kitasu oku.
434186	All roads lead to Rome.	5899480	Wayaan ngawi gisom do bandar Rome.
442011	It's time to get up.	5901245	Posik no.
540279	I am trying to learn English.	5907822	Umbalan ku pisingilaan do boros Inggilis.
593278	He's now studying.	5907164	Minsingilo isio po baino.
682439	Tom won $10,000 in the lottery.	5907842	Nakalantoi i Tom do numbur soginumu 10,000.
802650	They had not fought for more than forty years.	5901250	Aiso nodi saapan diolo lolobi do apat nohopod toun.
1094168	Tom expected at least a ten percent return on his investment.	5891719	Andasan di Tom nopo inbismin dau nga hopod pihatus do pogulion.
1098219	I am not a businessperson.	5894505	Yoho okon ko songulun mogigindapu.
1254676	Add rice wine before cooking to remove the unpleasant odour.	5913124	Poruhangon nopo lihing tintod do mongonsok montok poiduon do toutong.
1334936	Argentinian grapes for five reals a box!	5894544	Limo Reals gatang iso kaban do anggur Argentina!
1527922	"What anthropoid would your girlfriend be most like?" "What a question... Well, um... An orangutan, I guess."	5913109	"Nunu nopo kawo kara do sumandak nu?" "Kogiu matu."
1635525	There is one less.	5909575	Au nabagal songulun.
1660906	Tom is playing with his son.	5899687	Mamain i Tom do tanak kusai dau.
1839647	You don't need to say anything.	5894519	Au tagal poboroso diri.
2033598	Tom wanted to wear his new shoes.	5899543	Manu i Tom panangkasut wagu dau.
2195194	He's hung like a horse.	5894458	Kotirog toli dau miagal do kuda.
2252490	I have a twin brother.	5899681	Kimiapid oku di kusai.
2260530	I can't live without a woman.	5953311	Au oku milo iyonon miampai aiso tondu.
2264822	I'm a zombie!	5899684	Yoho i zombi!
2323058	I don't see how you can ignore this.	5899460	Au oku kokito poingkuro daa pologoson nu dilo.
2414030	Tom and Mary hurried up the steps together.	5953310	Pinoposiau i Tom om i Mary do wayaan laang.
2642552	We all know what happened here.	5953306	Nokoilo yahai do nunu kinaantakan hiti.
2642909	Tom is very worried about you.	5899470	Tumongob kopio i Tom kokomoi diya.
2698834	The box was full of books.	5894478	Nabagalan dilo kaban o buuk.
2771715	When will you come back home?	5901242	Soira ulion dualai nu?
2794061	They ate lunch together.	5894583	Mogiampot iyolo mangakan.
3070950	The majority of husbands remind me of an orangutan trying to play the violin.	5913105	Sawo nopo ginumuan nga pinosorou oku kokomoi do kogiu main violin.
3206903	I eat an apple and she eats bread.	5910903	Mangakan oku do ipol om isido nopo mangakan do ruti.
3233943	Where did I put my keys?	5952914	Hombo kunsi di pinoopi ku?
3344376	Today it's quite hot.	5894471	Alasu tadau baino tokuri.
3483058	Tom should've arrived by this time.	5899371	Apatut no i Tom korikot hiti'd baino.
3484726	Tom scolded his son for being lazy.	5901246	Otogod i Tom di tanak kusai dau tu gobulan.
3594010	That's all I want to say.	5901249	Iti no boros ku.
3620217	Tom has probably already been to the bank today.	5894446	Nokoongoi matu i Tom hilo'd walai poopian tusin dinondo.
3633606	We like playing.	5894388	Orohian yahai mamain.
3642026	Tom, what do you want to have for dinner?	5907817	Oi Tom, nunu siakan nu don totuong diti?
3721607	Tom tried to make sense of what just happened.	5953305	Umbalan i Tom poiloon do nunu kinaantakan.
3733430	I don't even know who you are anymore.	5952918	Au oku kointutun diya nodi.
3733556	Tom used to be my roommate.	5958616	Koruhang miiso bilik ku i Tom.
3821732	You look like an orangutan.	5913097	Miagal kogiu ko dii.
3861611	Water is life.	5978216	Waig nopo nga koposion.
3878517	I don't speak Albanian.	5899526	Au oku momboros Albania.
3915108	It's our job to help you.	5894497	Iti nopo nga tugu-wangon dahai monguhup diya.
3936210	Sorry, he is not here.	5899277	Siou, aiso isio hiti.
3956443	Tom is here to protect me.	5899487	Hiti i Tom tamangon doho.
4009122	Three people were found murdered in Dan's home.	5906596	Haro tolu tulun napatai id dualai Dan.
4190431	This grocery store only sells organic food.	5894364	Haro padagangan do taakanon kiruganik hilo'd kadai pomolian taakanon.
4214587	I will try to find them.	5907796	Ihumon ku'ndo diolo.
4224534	She will clean my room.	5894482	Lihungan isido ndo bilik ku.
4552765	Ikea instructions are not always perfect.	5901282	Au sumongkuro otopot ngawi ilo ponontudukan do Ikea kasasari.
4555662	Is there water there?	5891735	Haro waig hodi toi?
4717486	If you have a couple minutes, could you hear me out?	5899521	Kitimpu 2 minit ko nopo, obuli daa monongkiboros kito?
5441969	Bornean orangutans, a critically endangered species, give birth approximately every eight years.	5913101	Koligaganan nopo ginumuan kogiu mantad pulou Borneo dot osusuan id lolobi po walu toun.
5720603	Tom goes to the supermarket almost every day.	5892009	Mongoi i Tom hilo'd kadai pomolian tagayo monikid tadau.
5753467	Tom gave Mary a towel.	5958615	Manahak i Tom do kumut pinihid kumaa di Mary.
806878	A light rain was falling.	6141121	Moris-poris no rasam.
1398175	Tom has a small dick.	6141127	Okoro toli di Tom.
52679	John played cat and mouse with Dick.	6141129	Mamain i John do tungau om biik miampai di Dick.
5662192	Mary can lick her own chin.	6141158	Osilaan i Mary do roo dau.
3824791	Tom's dog likes to lick people's faces.	6141160	Orohian o tasu di Tom silaon id turos do wokon.
2267745	Spitting is prohibited.	6141165	Pogoduhan no dulaan.
680229	Smoke appeared.	6141171	Noimbulai no lisun.
2038369	Owls are cute.	6141189	Odoromot o puok.
262357	I'm fine too.	6142153	Yoku nga osonong nogi.
262357	I'm fine too.	6142154	Yoho nga osonong nogi.
410779	Am I wrong?	6144560	Nasala oku?
914018	Did you see it?	6144561	Kokito ko ti?
1488125	There's music for everyone.	6144562	Haro loyuk montok toinsanan.
6096938	Don't you want to come to Boston with me?	6144564	Au ko moi hiti Boston miampai doho?
6096939	Did Tom say he didn't think we needed to do that?	6144567	Okon ko boros ka di Tom dot au yau ondos nopo manu dahai maan dilo?
1832136	I'm working on it.	6144571	Maai ku po ti.
2645038	Listen to your wife, Tom.	6145376	Rongoho no sawo nu oi Tom.
2645039	Let's pretend we're busy.	6145377	Kanou maan tokou dot atangkangau nopo tinomod dahai.
2645040	Let them know we're busy.	6145378	Poiloon iyolo kaka tokou dit atangkangau.
2645041	Let me check my calendar.	6145385	Mintong oku po kalandor ku.
2645042	It's your responsibility.	6145389	Iti nopo nga tonggungan nu.
2645043	It's time to say goodbye.	6145392	Mongoi oku no.
631151	I had my driving licence renewed last month.	6147644	Nokoimbagu nodi lisin korita ku tulan do nakatalib.
58476	This novel bores me.	6147646	Apa'asan iti buuk basaan doho.
6168194	Tom has already been to all European capital cities.	6168198	Nokoumbal i Tom mongoi tombului id posorili do bandar tagayo pogun-pogun Yuropa' do ngawi.
6169809	Do not search for what you are worth in the eyes of people, but rather try to find it in your conscience is free your status is automatically elevated. If you truly know yourself, you would not be hurt by what others about you.	6169880	Kada ihumo- humo o rontob dokoyu kumaa mato tongoulun. Ihumo noh rontob dilo id suang ginawo dokoyu soira do otoronong nga kobontugan koimagon. Nung sokiro nopo kointutun kou sondiri nga ih pimboroson diolo montok dokoyu nga amu ih koponinduol dokoyu.
20119	You tried.	6171748	Umbalan nu.
49081	The company is on the verge of bankruptcy.	6194279	Osomok-somok nodi ilo sarikat do korikot id korutuman do kousinan.
2215673	Tom will find us.	6194294	Ihumon i Tom ndo dahai.
4869847	Did you read everything?	6201800	Nakabasa ko do ngawi?
4869848	Me!	6201802	Yoku!
3170592	Tom really wanted a cup of hot black coffee.	6201804	Manu kopio i Tom do sanggalas kupi talasu.
2262020	I'll work with Tom.	6201805	Kumaraja oku miampai di Tom.
2237639	Tom said that.	6201806	Binoros di Tom ilo.
2237640	Tom sat alone.	6201807	Osongulun i Tom do mirikau.
2199854	I'm hungry like the wolf.	6276023	Louson oku miagal do toni.
1095286	Tom chose the color to paint our offices.	6276050	Momili i Tom do wotik montok powotikon do tupis dati.
5858311	I'm full of hope.	6276054	Alansan oku kopio.
5193357	I want you to do that right now.	6276057	Manu oku diya maan do baino.
315836	She is in the habit of jogging before breakfast.	6276060	Oubas isido moi panangkus tintod do taakanon dongkosuabon.
269749	Parents punish their children for misbehavior.	6276064	Natagadan di tanganak do komolohingan tu oruya iyolo.
2361787	I wish you'd listen.	6299779	Alansan no daa korongou ko.
2241107	We have failed.	6299781	Au kalantoi tokou.
1771835	He's Georgian.	6299785	Isio tulun Georgia.
1419973	Nobody can live to be two hundred years old.	6299788	Aiso tulun milo poimpasi gisom do duo nahatus toun.
4981903	If I remember correctly, Tom sold his car to Mary for only 500 dollars.	6299795	Nung kosorou oku diri tootopot nga pinapadagang i Tom do korita dau kumaa di Mary do gatang 500 Dollar nopo.
4397597	Let's end this.	6299796	Maai no awi ti.
3650010	Tatoeba.org is offline for maintenance.	6299797	Au noukab po Tatoeba.org tu haro kinoundaran.
3329731	Can I offer you ladies a drink?	6299798	Obuli oku daa mamalanja dokoyu tiinumon oi sumandak?
3328178	Can I offer you a drink?	6299799	Obuli oku mamalanja dokoyu do tiinumon?
3204201	Tom told me you used to live in Australia.	6299801	Nokosunud i Tom kumaa doho tu poingiyon ko hilo'd pogun Australia.
3122998	I'd rather discuss this at a later time.	6299802	Somoonu yahai kopibooboros dilo kawagu.
266796	The nail that sticks up gets hammered down.	6299804	Nababak ilo sondulu do monokot dilo hodi.
5735946	Tom died in 2013 of pneumonia.	6299806	Napatai i Tom id toun 2013 tu toruol do Pneumonia.
5215157	Will I have to move?	6299807	Apatut ko popoundaliu dilo?
4015957	Do I look as bad as I feel?	6299808	Araat ko topurimanan ku id tokito ti?
2549661	I was a doctor.	6306672	Yoku nopo nga i dukutur.
5617655	What you say may be true...	6306673	Nunu nopo binoros nu nga otopot matu...
4171904	Children don't need their own rooms.	6306674	Au i tangaanak mumang do linimput diolo.
4014268	That was a pretty good movie.	6306677	Osonong kopio ilo wayang.
2681496	Tom brought Mary to the station.	6306678	Minongongoi i Tom di Mary hilo'd sitisin.
2537819	I thought this pair of shoes would last longer.	6306679	Andasan ku nopo ilo kolumpa nga katahan di.
3629919	Tom looked distant and distracted while Mary told him her life story.	6307750	Au osonong topirumanan di Tom soira i Mary manangon kokomoi kopoposion disido.
277624	While napping, I had a strange dream.	6307751	Donkoodopon ku, osuai-suai tinipi ku.
58279	During these years he wrote immortal poems.	6307752	Piipiro toun di, minonurat isio do pinukadan.
5829174	I let Tom go.	6307753	Poongoyon ku i Tom.
3004689	Sit over there and shut up.	6307754	Irikau no hodi om pakadaada.
2992313	Tom is way older than he looks.	6307755	Otuo i Tom mantad ko tokito dau.
2954201	Why did you suddenly leave yesterday afternoon?	6307757	Nokuro tu minooi ko konihab dangadau di?
2123618	It happened.	6308421	Nokoontok ti.
2029978	We haven't got much time.	6308433	Aiso maso tokou.
18599	I have some money with me.	6308435	Haro po tusin dot owitan ku.
6260267	Tom told me not to do that again.	6308439	"Kada maai kaagu" ka di Tom kumaa doho.
3910087	We're here to see them.	6308446	Hiti yahai rumuba diolo.
3822234	I'll go tomorrow morning.	6308448	Mongoi oku doid kosuabon.
3731169	What'll happen to you if you don't obey Tom?	6308449	Nunu o kaantakan nung au ko rumamit di Tom?
1961611	I thought you guys had already left.	6308450	Andasan ku nopo daa om nokoongoi kou di.
1342207	Nobody believes in him.	6308453	Ingaa no tulun mumboyo dau.
255293	I want a Toyota.	6308455	Manu oku do Toyota.
3518919	Do we need to do anything else?	6308456	Apatut ko yahai maan do kawawagu?
1024888	Tom is rarely late.	6308457	Apagau i Tom a'adahan.
599071	Are we still on for tomorrow night?	6308461	Koongoi ko yahai id suab totuong dii?
321353	He wasn't at home when I called on him.	6308462	Ingaa no iyau hilo'd dualai dau soira tinolipoun ku dau.
3329623	Can I get a little help, please?	6308465	Mokiuhup oku po, obuli?
2953247	On the table, there was a plate with three fried eggs on it.	6308468	Haro no iso pinggan maya do tolu tontolu ginuring id timpak do mija.
1164809	He does not say.	6308634	Au iyau momboros.
1768844	It's shockingly inexpensive.	6308635	Au oilaan tu omura gatang ti.
569071	Young man, enjoy yourself while you are young!	6308637	Oi ondu, sonong-sonongon ko poimulok sondiri kio!
6273904	Tom is always healthy.	6308639	Olidas i Tom kasasari.
3879702	You don't trust me anymore, do you?	6308644	Au ko mumboyo doho nodi kio?
2721049	She's in a bad mood.	6308649	Au osonong habar disido.
1093508	Tom is a failure as a father.	6308656	Au osonong kopio i Tom sabaagi do tapa.
261924	I will be watching TV about this time tomorrow.	6308661	Mintong oku do TV id maamaso do suab.
64311	I will make a new suit for you.	6308676	Maan oku ndo rasuk wagu montok diya.
6239649	I didn't arrive until the meeting was over.	6308694	Au oku rumikot po gisom dot aawi iri pirubaan.
6080720	I wasn't at Tom's party.	6308695	Au oku mongoi karamaian di Tom.
6067552	Layla knew all the hookers of the neighborhood.	6308708	Nokointutun i Layla do koinsanan mokiiyut hilo'd potimbangan.
2011978	Who wants to go hunting?	6308721	Isai manu moi pagasu?
62960	Spiders spin webs.	6308726	Monurug o korut do lawa.
6256041	Tom said he didn't understand what Mary said in French.	6308728	Au i Tom karati do nunu boros di Mary kad boros Poransis.
5953760	I wish you happiness!	6308729	Alansan oku do kounsikahan nu!
3594011	That's all I had to say.	6308742	Iti no kangku dii.
2955546	Tom always tries to do what he thinks is right.	6308748	Umbalan i Tom kasasari do nunu nopo topot id pomusarahan dau.
2298180	Can we still be friends?	6308750	Monongkiambalut yahai?
6247512	Did you know Tom was unhappy here?	6308751	Oilaan ko di Tom tu au otood iyau hiti?
6239463	I didn't drink the wine Tom poured for me.	6308754	Au oku moginum do wain do ponuangan di Tom.
2786822	"Why are you angry?" "I'm not angry!"	6308788	"Nokuro tu otogod ko?" "Au oku otogod bogia!"
6125488	Tom didn't know he no longer needed to do that.	6308791	Au i Tom oilaan tu au tagal maan no dilo.
5378771	We're not lost. I know where we are.	6308792	Au yahai apalid. Oilaan oku do hombo yahai.
3758710	They don't know how to use an asterisk.	6308794	Au iyolo koilo momoguno do tanda rombituon.
3413207	We don't have to do this now.	6308795	Ingaa no yahai maan diti baino.
3736228	I bet Tom never kissed you like that.	6309411	Au ko tunguban di Tom miagal diri kangku daa.
3638788	I didn't know you were looking for me.	6309413	Au oku oilaan tu iya mongilot doho.
3138242	But people have a little hope.	6309415	Nga okuri no kalansanan di tulun.
5158781	Stop fighting, you two!	6309594	Ula no piodu kou goduo oi!
4600562	That book is new.	6309596	Wagu ilo buuk.
375813	Thanks for the invite.	6309610	Kotoluadan tu pangalap.
324488	Yumi goes to the park to play tennis.	6309611	Mongoi i Yumi hilo'd taman om main tinis.
309667	Her beauty is incomparable.	6309618	Ingaa tulun milo tondingon mantad do kolundusan disido.
247031	I will explain it to her.	6309619	Poiloon ku ndo disido.
43482	Whether we will go on the trip depends on the weather.	6309623	Kuroyon no pakayaan om tombuluyon dahai nga tumanud moti tadau dau.
6308097	I miss Sami every day.	6309626	Lumangad oku di Sami monikid tadau.
6269799	Tom doesn't believe Mary can do that.	6309628	Au i Tom mumboyo di Mary do milo maan dilo.
6234737	I still haven't told Tom why I want to do that.	6309631	Au oku po poiloon kumaa di Tom do nunu sabap maan ku dilo.
6089196	Tom told me that he hadn't done that yet.	6309632	Pinoilo oku di Tom tu au po momongo dilo.
5798701	I'm sure Tom doesn't do that anymore.	6309635	Au i Tom maan diri nogi kangku daa.
5494438	We can't forget that.	6309640	Au yahai milo olingan dilo.
2966111	The first half of the story is set in Boston.	6309869	Tangon nopo kumoinsan do satanga nga hiri'd Boston.
2012559	You don't want to do that.	6309871	Au ko mumang maan dilo.
318428	Illness prevented me from going out.	6309872	Toruol diri nga mongodu doho mooi labus.
45096	That pole is not quite vertical.	6309885	Au otulid ilo pasok.
6098719	Couldn't you have just waited a week?	6309890	Au kou mangandad no sominggu?
6261290	I didn't want to eat anything.	6309892	Au oku siakan do nunu.
6049601	Esperanto unites humanity.	6311018	Miiso tulun-tulun Esperanto.
5587431	It was a lovely experience.	6311019	Aramai no toilaan do noonuan ti.
3927269	His eye was swollen and his nose was bleeding.	6311020	Lumonit no mato disio om mimomuraha id todung dau nogi.
3826600	Don't you feel anything?	6311021	Au ko opurimanan do nunu?
3722385	Tom is suffering from a headache.	6311047	Kisinduol tulu di Tom.
313521	She led a solitary life.	6311063	Kosongulunan koposion disido.
34261	Mr Brown speaks Japanese very well.	6311064	Abalantas kopio i gundoling Brown momboros do Jipun.
295580	He seems to be sick.	6311065	Sumakit iyau dii.
294601	Illness prevented him from attending the party.	6311067	Toruol disio mangantob iyau mongoi hiri'd karamaian.
5903881	I'm not Swiss.	6311069	Yoho okon ko tulun Switzerland.
5664490	I believe that Ariana Grande is going to win a Grammy award.	6311070	Otumbaya oku tu i Andriana Grande kamanang do sompomogunan Grammy.
3912775	Everyone liked me.	6311071	Muhang i koinsanai doho.
3619189	Tom wanted Mary to say that she loved him.	6311072	Manu i Tom do boros di Mary kaka guminawo iyau disio.
3419316	Tom and Mary never kiss each other in public.	6311073	Au i Tom om Mary kopitungub id labus walai.
3417616	Tom isn't very ambitious.	6311074	Aiso iman-imanon kopio i Tom.
1093221	Tom made the same mistake again.	6311075	Minaan sala i Tom do kawawagu nogi.
2945301	I don't like roosters.	6311086	Au oku orohian do tandaha.
4538445	The rooster crows.	6311089	Muuk-kuuk o tandaha.
6031311	Every morning, the neighbour's rooster woke us.	6311091	Tikid kosuabon, momosik ilo tandaha di sotimbang dahai.
4454100	Wild boars wiped out all our potatoes.	6311092	Nosumadan do kantang dahai iri bakas.
917669	One hunts wild boar at night.	6311093	I songulun nopo mooi pagasu do bakas totuong.
6048617	Wild boars have dug up my garden.	6311095	Noukadan do tumo ku mantad do bakas.
1936080	The number of wild boars is increasing rapidly in Germany.	6311097	Popoinsawat no ginumuan do bakas hiri'd pogun Jorman.
2729964	Tom is very good friend, but he looks like a wild boar so I don't consider him a potential love interest.	6311098	I Tom nopo nga tambalut di tosonong, nga miagal do bakas kokitanan dau om iri no sabap au oku songkuro muhang dau.
3538247	"Where is Tom?" "He's out drinking at the Laughing Boar."	6311100	"Hombo i Tom?" "Mongoi iyau poginum hilo'd Tirakan Bakas."
1663480	Foxes eat hens.	6311114	Mangakan i tompu do golupo.
5319848	That's a hen.	6311116	Ilo nopo nga golupo.
68404	That fox must have killed the hen.	6311137	Atantu no ilo tompu mooi patayo do golupo.
250412	My hens laid fewer eggs last year.	6311138	Minogontolu o golupo ku dot okuukuri id toun nakatalib.
1420770	Those hens lay eggs almost every day.	6311139	Mogontolu ilo golupo do monikid tadau.
5937618	I was looking at a pretty hen.	6311140	Mogihum oku do golupo tolumis.
6061208	The hens are in the chicken coop.	6311141	I golupo nga id suang do rinapa manuk.
3385760	The cow lost its calf.	6311142	Atagak no tampanak do sapi.
2474234	The calf was born this morning.	6311143	Nokosusu no tampanak dongkosuabon diti.
2761814	The calf should be separated from its mother.	6311145	Apatut no potongkiadan ilo tampanak mantad do tina dau sondiri.
723211	The cow gave birth to a calf with two heads.	6311147	I sapi nopo nokosusu do songinan tampanak miampai duo tulu.
2355496	Her puppy is clean.	6311149	Alangga ilo duku disido.
2648951	Tom got a puppy.	6311152	Haro duku i Tom.
2875850	She saved the puppy.	6311154	Manampasi isido do duku.
3281647	I want this puppy.	6311156	Manu oku dilo hodi duku.
4977043	Please adopt this puppy.	6311157	Tamangai no iti duku.
5099502	I really like puppies.	6311159	Orohian oku no kopio do duku.
5499267	My opponent hates puppies.	6311161	I sasaapon ku nopo araatan do duku.
298780	He named his puppy Pooch.	6311163	Pungaranan isio do duku dau Pooch.
320733	Mother bought us a puppy.	6311166	Minoboli i tina dahai do duku.
1616939	The puppy wants to sleep.	6311168	Siodop ilo duku.
2821113	Tom noticed that Mary had washed the car.	6311442	Nokoilo i Tom di Mary tu nokosusi nodi do kurita.
2549570	Funny, isn't it?	6311445	Aramai kio?
1309460	Don't ask me why but, he ran away when he saw me.	6311451	Kada oku uhoto nga minogidu iyau sondiri soira koruba doho.
314157	She wouldn't allow me to read the letter.	6311455	Au isido doho papabasa diri surat.
294514	He accidentally hit his thumb with the hammer.	6311460	Naantakan disio do gondoling sondiri o dunsul.
245281	Unfortunately, I didn't get the chance to see the castle.	6311466	Iri podi kaala tu aiso kosiwatan ku mintong diri istana.
6259658	Are you going to do that alone?	6311469	Maan ko dilo songulun?
6231098	You don't need to apologize. You've done nothing wrong.	6311475	Au tagal no pokiampun. Aiso sala minaan nu.
5909917	I usually have a snack around 2:30.	6311484	Oubas oku mooi akan do taakanon id jam 2 satanga.
2798722	I think I should join a study group.	6311492	Sorohon ku nga apatut no mooi amung do pisompuruan do palajaran.
2662635	I think this has something to do with Tom's problems.	6311497	Iri no matu do kobolingkangan di Tom kangku daa.
2249089	It's happening again.	6311503	Nokoontok no kaagu.
1580250	She's sitting in the kitchen and drinking tea.	6311506	Mirikau isido hilo'd dompuran om monginum do tii.
1398534	A smooth sea never made a skillful sailor.	6311515	Rahat dot aiso topuhod diri okon ko tabaal montok do pomomogun rahat.
245691	The children were playing in the park.	6311521	Mogimaamain ilo tangaanak hilo'd taman.
6273846	Tom eats more than Mary does.	6311525	Ogumu i Tom mangakan mantad ko di Mary.
5928105	Sami was in Layla's way.	6311528	I Sami id wayaan di Layla.
5261357	I've got the most ideas, and I've got the best ideas.	6311532	Haro toilaan ku kogumuan om dot ongosonong nogiddi.
4667087	Tom is a bad person.	6311534	I Tom nopo nga tulun taraat.
3716204	"Can you do me a favor?" "It depends."	6314639	"Obuli oku daa mokianu dii?" "Tumanud moti diri."
5017237	With any luck, my cellphone battery won't die.	6324020	Osonong nopo nasip ku nga au apatai ndo batori tolipoun ku.
4998510	I must buy shoes.	6324024	Momoli oku do kolumpa.
3920918	I need information about them.	6324025	Mumang oku do kopoilaan kokomoi diolo.
276059	It was in 1939 that the Second World War broke out.	6324033	Tontok do toun 1939 nodi nokoimbulai o pisangadan do pomogunan koduo.
50864	Let's go and see him there.	6324035	Kanou moi ruba disio hilo.
28952	I intend to take my position as a third party.	6324045	Manganu oku do ningkokoton ku sabaagi do puru-puru kotolu.
2455468	We need some more firewood.	6324051	Manu yahai suduon do kawagu.
2259817	Wet firewood doesn't burn well.	6324059	Au songkuro kosorob iri suduon toyopos.
293585	He broke up the chair for firewood.	6324063	Monipu isio do tirikohonon silihon do suduon.
6236973	There's a fireplace, but there's no firewood.	6324067	Haro o ropuan hilo nga ingaa o suduon.
953781	I'd like you to help me gather some firewood.	6324069	Mumang oku diya mooi pokisuduon.
2210728	Why don't you go out and get some firewood?	6324071	Obuli ko daa mooi pokisuduon?
3917437	I left a message for her.	6324072	Pinapaatod oku disido do misij.
5491229	Give me that jar.	6359100	Onuai oku dilo kakanan.
1490461	The jar is empty.	6359102	Aiso nunu hodi suang do kakanan.
3735466	Tom tried to open the jar.	6359104	Mumbal i Tom ukaban do kakanan.
4401078	I can't open this jar.	6359106	Au oku milo ukaban dilo kakanan.
32097	There are some cookies in the jar.	6359108	Haro tindalam hodi suang do kakanan.
2610089	Don't close the jar too tightly.	6359109	Kada angabai dilo kakanan kio.
4014513	Could you open this jar for me?	6359111	Obuli ko daa ukabai dilo kakanan?
5811781	Do you want to spend the rest of your life in jail?	6359131	Manu ko do sogimpasi hiri suang jiil?
271957	Some people claim that there are no more heroes in the Western world.	6372059	Ondos nopo dombokon nga aiso nodi gunsiou do kogumuan hiri'd kotonobon pogun.
6123174	Tom hasn't finished writing the report yet.	6372060	Au po minomongo i Tom do ripot.
5523919	We're very lucky to be alive.	6372061	Kinasip tosonong tokou poimpasi.
4255979	This is a powerful laser.	6372062	Iti nopo nga lasor tokuat.
6222102	Tom said Mary didn't seem angry.	6373770	Au otogod i Mary ka di Tom.
323873	The problem is who is going to tell him the truth.	6373771	Iri podi kaala tu isai daa poposunud disio dot otopot?
47743	The magazine revealed all his dirty secrets.	6373773	Kokito no karaato disio do songinlisok ngawi mantad dilo hodi majala.
4499607	I was surprised by the question.	6373775	Nokotigog oku korongou dilo ponguhatan.
3802035	I'm the one who has the key.	6373776	Yoku ti haro do kunsi.
1024945	Tom is never late for school.	6373777	Au i Tom nokoumbal dot a'adahan moi sikul.
