1023921	Tom wasn't able to swim.	2331476	Tom kunne ikkje symje.
1023922	Tom wasn't able to pass the examination.	2331479	Tom bestod ikkje på eksamen.
1023923	Tom wasn't able to find a place to park.	2331480	Tom klarte ikkje å finne ein plass å parkere.
1023924	Tom washes clothes at least once a week.	2331483	Tom vaskar kleda minst éin gong i veka.
1023925	Tom was well prepared for the exam.	2331484	Tom var godt førebudd til eksamenen.
1023926	Tom was wearing a black hat.	2331487	Tom hadde på seg ein svart hatt.
1023927	Tom was watching what was happening very carefully.	2331488	Tom følgde nøye med på kva som skjedde.
1024121	Tom takes a bath at least three times a week.	1983401	Tom tek seg eit laug minst tre gonger i veken.
1024236	Tom said that we weren't allowed to take photographs in this museum.	1981333	Han Tom sa at me ikkje fekk lov til å ta bilete på dette museet.
1024872	Tom is sick.	1980952	Han Tom er sjuk.
1025445	Tom has already drunk three cups of coffee.	1981775	Tom har alt drukke tre koppar kaffi.
1025754	Tom finally went to Boston last summer.	1981067	Tom fór endeleg til Boston i fjor sumar.
1027115	Tom appears to be a friendly guy.	1981085	Han Tom verkar som ein venleg kar.
1027597	I can't believe Tom ate the whole thing.	1981435	Eg kan kje tru at han Tom åt alt saman.
1040536	Tom tried the door, but it was locked.	1981818	Tom prøvde seg på døra, men ho var læst.
1074524	How is your last name written?	1982612	Korleis stavar du etternamnet ditt?
1092737	Tom thought the situation was really sad.	1980949	Tom syntest stoda var utruleg lei.
1095803	Tom became friends with Mary.	1981439	Tom vart ven med ho Mary.
1102451	Tom pretended he didn't care.	1981377	Tom lest som han ikkje brydde seg.
1125511	This is suicide!	1981814	Dette er sjølvmord!
1134230	The colour fuchsia is called after a flower.	1981346	Fargen fuksia er kalla opp etter ein blome.
1181992	Even if I go make love with some girl before midnight, I will never forget your kindness.	1981785	Sjølv om eg finn meg ei anna å liggje med føre midnatt, kjem eg aldri til å gløyme kor kjærleg du var.
1187019	Please show me something cheaper.	1981828	Syn meg noko rimelegare, er du snill.
1230787	I love American food.	1981441	Eg elskar amerikansk mat.
1231430	I am already going to Norway and Finland.	1982629	Eg skal til Noreg og Finland alt.
1298430	Why are you ignoring me?	1981401	Kvifor overser du meg?
1349570	The rabbi is on his way.	1980933	Rabbinaren er på veg.
1357284	It's not a joke.	1983770	Eg tullar ikkje.
1388145	I'll keep fighting until somebody defeats me.	1981773	Eg held fram med å kjempe til nokon slår meg.
1392583	I have hardly any English books.	1982616	Eg eig knapt engelske bøker.
1396369	They're on good terms with their neighbors.	1980984	Dei går godt i lag med grannane.
1449849	I have only half as many books as he does.	2977293	Jeg har kun halvparten så mange bøker som han.
1453601	Mary spends hours in the bathroom.	1981386	Mary er på badet i timevis.
1498898	Tom ran away from home.	1982744	Tom rømde heimanfrå.
1508180	Since when are you two on a first name basis?	1981046	Kva tid vart de dus?
1523850	Stop publishing bullshit.	1981784	Hald opp med å berre skrive kødd.
1527971	Does the Oedipus Complex apply to me, too? It sure doesn't feel like it, though.	1984012	Gjeld ødipuskomplekset for meg òg? Det kjenst sanneleg ikkje slik, men.
1528539	You love your wife, right?	1981379	Du elskar kona di, ikkje sant?
1542369	There's no minimum wage here.	1981027	Her har vi ikkje noka minstelønn.
1570764	I find her very pretty.	1981061	Eg synst ho er veldig pen.
1574265	From here on out things are going to change, for the worse.	1981779	Frå no av kjem ting til å ein annan veg; nedover.
1602148	They said that he was a talkative, noisy Oriental.	1984028	Dei sa at han var ein pratesjuk og pågåande austerlending.
1611166	The Van Horn family was wealthy.	1984284	Van Horn-familien var rik.
1619690	I'm happy you liked it.	1984032	Eg er glad for at du lika han.
1619690	I'm happy you liked it.	1984033	Eg er glad for at du lika ho.
1619690	I'm happy you liked it.	1984034	Eg er glad for at du lika det.
1619862	Tonight is the night.	1981391	Kvelden i kveld er kvelden.
1637199	Norway is the richest country in the world.	1982632	Noreg er det rikaste landet i verda.
1657656	You don't know that.	1981840	Det veit ikkje du.
1658011	She got caught.	1982748	Ho vart fakka.
1658011	She got caught.	1982750	Ho vart teken.
1662327	Tom is dozing off.	1983414	Tom held på å sovna.
1665706	I am neighing like a horse.	1981825	Eg kneggjar som ein hest.
1681268	Dora is an explorer.	1981022	Ho Dora er ein oppdagar.
1683329	Some people believe that polar bears walk around freely in the streets of Norway. Luckily, it's just nonsense.	1982633	Somme trur at isbjørnar går fritt omkring i gatene i Noreg. Til alt hell er det berre tull.
1723742	This game is so hard.	1982746	Dette spelet er så vanskeleg.
1723742	This game is so hard.	1982747	Denne leiken er så vanskeleg.
1742759	Tom hasn't had his dinner yet.	1981058	Han Tom har ikkje ete middagen sin enno.
1744796	Don't let him approach.	1981356	Ikkje lat han nærme seg.
1749344	It's not funny.	1982507	Det er ikkje morosamt.
1778767	Oslo is the capital of Norway.	1982634	Oslo er hovudstaden i Noreg.
1798664	What have I just written?	1981354	Kva skreiv eg no?
1812768	Do you think she still wants to live with me?	1984026	Trur du at ho framleis vil at vi skal bu i lag?
1814651	Norway is called "Norge" in Norwegian.	1982635	Noreg heiter "Norge" på bokmål.
1816216	He worked as a truck driver in Norway.	1982644	Han arbeidde som lastebilførar i Noreg.
1820756	There are around three thousand mosques in Istanbul.	3014171	Det er omlag tre tusen moskéar i Istanbul.
1820756	There are around three thousand mosques in Istanbul.	3014173	I Istanbul er det omtrent tre tusen moskéer.
1820756	There are around three thousand mosques in Istanbul.	3014174	Det er i Istanbul omtrent tre tusen moskéer.
1826157	Why does luck hate him?	1981370	Kvifor hatar hellet han?
1841224	I can't control myself.	1981812	Eg kan ikkje dy meg.
1841524	Who do we owe money to?	1981352	Kven skuldar vi pengar?
1848862	The party's over.	1984024	Festen er over.
1848909	He was drunk and angry.	1981433	Han var full og harm.
1848909	He was drunk and angry.	1981434	Han var full og sinna.
1860581	Take care of that for me, will you?	1984031	Kunne du teke hand om det?
1861733	I longed for something unattainable.	1981440	Eg lengta etter noko uoppnåeleg.
1862450	I don't live in Finland.	2124769	Eg bur ikkje i Finland.
1863617	Don't you have some work to do?	1984009	Har ikkje du noko å gjera?
1868059	Tom looked in the mirror again.	1981368	Tom såg seg i spegelen om att.
1879046	We did nothing wrong.	1981837	Vi har ikkje gjort noko gale.
1886938	She's a woman now.	1981108	No er ho vorten kvinne.
1887847	I told you I don't know.	1981798	Eg veit ikkje, sa eg jo.
1887847	I told you I don't know.	1981799	Eg veit ikkje, eg jo.
1890872	I'll be ready in ten minutes.	1983427	Eg er klar om ti minuttar.
1895743	You have plenty of time.	1981331	Du har meir enn nok tid.
1923412	Tom noticed a gunshot wound in Mary's right arm.	1981098	Tom la merke til eit skotsår i venstrearmen til ho Mari.
1938904	I thought Tom had a dog.	1982743	Eg trudde Tom hadde hund.
1972638	Grab Tom and don't let him get away.	1981438	Huk tak i han Tom og ikkje lat han få kome seg unna.
1975728	It's not actually raining yet.	1981093	Det regnar ikkje heilt enno.
1981260	Trang needs fish oil.	1981259	Trang treng tran
1982704	He is a great swimming champion.	1984060	Han er ein stor meister i symjing.
2163151	The book is on the table.	2345954	Boka ligg på bordet.
2163151	The book is on the table.	2345956	Boki ligg på bordet.
2308274	I couldn't see Tom's face.	2983909	Eg kunne ikkje sjå Tom sitt anlete.
2345890	Is your mum at home?	2345901	Er mor di heime?
2356926	You or I?	1983305	Du eller meg?
2393494	Let us protect the beautiful nature that surrounds us.	2977295	La oss beskytte den vakre naturen som omgir oss.
2412739	I have two cats.	3081365	Eg har to katter.
2412739	I have two cats.	3081366	Eg har to kattar.
2542712	You should double-check that.	2977290	Du bør dobbelt-sjekke det.
1194034	I'm not a doctor.	2661441	Eg er ikkje lege.
1434	I love you.	2753283	Eg elsker deg.
2837214	I have to be careful.	2977286	Jeg må være forsiktig.
2917119	I really like this restaurant.	3014218	Jeg elsker denne restauranten.
2933668	The stars look very beautiful tonight.	2933723	Stjernene ser mykje vakre ut i kveld.
2974589	I found the money.	2974679	Eg fann pengane.
2976978	I often used to eat pizza.	2977901	Jeg pleide ofte å spise pizza.
2885500	The future belongs to those who believe in the beauty of their dreams.	3081172	Framtida tilhøyrer dei som trur på venleiken i draumane sine.
3081764	When I give food to the poor, they call me a saint. When I ask why the poor have no food, they call me a communist.	3081799	Når eg gjev mat til dei fattige kallar dei meg helgen. Når eg spør kvifor dei fattige ikkje har noko mat kallar dei meg kommunist.
3663249	There are islands in the sea.	3663251	Det finst øyer i havet.
3677845	I'm trying to learn English.	3677848	Eg prøver å lære engelsk.
3677891	She is like my own child.	3677894	Ho er som mitt eige barn.
3716026	Santa lives at the North Pole.	3716027	Julenissen bur på Nordpolen.
3716048	I hope that I can do it.	3716050	Eg vonar at eg kan gjere det.
2739964	I have a friend.	3947305	Eg har ein venn.
252282	I am happiest when I sleep.	4110519	Eg er gladast når eg søv.
263268	We long for peace.	4110552	Vi lengtar etter fred.
263269	We hope for peace.	4110554	Vi håpar på fred.
263271	We live on rice.	4110556	Vi lever på ris.
263272	We sang as we walked.	4110558	Vi sang mens vi gjekk.
263272	We sang as we walked.	4110560	Vi sang medan vi gjekk.
263273	We started to walk.	4110563	Vi begynte å gå.
263274	We always talked about a lot of things after school.	4110569	Vi snakka alltid om mange ting etter skulen.
263275	We clean our classroom after school.	4110572	Vi vaskar klasserommet vårt etter skulen.
263276	We ought to obey the law.	4110582	Vi må rette oss etter lova.
263278	We are so busy we'd take any help we could get.	4110584	Vi er så opptatte at vi tar imot all den hjelpa vi kan få.
263279	We derive a lot of pleasure from books.	4110586	Vi har stor glede av bøker.
953903	I've got really good news.	4110591	Eg har verkeleg gode nyhende.
953904	I've got so much left to do.	4110592	Eg har så mykje igjen å gjere.
953905	I've got something important to discuss with you.	4110594	Eg har noko viktig å snakke med deg om.
953906	I've had a really tough day.	4110595	Eg har hatt en veldig tøff dag.
953915	I've just eaten so I'm not hungry.	4110596	Eg har nett ete så eg er ikkje svolten.
953916	I've made a list of foods that I can't eat.	4110600	Eg har laga ei liste over matvarer eg ikkje kan ete.
953917	I've made a list of people I need to talk to.	4110601	Eg har laga ei liste over folk eg må snakke med.
953918	I've made a list of things I'd like to buy.	4110603	Eg har laga ei liste med ting eg har lyst til å kjøpe.
953919	I've made up my mind to give back all the money I stole.	4110604	Eg har bestemt meg for å gje tilbake alle pengane eg stal.
953920	I've made up my mind to go.	4110606	Eg har bestemt meg for å gå.
953921	I've made up my mind to learn how to play the harp.	4110607	Eg har bestemt meg for å lære å spele harpe.
953922	I've never eaten a live octopus.	4110608	Eg har aldri ete ein levande blekksprut.
953926	I've never met anyone who makes me as happy as you make me.	4110609	Eg har aldri møtt nokon som gjer meg så lykkeleg som du.
261849	I run every day.	4110610	Eg spring kvar dag.
1078091	He spoke with great enthusiasm of the theatrical performance.	4110612	Han snakka med stor entusiasme om teaterforestillinga.
265244	As a matter of fact, his lecture was boring.	4110616	Førelesinga hans var faktisk keisam.
372002	The others will arrive in a few minutes.	4110619	Dei andre kjem om nokre få minutt.
3724392	I thought I'd stop by and wish you luck.	4110623	Eg tenkte eg ville komme innom og ønskje deg lukke til.
682098	What is the subject of your lecture?	4110631	Kva er temaet for førelesinga di?
38064	By the way, how old are you?	4110641	Kor gammal er du, forresten?
31683	It's already seven.	4110649	Klokka er allerede sju.
3914652	Why is everybody hugging him?	4110651	Kvifor klemmer alle han?
995270	Knowledge of foreign languages is useful for everyone.	4110653	Å kunne framandspråk er nyttig for alle.
280187	As a consequence of overwork, he became ill.	4110660	Han vart sjuk på grunn av overarbeid.
494742	She lives nearby.	4110661	Ho bur i nærleiken.
1963061	The enemy destroyed many of our ships.	4110664	Fienden øydela mange av skipa våre.
3399585	Tom, your father asked you a question.	4110666	Tom, far din spurde deg eit spørsmål.
2961449	Tom goes to the same school as Mary.	4110668	Tom går på samme skule som Mary.
3919770	Does your dog bark at him?	4110672	Bjeffar hunden din til han?
530562	The entire city was without electricity.	4110674	Heile byen var utan elektrisitet.
310315	She has been busy preparing for her trip to the U.S.	4110677	Ho har vore opptatt med å førebu turen sin til USA.
3239483	The scar isn't really visible.	4110679	Arret er ikkje eigentleg synleg.
316844	She cleaned the room.	4110689	Ho vaska rommet.
2140	How many hours of sleep do you need?	4110724	Kor mange timar søvn treng du?
319075	My father has never been abroad.	4110729	Far min har aldri vore utanlands.
1640171	Why was I banned?	4110769	Kvifor vart eg kasta ut?
266904	When spring comes, the days get longer day by day.	4110778	Når våren kjem, vert dagane lenger.
4108583	Is the guillotine still used by certain countries?	4110788	Blir giljotina framleis brukt i enkelte land?
4108469	Pedophilia is probably more common than people think.	4110791	Pedofili er sannsynlegvis vanlegare enn folk trur.
4106890	I don't eat poultry.	4110794	Eg et ikkje fjærkre.
4097045	We ate swordfish.	4110795	Vi åt sverdfisk.
29607	Who taught you to play the piano?	4110813	Kven lærte deg å spele piano?
444986	I live here.	4110815	Eg bur her.
411245	If you can use gravity to your advantage, do so.	4110816	Dersom du kan bruke tyngdekrafta til din fordel, gjer det.
409602	I am hungry.	4110817	Eg er svolten.
4256130	Welcome to Wikipedia.	4256195	Velkomen til Wikipedia.
39596	The calculator on the table is mine.	4110784	Kalkulatoren på bordet er min.
2299844	The Norwegians call Norway "Norge" or "Noreg", because there are two official languages: "Bokmål" and "Nynorsk".	4394937	Nordmenn kaller Norge for "Norge" eller "Noreg", fordi det er to offisielle skriftspråk: "Bokmål" og "Nynorsk".
2770447	He can play the flute.	4394951	Han kan spille fløyte.
251345	My grandfather was a soldier during the war.	1980641	Bestefaren min var soldat under krigen.
4546482	She is one person I can't live without.	4547460	Ho er ein person eg ikkje kan leva utan.
1282	Muiriel is 20 now.	4549299	Muiriel er 20 no.
4555749	There is a big difference in being able to speak a language well, and being able to speak a language fluently.	4555758	Det er ein stor skilnad i å vera i stand til å snakka eit språk bra, og å vera i stand til å snakka eit språk flytande.
3023795	Tom has been through enough.	4733055	Tom har vore gjennom nok.
2544463	You've been through a lot.	4733059	Du har vore gjennom mykje.
4733077	If you paid attention, you'd be worried too.	4733081	Viss du hadde følgd med, hadde du også vore bekymra.
4756191	They eat half of the world's halibut.	1980959	Dei et helvta av all kveiten i verda.
2406309	I shot the horse.	4756227	Eg skaut hesten.
470858	Do you have any sisters?	1983777	Har du systrer?
4792384	It was claimed that climate change would create great difficulties in the area.	4792383	Det vart hevda at klimaendringar ville skapa store vanskar i området.
4865025	I did not intend to say that.	4866432	Eg meinte ikkje å seie det.
4864607	They are eating bread.	4866442	Dei et brød.
4864604	I am eating bread.	4866449	Eg et brød.
4864597	Do you speak Japanese fluently?	4866455	Snakkar du flytande japansk?
4891943	I didn't intend to say that.	4866432	Eg meinte ikkje å seie det.
254782	I didn't realize the difference between them.	4935946	Eg innsåg ikkje skilnaden mellom dei.
5004806	This will take time.	5005793	Dette vil ta tid.
5004754	He called his sister, Mary.	5005796	Han ringte systera si, Mary.
5004169	How much can you pay?	5005800	Kor mye kan du betala?
5004168	How much is it worth?	5005806	Kor mye er det verd?
5004165	I know we can win.	5005811	Eg veit vi kan vinna.
2252537	Tom and Mary are twins.	5005814	Tom og Mary er tvillingar.
5004084	Tom said it was bad.	5005827	Tom sa det var dårleg.
5004083	Tom said that was OK.	5005829	Tom sa det var OK.
5004081	Tom says he likes it.	5005832	Tom seier han likar det.
5003776	Tom tried to kill us.	5005837	Tom prøvde å drepa oss.
1195261	Do you have a dog?	5007544	Har du ein hund?
2252590	The train left.	5007604	Toget gjekk.
3738807	Why does it bother you?	5007609	Kvifor plagar det deg?
3820171	No one has ever complained about that.	5007613	Ingen har klaga på det.
3912012	I've met him.	5007623	Eg har møtt han.
3309999	We've already been through this.	5129254	Vi har allereie vore gjennom dette.
4919021	They're going to make mistakes.	5220896	Dei kjem til å gjere feil.
1148052	People look like ants.	5391941	Menneske ser ut som maur.
1148052	People look like ants.	5392189	Menneske liknar på maur.
5428673	Accidents happen every day in this sport.	5428676	Uhell skjer kvar dag i denne sporten.
5441485	Indonesia is an enormous country which consists of more than 17,000 islands, numbering over 300 tribes and over 700 languages.	5441904	Indonesia er ett enormt stort land beståande av meir enn 17 000 øyer, 300 stammar og 700 språk.
1189413	I can't sleep.	5823071	Eg får ikkje sova.
67423	Arabic is written from right to left.	5926068	Arabisk skrivast frå høgre mot venstre.
417801	My eyes hurt.	5926563	Eg har vondt i augo.
431539	I'm bored.	5926109	Eg keiar meg.
496687	I count to ten.	5926310	Eg tel til ti.
501901	My feet hurt.	5926510	Eg har vondt i føtene.
627050	It won't hurt.	5926359	Det kjem ikkje til å gjera vondt.
953176	Did you say something?	5925576	Sa du noko?
1634917	Where are you hiding?	5926970	Kvar gøymer du deg?
2052041	Eat something.	5925477	Et noko!
2064199	I'm looking for something.	5925833	Eg leitar etter noko.
2111802	I misunderstood.	5926555	Eg misforstod.
2203796	We'll see.	5931038	Me får sjå.
2253862	Wait until tomorrow.	5926304	Vent til i morgon.
2708792	I'm swimming in the ocean.	5926199	Eg sym i havet.
3668669	I am boring.	5926131	Eg er keisam.
3861611	Water is life.	5978204	Vatn er liv.
4073387	Can you write?	5926619	Kan du skriva?
4499441	That must've hurt.	5926349	Det må ha gjort vondt!
5484546	It's easier than I thought.	5926906	Det er enklare enn eg trudde.
5926990	I haven't yet read all of these books.	5926992	Eg har ikkje lese alle desse bøkene enno.
417891	I have a sore throat.	5926592	Eg har vondt i halsen.
2360303	I've seen you somewhere before.	6330851	Eg har sett deg før ein stad.
6325656	It was so boring that I almost yawned.	6330859	Det var så keisamt at eg nesten geispa.
6326221	I'm so tired of you.	6330864	Eg er så lei av deg.
6326214	Sami e-mailed his boss.	6330872	Sami skikka ein e-post til sjefen.
6326215	Sami wasn't trustworthy.	6330875	Sami var ikkje til å stole på.
6326216	I have my own job.	6330879	Eg har min eigen jobb.
6326217	Everybody needs to know.	6330883	Alle bør veta dette.
6326197	Women are very vulnerable.	6330886	Kvinner er særs sårbare.
30286	It will not be long before the winter vacation ends.	6331301	Det tek ikkje lang tid innan vinterferien er over.
52263	I recognized your voice right away.	6331303	Eg kjende igjen stemma di med ein gong.
324085	He proposed that we should play baseball.	6331336	Han foreslo at vi skulle spele baseball.
398998	She likes Russian pop.	6331360	Ho liker russisk popmusikk.
508336	This gift is for you.	6331376	Denne gåva er til deg.
533884	I'm tired!	6331390	Eg er utsliten!
729882	He quickly scanned the page for the word he was looking for.	6331397	Han skumma raskt gjennom sida etter ordet han leita etter.
886150	Everyone else is sleeping.	6331400	Alle andre søv.
1026299	Tom didn't say how many times he had been there.	6331444	Tom sa ikkje kor mange gonger han hadde vore der.
1092627	Tom tried to hold back his tears.	6331455	Tom prøvde å halde tårene attende.
1102726	The dog was in a box under the table.	6331471	Hunden var i ei eske under bordet.
1214424	I went to Bali in the summer.	6331480	Eg reiste til Bali denne sommaren.
1723395	Is there anything to drink in the fridge?	6331643	Er det noko å drikke i kjøleskapet?
1852268	Stop being so nice.	6331645	Slutt å vere så snill.
1895689	You should call Tom.	6331647	Du burde ringje Tom.
2606104	Why do you want to learn English?	6331670	Kvifor ynskjer du å lære engelsk?
291661	Heavy smoking impaired his health.	6332656	Mykje røyking svekte helsa hans.
292142	For all his efforts, he didn't succeed.	6332665	Trass innsatsen hans, feila han.
311191	She seemed disappointed at the result.	6332670	Ho såg misnøgd ut med resultata.
329007	I was given a nasty look when I asked for my prescription at the local doctor's.	6332840	Eg vart sett stygt på då eg spurde etter resepten min på det lokale legekontoret.
2780800	I wear my old coat in weather like this.	6332843	Eg plar ha på den gamle frakken min i slikt vêr.
3403321	Tom can eat as much as he wants.	6332846	Tom kan ete så mykje han vil.
3730704	Are you in a bad mood or something?	6332848	Er du i dårleg humør, eller?
5553225	Tom will return next week.	6332850	Tom kjem att neste veke.
6108391	I don't remember ever seeing one of these before.	6332852	Eg kan ikkje hugse å ha sett ein av desse før.
891166	That must be the reddest pimple in history.	6332876	Det der må vere den raudaste kveisa nokosinne.
953336	How many audiobooks do you have on your iPod?	6332879	Kor mange ljodbøker har du på iPod-en din?
2387537	I need someone to protect me.	6332887	Eg treng nokon som kan varde meg.
3989229	I think that's very sweet, Tom.	6332904	Det tykkjer eg var veldig hyggjeleg, Tom.
5854421	Tom is my friend, too.	6332909	Tom er min venn òg.
6089378	No one is defending my country.	6332914	Ingen vernar landet mitt.
6104327	Did Tom have to do that, too?	6332945	Måtte Tom òg gjere det?
1498872	Tom never lost hope.	6333396	Tom gav aldri opp håpet.
2063655	My name is not "you"; it's Ricardo.	6333399	Eg heiter ikkje "du"; eg heiter Ricardo.
2483116	Don't do anything stupid while I'm gone.	6333407	Ikkje gjer noko dumt medan eg er vekke.
3904592	I don't want him to forget.	6333418	Eg vil ikkje at han skal gløyme.
3908468	I'm going to have to tell him.	6333423	Eg kjem til å måtte fortelje han det.
5168606	Who wants to visit the Philippines? It is such a tropical paradise!	6333428	Kven vil reise til Filippinane? For eit tropisk paradis!
6118795	Do you want the good news or the bad news first?	6333431	Vil du høyre dei gode eller dårlege nyhenda fyrst?
5121236	At your age I already knew how to tie my shoes.	6364717	Då eg var på din alder, kunne eg allereie knyte skoa mine.
464366	We chose a hotel near the museums.	6364728	Vi valde eit hotell nær musea.
2039894	We've chosen a hotel near the museums.	6364731	Vi har valt eit hotell nær musea.
2039895	We can go after lunch.	6364736	Vi kan dra etter lunsjen.
20459	Get back, get back!	6364742	Kom att, kom att!
4664698	Tom's house burned down in 2013.	6366277	Huset til Tom brann ned i 2013.
53359	How long have you known Jim Robinson?	6366303	Kor lenge har du kjent Jim Robinson?
1529653	I just got done eating lunch.	6366316	Eg vart nett ferdig med lunsjen.
2259543	They caught up with us quickly.	6366331	Dei tok oss fort igjen.
3688280	The leaves change their colour in autumn.	6366340	Blada endrar farge om hausten.
6123359	Is Tom at your place?	6366355	Er Tom hjå deg?
279149	Would you be so kind as to turn the light on?	6366367	Kunne du vere så snill og slå på ljoset?
312133	She put on the brakes and the car stopped.	6366373	Ho bremsa og bilen stoppa.
328584	We've destroyed the enemy flagship!	6366384	Vi har øydelagt fiendens flaggskip!
1570023	The bed linen changes every week.	6366421	Sengkleet vert bytta kvar veke.
1934710	I've been trying to reach Tom since yesterday.	6366475	Eg har prøvd å nå Tom sidan i går.
2169457	We oppose you.	6366489	Vi er imot deg.
2406119	I saw Tom and the others.	6366493	Eg såg Tom og dei.
3494953	Tom visited Australia last summer.	6366500	Tom dro til Australia førre sumar.
3737856	Do you want us to take you home?	6366506	Vil du at vi skal køyre deg heim?
4498365	I miss the excitement.	6366517	Eg saknar spenninga.
3991377	Dan took a picture of the license plate.	6366530	Dan tok eit bilete av registreringsnummeret.
4045675	What time do you think Tom will get here?	6366535	Når trur du Tom når fram hit?
5485950	Tom has always been a health nut.	6366575	Tom har alltid vore helsegalen.
5737859	The world will be watching.	6366594	Heile verda vil sjå på.
6040106	Tom has already given Mary what she asked for.	6366601	Tom har allereie gjeve Maria det ho spurde etter.
6110489	How's the apple?	6366617	Korleis smakar eplet?
6221197	Tom has everything that he needs.	6366634	Tom har alt han treng.
6260045	Tom works as a used car salesman.	6366640	Tom har jobb som bruktbilforhandlar.
