23499	The church we went past crumbled five minutes afterwards due to a huge earthquake and more than a 100 churchgoers were buried alive.	6366654	Kyrkja vi gjekk forbi braut saman fem minutt etterpå på grunn av eit enormt jordskjelv, og fleire enn 100 kyrkjefolk vart gravlagde levande.
1270315	The configuration file for your database server is located in this directory.	6366723	Databaseserveren din si konfigurasjonsfil ligg i denne mappa.
2514991	There is more than enough room for another car.	6366736	Det er meir enn nok plass til ein bil til.
3023523	Tom knew instantly that something was wrong.	6366738	Tom visste med ein gong at noko var galt.
1741860	Don't let him watch this film.	6366748	Ikkje lat han se denne filmen.
3052467	He never cared much for me.	6366750	Han brydde seg aldri noko særleg om meg.
3129752	Does that ever happen to you?	6366753	Hender dette nokon gong med deg?
4501452	Tom has started playing the guitar again.	6366757	Tom har byrja å spela gitar att.
5736514	Tom took a beating last week.	6366759	Tom vart banka opp sist veke.
20078	Hunger knows no law.	6366762	Svolten sannkjenner inga lov.
619780	If you have an indoor swimming pool, you're probably pretty rich.	6367576	Har du eit innandørs symjebasseng, er du truleg ganske rik.
2053907	The kitten seems to be enjoying her food this evening. She doesn't always seem to enjoy it.	6367618	Kattungen ser ut til å like maten sin i kveld. Det verkar ikkje som om ho alltid likar han.
2644359	Tom made the right choice.	6367683	Tom tok det rette valet.
304239	He works even late at night.	6369329	Han arbeider òg seint om nettene.
304240	He sits up till late at night.	6369330	Han sit oppe langt ut på nettene.
304243	He made us work till late at night.	6369333	Han fekk oss til å arbeide langt ut på natt.
304244	He often sits up late writing letters.	6369340	Han sit ofte lenge oppe om nettene og skriv brev.
304245	He sits up studying till late at night.	6369342	Han sit oppe langt ut på natt for å studere.
304246	He was robbed when coming home late at night.	6369351	Han vart rana idet han kom heim seint om natta.
304247	He didn't get in until 2 o'clock in the morning.	6369363	Han kom ikkje inn før klokka to om natta.
263973	I have plenty of time, but not enough money.	6378392	Eg har meir enn nok tid, men ikkje nok pengar.
1317084	Who do you think the author of this novel is?	6379221	Kven trur du romanen sin forfattar er?
16259	What do you intend to do?	6379222	Kva tenkjer du å gjere?
16260	You have put everything out of order.	6379237	Du har rota alt til.
16262	What are you going to be?	6379238	Kva skal du vera?
1023786	What happened to Tom?	6379242	Kva skjedde med Tom?
33667	I wonder what happened to Paul.	6379950	Eg lurar på kva som skjedde med Paul.
1670787	What happened to the German girl?	6379954	Kva skjedde med den tyske jenta?
6343248	I'm going to go to Boston to see Tom.	6380480	Eg skal reisa til Boston for å treffa Tom.
6343249	I heard that you were busy all afternoon.	6380505	Eg høyrde at du var oppteken heile ettermiddagen.
6343250	Tom doesn't seem to have a lot of friends.	6380510	Tom verkar ikkje å ha særleg mange vener.
6343251	I'm glad to hear that Tom didn't win.	6380532	Det er godt å høyra at Tom ikkje vann.
6343252	I haven't yet done what I was told to do.	6380535	Eg har enno ikkje gjort kva eg vart fortald til å gjera.
49081	The company is on the verge of bankruptcy.	6381405	Selskapet er i ferd med å gå konkurs.
750646	I misunderstand more than half the questions.	6381423	Eg mistyder meir enn halvparten av spørsmåla.
777624	Don't get yourself killed.	6381433	Pass på så du ikkje vert drepen.
886214	He disliked school.	6381443	Han likte ikkje å gå på skule.
1219830	The prophet Muhammad died in Medina in 632.	6381451	Profeten Muhammed døydde i Medina i 632.
3620385	Why is Tom not here?	6388221	Kvifor er ikkje Tom her?
318698	A lady, whose husband is a famous scientist, came over from the other side.	6388793	Ei dame med ein mann som var ein kjend vitskapsmann vitja frå den andre sida.
2546630	I'm doing this for Tom.	6388797	Eg gjer dette for Tom.
3264735	What is your new friend's name?	6388804	Kva heiter den nye venen din?
3394453	What's up with you and Tom?	6388812	Kva har hendt mellom deg og Tom?
4502308	You should stay away from Tom.	6388815	Du burde halde deg vekke frå Tom.
4889741	Tom did a fantastic job.	6388817	Tom gjorde eit fantastisk arbeid.
5357978	Do you like Seinfeld?	6388819	Likar du Seinfeld?
5735835	Tom grew up in a tough suburb.	6388826	Tom vaks opp i ein farleg forstad.
5859704	I won't be singing with you tonight.	6388835	Eg kjem ikkje til å syngja med deg i kveld.
6248620	They say that Tom won't do that.	6388839	Dei seier at Tom ikkje kjem til å gjera det.
3757226	Then he rustled his feathers, curved his slender neck, and cried joyfully, from the depths of his heart, "I never dreamed of such happiness as this, while I was an ugly duckling."	6388867	Så rasla han med fjørene, lyfta den slanke halsen sin og ropte med glede rett frå hjarta: "Slik ei glede drøymde eg aldri om då eg var ein stygg andunge."
3819169	It happens to me, too.	6388883	Det hender med meg òg.
4806962	My father is a native French speaker and my mother is a native English speaker.	6388902	Faren min har fransk som morsmål, og mora mi har engelsk som morsmål.
5906064	That's my seat.	6388904	Det er mitt sete.
6341235	Tom isn't really going to eat that frog, is he?	6388912	Tom skal vel ikkje eta den frosken?
1040691	The police treated Tom like a common criminal.	6388920	Politiet handsama Tom som om han var ein alminneleg kriminell.
1123007	He knows very well how to deceive people.	6388923	Han veit veldig godt korleis ein lurar folk.
1233508	I go to school every day.	6388932	Eg går på skolen kvar dag.
1938758	I am who I am thanks to my mother.	6388945	Eg er kven eg er takka vere mora mi.
2314688	Can you help me organize my files before you leave?	6388958	Kan du hjelpa meg med å rydda i filene mine innan du går?
67917	They mark down goods at that shop.	6391506	Dei set ned prisane på varene i den butikken.
67918	They sell sugar and salt at that store.	6391518	Dei sel sukker og salt i den butikken.
67919	The store is having a sale on summer goods.	6391549	Butikken har sal på sumarvarer.
6256076	You'd better do that in a hurry.	6391639	Det der må du gjera fortast mogleg.
881017	She sings and dances very well.	6404698	Ho syng og dansar veldig godt.
881019	He dresses himself well.	6404700	Han kler seg godt.
881021	He brushes his teeth after his meals.	6404715	Han pussar tennene etter måltider.
5916322	Tom thinks he's stronger than me.	6405594	Tom trur han er sterkare enn meg.
5916323	I'm not a French teacher.	6405613	Eg er ikkje ein fransklærar.
5916324	Tom talks a lot about his father.	6405614	Tom fortel mykje om far sin.
5916325	I'm making breakfast now.	6405624	Eg lagar frukost no.
5916326	Tom should never have been fired.	6405630	Tom burde aldri ha fått sparken.
5916327	I'm a pretty good golfer.	6405635	Eg er ganske god til å spela golf.
5916328	Tom says he has to wait for Mary.	6405654	Tom seier han må venta på Maria.
5916329	I would've just given up.	6405656	Eg hadde berre gjeve opp.
5916330	Tom put his toys back in the box.	6405665	Tom la leikene sine i eska att.
5916331	I was wearing sunglasses.	6405666	Eg hadde på meg solbriller.
5916332	Tom probably did that by himself.	6405674	Tom gjorde det sikkert sjølv.
1487439	I was visited by a customer.	6441068	Eg vart vitja av ein kunde.
301020	He can swim fast.	6441138	Han kan symja fort.
301021	He made up for lost time by running fast.	6441153	Han godtgjorde den tapte tida ved å laupa fort.
301023	He is too fat to run fast.	6441251	Han er for feit til å laupa fort.
301024	He can run fast.	6441254	Han kan laupa fort.
301025	He is so old that he cannot walk quickly.	6441270	Han er så gamal at han ikkje kan gå fort.
301027	He was charged with speeding.	6441292	Han vart sikta for å ha brote fartsgrensa.
301031	He is happiest when he is with his grandchildren.	6441309	Han er gladast når han er med barneborna sine.
301032	He dotes on his grandson.	6441312	Han er ovglad i barnebarnet sitt.
6443293	Do not listen to this man.	6388197	Ikkje høyr på denne mannen.
301722	He is a good loser.	5410058	Han er ein god tapar.
4499260	I hate my neighbor.	5409063	Eg hatar naboen min.
726741	I hate my neighbour.	5409063	Eg hatar naboen min.
2408389	I think Tom will like it.	5408937	Eg trur Tom kjem til å lika det.
2729876	Tom arrived at the train station at 3 o'clock.	5190852	Tom ankom togstasjonen klokka 3.
1357345	Where is Mississippi?	4756195	Kvar er Mississippi?
6443314	Tom dreams about living in the mountains.	4668623	Tom har ein dram om å bu på fjellet.
450773	Where is the emergency exit?	4550904	Kvar er naudutgangen?
6443315	What do I have to do to convince my father-in-law?	4111652	Kva må eg gjere for å overtyde svigerfaren min?
6443316	You know I love Mary, do you not?	4110760	Du veit at eg elskar Mary, ikkje sant?
6443317	You know I love Mary, right?	4110760	Du veit at eg elskar Mary, ikkje sant?
266692	Our teacher gives us a lot of homework.	4110750	Læraren vår gjev oss mykje lekser.
448645	Thanks!	4110752	Takk!
6443318	The news made him sad.	4110744	Nyhenda gjorde han trist.
6443319	I do not drink a lot of wine.	4110745	Eg drikk ikkje mykje vin.
36161	Nancy invited him to a party.	4110746	Nancy inviterte han til ein fest.
6443320	Do you not have anything to tell him?	4110659	Har du ingenting å fortelje han?
6443321	Don't you have anything to tell him?	4110659	Har du ingenting å fortelje han?
6443322	My parents love you.	4110614	Foreldra mine elskar deg.
1690592	Everything is possible.	4110613	Alt er mogeleg.
6443323	A pigeon is a symbol of peace.	4110547	Ei due er eit symbol på fred.
6443324	I want peace.	4110544	Eg vil ha fred.
6443325	They say she was rich.	3010228	Dei seiar at ho var rik.
6443331	Give me a pilsner!	2906404	Gi meg ei pils!
6443338	All problems must be answered.	2480800	Alle oppgåver skal svarast på
6443336	I am not doing anything special today. Perhaps I will just lie down on the couch and watch TV or something.	2656624	Eg skal ikkje gjere noko spesielt i dag, kanskje liggje på sofaen og sjå på TV, eller noko sånt.
6443340	Read the problem text thoroughly.	2480795	Les oppgåveteksten nøye.
6443343	My grandmother likes the tea ceremony a lot.	2244336	Min farmor liker te-seremonien veldig mye.
6443345	Norway is not ready for another terror attack.	2208190	Noreg er ikkje klar for eit nytt terroråtak.
1080170	Coffee or tea?	2059568	Kaffi eller te?
6443353	There were two roads in the forest for me to choose between, and I chose the one least trodden, and I made all my choices at that very moment.	1983998	Det var to vegar i skogen eg kunne gå, og eg valde den som var tråkka av få, og all ting valde eg der og då.
6443355	Why are they cutting up the meat?	1983791	Kvifor skjer de opp kjøtet?
6443356	Mom has bought me a book.	1983789	Mamma har kjøpt meg ei bok.
6443357	The lion eats meat.	1983389	Løva et kjøtt.
6443358	The pupil writes a letter by hand.	1983380	Eleven skriv eit brev for hand.
6443359	What sort of sport do you prefer?	1983375	Kva slags sportsgrein lika du?
6443360	I listened to the radio last night.	1983372	I går kveld høyrde eg på radio.
3378937	Whose fault is that?	1983366	Kven si skuld er det?
68248	Look at the girls.	1983362	Sjå på jentene.
417801	My eyes hurt.	1983350	Augo mine gjer vondt.
280173	Do you have a headache?	1983340	Har du vondt i hovudet?
6443365	Your brother was not at school today.	1983353	Broren din var ikkje på skulen i dag.
6104101	I have not yet read the book you are talking about.	1983342	Eg har endå ikkje lese boka du snakkar om.
6443366	I see the lion.	1983332	Eg ser løva.
6443367	I do not see your son.	1983323	Eg ser ikkje sonen din.
6443368	Here is the book.	1983325	Her er boka.
6443369	The girl is reading beneath the tree.	1983319	Jenta les under treet.
6443370	I have many fruit trees in my garden.	1983303	Det er mange frukttre i hagen min.
6443371	Is your horse black?	1983300	Er hesten din svart?
6443372	Your boat is not big.	1983297	Båten din er ikkje stor.
6443373	Without Latin, there would be no medicine.	1983291	Utan Latin, finst ikkje medisin.
6443375	I think your sisters are going to like this book.	1983284	Eg trur systrene dine vil lika denne boka.
6443376	The boy and the man drink water.	1983281	Guten og mannen drikk vatn.
2912566	How much did it cost?	1983278	Kor mykje kosta den?
1136927	I am very sad.	1983268	Eg er veldig trist.
6443377	Your mother is not strict, is she?	1983262	Mora di er vel ikkje streng?
6443378	I did all this for myself only.	1982873	Eg gjorde alt dette berre for meg sjølv.
6443382	Life is becoming ever more complex.	1982871	Livet vert stadig meir komplekst.
6443386	There were no protests from the students.	1982862	Det var ikkje nokon protest frå studentane si sida.
6443388	I have done everything I could to keep him alive.	1980707	Eg har gjort alt for å halda han i live.
50364	The concert was broadcast live.	1980698	Konserten blei direktesend.
6443394	The football match was broadcast live on television.	1980701	Fotballkampen blei direktesend på fjernsyn.
242740	I was tired today.	1980685	Eg var sliten i dag.
6443396	I played tennis when I was a student.	1980672	Eg spilte tennis da eg var student.
261394	I was tired.	1980678	Eg var sliten.
6443400	I was up in the mountains.	1980668	Eg var i fjella.
6443397	"Are you hungry?" "No, I am not hungry, because I ate sandwiches at school."	1980666	«Er du svolten?» «Nei, eg er ikkje svolten fordi eg åt smørbrød på skulen.»
6443401	I enjoyed learning Latin when I went to the university.	1980659	Eg lika å læra Latin da eg gjekk på universitetet.
6443403	I read this book when I went to primary school.	1980662	Eg las denne boka da eg gjekk på barneskulen.
6443407	I bought this when I visited the US.	1980654	Eg kjøpte dette da eg var i USA.
6443408	I am going back.	1980586	Eg går tilbake.
3426220	Is this water drinkable?	838025	Kan dette vannet drikkes?
6443411	I would be more than happy to pay.	838023	Eg vil gjerne betala.
6443412	It is very nice here.	838013	Det er veldig koselig her.
6443413	To whom are you going to give that book?	5924591	Kven skal du gje boka til?
6443415	It is very cozy here.	838013	Det er veldig koselig her.
6443413	To whom are you going to give that book?	5924592	Kven skal du gi boka til?
6443419	It is very cosy here.	838013	Det er veldig koselig her.
6443421	Whom are you going to give that book to?	5924592	Kven skal du gi boka til?
6443421	Whom are you going to give that book to?	5924593	Kven skal du gjeve boka til?
6443413	To whom are you going to give that book?	5924593	Kven skal du gjeve boka til?
6443423	He was hoping to see you.	5924598	Han kom i vona om å få sjå deg.
6443424	It is so boring.	5926144	Det er så keisamt.
2083231	Are you bored here?	5926153	Keiar du deg her?
6443427	The movie is boring.	5926154	Filmen er keisam.
2436035	The film is boring.	5926154	Filmen er keisam.
6443428	The summer is behind us.	5926968	Sommaren ligg bak oss.
6443431	I think three years is a long time.	5928212	Eg synest tre år er lenge.
6008185	I have read some of these books.	5928324	Eg har lese nokre av desse bøkene.
6443435	Marika was crazy about me, and I... well, you could say I was crazy about her, too.	5932186	Marika var galen etter meg, og eg... ja, man kan seie at eg var galen etter ho au.
6443436	Do you want me to tell you a joke?	5934640	Skal eg fortelje deg ein vits?
4098122	I should have brought an umbrella.	6009700	Eg skulle ha teke med meg ein paraply.
6443438	Stay with me!	6014604	Bli hos meg!
6443439	I want them to stay with me.	6014607	Eg vil at de skal bli hos meg.
6443440	I opened the box; it was empty.	6015414	Eg opna eska - ho var tom.
317459	In addition to being a good teacher, she was a great scholar.	6448805	I tillegg til å vera ein god lærar, var ho òg ein flittig student.
317460	She thought of the fine autumn day when she had rushed home from school with the good news; she was chosen to be on the relay team.	6448807	Ho tenkte på den fine haustdagen då ho hadde skunda seg heim frå skolen med gode nyhende; ho hadde vorte vald til å vera med på stafettlaget.
317461	She behaves as if she had been brought up in a good family.	6448812	Ho ter seg som om ho hadde vorte oppdregen i ein god familie.
2544076	I'm sure Tom would love it.	6449991	Eg er sikker på at Tom ville likt det.
2544077	I'm sure Tom will help you.	6449997	Eg er sikker på at Tom vil hjelpa deg.
2544078	I'm sure Tom told you that.	6450030	Eg er sikker på at Tom fortalde deg det.
2544079	I'm sure Tom is on his way.	6450033	Eg er sikker på at Tom er på veg.
2544080	I'm sure Tom could help us.	6450056	Eg er sikker på at Tom kan hjelpa oss.
2544081	I'm sure I wasn't followed.	6450070	Eg er sikker på at ingen fylgde etter meg.
2544082	I'm sure I locked the door.	6450071	Eg er sikker på at eg låste døra.
2388085	I never even noticed I'd lost my wallet until I got home.	6450303	Eg merka ikkje at eg hadde mista lommeboka før eg fyrst vart komen heim.
2388086	I never even saw it.	6450398	Eg såg det aldri eingong.
2388087	I never even saw Tom.	6450399	Eg såg aldri Tom eingong.
2388088	I never even saw you.	6450404	Eg såg deg aldri eingong.
2388089	I never even told my wife.	6450405	Eg fortalde det aldri til kona mi eingong.
2388090	I never expected this.	6450414	Eg venta aldri dette.
2388091	I never expected Tom to get out of prison.	6450421	Eg venta aldri at Tom skulle sleppa ut av fengsel.
6169119	Will you use this?	6450490	Skal du bruka denne?
6169119	Will you use this?	6450491	Skal du bruka dette?
266393	I have to hurry to the station to take the last train.	6460971	Eg må skunda meg til stasjonen for å ta det siste toget.
2516436	I hate winter.	6672766	Eg hatar vinter.
2516435	I hate the winter.	6672766	Eg hatar vinter.
289816	He drank a cup of coffee.	6837649	Han drakk ein kopp kaffi.
6994713	Portugal is not an Islamic country.	6994755	Portugal er ikkje eit islamsk land.
6994570	Tom's computer was acting strangely.	6994761	Datamaskinen til Tom tedde seg merkeleg.
6994571	Tom's computer started acting strangely.	6994906	Tom sin datamaskin byrja te seg merkeleg.
6994572	Tom started acting strangely.	6994909	Tom byrja te seg merkeleg.
6994567	Mary was reading a celebrity magazine.	6994919	Marie las i eit kjendisblad.
6994564	How can you read this stuff?	6994924	Korleis greier du å lesa det her?
6994565	Tom flipped furiously through the pages.	6994931	Tom bladde frenetisk gjennom sidene.
6994560	Please get it over with quickly.	6994943	Ver snill og få det fort overstått.
6994561	Tom seemed genuinely puzzled.	6994964	Tom verka vera verkeleg forundra.
6994548	Heavy rain and flooding hits much of China this time every year.	6995023	Store mengder regn og flaumar oppstår årleg i store delar av Kina på denne tida av året.
6994484	Where did you rapscallions put my chair?	6995058	Kvar sette de rakkarar stolen min?
6995758	Portugal is a republic.	6996256	Portugal er ein republikk.
6995721	It's an ugly flag.	6996258	Det er eit stygt flagg.
6995723	It's a pretty flag.	6996262	Det er eit fint flagg.
6995724	It's a beautiful flag.	6996265	Det er eit nydeleg flagg.
6995725	I like that flag.	6996268	Eg likar det flagget.
6995715	Has anyone here ever seen the night sky on a dark night, away from light pollution?	6996279	Har nokon her nokon gong sett nattehimmelen ei mørk natt borte frå lysforurensing?
6995717	Light pollution is a serious problem.	6996283	Lysforurensing er eit alvorleg problem.
6995718	Pollution is a serious problem.	6996284	Forurensing er eit alvorleg problem.
6995696	Is my novel any good?	6996286	Er romanen min god?
6995697	Is his novel any good?	6996288	Er romanen hans god?
6996618	Tom is a professional football player.	6996784	Tom er ein profesjonell fotballspelar.
6996620	Tom is a professional basketball player.	6996790	Tom er ein profesjonell basketballspelar.
6996617	Tom is a professional soccer player.	6996784	Tom er ein profesjonell fotballspelar.
6996624	Tom was more than happy.	6996793	Tom var meir enn glad.
6996626	They were more than happy.	6996800	Dei var meir enn glade.
6996610	Tom forgets Mary's birthday every year.	6996817	Tom gløymer Maria sin bursdag kvart år.
61725	Here is a book.	1983326	Her er ei bok.
3251387	The bus is coming.	3214050	Bussen kjem.
410244	She is beautiful.	1980632	Ho er vakker.
795927	She's beautiful.	1980632	Ho er vakker.
1394266	The car is blue.	1980592	Bilen er blå.
449095	Do you drink coffee?	1168715	Drikker du kaffe?
239730	I like languages.	1980618	Eg likar språk.
562905	Yes or no?	1980635	Ja eller nei?
887283	She loves him.	1980647	Ho elskar han.
1300804	I was at home.	1980676	Eg var heime.
5828906	I was home.	1980676	Eg var heime.
855612	Do you like golf?	1981129	Likar du golf?
2249228	It's really sad.	4110539	Det er verkeleg trist.
43928	Where is the book?	1980616	Kor er boka?
4707795	Drink something.	5925488	Drikk noko.
1357345	Where is Mississippi?	1980648	Kor er Mississippi?
1000136	I drink coffee.	5409006	Eg drikk kaffi.
586830	I see a lion.	1983330	Eg ser ei løve.
2422228	I am Gregor.	1983364	Eg er Gregor.
289824	He had dark brown hair.	4110782	Han hadde mørkebrunt hår.
528525	My father can swim, but my mother can't.	1983306	Faren min kan symja, men ikkje mora mi.
2248029	I'm in Boston.	4110767	Eg er i Boston.
6389394	He didn't like going to school.	6381443	Han likte ikkje å gå på skule.
7794636	I have no idea how long it'll take.	1981822	Eg har ikkje peiling på kor lang tid det kjem til å taka.
463030	The wooden chair is expensive.	1983315	Trestolen er kostbar.
766635	My name is Sally.	1983344	Eg heiter Sally.
485155	They're washing their hands.	1983352	Dei vaskar hendene.
463184	They wash their hands.	1983352	Dei vaskar hendene.
1148331	I'm able to speak.	1983363	Eg kan snakka.
1570082	The lion is eating meat.	1983389	Løva et kjøtt.
1590555	I see the book.	1983769	Eg ser boka.
3169970	The slave carries the water.	1983795	Slaven ber vatnet.
35626	The party is over.	1984024	Festen er over.
6702018	He eats.	5929439	Han et.
338182	All human beings are born free and equal in dignity and rights. They are endowed with reason and conscience and should act towards one another in a spirit of brotherhood.	396885	Alle menneske er fødde til fridom og med same menneskeverd og menneskerettar. Dei har fått fornuft og samvit og skal leve med kvarandre som brør.
32212	Would you like a cup of milk?	1983308	Vil du ha ein kopp mjølk?
1671849	I need coffee.	5928758	Eg treng kaffi.
2931676	I was smiling.	6333878	Eg smilte.
295799	He never lies.	2977024	Han lyg aldri.
289790	He never tells lies.	2977024	Han lyg aldri.
464594	What is the exchange rate?	2998234	Kva er kursen?
43273	The story was true.	4110532	Historia var sann.
2422733	The ruler is short.	4110710	Linjalen er kort.
317955	Where's the emergency exit?	4550904	Kvar er naudutgangen?
324290	He is kind.	4592753	Han er snill.
2723491	I'm eating bread.	4866449	Eg et brød.
1867478	I eat bread.	4866449	Eg et brød.
5392385	Who speaks Russian?	5392384	Kven snakkar russisk?
2248442	Is it blue?	5408957	Er det blått?
953198	Do you hear something?	5925897	Høyrer du noko?
389996	Symmetry is boring.	5926148	Symmetri er keisamt.
3702837	I'm boring.	5926131	Eg er keisam.
2241480	We were bored.	5926141	Me keia oss.
2304078	I misread.	5926552	Eg las feil.
6765820	You do not help.	6455128	Du hjelper ikkje.
6765843	You aren't helping.	6455128	Du hjelper ikkje.
1895591	You're not helping.	6455128	Du hjelper ikkje.
2380197	I lost the bet.	6019379	Eg tapte veddemålet.
4759519	Where is the tree?	6455126	Kvar er treet?
794269	That's his house.	1981075	Det er huset hans.
1981133	I know the girl who is playing tennis.	1981132	Eg kjenner jenta som speler tennis.
1214828	It's already seven o'clock.	4110649	Klokka er allerede sju.
1770346	I am tired!	6331390	Eg er utsliten!
24759	What do you want to do?	1983376	Kva vil du gjer?
2270189	Where's the exit?	5928871	Kvar er utgangen?
687648	Where is the exit?	5928871	Kvar er utgangen?
266811	Where is the way out?	5928871	Kvar er utgangen?
42099	I want to do it myself.	5928391	Eg vil gjera det sjølv.
270793	Water is a liquid.	4110697	Vatn er ei væske
70266	How many books do you read a month?	1982824	Kor mange bøker les du i månaden?
464546	What do you need?	5928731	Kva treng du?
1880399	I know where he is.	2998222	Eg veit kvar han er.
1880399	I know where he is.	2998223	Eg veit kor han er.
997880	I don't drink coffee.	5927923	Eg drikk ikkje kaffi.
436515	I do not drink coffee.	5927923	Eg drikk ikkje kaffi.
1758	I am married and have two children.	4110743	Eg er gift og har to born.
5850746	I've already said yes.	5927969	Eg har allereie sagt ja.
1195262	Have you got a dog?	5007544	Har du ein hund?
72810	Both are alive.	1980710	Begge to er i live.
7870238	What's the subject of your lecture?	4110631	Kva er temaet for førelesinga di?
72065	Iceland used to belong to Denmark.	2000890	Island høyrde før til Danmark.
1571999	DIY.	1982561	Gjer det sjølv.
3084093	Godspeed!	5408996	God tur!
319990	I know.	1980622	Eg veit.
299819	Is he sleeping?	5929423	Søv han?
755242	I'm the best.	1981115	Eg er best.
409664	I am the best.	1981115	Eg er best.
349064	I don't know.	4110779	Eg veit ikkje.
320001	Beats me.	4110779	Eg veit ikkje.
4422211	Dunno.	4110779	Eg veit ikkje.
1839531	I'm hungry.	4110817	Eg er svolten.
1849378	Don't touch me.	4763237	Ikkje rør meg.
2252574	The door's locked.	5408965	Døra er låst.
