6919721	But Love wanted to make a match of his own devising.	6919714	ὁ δὲ Ἔρως ζεῦγος ἴδιον ἠθέλησε συμπλέξαι
6919724	There was a public feast of Aphrodite.	6919723	Ἀφροδίτης ἑορτὴ δημοτελὴς ἦν.
6919727	Almost every woman had gone to the temple.	6919726	πᾶσαι σχεδὸν αἱ γυναῖκες ἀπῆλθον εἰς τὸν νεών.
6919729	So smitten, Chaereas could barely make his way home.	6919728	Ὁ μὲν οὖν Χαιρέας οἴκαδε μετὰ τοῦ τραύματος μόλις ἀπῄει.
6919732	Τhe night came terribly upon them both.	6919731	Νὺξ ἐπῆλθεν ἀμφοτέροις δεινή.
2745283	I'm looking for my cat.	7004724	Τὸν αἴλουρόν μου ζητῶ.
2665425	Diceopolis is Athenian.	7014476	Ὁ Δικαιόπολις Ἀθηναῖός ἐστιν.
3192079	We were farmers.	7014481	Γεωργοὶ ᾖμεν.
2167100	I'm a farmer.	7014482	Γεωργός εἰμι.
3322848	He's a farmer.	7014484	Γεωργός ἐστιν.
5493853	They aren't farmers.	7014485	Οὐ γεωργοί εἰσιν.
2262883	Tom is a terrible farmer.	7014486	Ὁ Θωμᾶς κάκιστος γεωργός ἐστιν.
2647934	Tom isn't a farmer.	7014489	Ὁ Θωμᾶς οὐ γεωργός ἐστιν.
1117347	She is strong.	7014494	Ἰσχυρά ἐστιν.
2203405	Tom is strong.	7014495	Ὁ Θωμᾶς ἰσχυρός ἐστιν.
1392505	A lion is strong.	7014498	Ὁ λέων ἰσχυρός ἐστιν.
2504044	The boy is strong.	7014500	Ὁ παῖς ἰσχυρός ἐστιν.
5003767	Tom works on his own.	7049257	Ὁ Θωμᾶς αὐτουργός ἐστιν.
2462075	I work on my own.	7049264	Αὐτουργός εἰμι.
279086	I live in the country.	7049270	Ἐν τοῖς ἀγροῖς οἰκῶ.
310509	She lives in the country.	7049271	Ἐν τοῖς ἀγροῖς οἰκεῖ.
3424137	Tom lives in the country.	7049273	Ὁ Θωμᾶς ἐν τοῖς ἀγροῖς οἰκεῖ .
251366	My grandmother lives in the country.	7049278	Ἡ τήθη μου ἐν τοῖς ἀγροῖς οἰκεῖ.
319305	My father lives in the country.	7049279	Ὁ πατήρ μου ἐν τοῖς ἀγροῖς οἰκεῖ.
252077	My parents live in the country.	7049289	Οἱ γονεῖς μου ἐν τοῖς ἀγροῖς οἰκοῦσιν.
1031266	I want to go to the city.	7051174	Βούλομαι πρὸς τὸ ἄστυ πορεύεσθαι.
5820154	Very well!	7051175	Εὖ γε.
324656	Time for dinner.	7051176	Καιρός ἐστι δειπνεῖν.
275064	The sun is rising now.	7051178	Νῦν δὲ ὁ ἥλιος ἀνατέλλει.
383682	The sun is rising already.	7051179	Ὁ ἥλιος ήδη ἀνατέλλει.
2218476	You're very brave.	7051180	Μάλα ἀνδρεῖος εἶ.
764592	Let it be.	7051181	Ἔστω οὖν.
2057765	I'm not to blame.	7051182	Οὐκ αἴτιος ἔγωγε.
5758116	Tom killed a man.	7051183	Ὁ Θωμᾶς ἄνθρωπον ἀπέκτονεν.
6274717	Tom killed a tiger.	7051184	Ὁ Θωμᾶς τίγριν ἀπέκτονεν.
681296	My cat killed a squirrel.	7051185	Ὁ αἴλουρός μου σκίουρον ἀπέκτονεν.
25310	What is happening?	7068908	Τί γίγνεται;
3910670	Save me.	7068911	Σῷζέ με.
2240332	Where is Tom?	7068915	Ποῦ ἐστιν ὁ Θωμᾶς;
1098723	Where is Mary?	7068918	Ποῦ ἐστιν ἡ Μαρία;
2111550	Sleep tight.	7068920	Ἡδὺν ὕπνον κάθευδε.
5345476	This athlete is strong and agile.	7069678	Ὁ ἀθλητὴς ἰσχυρός τε καὶ ἐλαφρός ἐστιν.
660498	The book is small.	7069679	Τὸ βιβλίον μικρόν ἐστιν.
2412891	The house is small.	7069680	Ὁ οἶκος μικρός ἐστιν.
2412891	The house is small.	7069681	Ἡ οἰκία μικρά ἐστιν.
6330475	The loaf is small.	7069683	Τὸ φύλλον μικρόν ἐστιν.
2490788	The market is large.	7069686	Ἡ ἀγορὰ μεγάλη ἐστίν.
6861563	The kitchen is large.	7069689	Ὁ ἰπνὸς μεγάλη ἐστίν.
6357181	Tom's house is large.	7069690	Ὁ οἶκος ὁ τοῦ Θωμᾶς μέγας ἐστίν.
6357181	Tom's house is large.	7069691	Ἡ οἰκία ἡ τοῦ Θωμᾶς μεγάλη ἐστίν.
1125405	The way is long.	7069693	Ἡ ὁδὸς μακρά ἐστιν.
2273641	Tom is working there.	7069696	Ὁ Θωμᾶς πονεῖ ἐκεῖ.
5034351	Tom is working with Mary.	7069699	Ὁ Θωμᾶς μετὰ τῆς Μαρίας πονεῖ.
4238211	The house is small but beautiful.	2657034	Ὁ οἶκος μικρός ἐστιν, ἀλλὰ καλός.
4238211	The house is small but beautiful.	7069703	Ἡ οἰκία μικρά ἐστιν, ἀλλὰ καλή.
307312	They work in the fields.	7069705	Ἐν τοῖς ἀγροῖς πονοῦσιν.
2568992	He works in the fields.	7069706	Ἐν τοῖς ἀγροῖς πονεῖ.
3422211	They live in caves.	7069726	Ἐν ἄντροις οἰκοῦσιν.
463208	They live in a house.	7069730	Ἐν οἰκίᾳ οἰκοῦσιν.
463208	They live in a house.	7069731	Ἐν οἴκῳ οἰκοῦσιν.
464406	We live in a house.	7069732	Ἐν οἰκίᾳ οἰκοῦμεν.
464406	We live in a house.	7069733	Ἐν οἴκῳ οἰκοῦμεν.
848987	I live in the city.	7069743	Ἐν τῷ ἄστει οἰκῶ.
1681406	He lives in the city.	7069745	Ἐν τῷ ἄστει οἰκεῖ.
2248454	Is it enough?	7069762	Ἆρα ἱκανόν ἐστιν;
25504	I'm a free man.	7069769	Ἐλεύθερός εἰμι.
2202889	Tom is free.	7069771	Ὁ Θωμᾶς ἐλεύθερός ἐστιν.
811617	I killed God.	7075915	Τὸν Θεὸν ἔκτεινα.
6645782	I killed Tom.	7075916	Τὸν Θωμᾶν ἔκτεινα.
2603171	Life is difficult.	7075920	Ὁ βίος χαλεπός ἐστιν.
1737320	This is how it is.	7075922	Ταῦτα οὕτως ἐστίν.
3914154	They killed him.	7075923	Ἀπέκτειναν αὐτόν.
3874524	I gave it to her.	7075924	Ἔδωκα αὐτῇ.
2011318	They want peace.	7084878	Τὴν εἰρήνην ἐθέλουσιν.
2011285	We want peace.	7084879	Τὴν εἰρήνην ἐθέλομεν.
4529995	What sort of man is Tom?	7086469	Ποῖος ἀνήρ ἐστι ὁ Θωμᾶς;
2239866	Tom was there.	7086476	Ὁ Θωμᾶς ἐκεῖ ἦν.
2249984	Someone was there.	7086477	Ἀνήρ τις ἐκεῖ ἦν.
50989	Jesus' mother was there.	7086480	Ἡ μήτηρ τοῦ Ἰησοῦ ἐκεῖ ἦν.
356200	Who are you?	7086488	Τίς εἶ σύ;
307858	Don't trust him.	7086498	Μὴ πίστευε αὐτῷ.
307858	Don't trust him.	7086499	Μὴ πιστεύετε αὐτῷ.
1849353	Don't trust Tom.	7086500	Μὴ πίστευε τῷ Θωμᾷ.
1849353	Don't trust Tom.	7086501	Μὴ πιστεύετε τῷ Θωμᾷ.
2277344	Don't trust strangers.	7086503	Μὴ πίστευε τοῖς ξένοις.
2277344	Don't trust strangers.	7086505	Μὴ πιστεύετε τοῖς ξένοις.
2194375	We don't trust strangers.	7086507	Οὐ πιστεύομεν τοῖς ξένοις.
2194376	I don't trust strangers.	7086509	Οὐ πιστεύω τοῖς ξένοις.
2271925	I don't trust Tom.	7086511	Οὐ πιστεύω τῷ Θωμᾷ.
2272133	They don't trust Tom.	7086514	Οὐ πιστεύουσι τῷ Θωμᾷ.
2273779	We don't trust Tom.	7086516	Οὐ πιστεύομεν τῷ Θωμᾷ.
3010425	I don't trust her.	7086520	Οὐ πιστεύω αὐτῇ.
3010426	I don't trust him.	7086521	Οὐ πιστεύω αὐτῷ.
3905067	We don't trust them.	7086523	Οὐ πιστεύομεν αὐτοῖς.
3905067	We don't trust them.	7086524	Οὐ πιστεύομεν αὐταῖς.
3905068	We don't trust him.	7086525	Οὐ πιστεύομεν αὐτῷ.
3905069	We don't trust her.	7086526	Οὐ πιστεύομεν αὐτῇ.
3905081	They don't trust him.	7086527	Οὐ πιστεύουσιν αὐτῷ.
3905082	They don't trust her.	7086528	Οὐ πιστεύουσιν αὐτῇ.
5165769	I don't trust them.	7086529	Οὐ πιστεύω αὐτοῖς.
5165769	I don't trust them.	7086530	Οὐ πιστεύω αὐταῖς.
5753758	We know the dangers.	7086543	Γιγνώσκομεν τοὺς κινδύνους.
2761828	This tree bears ugly fruits.	7087845	Τοῦτο τὸ δένδρον κακοὺς καρποὺς φέρει.
56764	This tree does not bear fruit.	7087856	Τοῦτο τὸ δένδρον οὐ φέρει καρπούς.
2481323	Come here and give it a look.	7087907	Δεῦρο ἐλθὲ καὶ βλέπε.
862477	I see the dog.	7087920	Τὸν κύνα ὁρῶ.
1130019	I see the boy.	7087922	Τὸν παῖδα ὁρῶ.
1590555	I see the book.	7087926	Τὸ βιβλίον ὁρῶ.
1875780	I see the girl.	7087931	Τὴν κόρην ὁρῶ.
1912244	I see the crown.	7087940	Τὸν στέφανον ὁρῶ.
3182938	I see the man.	7087941	Τὸν ἄνθρωπον ὁρῶ.
4980814	I see the sky.	7087942	Τὸν οὐρανὸν ὁρῶ.
5935825	I see the river.	7087943	Τὸν ποταμὸν ὁρῶ.
6443366	I see the lion.	7087946	Τὸν λέοντα ὁρῶ.
43928	Where is the book?	7087972	Ποῦ ἐστιν τὸ βιβλίον;
370651	Where is the boy?	7087976	Ποῦ ἐστιν ὁ παῖς;
687646	Where is the entrance?	7087981	Ποῦ ἐστιν ἡ εἴσοδος;
2255820	Where is the man?	7087988	Ποῦ ἐστιν ὁ ἀνήρ;
2255820	Where is the man?	7087989	Ποῦ ἐστιν ὁ ἄνθρωπος;
2311510	Where is the food?	7087994	Ποῦ ἐστιν τὸ δεῖπνον;
2312211	Where is the road?	7087996	Ποῦ ἐστιν ἡ ὁδός;
2507643	Where is the dog?	7088000	Ποῦ ἐστιν ὁ κύων;
2758392	Where is the woman?	7088006	Ποῦ ἐστιν ἡ γυνή;
3608096	Where is the mother?	7088011	Ποῦ ἐστιν ἡ μήτηρ;
3997922	Where is the sun?	7088014	Ποῦ ἐστιν ὁ ἥλιος;
4759519	Where is the tree?	7088017	Ποῦ ἐστιν τὸ δένδρον;
5162297	Where is the ship?	7088024	Ποῦ ἐστιν ἡ ναῦς;
5228478	Where is the horse?	7088027	Ποῦ ἐστιν ὁ ἵππος;
36004	How beautiful it is!	7088129	Ὡς καλόν ἐστιν.
311886	How beautiful she is!	7088130	Ὡς καλή ἐστιν.
1956374	You're not telling the truth.	7088141	Οὐκ ἀληθῆ λέγεις.
2645055	Is Tom telling the truth?	7088148	Ἆρα ἀληθῆ λέγει ὁ Θωμᾶς;
3100681	I hear the noise.	7088151	Τὸν ψόφον ἀκούω.
3422212	Tom is looking at the ceiling.	7088182	Ὁ Θωμᾶς πρὸς τὴν στέγην βλέπει.
3428380	Tom is looking at the floor.	7088183	Ὁ Θωμᾶς πρὸς τὴν γῆν βλέπει.
1179075	What does he see?	7088199	Τί ὁρᾷ;
1179093	What does she see?	7088199	Τί ὁρᾷ;
1349350	What do I see?	7088204	Τί ὁρῶ;
1841544	What do you see?	7088206	Τί ὁρᾷς;
506446	Don't worry.	3239903	Μὴ φρόντιζε.
506446	Don't worry.	7088222	Μὴ φροντίζετε.
5922084	Where does the word come from?	7088230	Πόθεν ὁ λόγος;
416367	Where are you going?	7088253	Ποῖ βαίνεις;
416367	Where are you going?	7088255	Ποῖ βαίνετε;
35117	Where are you going, Dad?	7088258	Ποῖ βαίνεις, ὦ πάππα;
1885963	Hey. Where are you going?	7088260	Χαῖρε. Ποῖ βαίνεις;
2644674	Where are you going, Tom?	7088263	Ποῖ βαίνεις, ὦ Θωμᾶ;
2892764	Where are you all going?	7088264	Ποῖ βαίνετε ὑμεῖς;
4861679	Where are you going, boy?	7088266	Ποῖ βαίνεις, ὦ παῖ;
6444175	Where are you two going?	7088271	Ποῖ βαίνετον;
2210900	Why don't you stay here?	7088287	Διὰ τί οὐ μένεις;
2210900	Why don't you stay here?	7088290	Διὰ τί οὐ μένετε;
2111606	Look here.	7088293	Δεῦρο βλέπε.
2111606	Look here.	7088294	Δεῦρο βλέπετε.
16492	What are you doing?	7088382	Τί ποιεῖς;
16492	What are you doing?	7088410	Τί ποιεῖτε;
17929	What is that thing in your right hand?	7088417	Τί ἔχεις ἐν τῇ δεξιᾷ;
6125468	Tom has a knife in his right hand.	7088425	Ὁ Θωμᾶς μάχαιραν ἔχει ἐν τῇ δεξιᾷ.
1140042	What are you saying?	7088436	Τί λέγεις;
1140042	What are you saying?	7088437	Τί λέγετε;
435084	Help!	7088443	βοήθει.
435084	Help!	7088446	Βοηθεῖτε.
2051764	I'm dying.	7088471	Ἀποθνῄσκω.
2248143	I'm not dying.	7088474	Οὐκ ἀποθνῄσκω.
3733264	Tom is looking for the rope.	7088484	Ὁ Θωμᾶς τὴν μήρινθον ζητεῖ.
6531426	Tom is looking for his dog.	7088485	Ὁ Θωμᾶς τὸν κύνα ζητεῖ.
3910668	Save us.	7095755	Σῷζε ἡμᾶς.
2203310	Tom is safe.	7095758	Ὁ Θωμᾶς σῶς ἐστιν.
2244928	Are we safe?	7095761	Ἆρα σῶοι ἐσμέν;
2549621	This is my job.	7095763	Ἐμὸν τὸ ἔργον.
2567839	Are we in danger?	7095766	Ἆρα ἐν κινδύνῳ ἐσμέν;
2648576	Are you in danger?	7095768	Ἆρα ἐν κινδύνῳ εἶ;
3726368	These kids are in danger.	7095771	Οὗτοι οἱ παῖδες ἐν κινδύνῳ εἰσίν.
3726369	My friends are in danger.	7095773	Οἱ φίλοι μου ἐν κινδύνῳ εἰσίν.
6921423	The cows are in danger.	7095774	Αἱ βόες ἐν κινδύνῳ εἰσίν.
2644044	Tom and Mary are in danger.	7095775	Ὁ Θωμᾶς τε καὶ ἡ Μαρία ἐν κινδύνῳ εἰσίν.
1651930	We're in danger.	7095776	Ἐν κινδύνῳ ἐσμέν.
2548024	We're not in danger.	7095777	Ἐν κινδύνῳ οὔκ ἐσμεν.
318380	The hospital is near here.	7095778	Ἐγγύς ἐστι τὸ νοσοκομεῖον.
4301659	The sheep are in the pen.	7101547	Τὰ πρόβατα ἐν τῷ αὐλίῳ ἐστίν.
914025	What does he say?	7101562	Τί λέγει;
1356454	What does she say?	7101562	Τί λέγει;
5757785	What does Tom say?	7101564	Τί λέγει ὁ Θωμᾶς;
3033023	What does the fox say?	7101567	Τί λέγει ἡ ἀλώπηξ;
6229714	What does Tom intend to do?	7101572	Τί ἐν νῷ ἔχει ὁ Θωμᾶς;
5806909	What do you do after work?	7101575	Τί ποιεῖτε μετὰ τὰ ἔργα;
2667373	Mary doesn't like Tom.	7101615	Ἡ Μαρία τὸν Θωμᾶν οὐ φιλεῖ.
7350219	Echetla is a Sicilian city.	7234271	Ἐχέτλα πόλις Σικελίας ἐστίν.
315395	She used to be diligent.	7796565	Ἄοκνος ἦν.
2202757	We're diligent.	7796575	Ἄοκνοί ἐσμεν.
2202758	You're diligent.	7796576	Ἄοκνος εἶ.
2202759	Tom is diligent.	7796577	Ὁ Θωμᾶς ἄοκνός ἐστιν.
2202760	I'm diligent.	7796578	Ἄοκνός εἰμι.
7847074	The sun is beautiful.	7847069	ὁ ἣλιος καλὸς ἐστίν.
1664244	Where's the boy?	7847063	ποῦ ἐστιν ὁ παῖς;
370651	Where is the boy?	7847063	ποῦ ἐστιν ὁ παῖς;
7868745	What's that thing in your right hand?	7088417	Τί ἔχεις ἐν τῇ δεξιᾷ;
40211	Charlie's father advised him to become a teacher.	8207830	Ὁ τοῦ Κάρολου πατήρ ἐσυμβούλευσε αὐτόν διδάσκαλον γίγνεσθαι.
2069119	I'm twelve years old.	8207837	Δωδεκαετής εἰμί.
436791	I love my wife.	8208176	Τὴν ἐμὴν γυναῖκα φιλέω.
8389010	What is and what isn't; the man is but a dream.	3103792	τί δέ τις; τί δ' οὔ τις; σκιᾶς ὄναρ ἄνθρωπος.
8389019	The soldiers are in the camp.	7087872	Οἱ στρατιῶται ἐν τῷ στρατοπέδῳ εἰσίν.
18344	The sky is getting dark.	8475340	Ὁ οὐρανὸς στυγνάζει.
1173265	My name is Tom.	8482051	Τὸ ὄνομά μοι Θωμᾶς ἐστιν.
3064297	Hello everyone! My name is Mary.	8482052	Χαίρετε. Τὸ ὄνομά μοι Μαρία ἐστίν.
3319395	I am Tom.	8482055	Ἐγὼ Θωμᾶς εἰμι.
408293	What's your name?	8482056	Τί ὄνομά σοί ἐστιν;
2647340	What are your names?	8482057	Τί ὄνομα ὑμῖν ἐστιν;
2261899	His name is Tom.	8482058	Τὸ ὄνομα αὐτῷ Θωμᾶς ἐστιν.
2273434	Her name is Mary.	8482059	Τὸ ὄνομα αὐτῇ Μαρία ἐστίν.
8482062	This is Mary.	8482061	Αὕτη Μαρία ἐστίν.
370708	Where do you live?	8482066	Ποῦ οἰκεῖς;
516745	Goodbye!	8482069	Ἔρρωσο.
516745	Goodbye!	8482070	Ἔρρωσθε.
2646765	What are their names?	8482071	Τί ὄνομα αὐτοῖς ἐστιν;
2646765	What are their names?	8482072	Τί ὄνομα αὐταῖς ἐστιν;
292024	Where does he live?	8482073	Ποῦ οἰκεῖ;
2647289	Where does Tom live?	8482074	Ποῦ οἰκεῖ ὁ Θωμᾶς;
7737521	Where does your brother live?	8482076	Ποῦ οἰκεῖ ὁ ἀδελφός σου;
2423001	Is this Tom?	8482081	Ἀρ' ἐστὶν οὗτος Θωμᾶς;
2659847	This is Tom.	8482060	Οὗτος Θωμᾶς ἐστιν.
8482082	Is this Mary?	8482083	Ἀρ' ἐστὶν αὕτη Μαρία;
8482087	Do you live in Athens?	8482088	Ἆρα ἐν ταῖς Ἀθήναις οἰκεῖς;
2272773	Tom is a child.	8482091	Ὁ Θωμᾶς παιδίον ἐστίν.
2272796	Tom is a farmer.	8482093	Ὁ Θωμᾶς γεωργός ἐστιν.
668099	This is my father.	8482106	Οὗτος πατήρ μού ἐστιν.
2358668	I have a brother.	8482107	Ἀδελφὸν ἔχω.
1447094	I have a sister.	8482109	Ἀδελφὴν ἔχω.
2358815	I have a sister and a brother.	8482110	Ἀδελφήν τε καὶ ἀδελφὸν ἔχω.
3171321	Tom is active.	7796577	Ὁ Θωμᾶς ἄοκνός ἐστιν.
313612	She is active.	7796573	Ἄοκνός ἐστιν.
65511	My mother is active.	8482356	Ἡ μήτηρ μου ἄοκνός ἐστιν.
296292	He works in a factory.	8491554	Ὁ Θωμᾶς ἐν τεκτονείῳ πονεῖ.
501436	He lives in a village.	8491567	Ἐν κώμῃ οἰκεῖ.
278746	Iron is hard.	8491571	Ὁ σίδηρος σκληρός ἐστιν.
630767	Life is hard.	7075920	Ὁ βίος χαλεπός ἐστιν.
56916	This book is small.	8491596	Τοῦτο τὸ βιβλίον μικρόν ἐστιν.
790118	My garden is small.	8491599	Ὁ κῆπος μου μικρός ἐστιν.
1467703	The world is small.	8491602	Ὁ κόσμος μικρός ἐστιν.
1765227	My house is small.	8491604	Ὁ οἶκος μου μέγας ἐστίν.
1765227	My house is small.	8491606	Ἡ οἰκία μου μικρά ἐστιν.
6330475	The loaf is small.	8491622	Ὁ ἄρτος μικρός ἐστιν.
4494226	Tom is small, but strong.	8491638	Ὁ Θωμᾶς μικρός ἐστιν, ἀλλ' ἰσχυρός.
278567	My brother is small but strong.	8491650	Ὁ ἀδελφός μου μικρός ἐστιν, ἀλλ' ἰσχυρός.
4719427	In my house, the garden is small.	8491674	Ἐν τῇ οἰκίᾳ μου ὁ κῆπος μικρός ἐστιν.
4719427	In my house, the garden is small.	8491676	Ἐν τῷ οἴκῳ μου ὁ κῆπος μικρός ἐστιν.
2202618	Tom is big.	8491699	Ὁ Θωμᾶς μέγας ἐστίν.
59419	This dog is big.	8491712	Οὗτος ὁ κύων μέγας ἐστίν.
59689	This fish is big.	8491716	Οὗτος ὁ ἰχθὺς μέγας ἐστίν.
250554	My house is big.	8491722	Ὁ οἰκία μου μεγάλη ἐστίν.
250554	My house is big.	8491604	Ὁ οἶκος μου μέγας ἐστίν.
602534	Your house is big.	8491723	Ἡ οἰκία σου μεγάλη ἐστίν.
602534	Your house is big.	8491727	Ὁ οἶκος σου μέγα ἐστίν.
697212	The book is big.	8491731	Τὸ βιβλίον μέγα ἐστίν.
1078150	My home is big.	8491734	Ἡ οἰκία μου μεγάλη ἐστίν.
1078150	My home is big.	8491604	Ὁ οἶκος μου μέγας ἐστίν.
1120802	The sun is big.	8491742	Ὁ ἥλιος μέγας ἐστίν.
1120810	The lake is big.	8491749	Ἡ λίμνη μεγάλη ἐστίν.
1487079	The sky is big.	8491751	Ὁ οὐρανὸς μέγας ἐστίν.
2002502	The city is big.	8491758	Τὸ ἄστυ μέγα ἐστίν.
3188279	My dog is big.	8491776	Ὁ κύων μου μέγας ἐστίν.
3487903	The bear is big.	8491783	Ὁ ἄρκτος μέγας ἐστίν.
5435664	The world is big.	8491788	Ὁ κόσμος μέγας ἐστίν.
1503453	I often read.	8491851	Πολλάκις ἀναγιγνώσκω.
5474297	Tom often smiles.	8491855	Ὁ Θωμᾶς πολλάκις γελᾷ.
6358634	I often sing.	8491858	Πολλάκις ᾄδω.
8000336	He walks often.	8491865	Πολλάκις βαδίζει.
8479408	He often smiles.	8491867	Πολλάκις γελᾷ.
315666	She owns a large property.	8491878	Μέγαν κλῆρον ἔχει.
5551079	Let's rejoice.	8491894	Χαίρωμεν.
4731161	I love my house.	8491899	Τὸν οἶκον φιλῶ.
4731161	I love my house.	8491902	Τὴν οἰκίαν φιλῶ.
2896769	The man loves the house.	8491906	Ὁ ἄνθρωπος τὴν οἰκίαν φιλεῖ.
3100632	I work for much time.	8491926	Πολὺν χρόνον πονῶ.
896158	Get up.	8491944	Ἔπαιρε σεαυτόν.
1898191	The sun is setting.	8491949	Ὁ ἥλιος καταδύνει.
294415	He walked home.	8491957	Οἴκαδε ἐβάδισεν.
1141051	Tom walked home.	8491961	Ὁ Θωμᾶς οἴκαδε ἐβάδισεν.
3090724	They walked home.	8491967	Οἴκαδε ἐβάδισαν.
6691600	Tom walks home.	8491975	Ὁ Θωμᾶς οἴκαδε βαδίζει.
2280263	Are you walking home?	8491977	Ἆρα οἴκαδε βαδίζεις;
1829	Life is beautiful.	8491993	Ὁ βίος καλός ἐστιν.
2045752	Mary is beautiful.	8491995	Ἡ Μαρία καλή ἐστιν.
2239323	Nature is beautiful.	8491996	Ἡ φύσις καλή ἐστιν.
7260496	Tom is beautiful.	8492004	Ὁ Θωμᾶς καλός ἐστιν.
56428	This rose is beautiful.	8492008	Τοῦτο τὸ ῥόδον καλόν ἐστιν.
58114	This river is beautiful.	8492012	Οὗτος ὁ ποταμὸς καλός ἐστιν.
250277	My mother is beautiful.	8492020	Ἡ μήτηρ μου καλή ἐστιν.
752469	The woman is beautiful.	8492022	Ἡ γυνὴ καλή ἐστιν.
1097957	The dog is beautiful.	8492025	Ὁ κύων καλός ἐστιν.
1164887	The day is beautiful.	8492036	Ἡ ἡμέρα καλή ἐστιν.
1617822	The house is beautiful.	8492039	Ὁ οἶκος καλός ἐστιν.
1617822	The house is beautiful.	8492040	Ἡ οἰκία καλή ἐστιν.
2045764	This place is beautiful.	8492046	Οὗτος ὁ τόπος καλός ἐστιν.
2504046	The girl is beautiful.	8492057	Ἡ παῖς καλή ἐστιν.
2504046	The girl is beautiful.	8492058	Ἡ κόρη καλή ἐστιν.
2545636	Your house is beautiful.	8492060	Ἡ οἰκία σου καλή ἐστιν.
2545636	Your house is beautiful.	8492061	Ὁ οἶκος σου καλός ἐστιν.
2779759	Your horse is beautiful.	8492066	Ὁ ἵππος σου καλός ἐστιν.
3826320	This flower is beautiful.	8492076	Τοῦτο τὸ ἄνθος καλόν ἐστιν.
4350341	The flower is beautiful.	8492081	Τὸ ἄνθος καλόν ἐστιν.
4889851	The city is beautiful.	8492083	Τὸ ἄστυ καλόν ἐστιν.
5395101	The water is beautiful.	8492085	Τὸ ὕδωρ καλόν ἐστιν.
5747235	The place is beautiful.	8492090	Ὁ τόπος καλός ἐστιν.
5774855	The moon is beautiful.	8492091	Ἡ σελήνη καλή ἐστιν.
6695336	This bird is beautiful.	8492097	Αὕτη ἡ ὄρνις καλή ἐστιν.
6695336	This bird is beautiful.	8492098	Τοῦτο τὸ ὄρνεον καλόν ἐστιν.
6878747	Your garden is beautiful.	8492108	Ὁ κῆπος σου καλός ἐστιν.
6888555	Your name is beautiful.	8492116	Τὸ ὄνομά σου καλόν ἐστιν.
7001865	My sister is beautiful.	8492119	Ἡ ἀδελφή μου καλή ἐστιν.
7847074	The sun is beautiful.	8492121	Ὁ ἥλιος καλός ἐστιν.
7850482	This garden is beautiful.	8492125	Οὗτος ὁ κῆπος καλός ἐστιν.
1531550	Whose son are you?	8492890	Τίνος υἱὸς εἶ σύ;
1766835	Whose son is Tom?	8492892	Τίνος υἱός ἐστιν ὁ Θωμᾶς;
303788	He has a book.	8505406	Βιβλίον ἔχει.
1310355	She has a book.	8505406	Βιβλίον ἔχει.
2761698	Tom has a lot of books.	8505407	Ὁ Θωμᾶς πολλὰ βιβλία ἔχει.
3175487	She has a lot of books.	8505408	Πολλὰ βιβλία ἔχει.
3175538	He has a lot of books.	8505408	Πολλὰ βιβλία ἔχει.
255571	I have a pen.	8505410	Κάλαμον ἔχω.
16425	Have you got a pen?	8505411	Ἆρα κάλαμον ἔχεις;
8546354	The crow is black.	8545049	Ὁ κόραξ μέλας ἐστίν.
8546348	The raven is black.	8545049	Ὁ κόραξ μέλας ἐστίν.
371958	Who ate the bread?	8557795	Τίς ἔφαγε τὸν ἂρτον;
2235822	It's Tom's birthday.	8604399	Τά τοῦ Θωμᾶ γενέθλια ἐστίν.
8625018	The poets, Thucydides and Euripides, were students of Anaxagoras.	8542374	Θουκυδίδης καὶ Εὐριπίδης ὁ ποιητὴς μαθηταὶ ἦσαν τοῦ Ἀναξαγόρου.
