1323	No I'm not; you are!	2451013	لالا ماشي انا، نتا!
1635	But the universe is infinite.	2581533	بالصّح الكون ما يخلاصش.
2302	Whose is this?	2691353	تاع منُّه هاذا؟
3075828	I go shopping every morning.	2691232	كل صبحة نروح نقضي.
16029	Do you know how to use a dictionary?	2691281	تعرف تستعمل قاموس؟
16029	Do you know how to use a dictionary?	2691282	تعرف كيفاش تستعمل قاموس؟
16031	You are free to go home.	2581639	تقدر تروح للدّار.
16031	You are free to go home.	2581640	تقدري تروحي للدّار.
16031	You are free to go home.	2581641	تقّدرو تروحو للدّار.
16154	You had better go.	2444957	روح خيرلك.
17298	Can I use your pencil?	3673553	نقدر نستعمل لقلم ديالك.
17354	Can I use your pen?	3673556	نقدر نستعمل ستيلو ديالك.
17440	I want you to read this book.	2447264	راني حابّك تقرى هاد لكتاب.
19350	Fish live in the sea.	2691057	الحوت يعيشو ف البحر.
22364	Call me at the office.	2950938	عيّطلي فلبيرو.
22859	We eat to live, not live to eat.	2691000	ناكلو باش نعيشو، ماشي نعيشو باش ناكلو.
23574	There is a small garden in front of my house.	2691054	كاين جنان سغير قُدّام داري.
23574	There is a small garden in front of my house.	2691055	كاين جنينة قُدّام داري.
24547	What make of computer do you use?	2581601	واش هو الميكرو اللي راك تستعمل فيه؟
24589	Do you know what time the shop is closed?	2691233	تعرف عليمن يغلق الحانوت؟
27544	If he studied hard, he would pass the test.	2445143	لُواكن يقرا مليح، يقدر ايجيب ليختيبار ديالو.
28296	Great people are not always wise.	2581552	الناس المشهورين ماشي دايمن رزان.
29032	I always walk to school.	2950969	دايما نروح لّمسيد نمشي.
33134	There she comes.	2446510	هايليك راي جايا.
35390	Are you going by bus or car?	2442498	تروح فلكار ولا فطونوبيل.
35390	Are you going by bus or car?	2442499	تروحي فلكار ولا فطونوبيل.
35390	Are you going by bus or car?	2442500	تروحو فلكار ولا فطونوبيل.
35798	A rat ran across the road.	2691231	واحد الطُپة قطعت الطريق تجري.
36464	Why do you work here?	2447172	علاش تخدم هنا.
36986	I count on Tom.	2581599	راني تاكل على طوم.
36986	I count on Tom.	2581600	راني تاكلة على طوم.
37121	Tom gave me a pen.	2445124	طوم أطالي كريُّون.
39139	Can I turn off the TV?	3063291	نقدر نطفي تلفزيون؟
40914	The octopus is in the sea.	2691015	القرنيط في البحر.
41002	A lot of insects are chirping in the field.	2581537	كاين بزّاف بعاعش راهوم يصفّرو في الخلا.
42391	It was a nervous moment for me.	2581565	كنت مقلّق بزّاف.
42391	It was a nervous moment for me.	2581566	كنت مقلّقة بزّاف.
42542	It was found at the bottom of the river.	2449115	لقاوه فقاع لواد.
42542	It was found at the bottom of the river.	2449117	لقاوها فقاع لواد.
43043	Do you have enough information to go on?	2582074	عندك المعلومات اللّي تكفيك باش تكمّل؟
43043	Do you have enough information to go on?	2582075	عندكم المعلومات اللّي تكفي باش تكملو؟
43043	Do you have enough information to go on?	2582077	عندك المعلومات اللّي تكفي باش تكملي؟
43340	The old man is blind in one eye.	2581592	هاداك الشيخ عندو عين عمية.
45250	The price is reasonable.	2442767	سوما معقولا.
45317	The man was imprisoned for murder.	2581626	هاداك الراجل حبسوه على جال القتيلة.
47627	The job pays well, but on the other hand I have to work twelve hours a day.	2442181	إيخلصوني مليح، بصَّح من جيها خرا لازم نخدم طناش نساعا فنهار.
49028	The ghost story was terrifying.	2950930	لحكايا تع لغول تخوف.
49028	The ghost story was terrifying.	2950931	لحكايا تع لغول تخلع.
49726	The apple has begun to decay.	2446498	هاد التّفاحا بدات ترشا.
50681	Keep an eye on the naughty kid.	2446508	دير بالك على لطفل لقبيح.
51443	Excuse me, but can you help me?	2691046	اسمحلي، تقدر تعاونني؟
51478	I'm sorry, I'm busy right now.	2581554	اسمح لي، راني مشغول درك.
51478	I'm sorry, I'm busy right now.	2581555	اسمح لي، راني مشغولة درك.
51623	Apart from sports, I like listening to jazz music.	2581615	من غير الرياضة، نحبّ نسمع للموسيقة تاع الجاز.
51935	Steve, I heard you were the baby of the family.	2950958	ستيف، سمعت بلّي كنت نتا لمازوزي تع ادّار.
52452	Have you bought a watermelon?	2691226	شريت دلاّعة؟
53134	Jack can speak French.	2442663	جاك يقدر يهدر بالفرنسي.
53233	Jim accompanied her on the piano.	2788600	جيم ضرب لها البيانو.
55537	This is a house to let, not to be sold.	2581730	هاد الدّر للكرا، ماشي للبيع.
56038	Above and beyond this, he can read Hebrew.	2442165	زيادا على هادا، يقدر يقرا العبريا.
57127	This hat is too tight for me.	2444922	تشابونا هادي مزيرا بزاف على راسي.
58035	She is responsible for this broken window.	2581766	هي اللّي كسّرت التاقة.
58417	This castle overlooks the city.	2581534	الشاطو هادا راه فوق المدينة.
58898	I will tell him about it when he comes next time.	2447274	نقولّو عليها كيجي لمرّا لجايا.
62434	Ken calls me every day.	2445166	كان ايتيليفونيلي كل يوم.
62764	I'm calling because my credit card has been stolen.	2446505	عيّطت علاخاطرش سرقولي لكارت كريدي.
63076	Lovely sunset, isn't it?	2581558	شباب هاد الغروب تاع السميشة، ولاّ لالا؟
63133	I'm going to go to the doctor this afternoon.	2449104	راني رايح نروح لطبيب هاد لعشيّا.
63457	The poor little girl did nothing but weep.	2950961	مسكينا اطّفلا صغيرا ما كانت ادّير والو، غير تبكي.
63917	May I have your name?	2445131	تقدر تقولِّي وسمك؟
63985	You mustn't answer your mother back when she scolds you.	2581585	ما لازمش ترجّع الكلام ليمّاك كي تعيّط عليك.
64305	Your behavior brought disgrace on our family.	2581470	المشية تاعك بهدلت العايلة تاعنا.
64774	I'll peel an orange for you.	2691219	نقشّرلك تْشينة.
66773	In other words, he is lazy.	2445109	بمعنى واحد آخر، فنيان.
70354	Come and write your name.	2581594	ارواح و اكتب آسمك.
70354	Come and write your name.	2581595	ارواحي و اكتبي آسمك.
70623	What is your name?	2445132	وسمك؟
70807	Could I use your pencil?	3673553	نقدر نستعمل لقلم ديالك.
72110	Yes. She used to be a very shy girl.	2442170	صح، كانت طفلة تحشم بزَّاف.
73173	Let's meet at one o'clock.	2691066	ايّا نتلاقاو عالوحدة.
239139	Have you fed the dog yet?	2581568	عطيت لو للكلب ياكل ولاّ مازال؟
242719	It is nice and warm today.	2453041	لحال راو شباب اودافي ليوم.
242917	It's fairly warm today.	2442682	الحال شوية سخون اليوم.
243538	Mr. Sato asked me many questions about the election.	2450754	سّي ساتو سقساني بزّاف أسئِلا عل إنتخابات.
245336	The failure in business left me penniless.	2444915	لخسارة لي خسرتها في تيجارا خلاتني بلا دراهم.
245569	My sister always keeps her room clean.	2442162	ختي دايمن تخلِّي لبِيت ديالها نقِيا.
249252	We gave way to their demands.	2581632	قبلنا واش طلبو منّا.
249421	We have no school tomorrow.	2950975	غدوا ما نقراوش.
249463	We're old friends.	2950951	حنا صحاب قدم.
249463	We're old friends.	2950952	حنا حباب قدم.
250962	My sister is shorter than you.	2442738	ختي قصيرا عليك.
251956	My daughter likes summer fruits, such as cherries, watermelons and peaches.	2691225	بنتي تحبّ الفاكية تاع الصيف: حبّ الملوك، الدلاّع، الخوخ.
252257	I am thinking of going to the mountains.	2691321	راني نخمّم نطلع للجبال.
253283	I watched TV after I washed the dishes.	2581472	شفت التيليفيزيون مور ما غسلت المواعن.
253848	I have a computer.	3063277	عندي ميكرو.
254315	I am not satisfied with the result at all.	2450737	ماهوش عاجبني لحال كامل بالنتيجا.
7316656	I teach.	2440285	.نقرِّي
258284	I am tired of my work.	2450762	عييت ملخدما ديالي.
261078	I wait here until she comes.	2450736	نستنّا هنا حتى اجّي.
262339	I think so, too.	2950973	حتانا بانتلي هاكدا.
262339	I think so, too.	2950974	حتانا نشك هاكدا.
262418	Don't treat me like a child.	2581656	ما تعاملنيش كي الطفل الصغير.
262418	Don't treat me like a child.	2581657	ما تعاملينيش كي الطفل الصغير.
262418	Don't treat me like a child.	2581658	ما تعاملونيش كي الطفل الصغير.
262424	Please help me.	2581679	عاونني من فضلك.
264366	Come on, Jiro.	2950950	أيا، جيرو.
264425	Don't be overconfident.	2450766	ما تكونش واتق بزّاف منفسك.
265501	Do you know how to drive a car?	2581580	تعرف كيفاش تصوق طونوبيل؟
266258	The prisoner is being quiet in the cell today.	2449073	لمحابسي راو عاقل فسِّيلولا ليوم.
267348	Pus has formed in the wound.	2581577	هاداك الجرح قّيح.
268728	Do you eat at home or eat out?	2691003	تاكُل ف الدار ولاّ برّا؟
268885	Don't wake up the sleeping child.	2446753	ما تنودش صغير لّي راو راقد.
270736	If it were not for water, no living things could live.	2442167	لوكان ماكانش كاين الما، حتى حاجا ما تقدر تعيش.
274291	Don't run, walk slowly.	2690991	ماتجريش، امشي بالعقل.
277619	After lunch we have two more classes.	2449089	مور لفطور عندنا زوج دروس.
282871	When he said "water," she gave him water.	2691062	كي قال "ما"، عطاتلُه الما.
287258	His arrival was greeted with cheers.	2581513	كي وصل، سفّقو عليه.
287258	His arrival was greeted with cheers.	2581514	كي وصل، قابلوه بالتسفاق.
287392	He is slowly recovering from his illness.	2445178	راو يبرا بلعقل ملمرض ديالو.
287469	His clothes always smell bad.	2581733	حوايجو دايمن فايحين.
287920	His story is true.	2447269	حكايتو كاين منها.
290062	He is older than Jane by two years.	2445107	كبير على جاين بعامين.
290287	He was good and drunk.	2581649	كان خابطها للطّرف.
290827	He applied for the job and got it.	2581540	طلب هاديك الخدمة و عطاوها لو.
290868	He crushed the sheet of paper up into a ball.	2444963	كرفس الورقا أو دار بيها بولا.
293622	He is no good as a doctor.	2449230	ماشي طبيب مليح.
294481	He eats nothing more than fruit.	2581544	ياكل غير الفاكية.
295952	He was killed with a sword.	2581629	قتلوه بالسّيف.
297809	He seems to be aware of my feelings.	2449229	ايبان راو واعي بواش راني نحّس.
301357	He seems to be very sleepy.	2450738	ايبان راو نعسان بزّاف.
302067	He crossed the street.	2447173	قطع طريق.
302689	He went up to her and they shook hands.	2445127	دنّا ليها وخمس معاها.
303302	He cared for his mother after his father died.	2451006	كان لاتي بيمّاه مور ما مات باباه.
306536	They did not abide by the school regulations.	2581567	ما قادرش القانون تاع المسيد.
307967	She is able to speak ten languages.	2445159	تقدر تهدر عشرا لوغات.
308159	I have not heard from her for a month.	2450739	عندي شهر ما سمعتش عليها.
310147	She left school two years ago.	2442495	خرجت ملمسيد عندها عامين.
313622	She was born with a silver spoon in her mouth.	2950941	زادت بمغرفا تع لفضا في فمها.
314227	She was kind to me.	2581618	كانت ضريفة معايا.
314227	She was kind to me.	2581619	كانت مليحة معايا.
318502	You must not despise someone because they are poor.	2442153	مالازمش تحقر حتى بنادم علاخطرش فقير.
319039	My father cut wood with a saw.	2451692	بابا قطّع لحطب بالمنشار
319259	My father converted a garage into a study.	2581541	بابا رجّع القاراج بيرو.
319296	My father has gone to China.	2444945	بابا راح لشِّين.
319489	There was hardly anyone in the room.	2581638	قريب ما كان حتّى واحد في هاديك الصالة.
322601	If we should miss the train, we'll go by bus.	2950971	إدا راح علينا تران، نروحو فلكار.
322601	If we should miss the train, we'll go by bus.	2950972	إدا راحت علينا لماشينا، نروحو فلكار.
322630	Fill it up, please.	2581743	عمّرو من فضلك.
322630	Fill it up, please.	2581746	عمّريه من فضلك.
322847	The fog has lifted.	2581648	راح هاداك الضباب.
323041	You mustn't forget to come and see me tomorrow morning.	2446503	ماتنساش جّي تشوفني غدوا صباح.
323148	Are you busy tomorrow afternoon?	2450735	راك محكوم غدوا لعشيّا؟
324486	Yumi is happy, isn't she?	2450755	يومي راي فرحانا، صح؟
328756	The police seized a large quantity of drugs at the school.	2444935	لابوليس سيزاو كانتيتي كبيرا تع الزطلا فلمسيد.
370703	Where are you from?	2691358	منينك؟
371995	We're out of sugar.	2581723	خلاص لنا السّكّر.
374827	Thank you!	2442644	يعطيك الصّحة.
374827	Thank you!	2442646	يعطيكم الصّحة.
388869	We are men.	2442666	حنايا رجال.
392151	I pretended not to understand what he was saying.	2445114	درت روحي مافهمتش واش كان إيقول.
402335	It tastes very good, doesn't it?	2690977	بنين بزّاف، ياك؟
405530	May I use your pencil?	3673553	نقدر نستعمل لقلم ديالك.
406224	The more you eat Kuqa's apricots, the more of them you'll want to eat.	2691005	قدّ ما تاكُل المشماش نتاع كوتشا، قدّ ما تبغي تزيد تاكُل.
408293	What's your name?	2445132	وسمك؟
410787	What's your occupation?	2581754	واش تخدم؟
410787	What's your occupation?	2581757	واش تخّدمي؟
434256	Are you teaching Spanish?	2691299	راك تقرّي السبنيولية؟
434458	Come with me.	2691257	أرواح معايا.
434868	He didn't just eat 1 pear, but 3.	2691033	ماكلاش لنجاصة واحدة برْك، كلا ثلاثة.
436243	How old are you?	2691344	شحال في عمرك؟
436319	I am buying a new umbrella.	2591342	راني رايح نشري بارابلي جديد.
436957	I should like to see the room.	2691345	بغيت نشوف الشومبرة.
456677	She brushes the horse.	2581661	راهي تمشط للعود.
464330	Wash your hands.	2691352	اُغسل يدّيك.
471758	That's my cat.	2950953	هادا لقط ديالي.
471758	That's my cat.	2950954	هادا لقط تاعي.
471758	That's my cat.	2950955	هادي لقطّا ديالي.
471758	That's my cat.	2950956	هادي لقطّا تاعي.
476211	I understand how to solve the problem.	2581509	فهمت كيفاش نفري المشكل هاداك.
477051	Sumatra is an island.	2445157	سوماترا جزيرا.
515588	There are almost no books.	2445137	قريب ماكاين حتى كتاب.
534622	It's too late to do anything about that now.	2950943	طروطار درك، ما نقدرو نديرو والو.
540200	They advised us to stay put for the time being.	2783026	قالولنا نريّحو ما نتحركوش هاد الساعة.
561109	Sorry I startled you!	2581603	اسمح لي كي خلعتك.
561109	Sorry I startled you!	2581604	اسمحي لي خلعتك.
587949	The house is cold.	2449106	ادّار راي باردا.
595263	She is about forty.	2451009	عندها قريب ربعين سنا في عمرها.
656831	I don't understand a thing you're saying.	2442630	ما فهمت والوا فواش راك تقول.
681034	They wanted a wedding picture in front of the Eiffel Tower.	2442150	حبو ياخدو تصويرا تع الزواج ديالهم قدام لاتوريفال.
681419	They are making a salad.	2442737	راهم ايديرو فشلاضا
687504	When did you go?	2581587	وقتاش رحت؟
687504	When did you go?	2581588	وقتاش رحتو؟
693874	I need a knife.	2582081	سحثقّيت موس.
719306	Do you speak Spanish?	2444952	تهدر سبنيوليّا؟
719437	John isn't here.	2450734	جون ماكانشو هنايا.
750683	I'll leave the book for you with my neighbour.	2691048	نخلّيلك الكتاب عنْد جاري.
750962	What do you think of this red hat?	2581642	واش رايك في هاد الشّابو الاحمر؟
765956	I wonder why we play tennis in miniskirts.	2444942	مانيش فاهم علاش يلعبو تينيس بلميني.
773175	What's her name?	2445134	وسّمها؟
773338	They are big.	2690971	هوما كُبار.
778783	It's difficult for me to solve this problem.	2445180	واعرا عليّا بش نحل هاد لمشكيلا.
790955	This is the last train.	2446507	هادي هيّا لماشينا لّخرا.
887123	She forgave him.	2451693	سمحتلو.
887486	She used to go mountain climbing with him.	2581570	كانت تروح تطلع الجبل معاه.
887556	She was ready to help him with cleaning the house.	2446757	كانت واجدا باش تعاونهم بش إينقِّيو ادّار.
914018	Did you see it?	2950962	شفتها؟
914018	Did you see it?	2950964	شفتو؟
914112	Did you see him while you were at Lambton?	2445106	شفتو كي كنت فلامبطون؟
953834	I'm more afraid of them than I am of you.	2581624	نخافهم كتر من اللي نخافك.
953922	I've never eaten a live octopus.	2691017	عمري ما كليت قريط حيّ.
957242	I'm 25 years old.	2442168	في عمري 25 سنا.
983650	This is a horse.	2950946	هادا عود.
1019960	Give my love to your kids.	2581505	سلّم على الدّراري تاوعك.
1021038	Good job!	2445160	خدما مليحا.
1118673	My cat barks.	2449776	لقط ديالي ينبح.
1120403	When's the wedding?	2582093	لوقتاش العرس؟
1140942	Tom was scared to death.	2581517	توم قريب مات من الخلعة.
1185640	I used to be the same age as you.	2447171	كنت قدّك.
1227660	Have you seen it?	2950962	شفتها؟
1227660	Have you seen it?	2950964	شفتو؟
1227661	Have you seen her?	2950962	شفتها؟
1299998	With whom are you talking?	2449237	معامن راك تهدر؟
1299998	With whom are you talking?	2449238	معامن راكي تهدري؟
1299998	With whom are you talking?	2449239	معامن راكم تهدرو؟
1316039	He left the room as soon as I entered it.	2446764	غير دخلت لشّمبرا خرج.
1316039	He left the room as soon as I entered it.	2446765	غير دخلت للبيت خرج.
1334755	My parents are going to kill me!	2446506	والديّا رايحين يقّتلوني.
1358643	Take your hands off me!	2444947	نحِّي يدّك عليّا.
1388239	Tom asked Mary and her friends if they wanted to play strip poker, but they refused.	2777747	طوم سقسا ماري و صحابها إدا كانوا حابّين يلّعبو الستريب بوكير، بالصّح ما قبلوش.
1419996	He was sitting beside his brother.	2445168	كان قاعد قدّام خوه.
1438330	You look stunning!	2581672	راك هايل.
1438330	You look stunning!	2581674	راكي هايلة.
1438330	You look stunning!	2581675	راكو هايلين.
1474147	I have been obsessed with French recently.	2447259	راني مضروب على لفرانسي هاد ليامات.
1476478	Tom and Mary are playing poker.	2777734	طوم و ماري راهوم يلّعبو في البوكير.
1493506	They read her book.	2691354	قراو كتابها.
1499018	Jim has not yet returned home.	2447278	جيم مازال ما ولاّ لدّار.
1499227	Don't just eat fish. Eat some meat, too.	2691010	ماتاكُلش الحوت برْك. كول شوية لحم ثاني.
1505503	Your coat is very beautiful.	2581748	المونطو تاعك شباب بزّاف.
1532901	Liar!	2447250	كدّاب.
1557594	I always go to school on foot.	2950970	دايما نروح لّمسيد على رجليا.
1566877	Mary is alone in the forest.	2449084	ماري راي وحّدها فلغابا.
1580083	This carpet is very long.	2690968	هاذ الزربية طويلة بزّاف.
1650992	I smell blood.	2581582	راني نشمّ الدّم.
1652316	Did you see that?	2950967	شفت هادا؟
1652316	Did you see that?	2950968	شفت هادي؟
1671788	I have bad news for you.	2445148	عندي خبر عيّان ليك.
1712304	Marika is Finnish but she speaks German just like the Germans.	2691375	ماريكا فينلاندية، بصّح تهدر الألمانية كي الألمانيين سواسوا.
1777423	We must move quickly.	2581564	لازم نخفّو رواحتينا.
1787902	How did he find us?	2445147	كيفاش لقانا؟
1797684	We need you.	2442154	نسحقُّوك.
1815429	Palestine is called "Filastin" in Arabic.	2691308	فلسطين يقولولها بالعربية "فلسطين".
1877213	He wasn't ready for it.	2447249	ماكانش واجدلها.
1877493	Tom is standing in the corner of the room.	2445162	طوم راو واقف فلكوانا تع اشّومبرا.
1877493	Tom is standing in the corner of the room.	2445164	طوم راو واقف فلكوانا تع لبيت.
1886076	Do you miss Tom?	2581698	توحّشت طوم؟
1886076	Do you miss Tom?	2581700	توحّشتي طوم؟
1886076	Do you miss Tom?	2581701	توحّشتو طوم؟
1886098	Do you have any more great ideas?	2581610	مازا عندك كاش فكرة هايلة؟
1886127	Did you win the race?	2445117	ربحت لاكورس.
1886147	Did you have fun?	2445174	عجبكم لحال؟
1886642	Where are you going to go?	2441818	وين راك رايح تروح.
1886642	Where are you going to go?	2441822	وين راكم رايحين تروحو.
1886642	Where are you going to go?	2441825	وين راكي رايحا تروحي.
1886688	What's that smell?	2690982	واشن هاذ الريحة؟
1886702	What's his name?	2445135	وسمو؟
1894176	The school is closed because of the snow.	3003073	لمسيد راو مغلوق علا جال التلج.
1934790	I owe you nothing!	2446513	ما راك تسالّي والو.
1936440	I'd like to help you.	2581761	حبّيت نعاونك.
1936440	I'd like to help you.	2581762	حبّيت نعاونكم.
1987969	Who did you vote for?	2444926	عليمن فوطيت.
2013930	I just want to go back to bed.	2449247	راني حاب برك نولّي لفراش.
2016970	Wait. I want to tell you something.	2691041	اسّنّى، بغيت نقوللك حاجة.
2031624	How do you know that Tom has never been to Boston?	2690978	كيفاش تعرف بللي توم عمرُه ما راح لبوستون؟
2042225	Can you wait a bit?	2449234	تقدر تسنّا شويّا.
2042225	Can you wait a bit?	2449235	تقّدري تسنّاي شويّا.
2042225	Can you wait a bit?	2449236	تقدّرو تسنّاو شويّا.
2049763	I don't want to be a hero.	2453037	مارانيش حاب نكون بطل.
2050700	Tom and his friends play poker almost every Friday night.	2777723	طوم و صحابو يلّعبو البوكير قريب كل جمعة العشية.
2107478	Tom's dead.	2445116	مات طوم.
2107601	Tom's smiling.	2446504	طوم راو يبتسم.
2116338	Give me a break!	2581597	خلّيني نرجّع النّفس.
2154803	But do you like it?	2581573	بالصّح عجبك؟
2154803	But do you like it?	2581574	بالصّح عجبكم؟
2183967	They don't know yet.	2581678	مازال ما على بالهومش.
2188827	I was in full control of myself.	2950948	كونت مكونترولي روحي مليح.
2188827	I was in full control of myself.	2950949	كونت متحكم فروحي مليح.
2208362	I can survive alone.	2442202	ما نقدرش نعيش وحدي.
2212968	Open at page nine.	2950928	أفتح صفحا تسعا.
2245902	I have won.	2444893	ربحت.
2246046	I ran home.	2447178	هربت لدّار.
2248106	I'm making tea.	3673546	راني ندير فلاتاي.
2249745	Open the doors.	2950944	افتح لبيبان.
2249745	Open the doors.	2950945	افتحو لبيبان.
2270311	Don't be so stupid.	2446761	ماتكونش جايح.
2270311	Don't be so stupid.	2446763	ماتكونش بهلول.
2273107	Tom is drinking champagne.	2790230	طوم راه يشرب في الشامبان.
2278231	OK, this is what we are going to do.	2450758	أيوه، هادا وش رانا رايحين نديرو.
